url,name,location,description,point,star
https://www.booking.com/hotel/vn/villa-sealink-can-ho-ocean-vista-an.vi.html,Villa Sealink - Căn Hộ Ocean Vista An,"Km09 Nguyễn thông, Phường Phú Hài, Phan Thiết, Bình Thuận. Block B tầng 6 khu ocean vista sealink, Phan Thiết, Việt Nam","Tọa lạc ở Phan Thiết thuộc Bình Thuận, gần Bãi đá Ông Địa và Tháp Poshanu (Tháp Chăm Phố Hài), Villa Sealink - Căn Hộ Ocean Vista An cung cấp Wi-Fi miễn phí và chỗ đậu xe riêng miễn phí.

Khách có thể sử dụng sân hiên tại căn hộ.

Villa Sealink - Căn Hộ Ocean Vista An cách Sân Golf Sea Link 8.3 km và Suối Tiên 8.9 km. Sân bay gần nhất là Sân bay Liên Khương, cách chỗ nghỉ 138 km.",8.2,
https://www.booking.com/hotel/vn/apec-mandala-mui-ne-delux-room-2-beds-4ppl.vi.html,Apec Mandala Mui Ne - Delux Room - 2 beds - 4ppl,"ĐT716, Ấp Long Sơn, Việt Nam","Apec Mandala Mui Ne - Delux Room - 2 beds - 4ppl có khu vườn, phòng chờ chung, nhà hàng và quầy bar ở Ấp Long Sơn. Ngoài Wi-Fi miễn phí, khách sạn 5 sao này còn cung cấp dịch vụ phòng và quầy lễ tân 24 giờ. Đây là chỗ nghỉ không hút thuốc và nằm cách Bãi biển Long Sơn 6 phút đi bộ.

Tại khách sạn, các phòng đều có điều hòa, bàn làm việc, sân hiên với view thành phố, phòng tắm riêng, TV màn hình phẳng, ga trải giường và khăn tắm. Tất cả các phòng đều có tủ lạnh.

Apec Mandala Mui Ne - Delux Room - 2 beds - 4ppl có phục vụ bữa sáng thực đơn buffet hoặc kiểu lục địa.

Chỗ nghỉ có sân chơi trẻ em.

Apec Mandala Mui Ne - Delux Room - 2 beds - 4ppl cách Bãi biển Đồi Cát Đỏ 2.8 km và Suối Tiên 16 km.",,5.0
https://www.booking.com/hotel/vn/biet-thu-4-phong-ngu-huy-hoang-novaworld-phan-thiet.vi.html,Biệt thự 4 phòng ngủ Huy Hoàng - Novaworld Phan Thiết,"194 Lạc Long Quân, Bình Tú, Việt Nam","Với hồ bơi ngoài trời, khu vườn, cùng sân hiên, Biệt thự 4 phòng ngủ Huy Hoàng - Novaworld Phan Thiết cung cấp chỗ nghỉ ở Bình Tú có Wi-Fi miễn phí và nhìn ra biển. Chỗ nghỉ này có ban công và chỗ đậu xe riêng miễn phí.

Biệt thự điều hòa này có 4 phòng ngủ, TV màn hình phẳng truyền hình cáp, khu vực ăn uống, bếp và phòng khách.

Biệt thự cách Ga xe lửa Phan Thiết 13 km và Bến xe buýt Bình Thuận 14 km.",,4.0
https://www.booking.com/hotel/vn/home-sun-moon-home-1.vi.html,Home Sun Moon - Home 1,"14/1 Lê Lợi, Phan Thiết, Việt Nam","Cách Bãi biển Thương Chánh 3 phút đi bộ, Home Sun Moon - Home 1 có khu vườn, khu vực bãi biển riêng, điều hòa, sân hiên và Wi-Fi miễn phí.

Tất cả các căn đều có bếp nhỏ đầy đủ tiện nghi, cho phép du khách tự chuẩn bị bữa ăn tươi ngon. Nơi đây còn có phòng tắm chung với vòi xịt/chậu rửa vệ sinh ở một số căn, cùng đồ vệ sinh cá nhân miễn phí, máy sấy tóc và dép đi trong phòng.

Các điểm tham quan nổi tiếng gần căn hộ bao gồm Bãi biển Đồi Dương, Sân Golf Sea Link và Ga xe lửa Phan Thiết. Sân bay Liên Khương cách 135 km.",,
https://www.booking.com/hotel/vn/dalis-waterfall-homestay.vi.html,Dalis Waterfall Homestay,"12 Nguyễn Bỉnh Khiêm, Tân Tạo, Việt Nam","Tọa lạc cách Núi Tà Cú 27 km, Dalis Waterfall Homestay cung cấp chỗ nghỉ có Wi-Fi miễn phí và chỗ đậu xe riêng miễn phí.

Tất cả các căn có phòng tắm riêng, vòi sen, điều hòa, TV màn hình phẳng và tủ lạnh.

Khách có thể thư giãn trong khu vườn tại chỗ nghỉ.

Homestay cách Hải đăng Mũi Kê Gà 33 km.",9.5,
https://www.booking.com/hotel/vn/homestay-phu-xuan.vi.html,Homestay Phú Xuân,"Khu phố Phú Xuân , thị trấn Phú Long , Huyện Hàm Thuận Bắc , Tỉnh Bình Thuận , Việt Nam, Phan Thiết, Việt Nam","Tọa lạc ở Phan Thiết, cách Sân Golf Sea Link 6.1 km và Bến xe buýt Bình Thuận 8.7 km, Homestay Phú Xuân cung cấp chỗ nghỉ có Wi-Fi miễn phí, điều hòa, khu vườn và nhà hàng.

Nơi đây còn có phòng tắm riêng với vòi sen ở tất cả các căn, cùng đồ vệ sinh cá nhân miễn phí và máy sấy tóc.

Khách tại lodge có thể thưởng thức bữa sáng thực đơn à la carte.

Homestay Phú Xuân cách Ga xe lửa Phan Thiết 10 km và Suối Tiên 18 km. Sân bay gần nhất là Sân bay Liên Khương, cách chỗ nghỉ 129 km.",,
https://www.booking.com/hotel/vn/apec-mandala-mui-ne-p1.vi.html,Apec ManDaLa cham bay mui ne,"Đường tỉnh 716, Ấp Thiẹn Ái, Việt Nam","Nằm ở Ấp Thiẹn Ái, Apec ManDaLa cham bay mui ne cung cấp chỗ nghỉ có hồ bơi riêng và Wi-Fi miễn phí. Tọa lạc cách Bãi biển Long Sơn chỉ vài bước chân, chỗ nghỉ cung cấp sân hiên và chỗ đậu xe riêng miễn phí.

Căn hộ điều hòa này có 1 phòng ngủ, bếp nhỏ và 1 phòng tắm. TV màn hình phẳng được cung cấp.

Căn hộ cách Bãi biển Đồi Cát Đỏ 2.3 km và Suối Tiên 16 km. Sân bay gần nhất là Sân bay Liên Khương, cách Apec ManDaLa cham bay mui ne 113 km.",,
https://www.booking.com/hotel/vn/apec-mandala-cham-bay-mui-ne-thanh-pho-phan-thiet9.vi.html,Apec Mandala Cham Bay R0401,"Đường tỉnh 716, Mũi Né, Việt Nam","Nhìn ra thành phố, Apec Mandala Cham Bay R0401 tọa lạc ở Mũi Né và có nhà hàng, dịch vụ phòng, quầy bar, khu vườn, hồ bơi ngoài trời mở quanh năm cũng như sân hiên. WiFi và chỗ đậu xe riêng đều có sẵn tại khách sạn căn hộ miễn phí.

Apec Mandala Cham Bay R0401 có sân trong nơi khách có thể nhìn ra biển, khu vực ghế ngồi, TV màn hình phẳng truyền hình cáp, bếp đầy đủ tiện nghi gồm tủ lạnh và lò vi sóng, cùng phòng tắm riêng được trang bị vòi xịt/chậu rửa vệ sinh và đồ vệ sinh cá nhân miễn phí. Một số căn có khu vực ăn uống và/hoặc ban công.

Chỗ nghỉ có phục vụ bữa sáng thực đơn buffet hoặc kiểu Á.

Tại Apec Mandala Cham Bay R0401, khách có thể sử dụng phòng tập thể dục.

Khuôn viên của khách sạn căn hộ có khu vực bãi biển riêng và du khách có thể leo núi ở khu vực gần đó.

Apec Mandala Cham Bay R0401 cách Bãi biển Long Sơn chỉ vài bước chân và Bãi biển Đồi Cát Đỏ 2.3 km.",7.4,3.0
https://www.booking.com/hotel/vn/grace-boutique-resort.vi.html,Grace Boutique Resort,"144A Nguyen Dinh Chieu, Mũi Né, Việt Nam","Được bao quanh bởi các khu vườn, Grace Boutique Resort nhìn ra biển này nằm ở Mũi Né, trong bán kính 300 m từ Trung tâm Spa Bùn Hàm Tiến và 400 m từ Trung tâm Lướt ván diều Surfpoint. Nơi đây có nhà hàng và hồ bơi ngoài trời, và cung cấp chỗ đỗ xe cũng như Wi-Fi miễn phí.

Với ban công lớn nhìn ra biển, hồ bơi hoặc khu vườn, mỗi phòng tại đây đều được trang bị máy lạnh, truyền hình vệ tinh, két an toàn cá nhân và minibar. Phòng tắm riêng đi kèm tiện nghi vòi sen, đồ vệ sinh cá nhân, dép và máy sấy tóc.

Quý khách có thể sử dụng trung tâm dịch vụ doanh nhân, hoặc tới bàn đặt tour để sắp đặt việc đi tham quan. Nhân viên tại lễ tân có thể trợ giúp với các dịch vụ như để hành lý, giặt là, đưa/đón sân bay và đặt vé.

Resort nằm trong bán kính 1,6 km từ khu vực Bờ Kè Mũi Né và 2,4 km từ Suối Tiên. Các Đồi Cát Vàng và Trắng cách đó 6,4 km.",8.3,3.0
https://www.booking.com/hotel/vn/nang-hon-rom-mui-ne-resort-by-bay-luxury.vi.html,Nắng Hòn Rơm Mũi Né Resort - by Bay Luxury,"28 Đường Xuân Thủy, Ấp Long Sơn, Việt Nam","Tọa lạc ở Ấp Long Sơn thuộc Bình Thuận, gần Bãi biển Hòn Rơm và Bãi biển Mũi Né, Nắng Hòn Rơm Mũi Né Resort - by Bay Luxury cung cấp Wi-Fi miễn phí và chỗ đậu xe riêng miễn phí.

Tất cả các căn đều có điều hòa và TV màn hình phẳng.

Căn hộ có phục vụ bữa sáng thực đơn à la carte mỗi sáng.

Nắng Hòn Rơm Mũi Né Resort - by Bay Luxury cách Bãi biển Long Sơn 2 km và Suối Tiên 9.4 km. Sân bay gần nhất là Sân bay Liên Khương, cách chỗ nghỉ 120 km.",,3.0
https://www.booking.com/hotel/vn/new-wind-apt-apec-mandala-mui-ne-sea-view.vi.html,New Wind Apt - Apec Mandala Mui Ne - Sea View,"716 Apec Mandala, Phan Thiết, Việt Nam","Với khu vườn, khu vực bãi biển riêng, cùng sân hiên, New Wind Apt - Apec Mandala Mui Ne - Sea View cung cấp chỗ nghỉ ở Phan Thiết có Wi-Fi miễn phí và nhìn ra biển. Tọa lạc cách Bãi biển Long Sơn 6 phút đi bộ, chỗ nghỉ cung cấp nhà hàng và chỗ đậu xe riêng miễn phí.

Với 1 phòng ngủ, căn hộ điều hòa này có 1 phòng tắm với vòi sen, bể sục và máy sấy tóc. Chỗ nghỉ này được trang bị bếp nhỏ.

Thành thạo tiếng Anh và tiếng Việt, đội ngũ nhân viên tại lễ tân luôn sẵn lòng đưa ra thông tin hữu ích về khu vực xung quanh.

Khách có thể ghé công viên nước tại căn hộ.

New Wind Apt - Apec Mandala Mui Ne - Sea View cách Bãi biển Đồi Cát Đỏ 2.8 km và Suối Tiên 16 km.",9,4.0
https://www.booking.com/hotel/vn/sunset-hill-villa-large-swimming-pool.vi.html,Amanda Villa,"Nguyễn Tấn Định, Mũi Né, Việt Nam","Nằm ở Mũi Né, cách Bãi biển Hàm Tiến 7 phút đi bộ và Suối Tiên 6.9 km, Amanda Villa cung cấp chỗ nghỉ có Wi-Fi miễn phí, điều hòa, hồ bơi ngoài trời và khu vực bãi biển riêng. Biệt thự có hồ bơi riêng, khu vườn và chỗ đậu xe riêng miễn phí.

Với sân hiên nhìn ra thành phố, biệt thự có 5 phòng ngủ, phòng khách, TV màn hình phẳng truyền hình vệ tinh, bếp đầy đủ tiện nghi, 5 phòng tắm với vòi xịt/chậu rửa vệ sinh và vòi sen. Khăn tắm và ga trải giường có sẵn ở biệt thự.

Biệt thự có bể sục.

Amanda Villa cách Sân Golf Sea Link 12 km và Bến xe buýt Bình Thuận 13 km. Sân bay gần nhất là Sân bay Liên Khương, cách chỗ nghỉ 134 km.",10,4.0
https://www.booking.com/hotel/vn/apartment-thanh-pho-phan-thiet.vi.html,Apartment,"202 Nguyễn Đình Chiểu, Ấp Thiện Sơn, Việt Nam","Apartment tọa lạc ở Ấp Thiện Sơn, cách Suối Tiên 1.7 km, Sân Golf Sea Link 15 km và Bến xe buýt Bình Thuận 17 km. Chỗ nghỉ này cách Bãi biển Hàm Tiến chỉ vài bước chân, khách có thể sử dụng chỗ đậu xe riêng có sẵn trong khuôn viên và Wi-Fi miễn phí.

Căn hộ có 1 phòng ngủ với điều hòa, khu vực ăn uống và bếp đầy đủ tiện nghi với tủ lạnh.

Apartment cách Ga xe lửa Phan Thiết 18 km và Hải đăng Mũi Kê Gà 50 km.",,
https://www.booking.com/hotel/vn/sg-happy-apartment-apec-mui-ne.vi.html,SG HAPPY Apartment - Apec Mui Ne,"283W+98, Mũi Né, Hàm Thuận Bắc, Bình Thuận, Việt Nam, Ấp Thiẹn Ái, Việt Nam","Nằm ở Ấp Thiẹn Ái, chỉ cách Bãi biển Long Sơn 6 phút đi bộ, SG HAPPY Apartment - Apec Mui Ne cung cấp chỗ nghỉ giáp biển có sân hiên, quầy bar và Wi-Fi miễn phí. Chỗ nghỉ tọa lạc cách Bãi biển Đồi Cát Đỏ 2.8 km và cung cấp dịch vụ tiền sảnh.

Căn hộ điều hòa này có 1 phòng ngủ riêng biệt, bếp đầy đủ tiện nghi, cùng 1 phòng tắm. TV màn hình phẳng được cung cấp.

Căn hộ cách Suối Tiên 16 km và Sân Golf Sea Link 33 km. Sân bay gần nhất là Sân bay Liên Khương, cách SG HAPPY Apartment - Apec Mui Ne 114 km.",,3.0
https://www.booking.com/hotel/vn/phuong-anh-thanh-pho-phan-thiet1.vi.html,Phương anh,"06 Lê Lợi, Phan Thiết, Việt Nam","Tọa lạc ở Phan Thiết, cách Bãi biển Đồi Dương 3 phút đi bộ và Sân Golf Sea Link 1.7 km, Phương anh cung cấp chỗ nghỉ có Wi-Fi miễn phí ở toàn bộ chỗ nghỉ. Chỗ nghỉ cách Ga xe lửa Phan Thiết khoảng 1.9 km, Bến xe buýt Bình Thuận 3.1 km và Suối Tiên 21 km. Đây là chỗ nghỉ không hút thuốc và nằm cách Bãi biển Thương Chánh 2 phút đi bộ.

Hostel cách Hải đăng Mũi Kê Gà 33 km và Núi Tà Cú 35 km. Sân bay gần nhất là Sân bay Liên Khương, cách Phương anh 135 km.",,
https://www.booking.com/hotel/vn/viet-s.vi.html,Viet's Hotel,"69 Nguyen Dinh Chieu, Mũi Né, Việt Nam","Viet's Hotel nằm ở thị trấn Mũi Né thanh bình. Được làm mát với máy lạnh, các phòng được bài trí đẹp mắt tại đây có tầm nhìn bao quát ra biển. Truy cập Wi-Fi miễn phí được cung cấp trong tất cả các khu vực.

Tòa nhà hiện đại này cách nhà hàng Sankara Beach Lounge 3,6 km. Khách sạn nằm trong bán kính chưa đến 3 km từ Tháp Poshanu và trong bán kính 17 km từ Chợ Phan Thiết. Ga Tàu Phan Thiết cách nơi nghỉ 20 km.

Với cửa sổ lớn, các phòng nghỉ đều tươi sáng và thoáng mát. Mỗi phòng được trang bị truyền hình cáp màn hình phẳng, ban công riêng, minibar cùng khu vực tiếp khách. Tất cả các phòng đều có phòng tắm riêng với đồ vệ sinh cá nhân miễn phí.

Tại Viet's Hotel, khách sẽ tìm thấy lễ tân 24 giờ với dịch vụ giữ hành lý. Nơi nghỉ này cũng cung cấp dịch vụ cho thuê xe đạp và dịch vụ đưa đón. Dịch vụ giặt/ủi có sẵn với một khoản chi phí.",7.1,2.0
https://www.booking.com/hotel/vn/pho-bien-homestay.vi.html,Pho Bien Homestay,"1/7 Ngo Thi Nham, Phan Thiết, Việt Nam","Nằm ở Phan Thiết, gần Bãi biển Đồi Dương, Pho Bien Homestay cung cấp cung cấp chỗ nghỉ có hồ bơi ngoài trời, dịch vụ thuê ô tô, nhiều tiện nghi thể thao dưới nước, khu vườn và phòng chờ chung. Chỗ nghỉ này có ban công, sân chơi golf mini, chỗ đậu xe riêng miễn phí và Wi-Fi miễn phí.

Với sân hiên nhìn ra hồ bơi, nhà nghỉ dưỡng có 2 phòng ngủ, phòng khách, TV màn hình phẳng truyền hình vệ tinh, bếp đầy đủ tiện nghi, 3 phòng tắm với vòi xịt/chậu rửa vệ sinh và vòi sen. Khăn tắm và ga trải giường có sẵn ở nhà nghỉ dưỡng.

Khách có thể sử dụng sân chơi trẻ em tại nhà nghỉ dưỡng.

Pho Bien Homestay cách Bãi biển Thương Chánh 2.6 km và Sân Golf Sea Link chưa đến 1 km. Sân bay gần nhất là Sân bay Liên Khương, cách chỗ nghỉ 138 km.",9.3,4.0
https://www.booking.com/hotel/vn/thuy-gunter-garden-bungalow.vi.html,Thuy - Gunter Garden Bungalow,"7A Huynh Thuc Khang, Mũi Né, Việt Nam","Cách bãi biển chỉ 400 m, Thuy - Gunter Garden Bungalow cung cấp chỗ ở giản dị và tiện nghi với Wi-Fi miễn phí trong toàn bộ khuôn viên. Chỗ nghỉ này có khu vườn nhiệt đới tươi tốt và chỗ đỗ xe máy miễn phí tại chỗ.

Nhà nghỉ mát này được trang bị quạt máy và có sân hiên, lối vào riêng, sàn lát gạch, tủ quần áo, khu vực tiếp khách, bàn ăn cũng như truyền hình cáp màn hình phẳng. Ngoài ra còn có nhà bếp nhỏ với bếp nấu ăn, tủ lạnh và ấm đun nước điện. Phòng tắm riêng đi kèm tiện nghi vòi sen và đồ vệ sinh cá nhân miễn phí.

Tại Thuy - Gunter Garden Bungalow, du khách có thể thuê xe đạp/xe hơi để tự khám phá khu vực này cũng như đi đến các điểm tham quan gần đó. Đội ngũ nhân viên thân thiện, giao tiếp lưu loát bằng tiếng Việt, Anh và Đức có thể hỗ trợ khách với dịch vụ giặt là và bố trí dịch vụ đưa đón sân bay.

Chỗ ở này chỉ cách Trung tâm lướt vát diều Storm Kiteboarding 1 km và cách Trung tâm lướt ván diều Surfpoint Kiteboarding 1,9 km.",7,
https://www.booking.com/hotel/vn/nha-tro-phuong-anh-thanh-pho-phan-thiet1.vi.html,Nhà trọ Phương Anh,"06 Lê Lợi, Phan Thiết, Việt Nam","Nằm ở Phan Thiết và cách Bãi biển Thương Chánh 2 phút đi bộ, Nhà trọ Phương Anh có phòng chờ chung, các phòng không hút thuốc và Wi-Fi miễn phí ở toàn bộ chỗ nghỉ. Chỗ nghỉ cách Bến xe buýt Bình Thuận khoảng 3.1 km, Suối Tiên 21 km và Hải đăng Mũi Kê Gà 33 km. Hostel nằm cách Núi Tà Cú 35 km và Bưu điện Bình Thuận 17 phút đi bộ.

Các điểm tham quan nổi tiếng gần hostel bao gồm Bãi biển Đồi Dương, Sân Golf Sea Link và Ga xe lửa Phan Thiết. Sân bay gần nhất là Sân bay Liên Khương, cách Nhà trọ Phương Anh 135 km.",,
https://www.booking.com/hotel/vn/jardin-des-thes-resort.vi.html,jardin des thes resort,"146 Nguyễn Đình Chiểu 146 nguyễn đình chiểu, Ấp Thiện Long, Việt Nam","Tọa lạc ở Ấp Thiện Long, cách Bãi biển Hàm Tiến chỉ vài bước chân, jardin des thes resort cung cấp chỗ nghỉ có khu vườn, chỗ đậu xe riêng miễn phí và nhà hàng. Khách sạn 2 sao này có dịch vụ phòng và quầy lễ tân 24 giờ. Khách sạn có phòng gia đình.

Khách sạn cách Suối Tiên 2.4 km và Sân Golf Sea Link 15 km. Sân bay gần nhất là Sân bay Liên Khương, cách jardin des thes resort 131 km.",5.7,2.0
https://www.booking.com/hotel/vn/biet-thu-3-pn-corner-villa-novaworld-phan-thiet.vi.html,Biệt thự 3 PN Corner Villa - NovaWorld Phan Thiet,"194 Lạc Long Quân, Bình Tú, Việt Nam","Nằm cách Ga xe lửa Phan Thiết 14 km và Bến xe buýt Bình Thuận 15 km ở Bình Tú, Biệt thự 3 PN Corner Villa - NovaWorld Phan Thiet cung cấp chỗ nghỉ cóbếp. Chỗ nghỉ này có hồ bơi riêng, Wi-Fi miễn phí và chỗ đậu xe riêng miễn phí.

Biệt thự có 3 phòng ngủ này cung cấp cho khách TV màn hình phẳng, điều hòa và phòng khách.

Biệt thự cách Sân Golf Sea Link 15 km và Hải đăng Mũi Kê Gà 21 km. Sân bay gần nhất là Sân bay Liên Khương, cách Biệt thự 3 PN Corner Villa - NovaWorld Phan Thiet 146 km.",,
https://www.booking.com/hotel/vn/nguyens-villa.vi.html,Nguyễn Villa Royale,"N21 Nguyễn Thái Học, Khu Phố 9, Phường Tân An, Lagi, Bình Thuận., La Gi, Việt Nam","Nằm cách Núi Tà Cú khoảng 28 km, Nguyễn Villa Royale cung cấp chỗ nghỉ với sân trong, ấm đun nước và tầm nhìn ra vườn. Nhà nghỉ dưỡng này có vườn, tiện nghi BBQ, WiFi miễn phí và chỗ đỗ xe riêng miễn phí.

Nhà nghỉ dưỡng lắp máy điều hòa này được bố trí 3 phòng ngủ, TV màn hình phẳng, khu vực ăn uống và bếp với lò vi sóng cùng tủ lạnh. Để thêm phần thuận tiện cho du khách, chỗ nghỉ có thể cung cấp khăn tắm và ga trải giường với một khoản phụ phí.

Nhà nghỉ dưỡng này có sân hiên.",9.9,3.0
https://www.booking.com/hotel/vn/biet-thu-3-phong-ngu-s-home-villa-novaworld-phan-thiet.vi.html,Biệt thự 3 phòng ngủ S Home Villa - NovaWorld Phan Thiết,"194 Lạc Long Quân, Bình Tú, Việt Nam","Với hồ bơi ngoài trời và khu vực bãi biển riêng, Biệt thự 3 phòng ngủ S Home Villa - NovaWorld Phan Thiết cung cấp chỗ nghỉ ở Bình Tú có Wi-Fi miễn phí và nhìn ra biển. Biệt thự có hồ bơi riêng, khu vườn và chỗ đậu xe riêng miễn phí.

Biệt thự điều hòa này có 3 phòng ngủ, TV màn hình phẳng truyền hình cáp, khu vực ăn uống, bếp với tủ lạnh và phòng khách. Khăn tắm và ga trải giường có sẵn ở biệt thự.

Biệt thự cách Ga xe lửa Phan Thiết 14 km và Bến xe buýt Bình Thuận 15 km. Sân bay gần nhất là Sân bay Liên Khương, cách Biệt thự 3 phòng ngủ S Home Villa - NovaWorld Phan Thiết 146 km.",,4.0
https://www.booking.com/hotel/vn/mandala-mui-ne.vi.html,Apec Mandala Cham Bay Mũi Né S2411,"ĐT716 Phường Mũi Né, Ấp Long Sơn, Việt Nam","Tọa lạc ở Ấp Long Sơn, gần Bãi biển Long Sơn, Apec Mandala Cham Bay Mũi Né S2411 cung cấp cung cấp chỗ nghỉ có hồ bơi ngoài trời, dịch vụ thuê ô tô, khu vực bãi biển riêng, khu vườn và sân hiên. Ở đây có nhà hàng ngay trong khuôn viên, chỗ đậu xe riêng miễn phí và Wi-Fi miễn phí.

Căn hộ điều hòa này có 1 phòng ngủ, phòng khách, bếp đầy đủ tiện nghi với tủ lạnh và ấm đun nước, 1 phòng tắm với vòi xịt/chậu rửa vệ sinh và vòi sen. Khăn tắm và ga trải giường có sẵn ở căn hộ.

Tại căn hộ, khách có thể sử dụng bể sục. Khách có thể ghé công viên nước tại Apec Mandala Cham Bay Mũi Né S2411.

Chỗ nghỉ cách Bãi biển Đồi Cát Đỏ 2.5 km và Suối Tiên 16 km.",,4.0
https://www.booking.com/hotel/vn/homestay-happiness-dao-phu-quy-by-bay-luxury.vi.html,"Happy Homestay - hẻm 61 Hai Bà Trưng, Đảo Phú Quý -by Bay Luxury","Đường Tân Hải 2, Cu Lao Thu, Việt Nam","Happy Homestay - hẻm 61 Hai Bà Trưng, Đảo Phú Quý -by Bay Luxury tọa lạc ở Cu Lao Thu. Căn hộ này cung cấp chỗ nghỉ điều hòa có Wi-Fi miễn phí.

Gồm 1 phòng ngủ và 1 bathroom, căn hộ có TV màn hình phẳng.

Sân bay gần nhất là Sân bay Liên Khương, cách căn hộ 242 km.",,2.0
https://www.booking.com/hotel/vn/41-village-mai-phan-thiet1.vi.html,41 Village Mai,"41 Mai Thúc Loan nhà 1 trêt, 1 lầu, Phan Thiết, Việt Nam","Nằm cách Bãi biển Thương Chánh 2.5 km và Sân Golf Sea Link chưa đến 1 km ở Phan Thiết, 41 Village Mai cung cấp chỗ nghỉ cóbếp. Chỗ nghỉ điều hòa này cách Bãi biển Đồi Dương chưa đến 1 km, khách có thể sử dụng WiFi miễn phí và chỗ đậu xe riêng có sẵn trong khuôn viên.

Chalet cách Ga xe lửa Phan Thiết 3 km và Bến xe buýt Bình Thuận 3.1 km. Sân bay gần nhất là Sân bay Liên Khương, cách 41 Village Mai 138 km.",,
https://www.booking.com/hotel/vn/khach-san-mui-tau.vi.html,Mui Tau Hotel Phan Ri Cua,"410 Quang Trung Thị trấn Phan Rí Cửa, Tuy Phong, Bình Thuận, Tuy Phong, Việt Nam","Nằm ở Tuy Phong, cách Triển lãm Tecnopolis Buenos Aires 23 km, Mui Tau Hotel Phan Ri Cua cung cấp chỗ nghỉ có khu vườn, chỗ đậu xe riêng miễn phí, phòng chờ chung và nhà hàng. Ngoài Wi-Fi miễn phí, khách sạn 1 sao này còn cung cấp dịch vụ phòng và quầy lễ tân 24 giờ. Khách sạn nằm cách Đồi cát hồng 46 km và Chợ Mũi Né 49 km.

Các phòng đi kèm tủ lạnh, minibar, ấm đun nước, vòi sen, dép đi trong phòng và bàn làm việc. Với phòng tắm riêng được trang bị vòi xịt/chậu rửa vệ sinh và đồ vệ sinh cá nhân miễn phí, các căn tại khách sạn có TV màn hình phẳng và điều hòa, trong đó một số phòng có sân trong. Tại Mui Tau Hotel Phan Ri Cua, tất cả các phòng có ga trải giường và khăn tắm.

Sân bay Liên Khương cách 113 km.",8.4,1.0
https://www.booking.com/hotel/vn/zen-village-lagi.vi.html,Zen Village Lagi,"Nguyễn Tri Phương MQ7P+H2H, La Gi, Việt Nam","Nhìn ra khu vườn, Zen Village Lagi cung cấp chỗ nghỉ có sân hiên và ban công, cách Núi Tà Cú khoảng 30 km. Căn hộ cách Hải đăng Mũi Kê Gà 36 km và với chỗ đậu xe riêng.

Căn hộ có 3 phòng ngủ này cung cấp cho khách TV màn hình phẳng, điều hòa và phòng khách. Bếp có minibar.

Sân bay gần nhất là Sân bay Quốc tế Tân Sơn Nhất, cách Zen Village Lagi 156 km.",9,
https://www.booking.com/hotel/vn/ocean-vista-can-ho-nghi-duong-cao-cap.vi.html,Ocean Vista Căn Hộ Nghỉ Dưỡng Cao Cấp,"Nguyễn Thông, Ấp Phú Tịnh (2), Việt Nam","Cách Bãi đá Ông Địa 3 phút đi bộ, Ocean Vista Căn Hộ Nghỉ Dưỡng Cao Cấp có khu vườn, sân hiên, điều hòa, sân trong và Wi-Fi miễn phí.

Căn hộ có ban công nơi khách có thể nhìn ra khu vườn, khu vực ghế ngồi, TV màn hình phẳng, bếp đầy đủ tiện nghi gồm tủ lạnh và lò nướng, cùng phòng tắm riêng được trang bị vòi sen và đồ vệ sinh cá nhân miễn phí. Lò vi sóng và bếp, cũng như ấm đun nước đều được cung cấp.

Chỗ nghỉ có khu vực bãi biển riêng trong khuôn viên.

Ocean Vista Căn Hộ Nghỉ Dưỡng Cao Cấp cách Sân Golf Sea Link 8.3 km và Suối Tiên 8.9 km. Sân bay gần nhất là Sân bay Liên Khương, cách chỗ nghỉ 138 km.",,
