url,name,location,description,point,star
https://www.booking.com/hotel/vn/co-hang-homestay.vi.html,Cô Hằng Homestay,"60-62 Lê Trọng Tấn, Ấp Bình Hưng, Việt Nam","Tọa lạc ở Ấp Bình Hưng, cách Bãi biển Đồi Dương 2.6 km và Bến xe buýt Bình Thuận 13 phút đi bộ, Cô Hằng Homestay cung cấp chỗ nghỉ có Wi-Fi miễn phí, điều hòa, khu vườn và sân hiên.

Homestay cung cấp BBQ.

Cô Hằng Homestay cách Sân Golf Sea Link 2.7 km và Ga xe lửa Phan Thiết 2.7 km. Sân bay gần nhất là Sân bay Liên Khương, cách chỗ nghỉ 132 km.",10,
https://www.booking.com/hotel/vn/memory-beach-phu-quy.vi.html,Memory Beach Hotel Phú Quý,"142 Lê Hồng Phong, Cu Lao Thu, Việt Nam","Memory Beach Hotel Phú Quý tọa lạc ở Cu Lao Thu. Chỗ nghỉ này có các tiện nghi như dịch vụ phòng và quầy lễ tân 24 giờ, cùng với Wi-Fi miễn phí ở toàn bộ chỗ nghỉ. Một số căn tại chỗ nghỉ có ban công với view núi.

Phòng khách được trang bị tủ lạnh, minibar, ấm đun nước, vòi sen, máy sấy tóc và tủ quần áo. Với phòng tắm riêng được trang bị vòi xịt/chậu rửa vệ sinh và đồ vệ sinh cá nhân miễn phí, các phòng tại khách sạn có TV màn hình phẳng và điều hòa, trong đó một số phòng có sân hiên. Tại Memory Beach Hotel Phú Quý, mỗi phòng đều có ga trải giường và khăn tắm.

Chỗ nghỉ có phục vụ bữa sáng thực đơn à la carte và kiểu Á hằng ngày.

Sân bay gần nhất là Sân bay Liên Khương, cách Memory Beach Hotel Phú Quý 242 km.",,
https://www.booking.com/hotel/vn/beautiful-apec-mandala-appartment.vi.html,Beautiful Apec Mandala appartment,"ÄÆ°á»ng XuÃ¢n Thá»§y 11-17, Ấp Thiẹn Ái, Việt Nam","Nằm ở Ấp Thiẹn Ái, chỉ cách Bãi biển Long Sơn chỉ vài bước chân, Beautiful Apec Mandala appartment cung cấp chỗ nghỉ có hồ bơi ngoài trời, quầy bar và Wi-Fi miễn phí. Căn hộ này còn có hồ bơi riêng.

Căn hộ có 1 phòng ngủ này cung cấp cho khách TV màn hình phẳng, điều hòa và phòng khách. Khăn tắm và ga trải giường có sẵn ở căn hộ.

Căn hộ cách Bãi biển Đồi Cát Đỏ 2.3 km và Suối Tiên 16 km. Sân bay gần nhất là Sân bay Liên Khương, cách Beautiful Apec Mandala appartment 113 km.",9,
https://www.booking.com/hotel/vn/resort-bao-anh-sunset-beach.vi.html,Resort Bao Anh Sunset Beach,"Le Minh Cong, La Gi, Việt Nam","Tọa lạc ở La Gi, cách Bãi biển Cam Bình chỉ vài bước chân, Resort Bao Anh Sunset Beach cung cấp chỗ nghỉ có hồ bơi ngoài trời, chỗ đậu xe riêng miễn phí, khu vườn và sân hiên. Mỗi phòng tại resort 2 sao này đều nhìn ra thành phố, đồng thời khách có thể sử dụng nhà hàng và quầy bar. Chỗ nghỉ này cung cấp dịch vụ phòng, quầy lễ tân 24 giờ và phòng giữ hành lý cho khách.

Tại resort, tất cả các phòng đều được thiết kế có sân trong. Phòng nào cũng có ấm đun nước, trong đó một số phòng có ban công và một số khác thì nhìn ra biển. Phòng khách tại Resort Bao Anh Sunset Beach có điều hòa và bàn làm việc.

Khách tại chỗ nghỉ sẽ có thể tận hưởng các hoạt động ở trong La Gi và khu vực xung quanh, như câu cá.

Resort Bao Anh Sunset Beach cách Núi Tà Cú 34 km và Hải đăng Mũi Kê Gà 40 km.",6,2.0
https://www.booking.com/hotel/vn/edensee-ke-ga-beach-resort.vi.html,Edensee Kega Beach Resort,"P282+X8, Tân Thành, Hàm Thuận Nam, Bình Thuận, Kê Gà, Việt Nam","Tọa lạc ở Kê Gà, cách Bãi biển Kê Gà chưa đến 1 km, Edensee Kega Beach Resort cung cấp chỗ nghỉ có hồ bơi ngoài trời, chỗ đậu xe riêng miễn phí, khu vườn và khu vực bãi biển riêng. Chỗ nghỉ này có các tiện nghi như nhà hàng, phòng chờ chung và dịch vụ phòng, cùng với Wi-Fi miễn phí ở toàn bộ chỗ nghỉ. Chỗ nghỉ này cung cấp quầy lễ tân 24 giờ, dịch vụ tiền sảnh và phòng giữ hành lý cho khách.

Phòng khách được trang bị tủ lạnh, minibar, ấm đun nước, bồn tắm, máy sấy tóc và bàn làm việc. Với phòng tắm riêng được trang bị vòi sen và đồ vệ sinh cá nhân miễn phí, tất cả các căn tại resort có TV màn hình phẳng và điều hòa, trong đó một số phòng có sân hiên. Các căn có tủ quần áo.

Hằng ngày, chỗ nghỉ có các lựa chọn thực đơn buffet, thực đơn à la carte hoặc kiểu lục địa cho bữa sáng.

Edensee Kega Beach Resort có sân chơi trẻ em. Khách có thể chơi đánh tennis tại chỗ nghỉ.

Edensee Kega Beach Resort cách Hải đăng Mũi Kê Gà 3 km và Núi Tà Cú 26 km.",,
https://www.booking.com/hotel/vn/full-house-phan-thiet.vi.html,Novaworld Phan Thiết - Full House,"Novaworld Phan Thiết, Phan Thiết, Việt Nam","Với hồ bơi ngoài trời, khu vườn, cùng quầy bar, Novaworld Phan Thiết - Full House cung cấp chỗ nghỉ ở Phan Thiết có Wi-Fi miễn phí và nhìn ra biển. Chỗ nghỉ này có ban công và chỗ đậu xe riêng miễn phí.

Biệt thự điều hòa này có 2 phòng ngủ, phòng khách, bếp đầy đủ tiện nghi với tủ lạnh và ấm đun nước, 3 phòng tắm với vòi sen và đồ vệ sinh cá nhân miễn phí. Khăn tắm và ga trải giường có sẵn ở biệt thự.

Chỗ nghỉ có khu vực bãi biển riêng trong khuôn viên.

Biệt thự cách Ga xe lửa Phan Thiết 13 km và Bến xe buýt Bình Thuận 14 km.",8.5,4.0
https://www.booking.com/hotel/vn/hana-beach-resort.vi.html,Silver Beach Resort Ke Ga,"Thuan Quy, Ham Thuan Nam, Binh Thuan, Kê Gà, Việt Nam","Tọa lạc trên bãi biển Kê Gà, cách Thành phố Hồ Chí Minh 190 km và resort du lịch mới nổi ở thành phố Phan Thiết, tỉnh Bình Thuận 17 km, TTC Resort - Ke Ga mang đến khung cảnh ngoạn mục của biển và bãi biển dài đầy cát trắng.

Resort được thiết kế trang nhã nhằm mang đến sự sang trọng cho những du khách cần một thiên đường yên tĩnh và riêng tư.

Các nhà hàng và quầy bar được thiết kế theo phong cách độc đáo dành cho một resort sang trọng. Để có trải nghiệm ăn uống đáng nhớ với khung cảnh hoàng hôn tuyệt đẹp, nhà hàng Pool Restaurant là địa điểm ăn uống đặc trưng bên bờ biển. Chỗ nghỉ đảm bảo du khách sẽ có trải nghiệm tuyệt vời nhất với đủ loại đồ ăn & đồ uống cùng các chương trình ẩm thực của chỗ nghỉ.

Tại Resort, du khách sẽ có cơ hội trải nghiệm một kỳ nghỉ tuyệt vời, mang lại cho du khách những kỷ niệm khó phai, đầy thú vị và thư giãn. Được đón tiếp và phục vụ du khách là niềm hạnh phúc lớn lao của chỗ nghỉ.",6.5,4.0
https://www.booking.com/hotel/vn/wakachill-villa-in-mui-ne-thanh-pho-phan-thiet.vi.html,Wakachill Villa in Mui Ne,"Nguyễn Tấn Định, Ấp Thiện Phước, Việt Nam","Nhìn ra hồ bơi, Wakachill Villa in Mui Ne cung cấp chỗ nghỉ có sân hiên và ban công, cách Suối Tiên khoảng 5 km. Nằm cách Bãi biển Hàm Tiến 6 phút đi bộ, chỗ nghỉ cung cấp khu vườn và chỗ đậu xe riêng miễn phí.

Homestay điều hòa này có 4 phòng ngủ riêng biệt, 4 phòng tắm với đồ vệ sinh cá nhân miễn phí, dép đi trong phòng và phòng khách. Khăn tắm và ga trải giường có sẵn ở homestay.

Homestay cách Sân Golf Sea Link 12 km và Bến xe buýt Bình Thuận 14 km. Sân bay gần nhất là Sân bay Liên Khương, cách Wakachill Villa in Mui Ne 134 km.",10,
https://www.booking.com/hotel/vn/resort-condotel-apec-mandala-ps-2-phong-ngu.vi.html,Resort CONDOTEL Apec Mandala PS,"Phan Thiết - Mương Mán, Ấp Thiẹn Ái, Việt Nam","Với Bãi biển Long Sơn nằm cách đó chỉ vài bước chân, Resort CONDOTEL Apec Mandala PS cung cấp chỗ nghỉ, nhà hàng, khu vườn, sân hiên và quầy bar. WiFi và chỗ đậu xe riêng đều có sẵn tại căn hộ miễn phí.

Tất cả các căn đều có điều hòa, phòng tắm riêng, TV màn hình phẳng và bếp nhỏ đầy đủ tiện nghi.

Khách có thể thưởng thức bữa sáng thực đơn buffet, thực đơn à la carte hoặc kiểu Á tại chỗ nghỉ.

Resort CONDOTEL Apec Mandala PS cách Bãi biển Đồi Cát Đỏ 2.4 km và Suối Tiên 16 km.",,3.0
https://www.booking.com/hotel/vn/homestay-an-nhien-long-hai.vi.html,Homestay An Nhiên đảo Phú Quý,"1 Đường Nguyễn Thông, Cu Lao Thu, Việt Nam","Tọa lạc ở Cu Lao Thu, Homestay An Nhiên đảo Phú Quý có khu vườn, sân hiên và Wi-Fi miễn phí ở toàn bộ chỗ nghỉ.

Lễ tân tại khách sạn có thể cung cấp các thông tin hữu ích để giúp du khách tham quan khu vực xung quanh một cách thuận tiện.",10,
https://www.booking.com/hotel/vn/sea-night-phan-thiet.vi.html,Sea Night Hotel,"N4 - 11 Phan Trung, Phú Thuỷ, Khu đô thị phố biển Phan Thiết, Bình Thuận, Phan Thiết, Việt Nam","Nằm ở Phan Thiết, cách Bãi biển Đồi Dương 8 phút đi bộ, Sea Night Hotel cung cấp chỗ nghỉ có phòng chờ chung, chỗ đậu xe riêng miễn phí, sân hiên và quầy bar. Ngoài Wi-Fi miễn phí, khách sạn 3 sao này còn cung cấp dịch vụ phòng và quầy lễ tân 24 giờ. Đây là chỗ nghỉ không hút thuốc và tọa lạc cách Bãi biển Thương Chánh 2.4 km.

Tất cả các căn đi kèm điều hòa, TV màn hình phẳng có truyền hình cáp, tủ lạnh, ấm đun nước, vòi sen, đồ vệ sinh cá nhân miễn phí và bàn làm việc. Tất cả các phòng đều có phòng tắm riêng với máy sấy tóc, trong đó một số phòng có ban công và một số phòng khác cũng nhìn ra thành phố. Tại khách sạn, phòng nào cũng có ga trải giường và khăn tắm.

Sea Night Hotel cách Sân Golf Sea Link 8 phút đi bộ và Ga xe lửa Phan Thiết 2.6 km. Sân bay gần nhất là Sân bay Liên Khương, cách chỗ nghỉ 137 km.",8.2,3.0
https://www.booking.com/hotel/vn/terracotta-resort-spa.vi.html,Terracotta Resort & Spa,"28 Nguyen Dinh Chieu, Ham Tien, Binh Thuan Province, Mũi Né, Việt Nam","Nằm trong khung cảnh thiên nhiên nhiệt đới, Terrracotta Resort and Spa có các phòng nghỉ thanh lịch với lối ra hồ bơi ngoài trời và nơi có các tiện nghi thể dục. Tại đây có nhà hàng, quán bar tại hồ bơi, chỗ đỗ xe và Wi-FI miễn phí.

Với mặt bằng rộng rãi, các phòng máy lạnh tại đây có đồ nội thất bằng gỗ cổ điển, truyền hình cáp và nhìn ra khu vườn. Những phòng này đều có két an toàn và phòng tắm riêng với áo choàng tắm và máy sấy tóc.

Quý khách có thể tận hưởng những giờ tập luyện năng động tại phòng tập thể dục trước khi hướng đến spa hoặc tiệm làm đẹp để thư giãn với những liệu pháp chăm sóc sắc đẹp. Nhân viên có thể hỗ trợ quý khách với các nhu cầu kinh doanh, du lịch và chăm sóc trẻ em.

Với chỗ ngồi rộng rãi, nhà hàng của Terracotta phục vụ rất nhiều món ăn Châu Á và Phương Tây khác nhau với danh sách rượu vang phong phú. Các loại cocktail sảng khoái và nhac sống được phục vụ tại quán bar.

Khu nghỉ mát Resort Terracotta nằm cách trung tâm thành phố Phan Thiết 10 phút lái xe. Nơi nghỉ này cách Sân bay Quốc tế Tân Sơn Nhất 5 giờ lái xe và khách sạn cung cấp phương tiện đưa đón sân bay.",7.7,4.0
https://www.booking.com/hotel/vn/co-tu-39-s-homestay-phuot-phan-thiet.vi.html,Cô Tư's Homestay,"160 Hien Vuong, Thanh Hai Ward, Phan Thiết, Việt Nam","Với Bãi biển Đồi Dương nằm cách đó 6 phút đi bộ, Cô Tư's Homestay cung cấp chỗ nghỉ, nhà hàng, khu vườn, khu vực bãi biển riêng và phòng chờ chung. WiFi và chỗ đậu xe riêng đều có sẵn tại homestay miễn phí.

Khuôn viên của Cô Tư's Homestay có sân hiên và du khách có thể đi xe đạp ở khu vực gần đó.

Chỗ nghỉ cách Sân Golf Sea Link 2 km. Sân bay Liên Khương cách 139 km, đồng thời chỗ nghỉ có cung cấp dịch vụ đưa đón sân bay mất phí.",8.4,
https://www.booking.com/hotel/vn/bao-quyen-resort.vi.html,Mui Ne Sunlight Villa,"229/2 Nguyen Dinh Chieu, Ham Tien Ward, Mũi Né, Việt Nam","Nằm cách Bãi biển Hàm Tiến chỉ vài bước chân, Mui Ne Sunlight Villa cung cấp chỗ nghỉ 2 sao ở Mũi Né, đồng thời có khu vườn, phòng chờ chung và nhà hàng. Ngoài phòng gia đình, chỗ nghỉ này cũng cung cấp cho khách hồ bơi ngoài trời. Chỗ nghỉ cung cấp lễ tân 24/24, dịch vụ đưa đón sân bay, dịch vụ phòng và Wi-Fi miễn phí.

Tại resort, các phòng được thiết kế có điều hòa, bàn làm việc, sân hiên với view hồ bơi, phòng tắm riêng, TV màn hình phẳng, ga trải giường và khăn tắm. Các căn đều có tủ lạnh.

Mui Ne Sunlight Villa có BBQ.

Chỗ nghỉ cách Suối Tiên 3.1 km và Sân Golf Sea Link 14 km.",9,2.0
https://www.booking.com/hotel/vn/nha-nghi-hoa-muoi-gio.vi.html,Nhà Nghỉ Hoa Mười Giờ,"48 Ngô Quyền, Tân Tạo, Việt Nam","Tọa lạc ở Tân Tạo, cách Núi Tà Cú 28 km và Hải đăng Mũi Kê Gà 35 km, Nhà Nghỉ Hoa Mười Giờ cung cấp chỗ nghỉ có khu vườn và Wi-Fi miễn phí ở toàn bộ chỗ nghỉ cũng như chỗ đậu xe riêng miễn phí cho khách lái xe.

Với phòng tắm riêng được trang bị vòi xịt/chậu rửa vệ sinh và đồ vệ sinh cá nhân miễn phí, các phòng tại guest house có TV màn hình phẳng và điều hòa, trong đó một số phòng có sân hiên.",9.6,
https://www.booking.com/hotel/vn/apec-mandala-mui-ne-phan-thiet-thanh-pho-phan-thiet5.vi.html,"Apec Mandala Mũi Né, Phan Thiết","ĐT716,, Ấp Long Sơn, Việt Nam","Nằm ở Ấp Long Sơn, cách Bãi biển Long Sơn 7 phút đi bộ và Suối Tiên 14 km, Apec Mandala Mũi Né, Phan Thiết cung cấp chỗ nghỉ có Wi-Fi miễn phí, điều hòa và khu vườn với hồ bơi ngoài trời.

Tất cả các căn đều có TV màn hình phẳng, cùng bếp đầy đủ tiện nghi với tủ lạnh, lò vi sóng và ấm đun nước.

Chỗ nghỉ có khu vực bãi biển riêng trong khuôn viên.

Khách sạn căn hộ cách Sân Golf Sea Link 30 km và Bến xe buýt Bình Thuận 32 km. Sân bay gần nhất là Sân bay Liên Khương, cách Apec Mandala Mũi Né, Phan Thiết 115 km.",,
https://www.booking.com/hotel/vn/lagi-beach.vi.html,Lagi Beach Hotel,"Bến xe Thầy Thím, Đường Lý Thái Tổ, Tân Tiến, Hàm Tân, Bình Thuận, La Gi, Việt Nam","Với khu vực bãi biển riêng, Lagi Beach Hotel nằm ở La Gi, Bình Thuận, cách Hải đăng Mũi Kê Gà 22 km và Ga xe lửa Phan Thiết 49 km. Chỗ nghỉ này có các tiện nghi như quầy lễ tân 24 giờ và dịch vụ tiền sảnh, cùng với Wi-Fi miễn phí ở toàn bộ chỗ nghỉ. Đây là chỗ nghỉ không hút thuốc và tọa lạc cách Núi Tà Cú 16 km.

Tại khách sạn, tất cả các phòng đều có bàn làm việc. Với phòng tắm riêng được trang bị vòi sen và đồ vệ sinh cá nhân miễn phí, phòng khách tại Lagi Beach Hotel có TV màn hình phẳng và điều hòa, trong đó một số phòng có sân hiên. Tại chỗ nghỉ, mỗi phòng đều được thiết kế có ga trải giường và khăn tắm.

Lagi Beach Hotel cách Bến xe buýt Bình Thuận 49 km và Bến xe buýt Nam Phan Thiết 46 km. Sân bay gần nhất là Sân bay Quốc tế Tân Sơn Nhất, cách khách sạn 162 km.",8.7,
https://www.booking.com/hotel/vn/lotus-muine-resort-spa.vi.html,Lotus Muine Resort & Spa,"Quarter 5, Phu Hai Ward, Mũi Né, Việt Nam","Lotus Muine Resort & Spa cung cấp các chỗ nghỉ ven biển ở Tỉnh Bình Thuận, cách Thành phố Phan Thiết chỉ 7 km. Resort xinh xắn này có hồ bơi nhiệt đới ngoài trời, và cung cấp miễn phí chỗ đỗ xe cùng Wi-Fi trong toàn bộ khuôn viên.

Các phòng nghỉ tại Muine Lotus Resort nổi bật với tầm nhìn toàn cảnh đại dương và bãi biển Mũi Né. Trong phòng cũng được trang bị TV truyền hình cáp/ vệ tinh màn hình phẳng và két an toàn cá nhân. Mỗi phòng đều có tiện nghi pha trà/cà phê và tủ lạnh.

Quý khách có thể ngâm mình sảng khoái trong hồ bơi hoặc tận hưởng dịch vụ mát-xa thư giãn tại spa. Vào buổi chiều, quý khách cũng có thể dành thời gian nghỉ ngơi trong phòng xông hơi khô và bồn tắm spa. Dịch vụ trợ giúp đặc biệt và đặt vé được cung cấp bởi các nhân viên thân thiện tại đây. Dịch vụ cho thuê xe đạp miễn phí cũng được cung cấp.

Lotus Muine Resort & Spa phục vụ các món ăn địa phương và quốc tế. Moon Beach Bar & Restaurant nhìn ra khung cảnh hoàng hôn tuyệt đẹp với cocktail độc đáo cũng như nhiều món tráng miệng thơm ngon.

Lotus Muine Resort & Spa chỉ cách Trung tâm Du lịch Mũi Né và Tháp Chăm Pôshanư một quãng ngắn.",7.3,4.0
https://www.booking.com/hotel/vn/jimmy-c-house.vi.html,Jimmy'C House Đảo Phú Quý,"65 Phan Bội Châu, Cu Lao Thu, Việt Nam","Jimmy'C House Đảo Phú Quý nằm ở Cu Lao Thu và có khu vườn. Ngoài Wi-Fi miễn phí, khách sạn 5 sao này còn cung cấp dịch vụ phòng và quầy lễ tân 24 giờ.",8,5.0
https://www.booking.com/hotel/vn/hoang-villa.vi.html,Hoàng Villa,"304 Quang Trung, Tuy Phong, Việt Nam","Nằm ở Tuy Phong thuộc vùng Bình Thuận và cách Triển lãm Tecnopolis Buenos Aires 23 km, Hoàng Villa cung cấp chỗ nghỉ có Wi-Fi miễn phí, tiện nghi BBQ, khu vườn cùng chỗ đậu xe riêng miễn phí.

Chỗ nghỉ có điều hòa, bếp đầy đủ tiện nghi, TV màn hình phẳng, cũng như phòng tắm riêng với vòi sen, đồ vệ sinh cá nhân miễn phí và máy sấy tóc. Một số căn có ban công và/hoặc sân trong nhìn ra biển.

Khách có thể tìm thấy sân hiên và khu vực bãi biển riêng tại nhà nghỉ B&B, cùng phòng chờ chung.

Hoàng Villa cách Đồi cát hồng 46 km và Chợ Mũi Né 49 km. Sân bay gần nhất là Sân bay Liên Khương, cách chỗ nghỉ 113 km.",8.4,
https://www.booking.com/hotel/vn/cam-binh-resort-tx-la-gi.vi.html,NBC Cam Bình Resort,"Lê Minh Công, Vĩnh Thạnh, Việt Nam","NBC Cam Bình Resort có hồ bơi ngoài trời, khu vườn, khu vực bãi biển riêng và nhà hàng ở Vĩnh Thạnh. Với quầy bar, chỗ nghỉ nằm cách Bãi biển Cam Bình chỉ vài bước chân. Chỗ nghỉ này cung cấp nhân viên phục vụ hoạt động giải trí và dịch vụ phòng.

Các căn đi kèm điều hòa, TV màn hình phẳng có truyền hình vệ tinh, tủ lạnh, ấm đun nước, vòi xịt/chậu rửa vệ sinh, đồ vệ sinh cá nhân miễn phí và bàn làm việc. Với phòng tắm riêng được trang bị vòi sen và máy sấy tóc, các phòng tại resort cũng có Wi-Fi miễn phí, trong đó một số phòng có sân hiên. Tại NBC Cam Bình Resort, các phòng đều đi kèm với ga trải giường và khăn tắm.

Khách có thể chơi trò phi tiêu tại chỗ nghỉ.

NBC Cam Bình Resort cách Núi Tà Cú 34 km và Hải đăng Mũi Kê Gà 40 km.",,
https://www.booking.com/hotel/vn/vy-39-s-house-phanthiet.vi.html,Vy's House Phanthiet Hotel,"C7-09 Khu phố biển Rạng Đông, Ấp Tân An (1), Việt Nam","Vy's House Phanthiet Hotel tọa lạc ở Ấp Tân An (1), cách Bãi biển Đồi Dương 3 km và Bến xe buýt Bình Thuận 18 phút đi bộ. Ngoài Wi-Fi miễn phí, khách sạn 2 sao này còn cung cấp quầy lễ tân 24 giờ và dịch vụ tiền sảnh. Một số căn tại chỗ nghỉ có ban công với view biển.

Các phòng được trang bị điều hòa, TV màn hình phẳng có truyền hình cáp, minibar, ấm đun nước, vòi sen, đồ vệ sinh cá nhân miễn phí và bàn làm việc. Mỗi phòng đều có két an toàn, trong đó một số phòng có sân hiên và một số khác cũng nhìn ra thành phố. Tại khách sạn, các phòng đều có ga trải giường và khăn tắm.

Vy's House Phanthiet Hotel cách Sân Golf Sea Link 3 km và Ga xe lửa Phan Thiết 3.7 km. Sân bay gần nhất là Sân bay Liên Khương, cách chỗ nghỉ 135 km.",9,2.0
https://www.booking.com/hotel/vn/bali-thanh-pho-phan-thiet.vi.html,Bali Hotel 2,"100 Tuyên Quang, Khu phố 6, phường Phú Thủy, Ấp Bình Hưng, Việt Nam","Nằm ở Ấp Bình Hưng, cách Bãi biển Đồi Dương 18 phút đi bộ, Bali Hotel 2 cung cấp chỗ nghỉ có phòng chờ chung, chỗ đậu xe riêng miễn phí và sân hiên. Chỗ nghỉ này tọa lạc cách Bãi biển Thương Chánh 2.2 km, Suối Tiên 19 km và Hải đăng Mũi Kê Gà 33 km. Chỗ nghỉ cung cấp lễ tân 24/24, dịch vụ đưa đón sân bay, dịch vụ phòng và Wi-Fi miễn phí.

Tất cả các phòng đi kèm điều hòa, TV màn hình phẳng có truyền hình cáp, tủ lạnh, ấm đun nước, vòi xịt/chậu rửa vệ sinh, đồ vệ sinh cá nhân miễn phí và bàn làm việc. Với phòng tắm riêng được trang bị vòi sen và máy sấy tóc, một số phòng tại khách sạn cũng có view thành phố. Tại Bali Hotel 2, các phòng đều đi kèm với ga trải giường và khăn tắm.

Các điểm tham quan nổi tiếng gần chỗ nghỉ bao gồm Ga xe lửa Phan Thiết, Bến xe buýt Bình Thuận và Sân Golf Sea Link. Sân bay Liên Khương cách 137 km.",7,
https://www.booking.com/hotel/vn/lahona-thi-xa-la-gi-tinh-binh-thuan.vi.html,LAHONA HOTEL,"317 NGUYỄN  TRƯỜNG TỘ P TÂN THIỆN THỊ XÃ  LAGI, TỈNH BÌNH THUẬN 317, La Gi, Việt Nam","Tọa lạc ở La Gi, cách Núi Tà Cú 27 km, LAHONA HOTEL nhìn ranúi. Ngoài quầy bar, khách sạn 3 sao này có các phòng được trang bị điều hòa và Wi-Fi miễn phí, trong đó mỗi phòng sẽ có phòng tắm riêng. Chỗ nghỉ có chỗ đậu xe riêng miễn phí và có cả dịch vụ đưa đón sân bay mất phí.

Phòng khách được trang bị tủ lạnh, minibar, ấm đun nước, vòi xịt/chậu rửa vệ sinh, đồ vệ sinh cá nhân miễn phí và tủ quần áo. Các phòng được thiết kế có TV màn hình phẳng, ngoài ra một số căn tại khách sạn có ban công. Tại LAHONA HOTEL, phòng nào cũng có ga trải giường và khăn tắm.

Đội ngũ nhân viên lễ tân giao tiếp thành thạo bằng tiếng Anh và tiếng Việt.

Chỗ nghỉ cách Hải đăng Mũi Kê Gà 33 km. Sân bay gần nhất là Sân bay Quốc tế Tân Sơn Nhất, cách LAHONA HOTEL 152 km.",8.3,3.0
https://www.booking.com/hotel/vn/amant-boutique-house-phu-quy.vi.html,L'amant Boutiqué House Phú Quý,"152 Lê Hồng Phong, Cu Lao Thu, Việt Nam","L'amant Boutiqué House Phú Quý cung cấp chỗ nghỉ điều hòa ở Cu Lao Thu. Tại đây có sân hiên và khách có thể sử dụng Wi-Fi miễn phí và chỗ đậu xe riêng miễn phí.

Tại khách sạn, các phòng được thiết kế có tủ quần áo. Với phòng tắm riêng được trang bị vòi xịt/chậu rửa vệ sinh và đồ vệ sinh cá nhân miễn phí, một số phòng tại L'amant Boutiqué House Phú Quý cũng có view biển. Tại chỗ nghỉ, tất cả các phòng có ga trải giường và khăn tắm.

Thành thạo tiếng Anh và tiếng Việt, đội ngũ nhân viên tại lễ tân 24/24 luôn sẵn lòng đưa ra thông tin hữu ích về khu vực xung quanh.

Sân bay Liên Khương cách 242 km.",,
