url,name,location,description,point,star
https://www.booking.com/hotel/vn/mui-ne-resort.vi.html,Mui Ne Resort,"144 Nguyen Dinh Chieu, Mũi Né, Việt Nam","Nằm dọc trên đường bờ biển, Mui Ne Resort được nối thẳng tới Bãi biển Phan Thiết xinh đẹp. Nơi nghỉ này có hồ bơi ngoài trời và chỗ đỗ xe miễn phí trong khuôn viên. Wi-Fi miễn phí được cung cấp tại các khu vực chung.

Khu nghỉ mát này cách Suối Tiên chỉ 10 phút và cách Cồn Cát Đỏ chỉ 15 phút đi xe. Trung tâm Thành phố Phan Thiết nằm cách nơi đây 21 km.

Với sàn lát gạch, các phòng ngủ máy lạnh được trang bị truyền hình cáp màn hình phẳng, minibar và khu vực tiếp khách. Phòng tắm riêng có máy sấy tóc, tiện nghi tắm vòi sen cũng như đồ vệ sinh cá nhân miễn phí. Du khách có thể chọn phòng nghỉ nhìn ra quang cảnh vườn hoặc hồ bơi.

Mui Ne Resort có quầy lễ tân làm việc 24 giờ, phục vụ dịch vụ để hành lý, dịch vụ giặt ủi và cho thuê xe hơi. Các tiện nghi khác dành cho khách bao gồm bàn bán tour và trung tâm dịch vụ doanh nhân. Du khách có thể thưởng thức một ván chơi bi-a hay nướng thịt ngoài trời với các tiện nghi được cung cấp sẵn.

Ẩm thực Việt Nam cũng như Quốc tế được phục vụ tại Nhà hàng Sunshine. Nơi nghỉ này còn có quầy bar bên hồ bơi và dịch vụ ăn uống tại phòng.",6.4,
https://www.booking.com/hotel/vn/truong-phuc-vinh.vi.html,Trường Phúc Vinh Hotel,"91 Đường Lê Đại Hành, Phan Thiết, Việt Nam","Tọa lạc ở Phan Thiết, cách Bãi biển Đồi Dương 2 km và Bến xe buýt Bình Thuận 1.7 km, Trường Phúc Vinh Hotel cung cấp chỗ nghỉ có sân hiên và Wi-Fi miễn phí cũng như chỗ đậu xe riêng miễn phí cho khách lái xe. Chỗ nghỉ cách Sân Golf Sea Link khoảng 2 km, Ga xe lửa Phan Thiết 3.1 km và Suối Tiên 18 km. Chỗ nghỉ này cung cấp dịch vụ phòng và quầy lễ tân 24 giờ cho khách.

Khách sạn cách Hải đăng Mũi Kê Gà 35 km và Núi Tà Cú 36 km.",7.9,
https://www.booking.com/hotel/vn/barland-villa.vi.html,Barland Villa,"Barland Villa, Kê Gà, Việt Nam","Nằm ở Kê Gà, cách Bãi biển Kê Gà chỉ vài bước chân và Hải đăng Mũi Kê Gà 15 phút đi bộ, Barland Villa cung cấp chỗ nghỉ có Wi-Fi miễn phí, điều hòa, khu vườn và quầy bar.

Một số căn có sân hiên và/hoặc sân trong nhìn ra biển hoặc khu vườn.

Khách tại nhà nghỉ B&B có thể thưởng thức bữa sáng kiểu Á.

Barland Villa cách Núi Tà Cú 24 km và Ga xe lửa Phan Thiết 32 km.",10,
https://www.booking.com/hotel/vn/co-tu-39-s-homestay-mui-ne.vi.html,Co Tu's Homestay - Mui Ne,"715, Khu Pho 3, Ham Tien ward, Mũi Né, Việt Nam","Nhìn ra khu vườn, Co Tu's Homestay - Mui Ne nằm ở Mũi Né và có nhà hàng, bếp chung, bar thức ăn nhẹ, khu vườn, sân hiên cũng như sân chơi trẻ em. Nhà nghỉ B&B có WiFi và chỗ đậu xe riêng miễn phí.

Tại đây có phòng tắm riêng đầy đủ tiện nghi với vòi xịt/chậu rửa vệ sinh và đồ vệ sinh cá nhân miễn phí.

Co Tu's Homestay - Mui Ne có phục vụ bữa sáng kiểu Á mỗi sáng.

Khách cũng có thể thư giãn trong khu vực phòng chờ chung.

Các điểm tham quan nổi tiếng gần chỗ nghỉ bao gồm Bãi biển Hàm Tiến, Rang Church và Chợ Rạng. Sân bay Liên Khương cách 130 km, đồng thời chỗ nghỉ có cung cấp dịch vụ đưa đón sân bay mất phí.",7.8,
https://www.booking.com/hotel/vn/lagi-1001-nights-lagi.vi.html,LAGI 1001 NIGHTS HOTEL,"215B Nguyễn Chí Thanh, Tân Bình, Lagi, Bình Thuận, La Gi, Việt Nam","Tọa lạc ở La Gi, cách Núi Tà Cú 24 km, LAGI 1001 NIGHTS HOTEL cung cấp chỗ nghỉ có khu vườn, chỗ đậu xe riêng miễn phí, sân hiên và tiện nghi BBQ. Chỗ nghỉ này cung cấp dịch vụ phòng và Wi-Fi miễn phí ở toàn bộ chỗ nghỉ.

Tại khách sạn, các phòng đều có ban công với view vườn. Với phòng tắm riêng được trang bị vòi sen và đồ vệ sinh cá nhân miễn phí, phòng khách tại LAGI 1001 NIGHTS HOTEL có TV màn hình phẳng và điều hòa, trong đó một số phòng có sân trong. Tại chỗ nghỉ, phòng nào cũng có ga trải giường và khăn tắm.

LAGI 1001 NIGHTS HOTEL cách Hải đăng Mũi Kê Gà 30 km.",10,
https://www.booking.com/hotel/vn/moon-apec-mandala-mui-ne.vi.html,Moon Apec mandala Mũi Né,"Đường tỉnh 716 15, Ấp Thiẹn Ái, Việt Nam","Moon Apec mandala Mũi Né tọa lạc ở Ấp Thiẹn Ái với hồ bơi riêng và nhìn ra biển. Chỗ nghỉ điều hòa này cách Bãi biển Long Sơn chỉ vài bước chân, khách có thể sử dụng WiFi miễn phí và chỗ đậu xe riêng có sẵn trong khuôn viên.

Căn hộ có 1 phòng ngủ, TV màn hình phẳng và bếp đầy đủ tiện nghi với minibar.

Căn hộ cách Bãi biển Đồi Cát Đỏ 2.4 km và Suối Tiên 16 km. Sân bay gần nhất là Sân bay Liên Khương, cách Moon Apec mandala Mũi Né 113 km.",,
https://www.booking.com/hotel/vn/ocean-beer-homestay.vi.html,Ocean Beer Homestay,"N2-08,10 phố biển Phan Thiết ( Ocean Dunes ), Phan Thiết, Việt Nam","Ocean Beer Homestay có xe đạp miễn phí, khu vườn, sân hiên và nhà hàng ở Phan Thiết. Chỗ nghỉ cách Ga xe lửa Phan Thiết khoảng 1.7 km, Bến xe buýt Bình Thuận 2.7 km và Suối Tiên 19 km. Chỗ nghỉ này cung cấp dịch vụ phòng và Wi-Fi miễn phí ở toàn bộ chỗ nghỉ.

Tại inn, các phòng đều đi kèm với ban công với view biển. Ngoài phòng tắm riêng, vòi sen và đồ vệ sinh cá nhân miễn phí, các phòng tại Ocean Beer Homestay đều có view thành phố. Tại chỗ nghỉ, tất cả các phòng đều được thiết kế có ga trải giường và khăn tắm.

Các điểm tham quan nổi tiếng gần Ocean Beer Homestay bao gồm Bãi biển Đồi Dương, Bãi biển Thương Chánh và Sân Golf Sea Link. Chỗ nghỉ cách Sân bay Liên Khương 134 km và cung cấp dịch vụ đưa đón sân bay mất phí.",,
https://www.booking.com/hotel/vn/can-ho-ocean-vista-1br-sea-view-sea-home-o867-7o7-123.vi.html,"Căn hộ Ocean Vista 1br Sea view - Sea Home O867,7O7,123","1 Nguyễn Đình Chiểu, Ấp Phú Tịnh (2), Việt Nam","Nằm ở Ấp Phú Tịnh (2), cách Bãi đá Ông Địa 2 phút đi bộ, Căn hộ Ocean Vista 1br Sea view - Sea Home O867,7O7,123 cung cấp chỗ nghỉ có khu vực bãi biển riêng, Wi-Fi miễn phí và quầy lễ tân 24 giờ. Chỗ nghỉ giáp biển này có ban công.

Căn hộ điều hòa này có 1 phòng ngủ riêng biệt, phòng khách, bếp nhỏ đầy đủ tiện nghi, cùng 1 phòng tắm. TV màn hình phẳng được cung cấp.

Căn hộ cách Sân Golf Sea Link 8.3 km và Suối Tiên 8.9 km. Sân bay gần nhất là Sân bay Liên Khương, cách Căn hộ Ocean Vista 1br Sea view - Sea Home O867,7O7,123 135 km.",,
https://www.booking.com/hotel/vn/huyen-tran-2-homestay.vi.html,Huyền Trân 2 Homestay,"Nguyễn Đình Chiểu 7, Ấp Thiện Phước, Việt Nam","Nằm ở Ấp Thiện Phước, cách Bãi đá Ông Địa 2.2 km và Suối Tiên 6.6 km, Huyền Trân 2 Homestay cung cấp chỗ nghỉ có điều hòa và khu vườn.

Căn hộ cách Sân Golf Sea Link 12 km và Bến xe buýt Bình Thuận 13 km.",5,
https://www.booking.com/hotel/vn/villa-novaworld-phan-thiet-mui-ne.vi.html,Anata Villa SeaView - Novaworld Phan Thiết,"Đường tỉnh 719 Villa 43, Bình Tú, Việt Nam","Với hồ bơi ngoài trời, khu vườn, cùng phòng chờ chung, Anata Villa SeaView - Novaworld Phan Thiết cung cấp chỗ nghỉ ở Bình Tú có Wi-Fi miễn phí và nhìn ra biển. Biệt thự cung cấp chỗ đậu xe riêng miễn phí và bếp chung.

Biệt thự điều hòa này có 3 phòng ngủ, phòng khách, bếp đầy đủ tiện nghi với tủ lạnh và ấm đun nước, 3 phòng tắm với vòi xịt/chậu rửa vệ sinh và vòi sen. Khăn tắm và ga trải giường có sẵn ở biệt thự.

Biệt thự có sân hiên.

Anata Villa SeaView - Novaworld Phan Thiết cách Ga xe lửa Phan Thiết 14 km và Bến xe buýt Bình Thuận 16 km.",,
https://www.booking.com/hotel/vn/nha-go-an-nhien.vi.html,Nhà Gỗ An Nhiên,"Cây Găng, Tân Thành, Hàm Thuận Nam, Xóm Chum Găng, Việt Nam","Nằm ở Xóm Chum Găng, cách Hải đăng Mũi Kê Gà 7.5 km, Nhà Gỗ An Nhiên cung cấp chỗ nghỉ có hồ bơi ngoài trời, chỗ đậu xe riêng miễn phí, khu vườn và phòng chờ chung. Ngoài sân hiên, chỗ nghỉ còn có nhà hàng và quầy bar. Chỗ nghỉ cung cấp lễ tân 24/24, dịch vụ đưa đón sân bay, dịch vụ phòng và Wi-Fi miễn phí ở toàn bộ chỗ nghỉ.

Tại resort, tất cả các phòng đều có bàn làm việc, ga trải giường và sân trong với view vườn. Các phòng được thiết kế có phòng tắm riêng với vòi xịt/chậu rửa vệ sinh, đồ vệ sinh cá nhân miễn phí và máy sấy tóc. Các căn tại Nhà Gỗ An Nhiên có điều hòa và tủ quần áo.

Chỗ nghỉ có phục vụ bữa sáng thực đơn à la carte mỗi buổi sáng.

Nhà Gỗ An Nhiên có sân chơi trẻ em. Khách tại resort sẽ có thể tận hưởng các hoạt động ở trong Xóm Chum Găng và khu vực xung quanh, như leo núi.

Nhà Gỗ An Nhiên cách Núi Tà Cú 19 km và Ga xe lửa Phan Thiết 38 km.",,
https://www.booking.com/hotel/vn/vipol-muine-thanh-pho-phan-thiet12.vi.html,Vipol Mui Ne Hotel & Spa,"29a Nguyễn Đình Chiểu, Mũi Né, Việt Nam","Nằm ở Mũi Né, cách Bãi biển Hàm Tiến 3 phút đi bộ, Vipol Mui Ne Hotel & Spa cung cấp chỗ nghỉ có hồ bơi ngoài trời, chỗ đậu xe riêng miễn phí, trung tâm thể dục và sân hiên. Chỗ nghỉ này có các tiện nghi như nhà hàng, câu lạc bộ trẻ em và dịch vụ phòng, cùng với Wi-Fi miễn phí. Chỗ nghỉ này cung cấp quầy lễ tân 24 giờ, máy ATM và dịch vụ thu đổi ngoại tệ cho khách.

Khách sạn sẽ cung cấp cho khách các phòng được trang bị điều hòa có bàn làm việc, ấm đun nước, minibar, két an toàn, TV màn hình phẳng và phòng tắm riêng với vòi xịt/chậu rửa vệ sinh. Tại Vipol Mui Ne Hotel & Spa, các phòng đều có ga trải giường và khăn tắm.

Chỗ nghỉ có phục vụ bữa sáng thực đơn buffet mỗi buổi sáng.

Vipol Mui Ne Hotel & Spa có sân chơi trẻ em.

Khách sạn cách Bãi đá Ông Địa chưa đến 1 km và Suối Tiên 7.4 km.",8.8,4.0
https://www.booking.com/hotel/vn/ocean-vista-sealinks-thanh-pho-phan-thiet1.vi.html,Ocean Vista Sealinks,"Nguyễn Thông, Ấp Ngọc Hải, Việt Nam","Ocean Vista Sealinks cung cấp chỗ nghỉ nằm ở Ấp Ngọc Hải, cách Bãi đá Ông Địa 4 phút đi bộ, Sân Golf Sea Link 7.8 km và Bến xe buýt Bình Thuận 9.2 km. Chỗ nghỉ này có ban công, chỗ đậu xe riêng miễn phí và Wi-Fi miễn phí.

Căn hộ điều hòa này có 1 phòng ngủ riêng biệt, phòng khách, bếp đầy đủ tiện nghi, cùng 1 phòng tắm. TV màn hình phẳng được cung cấp.

Căn hộ cách Ga xe lửa Phan Thiết 10 km và Suối Tiên 12 km. Sân bay gần nhất là Sân bay Liên Khương, cách Ocean Vista Sealinks 138 km.",,
https://www.booking.com/hotel/vn/nu-cuoi-mui-ne.vi.html,NỤ CƯỜI MŨI NÉ HOTEL,"168 Nguyễn Đình Chiểu, Ấp Thiện Long, Việt Nam","Tọa lạc ở Ấp Thiện Long, cách Bãi biển Hàm Tiến chỉ vài bước chân, NỤ CƯỜI MŨI NÉ HOTEL cung cấp chỗ nghỉ có khu vườn, chỗ đậu xe riêng miễn phí, sân hiên và nhà hàng. Khách sạn 2 sao này cung cấp dịch vụ phòng, quầy lễ tân 24 giờ và Wi-Fi miễn phí. Chỗ nghỉ này cung cấp máy ATM, dịch vụ tiền sảnh và tổ chức các tour du lịch cho khách.

Phòng khách được trang bị điều hòa, TV màn hình phẳng có truyền hình cáp, tủ lạnh, ấm đun nước, vòi sen, dép đi trong phòng và bàn làm việc. Ngoài phòng tắm riêng, các phòng tại khách sạn đều có view thành phố.

Khách có thể thưởng thức bữa sáng thực đơn buffet, thực đơn à la carte hoặc kiểu Ý tại chỗ nghỉ.

Các điểm tham quan nổi tiếng gần NỤ CƯỜI MŨI NÉ HOTEL bao gồm Suối Tiên, Chợ Rạng và Rang Church. Sân bay Liên Khương cách 131 km.",6.7,2.0
https://www.booking.com/hotel/vn/orchid-boutique-beach-resort.vi.html,Orchid Boutique Beach Resort,"Thon Tien Binh, Tien Thanh, Phan Thiết, Việt Nam","Nằm dọc theo bờ biển, Orchid Boutique Beach Resort cung cấp chỗ ở thoải mái và yên bình với Wi-Fi miễn phí toàn khuôn viên. Nơi đây có hồ bơi ngoài trời, khu vực bãi biển riêng và những khu vườn xanh tươi tốt.

Các phòng và bungalow máy lạnh tại đây được trang bị sàn lát gạch, tủ quần áo, khu vực tiếp khách, két an toàn (trong phòng), minibar và truyền hình cáp. Phòng tắm riêng đi kèm máy sấy tóc, dép và đồ vệ sinh cá nhân miễn phí.

Orchid Boutique Beach Resort có lễ tân 24 giờ và nhân viên tại đây có thể trợ giúp quý khách với các dịch vụ để hành lý, cho thuê xe đạp và giặt là. Quý khách cũng có thể chơi bida hoặc tận hưởng dịch vụ mát-xa thư giãn tại spa.

Nơi đây có nhà hàng phục vụ nhiều món ăn ngon của địa phương. Phố Ẩm Thực Phan Thiết nằm trong bán kính 7,3 km từ resort. Ga tàu Phan Thiết cách đó 7,6 km lái xe.",8.4,3.0
https://www.booking.com/hotel/vn/apec-mandala-chambay-mui-ne-binh-thuan1.vi.html,Apec Mandala Chambay Mui Ne Ocean view,"Đường tỉnh 716, Ấp Long Sơn, Việt Nam, Ấp Thiẹn Ái, Việt Nam","Nhìn ra biển, Apec Mandala Chambay Mui Ne Ocean view ở Ấp Thiẹn Ái cung cấp chỗ nghỉ có hồ bơi ngoài trời, khu vườn, sân hiên, quầy bar và khu vực bãi biển riêng. Căn hộ có WiFi và chỗ đậu xe riêng miễn phí.

Chỗ nghỉ có điều hòa, bếp nhỏ đầy đủ tiện nghi, TV màn hình phẳng, cũng như phòng tắm riêng với vòi xịt/chậu rửa vệ sinh, đồ vệ sinh cá nhân miễn phí và máy sấy tóc. Tủ lạnh và lò vi sóng, cũng như ấm đun nước đều được cung cấp.

Tại Apec Mandala Chambay Mui Ne Ocean view, khách có thể sử dụng bể sục.

Chỗ nghỉ cách Bãi biển Long Sơn 7 phút đi bộ và Bãi biển Đồi Cát Đỏ 2.5 km. Sân bay gần nhất là Sân bay Liên Khương, cách Apec Mandala Chambay Mui Ne Ocean view 113 km.",8,
https://www.booking.com/hotel/vn/ravenala-muine-resort.vi.html,Ravenala Muine Resort,"146 Nguyễn Đình Chiểu, Phan Thiết, Việt Nam","Nằm ở Phan Thiết, cách Bãi biển Hàm Tiến chỉ vài bước chân, Ravenala Muine Resort cung cấp chỗ nghỉ có hồ bơi ngoài trời, chỗ đậu xe riêng miễn phí, khu vườn và sân hiên. Ngoài dịch vụ phòng, chỗ nghỉ này còn có nhà hàng để phục vụ du khách. Một số phòng tại chỗ nghỉ có ban công với view vườn.

Thành thạo tiếng Anh và tiếng Việt, đội ngũ nhân viên tại lễ tân 24/24 luôn sẵn lòng đưa ra thông tin hữu ích về khu vực xung quanh.

Khách sạn cách Suối Tiên 2.4 km và Sân Golf Sea Link 15 km.",7.6,
https://www.booking.com/hotel/vn/mandala-chambayy-mui-ne-ngaa.vi.html,Mandala Chambayy Mũi Né TNRSS,"Đường tỉnh 716, Ấp Long Sơn, Việt Nam","Nằm cách Bãi biển Long Sơn 6 phút đi bộ, Mandala Chambayy Mũi Né TNRSS cung cấp chỗ nghỉ ở Ấp Long Sơn có hồ bơi trong nhà. Chỗ nghỉ nhìn ra thành phố, có khu vườn, sân hiên và Wi-Fi miễn phí ở toàn bộ chỗ nghỉ.

Căn hộ điều hòa này có 1 phòng ngủ, TV màn hình phẳng và bếp nhỏ với tủ lạnh và lò vi sóng.

Căn hộ cách Suối Tiên 13 km và Sân Golf Sea Link 30 km. Sân bay gần nhất là Sân bay Liên Khương, cách Mandala Chambayy Mũi Né TNRSS 116 km.",9,
https://www.booking.com/hotel/vn/phan-nguyen-mandala-mui-ne.vi.html,Phan Nguyên Mandala Mũi Né,"Đường tỉnh 716, Mũi Né, Việt Nam","Nằm ở Mũi Né, cách Bãi biển Long Sơn chỉ vài bước chân, Phan Nguyên Mandala Mũi Né cung cấp chỗ nghỉ có hồ bơi ngoài trời, chỗ đậu xe riêng miễn phí, khu vườn và khu vực bãi biển riêng. Ngoài Wi-Fi miễn phí, khách sạn 5 sao này còn cung cấp dịch vụ phòng và quầy lễ tân 24 giờ. Một số phòng tại chỗ nghỉ có ban công với view thành phố.

Khách sạn sẽ cung cấp cho khách các phòng được trang bị điều hòa có bàn làm việc, ấm đun nước, tủ lạnh, lò vi sóng, két an toàn, TV màn hình phẳng và phòng tắm riêng với vòi sen. Tại Phan Nguyên Mandala Mũi Né, các phòng đều có ga trải giường và khăn tắm.

Chỗ nghỉ có sân hiên.

Phan Nguyên Mandala Mũi Né cách Bãi biển Đồi Cát Đỏ 2.3 km và Suối Tiên 16 km.",7.2,5.0
https://www.booking.com/hotel/vn/ca-homestay-thanh-pho-phan-thiet.vi.html,Cá Homestay Mũi Né,"117D Nguyễn Đình Chiểu, Mũi Né, Việt Nam","Nằm ở Mũi Né, cách Suối Tiên 5.2 km và Sân Golf Sea Link 13 km, Cá Homestay Mũi Né cung cấp chỗ nghỉ có khu vườn và Wi-Fi miễn phí ở toàn bộ chỗ nghỉ cũng như chỗ đậu xe riêng miễn phí cho khách lái xe. Ngoài dịch vụ tiền sảnh, chỗ nghỉ này còn có sân hiên phơi nắng. Chỗ nghỉ này cung cấp dịch vụ phòng, quầy lễ tân 24 giờ và phòng giữ hành lý cho khách.

Tại inn, mỗi phòng đều được thiết kế có bàn làm việc. Với phòng tắm riêng được trang bị vòi xịt/chậu rửa vệ sinh và đồ vệ sinh cá nhân miễn phí, tất cả các phòng tại Cá Homestay Mũi Né có TV màn hình phẳng và điều hòa, trong đó một số phòng có sân trong. Tại chỗ nghỉ, các phòng đều có ga trải giường và khăn tắm.

Khách tại Cá Homestay Mũi Né sẽ có thể tận hưởng các hoạt động ở trong Mũi Né và khu vực xung quanh, như leo núi.

Inn cách Bến xe buýt Bình Thuận 14 km và Ga xe lửa Phan Thiết 15 km.",10,
https://www.booking.com/hotel/vn/tp-homes-phan-thiet.vi.html,TP-HOMES PHAN THIẾT,"75A Lạc Long Quân. P. Tiến Thành, TP. Phan Thiết, Bình Thuận, Phan Thiết, Việt Nam","Nằm ở Phan Thiết thuộc vùng Bình Thuận và cách Ga xe lửa Phan Thiết 14 km, TP-HOMES PHAN THIẾT cung cấp chỗ nghỉ có Wi-Fi miễn phí, tiện nghi BBQ, khu vườn cùng chỗ đậu xe riêng miễn phí.

Nơi đây còn có phòng tắm chung với vòi xịt/chậu rửa vệ sinh ở một số căn, cùng đồ vệ sinh cá nhân miễn phí, máy sấy tóc và dép đi trong phòng.

Khuôn viên của lodge có khu vực bãi biển riêng và du khách có thể leo núi ở khu vực gần đó.

TP-HOMES PHAN THIẾT cách Bến xe buýt Bình Thuận 16 km và Sân Golf Sea Link 16 km.",9.2,
https://www.booking.com/hotel/vn/khach-san-bay-tam.vi.html,Khách Sạn Bảy Tâm Khách Sạn Gần Dinh Thầy Thím Biển LaGi,"Đường Lý Thái Tổ , Tân Tiến , La Gi , Bình Thuận, La Gi, Việt Nam","Nằm ở La Gi, cách Núi Tà Cú 16 km, Khách Sạn Bảy Tâm Khách Sạn Gần Dinh Thầy Thím Biển LaGi cung cấp chỗ nghỉ có khu vườn, chỗ đậu xe riêng miễn phí, khu vực bãi biển riêng và nhà hàng. Khách sạn 1 sao này cung cấp bếp chung, dịch vụ phòng và Wi-Fi miễn phí. Khách sạn này nhìn ra biển và cung cấp BBQ cùng lễ tân 24/24.

Tại khách sạn, các phòng đều đi kèm với điều hòa, bàn làm việc, phòng tắm chung, TV màn hình phẳng, ga trải giường và ban công với view thành phố. Tất cả các phòng đều có tủ lạnh.

Khách tại Khách Sạn Bảy Tâm Khách Sạn Gần Dinh Thầy Thím Biển LaGi có thể thưởng thức bữa sáng kiểu Á.

Chỗ nghỉ cách Hải đăng Mũi Kê Gà 22 km và Ga xe lửa Phan Thiết 48 km.",6.9,1.0
https://www.booking.com/hotel/vn/y-bon.vi.html,Y Bon,"10 Cao Thang, Phan Thiết, Việt Nam","Tọa lạc ở Phan Thiết, cách Bãi biển Đồi Dương, Y Bon cung cấp điều hòa các phòng Và sân hiên. Chỗ nghỉ có Wi-Fi miễn phí này nằm cách Bãi biển Thương Chánh khoảng 17 phút đi bộ và Ga xe lửa Phan Thiết 600 m. Khách sạn có phòng gia đình.

Ngoài phòng tắm riêng với vòi xịt/chậu rửa vệ sinh và đồ vệ sinh cá nhân miễn phí, một số căn tại khách sạn cũng có view thành phố. Tại Y Bon, phòng nào cũng có ga trải giường và khăn tắm.

Các điểm tham quan nổi tiếng gần chỗ nghỉ bao gồm Bến xe buýt Bình Thuận, Sân Golf Sea Link và Bưu điện Bình Thuận. Sân bay gần nhất là Sân bay Liên Khương, cách Y Bon 137 km.",7.8,
https://www.booking.com/hotel/vn/ocean-vista-thanh-pho-phan-thiet2.vi.html,Ocean Vista,"Nguyễn Thông, Ấp Ngọc Hải, Việt Nam","Cách Sân Golf Sea Link 5.8 km, Ocean Vista có khu vườn, sân hiên, điều hòa, ban công và Wi-Fi miễn phí.

Chỗ nghỉ có TV màn hình phẳng, phòng tắm riêng, cùng bếp đầy đủ tiện nghi với tủ lạnh. Lò vi sóng và ấm đun nước đều được cung cấp.

Căn hộ cách Bến xe buýt Bình Thuận 7.2 km và Ga xe lửa Phan Thiết 8.2 km. Sân bay gần nhất là Sân bay Liên Khương, cách Ocean Vista 136 km.",9.3,3.0
https://www.booking.com/hotel/vn/nina-spa-coffee-and-homestay-phan-thiet-binh-thuan.vi.html,Sabina Boutique Hotel & Villa Mui Ne,"165 Nguyễn Đình Chiểu, Mũi Né, Việt Nam","Nhìn ra hồ bơi, Sabina Boutique Hotel & Villa Mui Ne tọa lạc ở Mũi Né và có nhà hàng, bếp chung, quầy bar, khu vườn, hồ bơi ngoài trời mở quanh năm cũng như sân hiên. Wi-Fi miễn phí được cung cấp ở toàn bộ chỗ nghỉ.

Tất cả các căn có phòng tắm riêng, vòi xịt/chậu rửa vệ sinh, điều hòa, TV màn hình phẳng và minibar. Một số căn có ban công và/hoặc sân trong nhìn ra biển hoặc khu vườn.

Homestay có phục vụ bữa sáng thực đơn à la carte và kiểu Á hằng ngày.

Sabina Boutique Hotel & Villa Mui Ne cách Bãi biển Hàm Tiến chỉ vài bước chân và Suối Tiên 4.2 km.",9.6,
https://www.booking.com/hotel/vn/areca-muine-homestay.vi.html,ARECA MUINE HOMESTAY,"251/6 Nguyễn Đình Chiểu, Phan Thiết, Việt Nam","Cách Bãi biển Hàm Tiến 3 phút đi bộ, ARECA MUINE HOMESTAY có khu vườn, ban công và Wi-Fi miễn phí.

Được thiết kế với sân hiên, các căn có điều hòa, TV màn hình phẳng, cùng phòng tắm riêng gồm vòi sen và đồ vệ sinh cá nhân miễn phí.

Homestay cách Suối Tiên 2.4 km và Sân Golf Sea Link 15 km. Sân bay gần nhất là Sân bay Liên Khương, cách ARECA MUINE HOMESTAY 131 km.",8.3,
https://www.booking.com/hotel/vn/home-sun-moon-home-4.vi.html,Home Sun Moon - Home 4,"14/1 Lê Lợi, Phan Thiết, Việt Nam","Với khu vườn, khu vực bãi biển riêng, cùng sân hiên, Home Sun Moon - Home 4 cung cấp chỗ nghỉ ở Phan Thiết có Wi-Fi miễn phí và nhìn ra biển. Chỗ nghỉ nằm cách Bãi biển Thương Chánh 3 phút đi bộ và cung cấp bếp chung.

Căn hộ điều hòa này có 1 phòng ngủ với ban công nhìn ra khu vườn và bếp nhỏ đầy đủ tiện nghi. Khăn tắm và ga trải giường có sẵn ở căn hộ.

Đội ngũ nhân viên lễ tân giao tiếp thành thạo bằng tiếng Anh và tiếng Việt.

Khách có thể sử dụng sân chơi trẻ em và tiện nghi BBQ tại căn hộ.

Các điểm tham quan nổi tiếng gần Home Sun Moon - Home 4 bao gồm Bãi biển Đồi Dương, Sân Golf Sea Link và Ga xe lửa Phan Thiết. Sân bay Liên Khương cách 135 km.",,
https://www.booking.com/hotel/vn/bot-bien-homestay-phan-thiet.vi.html,Bot Bien Homestay,"Nguyen Huu Tho, Mũi Né, Việt Nam","Cách Bãi biển Mũi Né 2 phút đi bộ, Bot Bien Homestay có khu vườn, phòng chờ chung, điều hòa, sân hiên và Wi-Fi miễn phí.

Một số căn có TV màn hình phẳng truyền hình cáp, bếp đầy đủ tiện nghi với lò nướng, cùng phòng tắm riêng được trang bị vòi xịt/chậu rửa vệ sinh và đồ vệ sinh cá nhân miễn phí.

Homestay có sẵn dịch vụ cho thuê ô tô và khu vực bãi biển riêng.

Bot Bien Homestay cách Bãi biển Hàm Tiến 2.6 km và Suối Tiên 5.3 km. Sân bay gần nhất là Sân bay Liên Khương, cách chỗ nghỉ 124 km, đồng thời chỗ nghỉ có cung cấp dịch vụ đưa đón sân bay mất phí.",7.5,
