url,name,location,description,point,star
https://www.booking.com/hotel/vn/queen-sea-223307.vi.html,Queen Sea Resort - Đảo Phú Quý,"156/19 đường 27/4, xã Tam Thanh, Phú Quý, Bình Thuận 800000, Cu Lao Thu, Việt Nam","Queen Sea Resort - Đảo Phú Quý tọa lạc ở Cu Lao Thu và có khu vườn. Khách sạn 5 sao này có dịch vụ phòng và quầy lễ tân 24 giờ. Tại đây có sân hiên và khách có thể sử dụng Wi-Fi miễn phí và chỗ đậu xe riêng miễn phí.

Tại khách sạn, tất cả các phòng có bàn làm việc. Ngoài phòng tắm riêng được trang bị vòi sen và đồ vệ sinh cá nhân miễn phí, các phòng tại Queen Sea Resort - Đảo Phú Quý đều có view biển. Tại chỗ nghỉ, phòng nào cũng có ga trải giường và khăn tắm.",9,5.0
https://www.booking.com/hotel/vn/dynasty-muine-resort.vi.html,DYNASTY MUINE RESORT,"Nguyễn Đình Chiểu 140A, Ấp Thiện Phước, Việt Nam","Nằm ở Ấp Thiện Phước, cách Bãi biển Hàm Tiến chỉ vài bước chân, DYNASTY MUINE RESORT cung cấp chỗ nghỉ có hồ bơi ngoài trời, chỗ đậu xe riêng miễn phí, khu vườn và khu vực bãi biển riêng. Chỗ nghỉ này có các tiện nghi như sân hiên và quầy bar. Chỗ nghỉ này cung cấp dịch vụ phòng, quầy lễ tân 24 giờ và dịch vụ thu đổi ngoại tệ cho khách.

Các căn tại resort được trang bị điều hòa, khu vực ghế ngồi, TV màn hình phẳng có truyền hình vệ tinh, két an toàn, phòng tắm riêng, vòi sen, máy sấy tóc và dép đi trong phòng. Phòng nào cũng có ấm đun nước, trong đó một số phòng có ban công và một số khác thì nhìn ra thành phố. Tại DYNASTY MUINE RESORT, các phòng được thiết kế có ga trải giường và khăn tắm.

Chỗ nghỉ có phục vụ bữa sáng thực đơn buffet hoặc kiểu Mỹ. Tại DYNASTY MUINE RESORT, khách sẽ tìm thấy nhà hàng phục vụ ẩm thực Mỹ, Hoa và Á. Bên cạnh đó, họ có thể yêu cầu món chay và món thuần chay.

Resort có bể sục.

DYNASTY MUINE RESORT cách Suối Tiên 2.5 km và Sân Golf Sea Link 15 km. Chỗ nghỉ cách Sân bay Liên Khương 131 km và cung cấp dịch vụ đưa đón sân bay mất phí.",8.2,
https://www.booking.com/hotel/vn/d-apartment.vi.html,D Apartment,"n4-01 Phan Trung, Ấp Bình Hưng, Việt Nam","Tọa lạc ở Ấp Bình Hưng, cách Bãi biển Đồi Dương 7 phút đi bộ và Bãi biển Thương Chánh 2.2 km, D Apartment cung cấp chỗ nghỉ có Wi-Fi miễn phí, điều hòa, sân hiên và khu vực bãi biển riêng. Chỗ nghỉ có bể sục.

Mỗi căn đều có ban công nhìn ra thành phố, TV màn hình phẳng, bếp tiện nghi, cùng phòng tắm riêng có vòi xịt/chậu rửa vệ sinh, đồ vệ sinh cá nhân miễn phí và máy sấy tóc. Để thuận tiện hơn cho khách, chỗ nghỉ có thể cung cấp khăn tắm và khăn trải giường với khoản phụ phí.

Căn hộ cách Sân Golf Sea Link 7 phút đi bộ và Ga xe lửa Phan Thiết 2.7 km. Sân bay gần nhất là Sân bay Liên Khương, cách D Apartment 134 km.",10,
https://www.booking.com/hotel/vn/apec-mandala-cham-bay-hotels-amp-resorts.vi.html,Mandala Cham Bay Hotels & Resorts,"Apec Mandala Cham Bay Hotels & Resorts, Ấp Thiẹn Ái, Việt Nam","Nằm ở Ấp Thiẹn Ái, cách Bãi biển Long Sơn chỉ vài bước chân, Mandala Cham Bay Hotels & Resorts cung cấp chỗ nghỉ có hồ bơi ngoài trời, chỗ đậu xe riêng miễn phí, khu vườn và sân hiên. Chỗ nghỉ này có các tiện nghi như nhà hàng, dịch vụ phòng và quầy lễ tân 24 giờ, cùng với Wi-Fi miễn phí ở toàn bộ chỗ nghỉ. Du khách có thể sử dụng bể sục, hoặc tận hưởng cảnh thành phố.

Tại resort, tất cả các phòng đều có điều hòa, khu vực ghế ngồi, TV màn hình phẳng có truyền hình vệ tinh, bếp, khu vực ăn uống, két an toàn, phòng tắm riêng, vòi xịt/chậu rửa vệ sinh, đồ vệ sinh cá nhân miễn phí và máy sấy tóc. Mandala Cham Bay Hotels & Resorts cung cấp một số phòng được trang bị ban công và mỗi phòng đều được thiết kế có ấm đun nước. Tại chỗ nghỉ, các phòng đều đi kèm với ga trải giường và khăn tắm.

Chỗ nghỉ có phục vụ bữa sáng mỗi sáng, gồm các lựa chọn thực đơn buffet, kiểu lục địa và kiểu Anh/ Ai-len.

Mandala Cham Bay Hotels & Resorts có sân chơi trẻ em. Resort có dịch vụ thuê xe đạp và dịch vụ thuê ô tô. Ngoài ra, leo núi và đi xe đạp là hoạt động được ưa chuộng trong khu vực.

Mandala Cham Bay Hotels & Resorts cách Bãi biển Đồi Cát Đỏ 2.3 km và Suối Tiên 16 km.",9,
https://www.booking.com/hotel/vn/villa-dai-duong-2-view-bien.vi.html,Villa Đại Dương 2 View biển,"bè kè biển đảo phú quý, Cu Lao Thu, Việt Nam","Tọa lạc ở Cu Lao Thu, Villa Đại Dương 2 View biển cung cấp chỗ nghỉ có ban công và Wi-Fi miễn phí.

Căn hộ có sân hiên nơi khách có thể nhìn ra biển, khu vực ghế ngồi, TV màn hình phẳng, bếp đầy đủ tiện nghi gồm tủ lạnh và bếp, cùng phòng tắm riêng được trang bị vòi xịt/chậu rửa vệ sinh và đồ vệ sinh cá nhân miễn phí.

Villa Đại Dương 2 View biển có sẵn dịch vụ cho thuê ô tô và khu vực bãi biển riêng.",9.3,3.0
https://www.booking.com/hotel/vn/apec-mandala-mui-ne-lh.vi.html,Apec Mandala Mũi Né Beach - Khách Sạn LHG,"Đường tỉnh 716, Ấp Thiẹn Ái, Việt Nam","Tọa lạc ở Ấp Thiẹn Ái, Apec Mandala Mũi Né Beach - Khách Sạn LHG cung cấp chỗ nghỉ có hồ bơi ngoài trời mở quanh năm, Wi-Fi miễn phí, khu vườn và quầy bar.

Chỗ nghỉ có điều hòa, bếp nhỏ đầy đủ tiện nghi, TV màn hình phẳng, cũng như phòng tắm riêng với vòi xịt/chậu rửa vệ sinh, đồ vệ sinh cá nhân miễn phí và máy sấy tóc. Một số căn có sân hiên và/hoặc ban công nhìn ra thành phố hoặc biển.

Căn hộ có phục vụ bữa sáng thực đơn à la carte hoặc kiểu Á.

Apec Mandala Mũi Né Beach - Khách Sạn LHG cách Bãi biển Long Sơn 6 phút đi bộ và Bãi biển Đồi Cát Đỏ 2.4 km. Sân bay gần nhất là Sân bay Liên Khương, cách chỗ nghỉ 113 km.",8.9,
https://www.booking.com/hotel/vn/apec-mandala-wyndham-mui-ne-thanh-pho-phan-thiet20.vi.html,Apec Mandala Wyndham Mui Ne - V Ruby,"Ap Thien Ai, Xa Hoa Thang, TP Phan Thiet, Tinh Binh Thuan, Ấp Thiẹn Ái, Việt Nam","Nhìn ra biển, Apec Mandala Wyndham Mui Ne - V Ruby tọa lạc ở Ấp Thiẹn Ái và có nhà hàng, dịch vụ phòng, quầy bar, khu vườn, hồ bơi ngoài trời mở quanh năm cũng như sân hiên phơi nắng. WiFi miễn phí có sẵn ở toàn bộ chỗ nghỉ.

Chỗ nghỉ có điều hòa, bếp nhỏ đầy đủ tiện nghi, TV màn hình phẳng, cũng như phòng tắm riêng với vòi sen, đồ vệ sinh cá nhân miễn phí và máy sấy tóc. Tủ lạnh và lò vi sóng, cũng như ấm đun nước đều được cung cấp.

Khách sạn căn hộ có phục vụ bữa sáng kiểu Á hằng ngày.

Chỗ nghỉ có khu vực bãi biển riêng trong khuôn viên.

Apec Mandala Wyndham Mui Ne - V Ruby cách Bãi biển Long Sơn chỉ vài bước chân và Bãi biển Đồi Cát Đỏ 2.3 km. Chỗ nghỉ cách Sân bay Liên Khương 113 km và cung cấp dịch vụ đưa đón sân bay mất phí.",7.9,3.0
https://www.booking.com/hotel/vn/khach-san-hoang-phu.vi.html,Khách sạn Hoàng Phú đảo Phú Quý,"27 tháng 4 xã Tam Thanh huyện Phú Quý tỉnh Bình Thuận, Cu Lao Thu, Việt Nam","Tọa lạc ở Cu Lao Thu, Khách sạn Hoàng Phú đảo Phú Quý có khu vườn, sân hiên, quầy bar, cùng Wi-Fi miễn phí ở toàn bộ chỗ nghỉ. Ngoài bếp chung, chỗ nghỉ này còn có sân chơi trẻ em. Chỗ đậu xe riêng miễn phí có sẵn và khách sạn còn cung cấp dịch vụ đưa đón cho những khách muốn khám phá khu vực xung quanh.

Lễ tân tại khách sạn có thể cung cấp các thông tin hữu ích để giúp du khách tham quan khu vực xung quanh một cách thuận tiện.",9.2,
https://www.booking.com/hotel/vn/holiday-thanh-pho-phan-thiet.vi.html,HOLIDAY HOTEL,"Nguyễn Trãi, Ấp Bình Hưng, Việt Nam","HOLIDAY HOTEL nằm ở Ấp Bình Hưng, cách Ga xe lửa Phan Thiết 15 phút đi bộ và Bến xe buýt Bình Thuận 2 km. Ngoài phòng chờ chung, khách sạn 2 sao này có các phòng được trang bị điều hòa và Wi-Fi miễn phí, trong đó mỗi phòng sẽ có phòng tắm riêng. Chỗ nghỉ này cung cấp dịch vụ phòng, quầy lễ tân 24 giờ và phòng giữ hành lý cho khách.

Tại khách sạn, các phòng đều có bàn làm việc. Mỗi phòng đều có ấm đun nước, trong đó một số phòng có ban công và một số khác thì nhìn ra thành phố. Tại HOLIDAY HOTEL, tất cả các phòng có ga trải giường và khăn tắm.

Các điểm tham quan nổi tiếng gần chỗ nghỉ bao gồm Bãi biển Đồi Dương, Bãi biển Thương Chánh và Sân Golf Sea Link. Sân bay gần nhất là Sân bay Liên Khương, cách HOLIDAY HOTEL 134 km.",9.2,2.0
https://www.booking.com/hotel/vn/paris-binh-thuan.vi.html,Paris Hotel Bình Thuận,"270 Quang Trung, Tuy Phong, Việt Nam","Paris Hotel Bình Thuận nằm giáp biển ở Tuy Phong, cách Triển lãm Tecnopolis Buenos Aires 23 km và Đồi cát hồng 46 km. Ngoài Wi-Fi miễn phí, khách sạn 3 sao này còn cung cấp phòng chờ chung và dịch vụ phòng. Chỗ nghỉ này cung cấp quầy lễ tân 24 giờ, dịch vụ tiền sảnh và tổ chức các tour du lịch cho khách.

Tất cả các phòng tại khách sạn được trang bị điều hòa, khu vực ghế ngồi, TV màn hình phẳng có truyền hình cáp, két an toàn, phòng tắm riêng, vòi sen, đồ vệ sinh cá nhân miễn phí và máy sấy tóc. Tại Paris Hotel Bình Thuận, các phòng đều có ga trải giường và khăn tắm.

Chỗ nghỉ cách Chợ Mũi Né 49 km. Sân bay gần nhất là Sân bay Liên Khương, cách Paris Hotel Bình Thuận 113 km.",8.1,3.0
https://www.booking.com/hotel/vn/thuyen-xua-homestay-dao-phu-quy.vi.html,Thuyền Xưa Homestay Đảo Phú Quý,"74 Hùng Vương, Cu Lao Thu, Việt Nam","Thuyền Xưa Homestay Đảo Phú Quý cung cấp chỗ nghỉ tại Cu Lao Thu. Ngoài dịch vụ phòng, chỗ nghỉ này còn có sân hiên. Các phòng điều hòa này nhìn ra view núi, cũng như có bàn làm việc và Wi-Fi miễn phí.

Tại khách sạn, tất cả các phòng có tủ quần áo, ga trải giường và ban công với view vườn. Phòng tắm riêng được trang bị vòi xịt/chậu rửa vệ sinh, đồ vệ sinh cá nhân miễn phí và máy sấy tóc.

Leo núi và đi xe đạp là hoạt động được ưa chuộng trong khu vực. Ngoài ra, Thuyền Xưa Homestay Đảo Phú Quý có dịch vụ thuê xe đạp.",9.3,
https://www.booking.com/hotel/vn/nha-mer-homestay-dao-phu-quy.vi.html,Nhà Mer – Homestay đảo Phú Quý,"270 Võ Văn Kiệt, thôn Mỹ Khê, xã Tam Thanh, huyện Phú Quý, tỉnh Bình Thuận, Cu Lao Thu, Việt Nam","Nhà Mer – Homestay đảo Phú Quý cung cấp chỗ nghỉ tại Cu Lao Thu. Khách sạn 1 sao này có các phòng được trang bị điều hòa, phòng tắm riêng và Wi-Fi miễn phí. Chỗ nghỉ này cung cấp quầy lễ tân 24 giờ, bàn bán tour và dịch vụ thu đổi ngoại tệ cho khách.

Tại khách sạn, các phòng được thiết kế có tủ quần áo và TV màn hình phẳng. Tại Nhà Mer – Homestay đảo Phú Quý, các phòng đều đi kèm với ga trải giường và khăn tắm.",9,1.0
https://www.booking.com/hotel/vn/centara-mirage-resort-mui-ne.vi.html,Centara Mirage Resort Mui Ne,"Huynh Thuc Khang street, Mui Ne, 801098 Mũi Né, Việt Nam","Nằm ở Mũi Né, cách Bãi biển Hàm Tiến chỉ vài bước chân, Centara Mirage Resort Mui Ne cung cấp chỗ nghỉ có hồ bơi ngoài trời, chỗ đậu xe riêng miễn phí, trung tâm thể dục và khu vườn. Ngoài câu lạc bộ trẻ em, chỗ nghỉ này còn có nhà hàng, công viên nước và sân hiên để phục vụ du khách. Chỗ nghỉ cung cấp lễ tân 24/24, dịch vụ đưa đón sân bay, dịch vụ phòng và Wi-Fi miễn phí.

Resort có phục vụ bữa sáng thực đơn buffet hoặc kiểu Á.

Centara Mirage Resort Mui Ne có sân chơi trẻ em. Đi xe đạp là hoạt động được ưa chuộng trong khu vực. Ngoài ra, resort 5 sao này có dịch vụ thuê xe đạp.

Chỗ nghỉ cách Suối Tiên 19 phút đi bộ và Sân Golf Sea Link 20 km.",8.3,5.0
https://www.booking.com/hotel/vn/villa-homestay-giac.vi.html,Villa - Homestay Giác,"Lý Tự Trọng, Cu Lao Thu, Việt Nam","Tọa lạc ở Cu Lao Thu, Villa - Homestay Giác cung cấp Wi-Fi miễn phí, nơi khách có thể trải nghiệm khu vườn, quầy bar và khu vực bãi biển riêng.

Một số căn có sân hiên và/hoặc ban công nhìn ra thành phố hoặc biển.

Khách tại biệt thự có thể thưởng thức bữa sáng kiểu Á.

Villa - Homestay Giác có BBQ.",9.7,2.0
https://www.booking.com/hotel/vn/apec-mandala-mui-ne-paradise-bay.vi.html,Apec Mandala Mui Ne Paradise Bay,"ĐT716, Hòa Thắng, Ấp Thiẹn Ái, Việt Nam","Tọa lạc ở Ấp Thiẹn Ái, cách Bãi biển Long Sơn 6 phút đi bộ, Apec Mandala Mui Ne Paradise Bay cung cấp chỗ nghỉ có hồ bơi ngoài trời, chỗ đậu xe riêng miễn phí, trung tâm thể dục và khu vực bãi biển riêng. Khách sạn 5 sao này có dịch vụ phòng và máy ATM. Chỗ nghỉ cung cấp lễ tân 24/24, dịch vụ đưa đón sân bay, phòng chờ chung và Wi-Fi miễn phí ở toàn bộ chỗ nghỉ.

Tất cả các căn ở khách sạn được trang bị điều hòa, khu vực ghế ngồi, TV màn hình phẳng có truyền hình vệ tinh, bếp nhỏ, khu vực ăn uống, két an toàn, phòng tắm riêng, vòi xịt/chậu rửa vệ sinh, đồ vệ sinh cá nhân miễn phí và máy sấy tóc. Tại Apec Mandala Mui Ne Paradise Bay, tất cả các phòng đều có ga trải giường và khăn tắm.

Chỗ nghỉ có sân hiên. Đi xe đạp là hoạt động được ưa chuộng trong khu vực. Ngoài ra, Apec Mandala Mui Ne Paradise Bay có dịch vụ thuê xe đạp và dịch vụ thuê ô tô.

Khách sạn cách Bãi biển Đồi Cát Đỏ 2.8 km và Suối Tiên 16 km.",9.1,5.0
https://www.booking.com/hotel/vn/mana-mui-ne-beach-resort.vi.html,MANA Mui Ne Beach Resort,"20b Nguyễn Đình Chiểu, Mũi Né, Việt Nam","Nằm ở Mũi Né, cách Bãi đá Ông Địa 13 phút đi bộ, MANA Mui Ne Beach Resort cung cấp chỗ nghỉ có hồ bơi ngoài trời, chỗ đậu xe riêng miễn phí, khu vực bãi biển riêng và nhà hàng. Ngoài quầy bar, khách sạn 4 sao này có các phòng được trang bị điều hòa và Wi-Fi miễn phí, trong đó mỗi phòng sẽ có phòng tắm riêng. Chỗ nghỉ này cung cấp dịch vụ phòng và quầy lễ tân 24 giờ cho khách.

Các phòng đều có ấm đun nước, TV màn hình phẳng và két an toàn, trong đó một số phòng có ban công và một số khác nhìn ra biển. Tại khách sạn, tất cả các phòng đều được thiết kế có ga trải giường và khăn tắm.

MANA Mui Ne Beach Resort có phục vụ bữa sáng thực đơn buffet hoặc thực đơn à la carte.

Chỗ nghỉ có BBQ.

MANA Mui Ne Beach Resort cách Suối Tiên 7.2 km và Sân Golf Sea Link 10 km.",9.4,4.0
https://www.booking.com/hotel/vn/movenpick-resort-phan-thiet.vi.html,Mövenpick Resort Phan Thiet,"Hon Gio - Thuan Quy Street Tien Hoa Hamlet Tien Thanh Commune Binh Thuan, 77100 Phan Thiết, Việt Nam","Nằm giáp biển, Mövenpick Resort Phan Thiet cung cấp chỗ nghỉ 5 sao ở Phan Thiết, đồng thời có khu vườn, sân hiên và nhà hàng. Chỗ nghỉ này có các tiện nghi như dịch vụ phòng và quầy lễ tân 24 giờ, cùng với Wi-Fi miễn phí ở toàn bộ chỗ nghỉ. Resort cung cấp hồ bơi ngoài trời, trung tâm thể dục, hoạt động giải trí vào buổi tối và câu lạc bộ trẻ em.

Tại resort, tất cả các phòng có điều hòa, khu vực ghế ngồi, TV màn hình phẳng có truyền hình vệ tinh, két an toàn, phòng tắm riêng, vòi xịt/chậu rửa vệ sinh, đồ vệ sinh cá nhân miễn phí và máy sấy tóc. Các căn đều có tủ quần áo và ấm đun nước để khách sử dụng.

Khách có thể thưởng thức bữa sáng thực đơn buffet, kiểu lục địa hoặc kiểu Á tại chỗ nghỉ.

Mövenpick Resort Phan Thiet có sân chơi trẻ em. Khách có thể chơi bi-a tại chỗ nghỉ.

Mövenpick Resort Phan Thiet cách Bãi biển Tiến Thành 3 phút đi bộ và Ga xe lửa Phan Thiết 13 km.",8.2,5.0
https://www.booking.com/hotel/vn/villa-bien-xanh.vi.html,Villa Biển Xanh 1 - View Biển Đảo Phú Quý,"Bờ kè Tam Thanh Huyện Phú Quý - Tỉnh Bình Thuận, Cu Lao Thu, Việt Nam","Nằm ở Cu Lao Thu, Villa Biển Xanh 1 - View Biển Đảo Phú Quý cung cấp chỗ nghỉ có Wi-Fi miễn phí, điều hòa và khu vườn với sân hiên.

Nơi đây còn có phòng tắm riêng với vòi xịt/chậu rửa vệ sinh ở tất cả các căn, cùng máy sấy tóc và dép đi trong phòng.

Khách sạn căn hộ có dịch vụ cho thuê ô tô.",9,3.0
https://www.booking.com/hotel/vn/trang-van.vi.html,Trang Vân Hotel Đảo Phú Quý,"Bãi biển Ông Mẵng, Tam Thanh, Phú Quý, Cu Lao Thu, Việt Nam","Trang Vân Hotel Đảo Phú Quý tọa lạc ở Cu Lao Thu. Chỗ nghỉ này cung cấp bếp chung, quầy lễ tân 24 giờ và tổ chức các tour du lịch cho khách.

Các phòng ở khách sạn được trang bị ấm đun nước. Ngoài phòng tắm riêng với vòi xịt/chậu rửa vệ sinh và đồ vệ sinh cá nhân miễn phí, các phòng tại Trang Vân Hotel Đảo Phú Quý cũng có Wi-Fi miễn phí, trong đó một số phòng có view biển. Tại chỗ nghỉ, mỗi phòng đều có ga trải giường và khăn tắm.",9.4,
https://www.booking.com/hotel/vn/hon-rom-1-resort.vi.html,Hon Rom Central Beach Resort,"Long Son, Mũi Né, Việt Nam","Nằm ở Mũi Né, Hon Rom Central Beach Resort cung cấp chỗ nghỉ yên bình và thoải mái với tầm nhìn ra biển cùng Wi-Fi miễn phí trong toàn khuôn viên. Resort có khu vực bãi biển riêng và 2 khu vực nhà hàng phục vụ các món ăn theo thực đơn lập sẵn, tiệc tự chọn và BBQ.

Với cây cối xanh tươi bao quanh, các phòng máy lạnh tại đây có đồ nội thất bằng gỗ. Ngoài ra, phòng còn có khu vực ghế ngồi, minibar và truyền hình cáp. Phòng tắm riêng đi kèm tiện nghi vòi sen và đồ vệ sinh cá nhân miễn phí.

Hon Rom Central Beach Resort cung cấp dịch vụ cho thuê xe hơi và dịch vụ giặt là. Khách có thể sử dụng tiện nghi chơi thể thao dưới nước nằm dọc resort.

Khách cũng có thể chọn từ nhiều loại đồ hải sản tươi sống tại nhà hàng Hon Rom 1 nằm trước bãi biển hay chọn đồ uống tại quán Hon Rom 1 Bar trong lúc ngắm nhìn những ngọn sóng tràn lên bờ cát.

Cồn Cát Đỏ cách đó 3 km trong khi Suối Tiên và chợ địa phương Mũi Né cách resort 6 km. Resort cách thành phố Phan Thiết 20 phút lái xe.",7.8,3.0
https://www.booking.com/hotel/vn/nha-nghi-phong-quynh.vi.html,Nhà Nghỉ Phong Quỳnh - Đảo Phú Quý,"Bờ Kè Hội An - Tam Thanh - Phú Quý, Cu Lao Thu, Việt Nam","Nhà Nghỉ Phong Quỳnh - Đảo Phú Quý cung cấp chỗ nghỉ ở Cu Lao Thu. Tại đây có sân hiên và khách có thể sử dụng Wi-Fi miễn phí và chỗ đậu xe riêng miễn phí.

Ngoài phòng tắm riêng với vòi xịt/chậu rửa vệ sinh và đồ vệ sinh cá nhân miễn phí, một số phòng tại khách sạn cũng có view biển. Tất cả các phòng tại Nhà Nghỉ Phong Quỳnh - Đảo Phú Quý có điều hòa và tủ quần áo.

Khách tại chỗ nghỉ sẽ có thể tận hưởng các hoạt động ở trong Cu Lao Thu và khu vực xung quanh, như leo núi, lặn biển và lặn với ống thở.

Thành thạo tiếng Anh và tiếng Việt, đội ngũ nhân viên tại lễ tân 24/24 luôn sẵn lòng hỗ trợ khách vào bất kỳ thời điểm nào trong ngày.",9.5,
https://www.booking.com/hotel/vn/ke-ga-lighthouse-resort.vi.html,Kega Lighthouse Resort Bình Thuận,"Thôn Kê Gà, Tân Thành, Hàm Thuận Nam, Bình Thuận, Kê Gà, Việt Nam","Nằm ở Kê Gà, cách Bãi biển Thuận Quý 18 phút đi bộ, Kega Lighthouse Resort Bình Thuận cung cấp chỗ nghỉ có hồ bơi ngoài trời, chỗ đậu xe riêng miễn phí, khu vườn và khu vực bãi biển riêng. Ngoài sân hiên, resort 3 sao này còn có các phòng với điều hòa được trang bị Wi-Fi miễn phí, trong đó mỗi phòng đều có phòng tắm riêng. Chỗ nghỉ này cung cấp dịch vụ phòng, quầy lễ tân 24 giờ và tổ chức các tour du lịch cho khách.

Các phòng được thiết kế có bàn làm việc và TV màn hình phẳng, ngoài ra một số phòng tại resort có ban công. Các căn tại Kega Lighthouse Resort Bình Thuận đi kèm khu vực ghế ngồi.

Chỗ nghỉ có phục vụ bữa sáng thực đơn buffet, thực đơn à la carte hoặc kiểu lục địa mỗi buổi sáng.

Chỗ nghỉ có sân chơi trẻ em.

Kega Lighthouse Resort Bình Thuận cách Bãi biển Kê Gà 2.4 km và Hải đăng Mũi Kê Gà 4.4 km.",8,3.0
https://www.booking.com/hotel/vn/homestay-moc-binh-thuan.vi.html,Mộc Homestay Đảo Phú Quý,"Hẻm 246, đường 27/4, Đảo Phú Quý, Cu Lao Thu, Việt Nam","Mộc Homestay Đảo Phú Quý cung cấp các phòng điều hòa ở Cu Lao Thu. Chỗ nghỉ này có các tiện nghi như bếp chung và quầy lễ tân 24 giờ, cùng với Wi-Fi miễn phí ở toàn bộ chỗ nghỉ. Bàn bán tour sẵn sàng hỗ trợ khách lên kế hoạch cho những ngày đi chơi.

Ngoài phòng tắm riêng được trang bị vòi xịt/chậu rửa vệ sinh và đồ vệ sinh cá nhân miễn phí, các phòng tại khách sạn đều có view biển. Tại Mộc Homestay Đảo Phú Quý, tất cả các phòng đều được thiết kế có ga trải giường và khăn tắm.",8.3,
https://www.booking.com/hotel/vn/muong-thanh-mui-ne.vi.html,Muong Thanh Holiday Muine Hotel,"54 Huynh Thuc Khang, Mũi Né, Việt Nam","Tự hào với khu vực bãi biển riêng, Muong Thanh Holiday Muine Hotel có hồ bơi ngoài trời, trung tâm thể dục và phòng xông hơi khô. Nơi nghỉ cung cấp bãi đỗ xe miễn phí tại chỗ và truy cập Wi-Fi miễn phí trong toàn bộ khuôn viên.

Các phòng nghỉ máy lạnh được bài trí trang nhã tại đây có tủ quần áo, khu vực tiếp khách, két an toàn và TV màn hình phẳng với các kênh truyền hình cáp. Ngoài ra còn đi kèm minibar và ấm đun nước điện. Trong phòng tắm riêng được trang bị bồn tắm, tiện nghi vòi sen, áo choàng tắm, máy sấy tóc và đồ vệ sinh cá nhân miễn phí.

Tại Muong Thanh Holiday Muine Hotel, du khách có thể tận hưởng dịch vụ mát-xa nhẹ nhàng tại spa hoặc thưởng thức đồ uống sau bữa ăn ở quán bar. Nhân viên lễ tân 24 giờ có thể hỗ trợ khách với các dịch vụ đưa đón sân bay, giặt là và sắp xếp tour du lịch.

Nơi nghỉ có nhà hàng phục vụ một loạt các món ăn ngon của địa phương và phương Tây. Các tiện nghi tổ chức hội họp và tiệc cũng có tại đây.

Sân bay Liên Khương cách nơi nghỉ này khoảng 90 km.",8.4,4.0
