url,name,location,description,point,star
https://www.booking.com/hotel/vn/then-and-now-homestay.vi.html,Hava Homestay,"số 3 ngõ 19 Đường Bà Triệu Phường Đông Kinh No 3/19, Ba Trieu, Dong Kinh, Lang Son, Lạng Sơn, Việt Nam","Hava Homestay có khu vườn, phòng chờ chung, sân hiên và nhà hàng ở Lạng Sơn. Chỗ nghỉ có chỗ đậu xe riêng miễn phí và có cả dịch vụ đưa đón sân bay mất phí.

Tại hostel, tất cả các phòng đều có bàn làm việc, ga trải giường và ban công với view thành phố. Với phòng tắm chung được trang bị vòi sen và máy sấy tóc, các phòng tại Hava Homestay cũng có Wi-Fi miễn phí, trong khi một số phòng có sân trong. Tại chỗ nghỉ, mỗi phòng đều có khu vực ghế ngồi.

Hava Homestay có phục vụ bữa sáng thực đơn à la carte hoặc kiểu lục địa.

Sân bay quốc tế Vân Đồn cách 124 km.",9.1,
https://www.booking.com/hotel/vn/four-points-by-sheraton-lang-son.vi.html,Four Points by Sheraton Lang Son,"No.02, Tran Hung Dao street, Lạng Sơn, Việt Nam","Four Points by Sheraton Lang Son tọa lạc ở Lạng Sơn và có quầy bar. Ngoài nhà hàng, khách sạn 5 sao này có các phòng được trang bị điều hòa và Wi-Fi miễn phí, trong đó mỗi phòng sẽ có phòng tắm riêng. Chỗ nghỉ này cung cấp dịch vụ phòng, quầy lễ tân 24 giờ và dịch vụ thu đổi ngoại tệ cho khách.

Tại khách sạn, các phòng đều có ban công. Tất cả các phòng đều được thiết kế có TV màn hình phẳng, ngoài ra một số căn tại Four Points by Sheraton Lang Son có view thành phố.

Chỗ nghỉ có phục vụ bữa sáng thực đơn buffet và kiểu Á mỗi sáng.

Sân bay quốc tế Vân Đồn cách 124 km.",8.8,5.0
https://www.booking.com/hotel/vn/khach-san-dong-phuong-thanh-pho-lang-son.vi.html,Khách Sạn Đông Phương,"46 Ngô Gia Tự, Lạng Sơn, Việt Nam","Khách Sạn Đông Phương cung cấp chỗ nghỉ tại Lạng Sơn. Khách sạn 3 sao này có dịch vụ phòng và quầy lễ tân 24 giờ. Tại đây có sân hiên và khách có thể sử dụng Wi-Fi miễn phí và chỗ đậu xe riêng miễn phí.

Tại khách sạn, tất cả các phòng có điều hòa và TV màn hình phẳng.

Sân bay gần nhất là Sân bay quốc tế Vân Đồn, cách Khách Sạn Đông Phương 123 km.",7.4,3.0
https://www.booking.com/hotel/vn/phu-quy-thanh-pho-lang-son.vi.html,PHÚ QUÝ HOTEL near ĐÔNG KINH MARKET,"200 Phai Vệ 7 Tầng, Lạng Sơn, Việt Nam","Nhìn ra thành phố, PHÚ QUÝ HOTEL near ĐÔNG KINH MARKET ở Lạng Sơn cung cấp chỗ nghỉ có khu vườn, phòng chờ chung, sân hiên, nhà hàng và quầy bar. WiFi miễn phí có sẵn ở toàn bộ chỗ nghỉ.

Tất cả các căn có phòng tắm riêng, vòi xịt/chậu rửa vệ sinh, điều hòa, TV màn hình phẳng và tủ lạnh.

Nhà nghỉ B&B có dịch vụ cho thuê xe đạp, đồng thời du khách có thể đi xe đạp gần đó.

Chỗ nghỉ cách Sân bay quốc tế Vân Đồn 123 km và cung cấp dịch vụ đưa đón sân bay mất phí.",7.9,3.0
https://www.booking.com/hotel/vn/camellia-home-nha-tra.vi.html,Camellia home,"số 5/ngõ 1 phố muối phường tam thanh thành phố lạng sơn, Lạng Sơn, Việt Nam","Tọa lạc ở Lạng Sơn, Camellia home cung cấp chỗ nghỉ có sân hiên hoặc ban công, Wi-Fi miễn phí và TV màn hình phẳng, cũng như xe đạp miễn phí và khu vườn.

Nơi đây còn có phòng tắm chung với vòi sen ở một số căn, cùng đồ vệ sinh cá nhân miễn phí, máy sấy tóc và dép đi trong phòng.

Khách cũng có thể thư giãn trong khu vực phòng chờ chung.

Sân bay gần nhất là Sân bay quốc tế Vân Đồn, cách căn hộ 124 km, đồng thời chỗ nghỉ có cung cấp dịch vụ đưa đón sân bay mất phí.",9.5,3.0
https://www.booking.com/hotel/vn/bbq-lang-son-lang-son9.vi.html,BBQ Hotel Lang Son,"Số 48 Apec Diamond, Mai Pha, Phai Đuốc, Thành Phố Lạng Sơn, Tỉnh Lạng Sơn, Lạng Sơn, Việt Nam","Nằm ở Lạng Sơn, BBQ Hotel Lang Son cung cấp chỗ nghỉ 3 sao có sân hiên, nhà hàng và quầy bar. Chỗ nghỉ này có các tiện nghi như dịch vụ phòng và quầy lễ tân 24 giờ, cùng với Wi-Fi miễn phí ở toàn bộ chỗ nghỉ. Một số phòng tại chỗ nghỉ có ban công với view thành phố.

Một số phòng có bếp với tủ lạnh, lò vi sóng và minibar.

Hằng ngày, chỗ nghỉ có các lựa chọn thực đơn à la carte, kiểu Mỹ hoặc kiểu Á cho bữa sáng.

Sân bay quốc tế Vân Đồn cách 123 km.",10,3.0
https://www.booking.com/hotel/vn/may-retreat-huu-lung.vi.html,May Retreat - Huu Lung,"Yên Thịnh, Hữu Lũng, Lạng Sơn, Việt Nam","Nhìn ra núi, May Retreat - Huu Lung ở Lạng Sơn cung cấp chỗ nghỉ có xe đạp miễn phí, khu vườn, phòng chờ chung, sân hiên và nhà hàng. WiFi và chỗ đậu xe riêng đều có sẵn tại lodge miễn phí.

Nơi đây còn có phòng tắm riêng với vòi sen và máy sấy tóc ở từng căn, cùng dép đi trong phòng.

Khách tại May Retreat - Huu Lung có thể thưởng thức bữa sáng thực đơn à la carte hoặc kiểu Á.

Du khách có thể leo núi và đi xe đạp trong khu vực, đồng thời chỗ nghỉ cũng có nhiều tiện nghi thể thao dưới nước.

Chỗ nghỉ cách Sân bay Quốc tế Nội Bài 106 km và cung cấp dịch vụ đưa đón sân bay mất phí.",9.5,
https://www.booking.com/hotel/vn/nha-nghi-quynh-van-thanh-pho-lang-son.vi.html,nhà nghỉ Quỳnh Vân,"50 Phố Đinh Liệt, Lạng Sơn, Việt Nam","Nằm ở Lạng Sơn, nhà nghỉ Quỳnh Vân cung cấp chỗ nghỉ có Wi-Fi miễn phí và khu vườn với sân hiên.

Sân bay gần nhất là Sân bay quốc tế Vân Đồn, cách khách sạn căn hộ 123 km.",8.5,
https://www.booking.com/hotel/vn/muong-thanh-lang-son.vi.html,Muong Thanh Luxury Lang Son Hotel,"68 Ngo Quyen, Lạng Sơn, Việt Nam","Muong Thanh cung cấp các phòng nghỉ máy lạnh hiện đại ở trong trung tâm Thành phố Lạng Sơn. Cách Chợ Đêm 10 phút lái xe, du khách có thể thư giãn bên hồ bơi ngoài trời của khách sạn hoặc thưởng thức dịch vụ mát-xa thư giãn. Wi-Fi được cung cấp miễn phí tại đây.

Các phòng sáng sủa với sàn trải thảm hoặc bằng gỗ của khách sạn được trang bị truyền hình cáp màn hình phẳng, minibar và phòng tắm riêng với bồn tắm.

Muong Thanh Luxury Lang Son Hotel có phòng tập thể dục và sân tennis. Tại đây cũng có hồ bơi spa, phòng xông hơi và phòng tắm hơi. Ngoài ra còn có các dịch vụ khác cho khách như bàn bán tour, cho thuê xe đạp và dịch vụ phòng.

Nhà hàng của khách sạn phục vụ thực đơn đa dạng gồm các món ăn địa phương và quốc tế cho tất cả các bữa ăn.

Từ Muong Than Lang Son chỉ cần lái xe 10 phút là tới chợ Đông Kinh và Kỳ Lừa. Bến xe buýt cách đó 100 m.",8.3,5.0
https://www.booking.com/hotel/vn/white-lang-son.vi.html,WHITE HOTEL,"37 Lê Hồng Phong Phường Tam Thanh, Lạng Sơn, Việt Nam","Tọa lạc ở Lạng Sơn, WHITE HOTEL cung cấp chỗ nghỉ 3 sao có khu vườn, phòng chờ chung và sân hiên. Ngoài dịch vụ tiền sảnh, chỗ nghỉ này còn có công viên nước. Chỗ nghỉ cung cấp lễ tân 24/24, dịch vụ đưa đón, dịch vụ phòng và Wi-Fi miễn phí.

Sân bay quốc tế Vân Đồn cách 125 km.",7.6,3.0
https://www.booking.com/hotel/vn/khach-san-a1-thanh-pho-lang-son.vi.html,Khách Sạn A1,"35 Đinh Tiên Hoàng Phường Chi Lăng, Lạng Sơn, Việt Nam","Khách Sạn A1 có khu vườn, phòng chờ chung, sân hiên và nhà hàng ở Lạng Sơn. Ngoài quầy bar, khách sạn 3 sao này có các phòng được trang bị điều hòa và Wi-Fi miễn phí, trong đó mỗi phòng sẽ có phòng tắm riêng. Chỗ nghỉ này cung cấp bếp chung, dịch vụ phòng và phòng giữ hành lý cho khách.

Tất cả các phòng đi kèm tủ lạnh, minibar, ấm đun nước, vòi sen, đồ vệ sinh cá nhân miễn phí và bàn làm việc. Tại khách sạn, các phòng đều đi kèm với ga trải giường và khăn tắm.

Lễ tân tại Khách Sạn A1 có thể tư vấn cho khách về khu vực xung quanh.

Sân bay quốc tế Vân Đồn cách 125 km.",8.6,3.0
https://www.booking.com/hotel/vn/khach-san-anh-tu-thanh-pho-lang-son6.vi.html,ANH TU Hotel,"95 Lý Thường Kiệt, Lạng Sơn, Việt Nam","ANH TU Hotel tọa lạc ở Lạng Sơn. Tại đây có sân hiên và khách có thể sử dụng Wi-Fi miễn phí và chỗ đậu xe riêng miễn phí.

Tại khách sạn, mỗi phòng đều được thiết kế có bàn làm việc và TV màn hình phẳng. Với phòng tắm riêng được trang bị vòi xịt/chậu rửa vệ sinh và đồ vệ sinh cá nhân miễn phí, một số căn tại ANH TU Hotel cũng có view thành phố. Phòng khách có két an toàn.

Thành thạo tiếng Anh, tiếng Việt và tiếng Hoa, đội ngũ nhân viên luôn túc trực 24/7 tại lễ tân.

Sân bay gần nhất là Sân bay quốc tế Vân Đồn, cách chỗ nghỉ 124 km.",9,
https://www.booking.com/hotel/vn/khach-san-bala.vi.html,Khách sạn Bala,"362 Ngô Quyền, Lạng Sơn, Việt Nam","Khách sạn Bala nằm ở Lạng Sơn và có nhà hàng. Ngoài sân hiên, khách sạn 3 sao này còn có các phòng với điều hòa được trang bị Wi-Fi miễn phí, trong đó mỗi phòng đều có phòng tắm riêng. Chỗ nghỉ này cung cấp dịch vụ phòng và quầy lễ tân 24 giờ cho khách.

Các căn đi kèm TV màn hình phẳng có truyền hình vệ tinh, ấm đun nước, vòi xịt/chậu rửa vệ sinh, đồ vệ sinh cá nhân miễn phí và bàn làm việc. Tại khách sạn, các phòng được thiết kế có ga trải giường và khăn tắm.

Hằng ngày, chỗ nghỉ có các lựa chọn thực đơn buffet, thực đơn à la carte hoặc kiểu Á cho bữa sáng.

Sân bay quốc tế Vân Đồn cách 121 km.",7.6,3.0
https://www.booking.com/hotel/vn/sojo-lang-son.vi.html,SOJO Hotel Lang Son,"Phai Ve, Mai Pha, Lạng Sơn, Việt Nam","SOJO Hotel Lang Son có trung tâm thể dục, phòng chờ chung, nhà hàng và quầy bar ở Lạng Sơn. Ngoài Wi-Fi miễn phí, khách sạn 4 sao này còn cung cấp bếp chung và quầy lễ tân 24 giờ. Chỗ nghỉ này cung cấp hoạt động giải trí vào buổi tối và dịch vụ tiền sảnh.

Khách sạn sẽ cung cấp cho khách các phòng được trang bị điều hòa có bàn làm việc, két an toàn, TV màn hình phẳng và phòng tắm riêng với vòi xịt/chậu rửa vệ sinh. Các phòng đều có minibar.

Khách tại SOJO Hotel Lang Son có thể thưởng thức bữa sáng thực đơn à la carte.

Khách có thể chơi bi-a và trò phi tiêu tại chỗ nghỉ.

Sân bay quốc tế Vân Đồn cách 123 km.",8.8,4.0
https://www.booking.com/hotel/vn/miamor.vi.html,Hotel Miamor,"113 Nguyễn Du, Lạng Sơn, Việt Nam","Hotel Miamor tọa lạc ở Lạng Sơn. Ngoài sân hiên, khách sạn 3 sao này còn có các phòng với điều hòa được trang bị Wi-Fi miễn phí, trong đó mỗi phòng đều có phòng tắm riêng. Chỗ nghỉ này cung cấp dịch vụ phòng, quầy lễ tân 24 giờ và phòng giữ hành lý cho khách.

Các phòng được trang bị TV màn hình phẳng có truyền hình cáp, ấm đun nước, vòi sen, đồ vệ sinh cá nhân miễn phí và bàn làm việc. Tại khách sạn, mỗi phòng đều có ga trải giường và khăn tắm.

Sân bay gần nhất là Sân bay quốc tế Vân Đồn, cách Hotel Miamor 124 km.",7.8,3.0
https://www.booking.com/hotel/vn/nha-nghi-nhat-son.vi.html,Nhat Son Guesthouse,"61, Street 4B, Group 1, Lot 5, Hop Thanh Commune, Cao Loc District, Lang Son Province, Lạng Sơn, Việt Nam","Nhat Son Guesthouse nằm ở Lạng Sơn, nhìn ra núi và có Wi-Fi miễn phí cùng chỗ đậu xe riêng miễn phí.

Được thiết kế với ban công, các căn có điều hòa, TV màn hình phẳng, cùng phòng tắm riêng gồm vòi xịt/chậu rửa vệ sinh và đồ vệ sinh cá nhân miễn phí. Tủ lạnh và ấm đun nước đều được cung cấp.

Nhà nghỉ B&B có sân hiên phơi nắng.

Khách cũng có thể thư giãn trong khu vườn hoặc khu vực phòng chờ chung.

Sân bay gần nhất là Sân bay quốc tế Vân Đồn, cách Nhat Son Guesthouse 121 km.",8.6,3.0
https://www.booking.com/hotel/vn/duong-cong-chich-homestay.vi.html,Duong Cong Chich Homestay,"Nà Riềng 2, Quỳnh Sơn, Bắc Sơn, Lạng Sơn, Việt Nam","Nhìn ra núi, Duong Cong Chich Homestay tọa lạc ở Lạng Sơn và có nhà hàng, bếp chung, bar thức ăn nhẹ, khu vườn cũng như sân hiên. Homestay có WiFi và chỗ đậu xe riêng miễn phí.

Tất cả các căn đều được thiết kế có ban công nhìn ra khu vườn.

Chỗ nghỉ có phục vụ bữa sáng mỗi sáng, gồm các lựa chọn thực đơn buffet, kiểu Á và món chay.

Chỗ nghỉ này có phòng chờ chung, ngoài ra khách có thể đi xe đạp gần đó.

Sân bay Quốc tế Nội Bài cách 127 km.",9.3,
https://www.booking.com/hotel/vn/hoang-son-hai.vi.html,Hoàng Sơn Hải Hotel,"57 Tam Thanh, Lạng Sơn, Việt Nam","Hoàng Sơn Hải Hotel tọa lạc ở Lạng Sơn. Tại đây có sân hiên và khách có thể sử dụng Wi-Fi miễn phí và chỗ đậu xe riêng miễn phí.

Nhân viên khách sạn luôn có mặt ở lễ tân để hướng dẫn du khách.

Sân bay gần nhất là Sân bay quốc tế Vân Đồn, cách Hoàng Sơn Hải Hotel 124 km.",7.3,
https://www.booking.com/hotel/vn/an-khang-thanh-pho-lang-son.vi.html,An Khang Hotel,"Đường Bà Triệu số 734, Lạng Sơn, Việt Nam","An Khang Hotel tọa lạc ở Lạng Sơn. Khách sạn 3 sao này có quầy lễ tân 24 giờ. Khách sạn cung cấp cả Wi-Fi miễn phí và chỗ đậu xe riêng miễn phí.

Tại khách sạn, phòng nào cũng có tủ quần áo. Với phòng tắm riêng được trang bị vòi xịt/chậu rửa vệ sinh và đồ vệ sinh cá nhân miễn phí, các phòng tại An Khang Hotel có TV màn hình phẳng và điều hòa, trong đó một số phòng có ban công. Tại chỗ nghỉ, tất cả các phòng đều được thiết kế có ga trải giường và khăn tắm.

Sân bay gần nhất là Sân bay quốc tế Vân Đồn, cách An Khang Hotel 124 km.",9.3,3.0
https://www.booking.com/hotel/vn/phong-son-retreat-huu-lung-lang-son.vi.html,"Phong Sơn Retreat - Homestay Hữu Lũng, Lạng Sơn","Tân Yên , Ba Mìn - Phong Sơn Retreat, Xã Yên Thịnh, Huyện Hữu Lũng,, Lạng Sơn, Việt Nam","Nhìn ra núi, Phong Sơn Retreat - Homestay Hữu Lũng, Lạng Sơn tọa lạc ở Lạng Sơn và có nhà hàng, dịch vụ phòng, quầy bar, khu vườn, sân hiên cũng như BBQ. WiFi và chỗ đậu xe riêng đều có sẵn tại căn hộ miễn phí.

Nơi đây còn có phòng tắm riêng với vòi xịt/chậu rửa vệ sinh ở tất cả các căn, cùng đồ vệ sinh cá nhân miễn phí, máy sấy tóc và dép đi trong phòng.

Phong Sơn Retreat - Homestay Hữu Lũng, Lạng Sơn có phục vụ bữa sáng thực đơn buffet hoặc kiểu Á.

Du khách có thể leo núi và câu cá để khám phá khu vực xung quanh, đồng thời chỗ nghỉ có thể sắp xếp dịch vụ cho thuê xe đạp.

Sân bay Quốc tế Nội Bài cách 106 km, đồng thời chỗ nghỉ có cung cấp dịch vụ đưa đón sân bay mất phí.",9.7,
https://www.booking.com/hotel/vn/hong-ngoc-thanh-pho-lang-son1.vi.html,Hồng Ngọc Hotel,"503 Đường Bà Triệu, Lạng Sơn, Việt Nam","Hồng Ngọc Hotel cung cấp chỗ nghỉ tại Lạng Sơn. Chỗ nghỉ này cung cấp dịch vụ phòng và quầy lễ tân 24 giờ cho khách.

Sân bay gần nhất là Sân bay quốc tế Vân Đồn, cách khách sạn 124 km.",8.2,
https://www.booking.com/hotel/vn/nha-nghi-quynh-van-2.vi.html,Quỳnh Vân 2,"Phố Đinh Liệt, Lạng Sơn, Việt Nam","Nằm ở Lạng Sơn thuộc Lang Son, Quỳnh Vân 2 cung cấp Wi-Fi miễn phí và chỗ đậu xe riêng miễn phí.

Sân bay quốc tế Vân Đồn cách 123 km.",9.5,
https://www.booking.com/hotel/vn/khach-san-trieu-ky-voong.vi.html,Khách sạn TRIỆU KÝ VOÒNG,"130 lý thường kiệt phường hoàng văn thụ thành phố Lạng Sơn, Lạng Sơn, Việt Nam","Nằm ở Lạng Sơn, Khách sạn TRIỆU KÝ VOÒNG cung cấp chỗ nghỉ 2 sao có khu vườn, phòng chờ chung và quầy bar. Chỗ nghỉ này cung cấp dịch vụ phòng, quầy lễ tân 24 giờ và dịch vụ thu đổi ngoại tệ cho khách.

Tại khách sạn, các phòng đều có điều hòa, bàn làm việc, TV màn hình phẳng, phòng tắm riêng, ga trải giường, khăn tắm và sân hiên với view thành phố. Tất cả các phòng ở Khách sạn TRIỆU KÝ VOÒNG được trang bị đồ vệ sinh cá nhân miễn phí và ổ cắm iPod.

Sân bay gần nhất là Sân bay quốc tế Vân Đồn, cách chỗ nghỉ 124 km.",7,2.0
https://www.booking.com/hotel/vn/nhat-minh-thanh-pho-lang-son.vi.html,Nhật Minh Hotel,"50 Lý Thường Kiệt, Lạng Sơn, Việt Nam","Nhật Minh Hotel cung cấp chỗ nghỉ tại Lạng Sơn. Mỗi phòng tại khách sạn 2 sao này đều nhìn ra thành phố, đồng thời khách có thể sử dụng phòng chờ chung và quầy bar. Chỗ nghỉ này cung cấp dịch vụ phòng và quầy lễ tân 24 giờ cho khách.

Các căn đi kèm điều hòa, TV màn hình phẳng có truyền hình cáp, tủ lạnh, ấm đun nước, vòi xịt/chậu rửa vệ sinh, đồ vệ sinh cá nhân miễn phí và tủ quần áo. Ngoài phòng tắm riêng với vòi sen và máy sấy tóc, các phòng tại khách sạn cũng có Wi-Fi miễn phí, trong đó một số phòng có view núi. Tại Nhật Minh Hotel, tất cả các phòng có ga trải giường và khăn tắm.

Sân bay gần nhất là Sân bay quốc tế Vân Đồn, cách chỗ nghỉ 123 km.",,2.0
https://www.booking.com/hotel/vn/long-vu-thanh-pho-lang-son.vi.html,LONG VŨ HOTEL,"136 Lý Thường Kiệt, Lạng Sơn, Việt Nam","LONG VŨ HOTEL tọa lạc ở Lạng Sơn. Ngoài nhà hàng, khách sạn 3 sao này có các phòng được trang bị điều hòa và Wi-Fi miễn phí, trong đó mỗi phòng sẽ có phòng tắm riêng. Chỗ nghỉ này cung cấp dịch vụ phòng và quầy lễ tân 24 giờ cho khách.

Các phòng được trang bị tủ lạnh, minibar, ấm đun nước, vòi sen, máy sấy tóc và bàn làm việc. Tại khách sạn, mỗi phòng đều có ga trải giường và khăn tắm.

Sân bay quốc tế Vân Đồn cách 124 km.",6.8,3.0
https://www.booking.com/hotel/vn/happy-house-lang-son.vi.html,Happy Home,"Green Park Lạng Sơn, đường Võ Thị Sáu, phường Đông Kinh, thành Phố Lạng Sơn, tỉnh Lạng Sơn, Lạng Sơn, Việt Nam","Nằm ở Lạng Sơn, Happy Home cung cấp chỗ nghỉ có Wi-Fi miễn phí, điều hòa và khu vườn với sân hiên.

Căn hộ có ban công nơi khách có thể nhìn ra thành phố, khu vực ghế ngồi, TV màn hình phẳng truyền hình vệ tinh, bếp đầy đủ tiện nghi gồm tủ lạnh và lò vi sóng, cùng phòng tắm riêng được trang bị vòi sen và đồ vệ sinh cá nhân miễn phí. Bếp và ấm đun nước đều được cung cấp.

Sân bay gần nhất là Sân bay quốc tế Vân Đồn, cách Happy Home 123 km.",8.4,4.0
https://www.booking.com/hotel/vn/nha-nghi-ha-giang.vi.html,Nhà nghỉ Hà Giang,"Số 9 Quốc lộ 1A, tổ 5, khối 1, thị trấn Cao Lộc, huyện Cao Lộc, tỉnh Lạng Sơn, Lạng Sơn, Việt Nam","Nhà nghỉ Hà Giang có khu vườn, phòng chờ chung, sân hiên và nhà hàng ở Lạng Sơn. Motel còn cung cấp Wi-Fi miễn phí và chỗ đậu xe riêng miễn phí.

Tại motel, các phòng đều có tủ quần áo, TV màn hình phẳng, phòng tắm riêng, ga trải giường và khăn tắm. Tất cả các phòng đều có tủ lạnh.

Đội ngũ nhân viên của Nhà nghỉ Hà Giang luôn túc trực tại lễ tân 24/24 để cung cấp đề xuất cho du khách.

Sân bay quốc tế Vân Đồn cách 124 km.",5.5,
https://www.booking.com/hotel/vn/nha-nghi-chieu-tim.vi.html,Nhà nghỉ Chiều Tím,"92A đường Na Làng, tổ 5, khối 1, thị trấn Cao Lộc, huyện Cao Lộc, Lạng Sơn, Việt Nam","Nhà nghỉ Chiều Tím tọa lạc ở Lạng Sơn và có khu vườn. Ở đây có nhà hàng phục vụ món ăn Việt và chỗ đậu xe riêng miễn phí.

Tại motel, các phòng đều có tủ quần áo. Với phòng tắm riêng được trang bị vòi xịt/chậu rửa vệ sinh và đồ vệ sinh cá nhân miễn phí, tất cả các căn tại Nhà nghỉ Chiều Tím có TV màn hình phẳng và điều hòa, trong đó một số phòng có sân hiên. Tại chỗ nghỉ, tất cả các phòng đều có ga trải giường và khăn tắm.

Lễ tân tại Nhà nghỉ Chiều Tím có thể cung cấp các thông tin hữu ích để giúp du khách tham quan khu vực xung quanh một cách thuận tiện.

Sân bay quốc tế Vân Đồn cách 124 km.",6.5,
https://www.booking.com/hotel/vn/mons-house-thanh-pho-lang-son1.vi.html,Mon's house,"Đường Võ Thị Sáu Căn 1213, Lạng Sơn, Việt Nam","Mon's house nằm ở Lạng Sơn. Chỗ nghỉ nhìn ra khu vườn, có khu vườn, sân hiên và Wi-Fi miễn phí ở toàn bộ chỗ nghỉ.

Căn hộ điều hòa này có 2 phòng ngủ với ban công nhìn ra núi và bếp đầy đủ tiện nghi. TV màn hình phẳng được cung cấp.

Sân bay gần nhất là Sân bay quốc tế Vân Đồn, cách căn hộ 123 km.",9,3.0
https://www.booking.com/hotel/vn/khach-san-anh-trang-thanh-pho-lang-son.vi.html,Khách sạn Ánh Trăng,"Khu đô thị Nam Hoàng Đồng Ô số 16+17 Lô 29 đường số 24 Nguyễn Phi Khanh, Lạng Sơn, Việt Nam","Khách sạn Ánh Trăng cung cấp chỗ nghỉ tại Lạng Sơn. Chỗ nghỉ này cung cấp dịch vụ phòng và quầy lễ tân 24 giờ cho khách.

Tại khách sạn, mỗi phòng đều có tủ quần áo và TV màn hình phẳng. Các phòng đều đi kèm với phòng tắm riêng với vòi xịt/chậu rửa vệ sinh, máy sấy tóc và dép đi trong phòng. Các căn tại Khách sạn Ánh Trăng có điều hòa và bàn làm việc.

Sân bay gần nhất là Sân bay quốc tế Vân Đồn, cách chỗ nghỉ 125 km.",6,
