url,name,location,description,point,star
https://www.booking.com/hotel/vn/khach-san-som-phu-quy-ninh-thuan-thanh-pho-phan-rang-thap-cham.vi.html,Khách sạn Sớm Phú Quý - Ninh Thuận,"Quốc lộ 1A, Phan Rang, Việt Nam","Khách sạn Sớm Phú Quý - Ninh Thuận có khu vườn, sân hiên, nhà hàng và quầy bar ở Phan Rang. Chỗ nghỉ có chỗ đậu xe riêng miễn phí và có cả dịch vụ đưa đón sân bay mất phí.

Với phòng tắm riêng được trang bị vòi xịt/chậu rửa vệ sinh và đồ vệ sinh cá nhân miễn phí, các phòng tại khách sạn có TV màn hình phẳng và điều hòa, trong đó một số phòng có ban công. Tại Khách sạn Sớm Phú Quý - Ninh Thuận, mỗi phòng đều có ga trải giường và khăn tắm.

Thành thạo tiếng Anh và tiếng Việt, đội ngũ nhân viên tại lễ tân 24/24 luôn sẵn lòng hỗ trợ khách lên kế hoạch cho kỳ nghỉ.

Sân bay Liên Khương cách 115 km.",8.9,
https://www.booking.com/hotel/vn/vision-phan-rang1.vi.html,VISION HOTEL,"Đường Thế Lữ, Khu K1, Phan Rang, Việt Nam","VISION HOTEL nằm ở Phan Rang. Khách sạn cung cấp cả Wi-Fi miễn phí và chỗ đậu xe riêng miễn phí.

Tất cả các căn đi kèm điều hòa, TV màn hình phẳng có truyền hình cáp, tủ lạnh, ấm đun nước, vòi xịt/chậu rửa vệ sinh, đồ vệ sinh cá nhân miễn phí và bàn làm việc. Ngoài phòng tắm riêng với vòi sen và máy sấy tóc, một số phòng tại khách sạn cũng có view thành phố. Tại VISION HOTEL, tất cả các phòng có ga trải giường và khăn tắm.

Lễ tân tại chỗ nghỉ có thể tư vấn cho khách về khu vực xung quanh.

Sân bay Liên Khương cách 112 km.",8.5,
https://www.booking.com/hotel/vn/dalat-ninhchu.vi.html,Dalat Ninhchu,"66 Yên Ninh, Bắc Sớn, Việt Nam","Nằm giáp biển, Dalat Ninhchu cung cấp chỗ nghỉ 2 sao ở Bắc Sớn, đồng thời có khu vườn, sân hiên và quầy bar. Chỗ nghỉ cách Bãi biển Bình Sơn khoảng 3 phút đi bộ, Bãi biển Ninh Chữ 300 m và Bãi biển Phan Rang 2.8 km. Chỗ nghỉ cung cấp lễ tân 24/24, dịch vụ đưa đón, bếp chung và Wi-Fi miễn phí ở toàn bộ chỗ nghỉ.

Các căn đi kèm điều hòa, lò nướng, lò vi sóng, máy pha cà phê, vòi sen, đồ vệ sinh cá nhân miễn phí và tủ quần áo. Các phòng được thiết kế có phòng tắm riêng với dép đi trong phòng, trong đó một số phòng có sân trong và một số phòng khác cũng nhìn ra thành phố. Phòng khách đều có bếp.

Sân bay gần nhất là Sân bay quốc tế Cam Ranh, cách khách sạn 72 km.","8,7",2.0
https://www.booking.com/hotel/vn/khach-san-fara.vi.html,Khách Sạn FARA,"184 -186 Ngô Gia Tự, P. Thanh Sơn, Thành phố Phan Rang - Tháp Chàm, Phan Rang, Việt Nam","Khách Sạn FARA cung cấp chỗ nghỉ tại Phan Rang. Khách sạn 2 sao này có các phòng được trang bị điều hòa. Chỗ nghỉ cung cấp lễ tân 24/24, dịch vụ đưa đón sân bay, dịch vụ phòng và Wi-Fi miễn phí.

Tại khách sạn, các phòng được thiết kế có tủ quần áo. Ngoài phòng tắm riêng với vòi xịt/chậu rửa vệ sinh và đồ vệ sinh cá nhân miễn phí, một số phòng tại Khách Sạn FARA cũng có view thành phố. Các căn ở chỗ nghỉ được trang bị TV màn hình phẳng và máy sấy tóc.

Sân bay gần nhất là Sân bay Liên Khương, cách Khách Sạn FARA 112 km.",7.8,2.0
https://www.booking.com/hotel/vn/khach-san-truong-long.vi.html,Khách sạn Trường Long,"Nguyễn Tri Phương Lô 8 Khu K1, Phan Rang, Việt Nam","Khách sạn Trường Long cung cấp chỗ nghỉ tại Phan Rang. Tại đây có sân hiên và khách có thể sử dụng Wi-Fi miễn phí và chỗ đậu xe riêng miễn phí.

Chỗ nghỉ cách Sân bay Liên Khương 113 km và cung cấp dịch vụ đưa đón sân bay mất phí.",8.2,
https://www.booking.com/hotel/vn/khach-san-hong-anh-thanh-pho-phan-rang-thap-cham1.vi.html,Hotel Hong Anh,"130A Nguyen Thi Minh Khai, Phan Rang, Thap Cham, Ninh Thuan, Phan Rang, Việt Nam","Nằm ở Phan Rang, cách Bãi biển Bình Sơn 4 phút đi bộ, Hotel Hong Anh cung cấp chỗ nghỉ có phòng chờ chung, chỗ đậu xe riêng miễn phí và sân hiên. Chỗ nghỉ cung cấp lễ tân 24/24, dịch vụ đưa đón sân bay, dịch vụ phòng và Wi-Fi miễn phí.

Tại khách sạn, tất cả các phòng đều được thiết kế có tủ quần áo. Với phòng tắm riêng được trang bị vòi xịt/chậu rửa vệ sinh và đồ vệ sinh cá nhân miễn phí, các căn tại Hotel Hong Anh có TV màn hình phẳng và điều hòa, trong đó một số phòng có ban công. Tại chỗ nghỉ, các phòng đều đi kèm với ga trải giường và khăn tắm.

Hotel Hong Anh cách Bãi biển Ninh Chữ 18 phút đi bộ và Bãi biển Phan Rang 1.8 km.",7.9,
https://www.booking.com/hotel/vn/khach-san-kim-hoan.vi.html,Kim Hoàn Hotel Phan Rang,"Hoàng Diệu, Phan Rang, Việt Nam","Kim Hoàn Hotel Phan Rang cung cấp chỗ nghỉ tại Phan Rang. Khách sạn 2 sao này có các phòng được trang bị điều hòa, phòng tắm riêng và Wi-Fi miễn phí. Du khách có thể tận hưởng cảnh thành phố.

Khách sạn cung cấp một số phòng được trang bị ban công và tất cả các phòng có ấm đun nước. Tại Kim Hoàn Hotel Phan Rang, các phòng được thiết kế có ga trải giường và khăn tắm.

Thành thạo tiếng Anh và tiếng Việt, đội ngũ nhân viên tại lễ tân 24/24 luôn túc trực để hỗ trợ khách.

Sân bay gần nhất là Sân bay quốc tế Cam Ranh, cách chỗ nghỉ 73 km.",8.1,2.0
https://www.booking.com/hotel/vn/hoang-sang-guest-house-amp-restaurant.vi.html,Hoàng Sáng Residence & Restaurant,"J44V+QX9, Mỹ Hòa, Ninh Hải, Ninh Thuận, Vietnam, Ấp Mỹ Hải, Việt Nam","Hoàng Sáng Residence & Restaurant có khu vườn, phòng chờ chung, nhà hàng và quầy bar ở Ấp Mỹ Hải. Ngoài phòng gia đình, chỗ nghỉ này cũng cung cấp cho khách BBQ. Du khách có thể thưởng thức đồ uống tại bar thức ăn nhẹ.

Tại guest house, tất cả các phòng có tủ quần áo. Tất cả các căn tại Hoàng Sáng Residence & Restaurant có điều hòa và bàn làm việc.

Chỗ nghỉ có phục vụ bữa sáng mỗi sáng, gồm các lựa chọn kiểu Á, món chay và món thuần chay.

Sân bay quốc tế Cam Ranh cách 76 km.",9.7,
https://www.booking.com/hotel/vn/lamer-homestay-amp-villa.vi.html,Lamer Homestay & Villa - Vinh Hy Bay,"Lamer Homestay & Villa, vịnh Vĩnh Hy, huyện Ninh Hải, Thôn Bảo An, Việt Nam","Lamer Homestay & Villa - Vinh Hy Bay tọa lạc ở Thôn Bảo An. Chỗ nghỉ này có các tiện nghi như nhà hàng, dịch vụ phòng và quầy lễ tân 24 giờ, cùng với Wi-Fi miễn phí ở toàn bộ chỗ nghỉ. Khách sạn có phòng gia đình.

Khách tại khách sạn sẽ có thể tận hưởng các hoạt động ở trong Thôn Bảo An và khu vực xung quanh, như đi xe đạp.

Sân bay quốc tế Cam Ranh cách 68 km.",7.9,
https://www.booking.com/hotel/vn/vung-gang-phan-rang-thap-cham.vi.html,Hotel Vũng Găng,"thôn Vĩnh Hy , xã Vĩnh Hải, Huyện Ninh Hải, tỉnh NInh Thuận 2 tầng, Vịnh Vĩnh Hy, Việt Nam","Hotel Vũng Găng cung cấp chỗ nghỉ giáp biển ở Vịnh Vĩnh Hy. Ngoài dịch vụ tiền sảnh, chỗ nghỉ này còn có sân hiên. Chỗ nghỉ cung cấp lễ tân 24/24, dịch vụ đưa đón sân bay, dịch vụ phòng và Wi-Fi miễn phí ở toàn bộ chỗ nghỉ.

Sân bay gần nhất là Sân bay Liên Khương, cách khách sạn 148 km.",9.4,
https://www.booking.com/hotel/vn/saigon-ninh-chu-resort.vi.html,Saigon - Ninh Chu Hotel & Resort,"Yen Ninh Street, Khanh Hai Town, Ninh Hai District, Phan Rang, Việt Nam","Chỉ cách Thành phố Phan Rang 4 km, Sài Gòn-Ninh Chữ Hotel & Resort có hồ bơi và bãi biển biệt lập hướng về phía biển Đông. Tất cả các phòng đều có Wi-Fi miễn phí.

Ngoài truyền hình vệ tinh, các phòng máy lạnh tại Khách sạn Sài Gòn-Ninh Chữ còn được trang bị minibar. Từ tất cả các phòng khách có thể chiêm ngưỡng cảnh vườn đẹp đẽ, cảnh hồ bơi hoặc biển.

Khách có thể chơi tennis trên sân riêng của khách sạn hoặc thư giãn bên hồ bơi ngoài trời. Lễ tân 24-giờ và dịch vụ thu đổi ngoại tệ tại đây cho khách sự tiện lợi.

Nhà hàng Seaview phục vụ ẩm thực Việt Nam và phương Tây với tầm nhìn ra đại dương.

Sài Gòn-Ninh Chữ Hotel & Resort cách Sân bay Cam Ranh 45 phút lái xe. Chỗ ở này cũng gần Ga Tàu Tháp Chàm, cách đó chỉ 20 phút lái xe.",8,4.0
https://www.booking.com/hotel/vn/lovely3bedroom-condo-with-free-parking-on-premises-thanh-pho-phan-rang-thap-cha1.vi.html,Lovely 3-bedroom condo with free parking,"66 Lê Thánh Tôn, Kinh Dinh, Việt Nam","Nằm ở Kinh Dinh, Lovely 3-bedroom condo with free parking cung cấp chỗ nghỉ có Wi-Fi miễn phí, điều hòa và khu vườn với sân hiên.

Các căn có bếp đầy đủ tiện nghi với khu vực ăn uống, tủ lạnh, ấm đun nước và bếp. Nơi đây còn có phòng tắm chung với vòi xịt/chậu rửa vệ sinh ở một số căn, cùng đồ vệ sinh cá nhân miễn phí, máy sấy tóc và dép đi trong phòng.

Căn hộ cung cấp sân chơi trẻ em.

Sân bay Liên Khương cách 112 km.",9.1,3.0
https://www.booking.com/hotel/vn/new-yeu-bien-homestay.vi.html,New Yêu Biển homestay,"179/14H Đường Mai Văn Ngọc, Vịnh Vĩnh Hy, Việt Nam","Tọa lạc ở Vịnh Vĩnh Hy, New Yêu Biển homestay cung cấp chỗ nghỉ có sân hiên.

Nơi đây còn có phòng tắm riêng với vòi xịt/chậu rửa vệ sinh ở tất cả các căn, cùng đồ vệ sinh cá nhân miễn phí, máy sấy tóc và dép đi trong phòng.

Homestay có phục vụ bữa sáng thực đơn à la carte hằng ngày.

Sân bay quốc tế Cam Ranh cách 68 km.",,
https://www.booking.com/hotel/vn/queen-luxury.vi.html,QUEEN LUXURY HoTel,"9 Nguyễn Tri Phương, Kinh Dinh, Việt Nam","QUEEN LUXURY HoTel tọa lạc ở Kinh Dinh. Ngoài sân hiên, khách sạn 2 sao này còn có các phòng với điều hòa được trang bị Wi-Fi miễn phí, trong đó mỗi phòng đều có phòng tắm riêng. Chỗ nghỉ này cung cấp dịch vụ phòng và quầy lễ tân 24 giờ cho khách.

Tại khách sạn, các phòng đều có bàn làm việc và TV màn hình phẳng. Tại QUEEN LUXURY HoTel, tất cả các phòng đều được thiết kế có ga trải giường và khăn tắm.

Sân bay quốc tế Cam Ranh cách 74 km.",,2.0
https://www.booking.com/hotel/vn/casadimare.vi.html,Casa Maya Hotel,"Đường 702 xã Vĩnh Hải, Huyện Ninh Hải, Thôn Bảo An, Việt Nam","Nằm ở Thôn Bảo An, cách Bãi Kinh chỉ vài bước chân, Casa Maya Hotel cung cấp chỗ nghỉ có hồ bơi ngoài trời, chỗ đậu xe riêng miễn phí, khu vườn và khu vực bãi biển riêng. Chỗ nghỉ này có các tiện nghi như sân hiên, nhà hàng và quầy bar. Chỗ nghỉ cung cấp lễ tân 24/24, dịch vụ đưa đón sân bay, dịch vụ phòng và Wi-Fi miễn phí ở toàn bộ chỗ nghỉ.

Các căn đi kèm điều hòa, TV màn hình phẳng có truyền hình vệ tinh, tủ lạnh, ấm đun nước, vòi sen, đồ vệ sinh cá nhân miễn phí và bàn làm việc. Các phòng có phòng tắm riêng, máy sấy tóc và ga trải giường.

Khách sạn cách Bãi biển Lighthouse 5 phút đi bộ và Bãi Chuối 2 km.",7.2,3.0
https://www.booking.com/hotel/vn/coco-vinh-hy.vi.html,CoCo Homestay - Vĩnh Hy,"Thôn Vĩnh Hy, xã Vĩnh Hải, huyện Ninh Hải, tỉnh Ninh Thuận, Vịnh Vĩnh Hy, Việt Nam","Tọa lạc ở Vịnh Vĩnh Hy, cách Bãi Suối Sâu 2.7 km và Bãi Ông Thịnh 2.8 km, CoCo Homestay - Vĩnh Hy cung cấp chỗ nghỉ có Wi-Fi miễn phí, điều hòa và khu vườn. Chỗ nghỉ này nhìn ra biển và núi.

Khăn tắm và ga trải giường có sẵn ở homestay.

Khách có thể sử dụng sân hiên phơi nắng tại homestay.

Sân bay quốc tế Cam Ranh cách 68 km.",,
https://www.booking.com/hotel/vn/long-thuan-resort-amp-spa.vi.html,Long Thuan Hotel & Resort,"01 Yen Ninh, Bai bien Binh Son, Ninh Chu, Phan Rang, Việt Nam","Tọa lạc ở Phan Rang, cách Bãi biển Phan Rang 7 phút đi bộ, Long Thuan Hotel & Resort cung cấp chỗ nghỉ có hồ bơi ngoài trời, chỗ đậu xe riêng miễn phí, khu vườn và khu vực bãi biển riêng. Chỗ nghỉ này có các tiện nghi như sân hiên, nhà hàng và quầy bar. Chỗ nghỉ cung cấp lễ tân 24/24, dịch vụ đưa đón sân bay, dịch vụ phòng và Wi-Fi miễn phí ở toàn bộ chỗ nghỉ.

Resort sẽ cung cấp cho khách các phòng được trang bị điều hòa có bàn làm việc, ấm đun nước, minibar, két an toàn, TV màn hình phẳng và phòng tắm riêng với vòi xịt/chậu rửa vệ sinh. Tại Long Thuan Hotel & Resort, phòng nào cũng có ga trải giường và khăn tắm.

Chỗ nghỉ có sân chơi trẻ em. Khách có thể chơi đánh tennis tại resort 4 sao này.

Long Thuan Hotel & Resort cách Bãi biển Bình Sơn 7 phút đi bộ. Sân bay Liên Khương cách 115 km.",8,4.0
https://www.booking.com/hotel/vn/homestay-van-vinh-hy-phan-rang-thap-cham.vi.html,Homestay Văn Vĩnh Hy,"Thôn Vĩnh Hy, xã Vĩnh Hải, huyện Ninh Hải, tỉnh Ninh Thuận, Vịnh Vĩnh Hy, Việt Nam","Homestay Văn Vĩnh Hy tọa lạc ở Vịnh Vĩnh Hy và có khu vườn. Chỗ nghỉ cung cấp lễ tân 24/24, dịch vụ đưa đón sân bay, dịch vụ phòng và Wi-Fi miễn phí ở toàn bộ chỗ nghỉ.

Tại khách sạn, mỗi phòng đều có sân hiên với view vườn. Phòng tắm riêng được trang bị vòi xịt/chậu rửa vệ sinh, đồ vệ sinh cá nhân miễn phí và máy sấy tóc. Tại Homestay Văn Vĩnh Hy, mỗi phòng đều được thiết kế có ga trải giường và khăn tắm.

Sân bay gần nhất là Sân bay quốc tế Cam Ranh, cách chỗ nghỉ 68 km.",9.3,
https://www.booking.com/hotel/vn/homestay-mien-bien-vinh-hy-2.vi.html,Homestay Miền Biển Vĩnh Hy 2,"Thôn Vĩnh Hy, xã Vĩnh Hải, huyện Ninh Hải, Vịnh Vĩnh Hy, Việt Nam","Tọa lạc ở Vịnh Vĩnh Hy, Homestay Miền Biển Vĩnh Hy 2 cung cấp chỗ nghỉ có Wi-Fi miễn phí, điều hòa và khu vườn.

Nơi đây còn có phòng tắm riêng với vòi sen và máy sấy tóc ở từng căn, cùng dép đi trong phòng.

Sân bay gần nhất là Sân bay Liên Khương, cách homestay 148 km.",9.2,
https://www.booking.com/hotel/vn/yeu-bien-homestay.vi.html,Yêu Biển homestay,"Thôn Vĩnh Hy, xã Vĩnh Hải, huyện Ninh Hải, tỉnh Ninh Thuận, Phan Rang, Việt Nam","Nằm ở Phan Rang, Yêu Biển homestay cung cấp Wi-Fi miễn phí, nơi khách có thể trải nghiệm khu vườn, sân hiên và nhà hàng.

Sân bay quốc tế Cam Ranh cách 67 km.",7.8,
https://www.booking.com/hotel/vn/nhan-duyen.vi.html,Nhân Duyên Hotel,"Vịnh vĩnh hy, Thôn Bảo An, Việt Nam","Tọa lạc ở Thôn Bảo An thuộc Ninh Thuận, Nhân Duyên Hotel cung cấp Wi-Fi miễn phí và chỗ đậu xe riêng miễn phí.

Được thiết kế với sân hiên, các căn có điều hòa, TV màn hình phẳng, cùng phòng tắm riêng gồm vòi xịt/chậu rửa vệ sinh và đồ vệ sinh cá nhân miễn phí. Tủ lạnh và ấm đun nước đều được cung cấp.

Sân bay quốc tế Cam Ranh cách 68 km.",,
https://www.booking.com/hotel/vn/chu-troc-homestay-phan-rang-homestay-amp-camp.vi.html,Chú Trọc Homestay - Phan Rang Homestay & Camp,"19 Lê Lợi 19, Phan Rang, Việt Nam","Chú Trọc Homestay - Phan Rang Homestay & Camp ở Phan Rang cung cấp sân hiên và bếp.

Nơi đây còn có phòng tắm chung với vòi xịt/chậu rửa vệ sinh ở một số căn, cùng đồ vệ sinh cá nhân miễn phí, máy sấy tóc và dép đi trong phòng.

Khách cũng có thể thư giãn trong khu vườn hoặc khu vực phòng chờ chung.

Sân bay gần nhất là Sân bay Liên Khương, cách homestay 112 km, đồng thời chỗ nghỉ có cung cấp dịch vụ đưa đón sân bay mất phí.",8.9,
https://www.booking.com/hotel/vn/lily-phan-rang.vi.html,LY'S Căn hộ Homestay Phan Rang-2pn,"đường 16/4, Phan Rang, Việt Nam","Tọa lạc ở Phan Rang, LY'S Căn hộ Homestay Phan Rang-2pn nhìn ra núi, có Wi-Fi miễn phí và cách Bãi biển Phan Rang 13 phút đi bộ cũng như Bãi biển Bình Sơn 1.4 km.

Với sân hiên hoặc ban công nhìn ra thành phố và biển, các căn chỗ nghỉ có điều hòa, khu vực ghế ngồi, TV màn hình phẳng truyền hình cáp và bếp. Nơi đây còn có phòng tắm chung với vòi xịt/chậu rửa vệ sinh ở một số căn, cùng đồ vệ sinh cá nhân miễn phí, máy sấy tóc và dép đi trong phòng.

Căn hộ có sân chơi trẻ em.

LY'S Căn hộ Homestay Phan Rang-2pn có cả dịch vụ cho thuê xe đạp và dịch vụ cho thuê ô tô, đồng thời du khách có thể câu cá gần đó.

Sân bay gần nhất là Sân bay Liên Khương, cách chỗ nghỉ 114 km, đồng thời chỗ nghỉ có cung cấp dịch vụ đưa đón sân bay mất phí.",6.6,3.0
https://www.booking.com/hotel/vn/nap-homestay.vi.html,Nạp Homestay,"Số nhà 18A, 131 Lê Lợi, phường Tấn Tài, Phan Rang - Tháp Chàm, Ninh Thuận, Việt Nam, Kinh Dinh, Việt Nam","Tọa lạc ở Kinh Dinh, Nạp Homestay cung cấp chỗ nghỉ có Wi-Fi miễn phí, điều hòa và khu vườn với sân hiên.

Các căn có bếp đầy đủ tiện nghi với khu vực ăn uống, tủ lạnh, ấm đun nước và lò vi sóng. Nơi đây còn có phòng tắm riêng với vòi xịt/chậu rửa vệ sinh ở tất cả các căn, cùng đồ vệ sinh cá nhân miễn phí, máy sấy tóc và dép đi trong phòng.

Khách cũng có thể thư giãn trong khu vực phòng chờ chung.

Sân bay gần nhất là Sân bay Liên Khương, cách homestay 112 km, đồng thời chỗ nghỉ có cung cấp dịch vụ đưa đón sân bay mất phí.",9.9,
https://www.booking.com/hotel/vn/color-inn-homestay-amp-cafe.vi.html,Color Inn - Homestay & Cafe,"Đường 702, Ninh Hải, Việt Nam","Nằm ở Ninh Hải, Color Inn - Homestay & Cafe có khu vườn, quầy bar và Wi-Fi miễn phí ở toàn bộ chỗ nghỉ.

Tại guest house, tất cả các phòng đều có điều hòa, tủ quần áo, sân hiên với view vườn, phòng tắm riêng, TV màn hình phẳng, ga trải giường và khăn tắm. Tất cả các căn đều có tủ lạnh.

Sân bay gần nhất là Sân bay Liên Khương, cách Color Inn - Homestay & Cafe 132 km.",9,
https://www.booking.com/hotel/vn/truc-nguyen-vinh-hy-homestay.vi.html,Trúc Nguyên - Vĩnh Hy Homestay,"Vinh Hy 12 Truong mau giao, Vịnh Vĩnh Hy, Việt Nam","Trúc Nguyên - Vĩnh Hy Homestay nằm ở Vịnh Vĩnh Hy, nhìn ra khu vườn và có Wi-Fi miễn phí cùng chỗ đậu xe riêng miễn phí.

Được thiết kế với sân hiên, các căn có điều hòa, TV màn hình phẳng, cùng phòng tắm riêng gồm vòi sen và đồ vệ sinh cá nhân miễn phí. Tủ lạnh và ấm đun nước đều được cung cấp.

Sau một ngày leo núi hoặc đi xe đạp, khách có thể thư giãn trong khu vườn hoặc khu vực phòng chờ chung.

Sân bay gần nhất là Sân bay Liên Khương, cách homestay 147 km, đồng thời chỗ nghỉ có cung cấp dịch vụ đưa đón sân bay mất phí.",9.3,
https://www.booking.com/hotel/vn/windy-homestay-hacomgalacity-phan-rang.vi.html,Windy Homestay View Biển PR-TC,"66 Lê Thánh Tôn, Kinh Dinh, Việt Nam","Windy Homestay View Biển PR-TC là chỗ nghỉ nằm ở Kinh Dinh và có ban công. Chỗ nghỉ nhìn ra thành phố, có sân hiên và Wi-Fi miễn phí ở toàn bộ chỗ nghỉ.

Căn hộ điều hòa này có 2 phòng ngủ, phòng khách, bếp đầy đủ tiện nghi với tủ lạnh và ấm đun nước, 2 phòng tắm với vòi xịt/chậu rửa vệ sinh và vòi sen. Khăn tắm và ga trải giường có sẵn ở căn hộ.

Sân bay gần nhất là Sân bay quốc tế Cam Ranh, cách căn hộ 73 km.",9,
https://www.booking.com/hotel/vn/nu-hoang.vi.html,NỮ HOÀNG HOTEL,"23 đường 16 tháng 4, phường Kinh Dinh, Phan Rang, Việt Nam","Nằm giáp biển ở Phan Rang, NỮ HOÀNG HOTEL có nhà hàng. Ngoài sân hiên, khách sạn 2 sao này có các phòng được trang bị điều hòa và Wi-Fi miễn phí, trong đó mỗi phòng sẽ có phòng tắm riêng. Chỗ nghỉ có chỗ đậu xe riêng miễn phí và có cả dịch vụ đưa đón sân bay mất phí.

Tại khách sạn, các phòng đều đi kèm với bàn làm việc. Tất cả các phòng có két an toàn.

Thành thạo tiếng Anh và tiếng Việt, đội ngũ nhân viên tại lễ tân 24/24 luôn túc trực để hỗ trợ khách.

Sân bay Liên Khương cách 111 km.",8.4,2.0
https://www.booking.com/hotel/vn/thu-thao-thanh-pho-phan-rang-thap-cham.vi.html,Khách sạn Thu Thảo,"25A Lương Ngọc Quyến, Phan Rang, Việt Nam","Khách sạn Thu Thảo nằm ở thành phố Phan Rang. Chỗ nghỉ này có lễ tân 24 giờ, sân hiên, sảnh khách chung và dịch vụ mua vé cho khách.

Phòng nghỉ tại khách sạn dành cho khách công tác kiểu Nhật này được trang bị TV truyền hình cáp màn hình phẳng, bàn làm việc và ấm đun nước. Một số phòng tại Khách sạn Thu Thảo còn có ban công và phòng tắm riêng với chậu rửa vệ sinh (bidet) cùng đồ vệ sinh cá nhân miễn phí.

Chỗ nghỉ phục vụ bữa sáng kiểu Á hàng ngày.

Đi xe đạp là hoạt động được ưa chuộng trong khu vực và chỗ nghỉ cung cấp dịch vụ cho thuê xe đạp.

Sân bay gần nhất là sân bay quốc tế Cam Ranh, cách Khách sạn Thu Thảo 62 km.",8.1,
https://www.booking.com/hotel/vn/khach-san-chau-gia.vi.html,Chau Gia Hotel,"Vĩnh Hy Vĩnh Hải, Vịnh Vĩnh Hy, Việt Nam","Tọa lạc ở Vịnh Vĩnh Hy, Chau Gia Hotel có phòng chờ chung, sân hiên, nhà hàng, cùng Wi-Fi miễn phí ở toàn bộ chỗ nghỉ. Chỗ nghỉ này cung cấp dịch vụ phòng, quầy lễ tân 24 giờ và tổ chức các tour du lịch cho khách.

Các phòng được trang bị điều hòa, TV màn hình phẳng có truyền hình vệ tinh, tủ lạnh, ấm đun nước, vòi xịt/chậu rửa vệ sinh, đồ vệ sinh cá nhân miễn phí và bàn làm việc. Ngoài phòng tắm riêng, vòi sen và máy sấy tóc, các phòng tại khách sạn đều có view núi. Tại Chau Gia Hotel, mỗi phòng đều có ga trải giường và khăn tắm.

Chỗ nghỉ cách Bãi Suối Sâu 2.8 km và Bãi Ông Thịnh 2.9 km.",7.9,
https://www.booking.com/hotel/vn/nha-nghi-ngoc-nga-thanh-pho-phan-rang-thap-cham.vi.html,Ngọc Nga Hotel,"Đường 702 Cầu Ninh Chữ, Phan Rang, Việt Nam","Tọa lạc ở Phan Rang thuộc Ninh Thuận, gần Bãi biển Ninh Chữ, Ngọc Nga Hotel cung cấp Wi-Fi miễn phí và chỗ đậu xe riêng miễn phí.

Khách sạn căn hộ có TV màn hình phẳng và phòng tắm riêng với đồ vệ sinh cá nhân miễn phí, dép đi trong phòng và vòi xịt/chậu rửa vệ sinh.

Sân bay gần nhất là Sân bay Liên Khương, cách Ngọc Nga Hotel 118 km.",6.6,3.0
https://www.booking.com/hotel/vn/khach-san-som-phu-quy-2-phan-rang.vi.html,Khách sạn Sớm Phú Quý 2 - Phan Rang,"03-09 Khu k1, Nguyễn Tri Phương, Phường Mỹ Bình, Phan Rang, Việt Nam","Khách sạn Sớm Phú Quý 2 - Phan Rang nằm ở Phan Rang và có sân hiên. Khách sạn 1 sao này có dịch vụ phòng và quầy lễ tân 24 giờ. Chỗ nghỉ có chỗ đậu xe riêng miễn phí và có cả dịch vụ đưa đón sân bay mất phí.

Khách sạn sẽ cung cấp cho khách các phòng được trang bị điều hòa có bàn làm việc, ấm đun nước, tủ lạnh, minibar, két an toàn, TV màn hình phẳng và phòng tắm riêng với vòi xịt/chậu rửa vệ sinh. Tại Khách sạn Sớm Phú Quý 2 - Phan Rang, tất cả các phòng đều có ga trải giường và khăn tắm.

Sân bay gần nhất là Sân bay Liên Khương, cách chỗ nghỉ 113 km.",8.4,1.0
