url,name,location,description,point,star
https://www.booking.com/hotel/vn/madlad-space-2.vi.html,Madlad Space 2,"292 Yên Ninh, Thôn My An, Việt Nam","Nằm ở Thôn My An thuộc Ninh Thuận, gần Bãi biển Phan Rang và Bãi biển Bình Sơn, Madlad Space 2 cung cấp Wi-Fi miễn phí và chỗ đậu xe riêng miễn phí.

Tất cả các căn có phòng tắm riêng, vòi sen, điều hòa, TV màn hình phẳng và tủ lạnh. Một số căn còn có bếp được trang bị bếp.

Khách có thể sử dụng sân hiên tại khách sạn căn hộ.

Sân bay gần nhất là Sân bay quốc tế Cam Ranh, cách Madlad Space 2 78 km.",,
https://www.booking.com/hotel/vn/farobe-homestay.vi.html,Farobe Homestay & Kite Center,"ĐT702, Mỹ Hòa, Ninh Hai 660000 Ninh Thuan Province, Ấp Mỹ Hải, Việt Nam","Farobe Homestay & Kite Center có xe đạp miễn phí, hồ bơi ngoài trời, khu vườn và sân hiên ở Ấp Mỹ Hải. Chỗ nghỉ này có các tiện nghi như nhà hàng, dịch vụ phòng và quầy lễ tân 24 giờ, cùng với Wi-Fi miễn phí ở toàn bộ chỗ nghỉ. Chỗ đậu xe riêng miễn phí có sẵn và khách sạn còn cung cấp dịch vụ thuê ô tô cho những khách muốn khám phá khu vực xung quanh.

Tất cả các phòng ở khách sạn được trang bị TV màn hình phẳng. Các phòng đều có phòng tắm riêng với vòi xịt/chậu rửa vệ sinh, đồ vệ sinh cá nhân miễn phí và máy sấy tóc. Tại Farobe Homestay & Kite Center, các phòng đều đi kèm với ga trải giường và khăn tắm.

Sân bay quốc tế Cam Ranh cách 76 km.",,
https://www.booking.com/hotel/vn/sunny-phan-rang.vi.html,Sunny Hotel,"63 Nguyen Van Troi, Phan Rang - Thap Cham, Phan Rang, Việt Nam","Nằm ở Phan Rang, Sunny Hotel cung cấp chỗ nghỉ 2 sao có sân hiên. Ngoài phòng gia đình, chỗ nghỉ này cũng cung cấp cho khách sân chơi trẻ em. Chỗ nghỉ cung cấp lễ tân 24/24, dịch vụ đưa đón sân bay, dịch vụ phòng và Wi-Fi miễn phí ở toàn bộ chỗ nghỉ.

Tại khách sạn, các phòng được thiết kế có điều hòa, khu vực ghế ngồi, TV màn hình phẳng có truyền hình vệ tinh, két an toàn, phòng tắm riêng, vòi xịt/chậu rửa vệ sinh, đồ vệ sinh cá nhân miễn phí và máy sấy tóc. Các phòng đều đi kèm với ấm đun nước, trong đó một số phòng có ban công và một số khác thì nhìn ra thành phố. Tại Sunny Hotel, tất cả các phòng có ga trải giường và khăn tắm.

Sân bay gần nhất là Sân bay Liên Khương, cách chỗ nghỉ 112 km.",6.2,2.0
https://www.booking.com/hotel/vn/qv-manor-homestay-thanh-pho-phan-rang-thap-cham.vi.html,QV Manor Hotel,"18 Nguyễn Thị Minh Khai, phường Mỹ Bình, Phan Rang, Việt Nam","Tọa lạc ở Phan Rang thuộc vùng Ninh Thuận và cách Bãi biển Bình Sơn 1.7 km, QV Manor Hotel cung cấp chỗ nghỉ có Wi-Fi miễn phí, tiện nghi BBQ, khu vườn cùng chỗ đậu xe riêng miễn phí.

Một số căn có sân hiên và/hoặc ban công nhìn ra thành phố hoặc khu vườn.

Homestay cách Bãi biển Ninh Chữ 2.9 km. Sân bay gần nhất là Sân bay Liên Khương, cách QV Manor Hotel 113 km.",9.5,
https://www.booking.com/hotel/vn/can-ho-dich-vu-hacom-binbong-hacom-apartment.vi.html,CĂN HỘ DỊCH VỤ HACOM BINBONG(HACOM APARTMENT),"66 Lê Thánh Tôn, Kinh Dinh, Việt Nam","Tọa lạc ở Kinh Dinh, CĂN HỘ DỊCH VỤ HACOM BINBONG(HACOM APARTMENT) cung cấp chỗ nghỉ có điều hòa với ban công và Wi-Fi miễn phí. Chỗ nghỉ này nhìn ra thành phố và biển.

Căn hộ có 1 phòng ngủ, bếp với tủ lạnh và bếp, TV màn hình phẳng, khu vực ghế ngồi, 1 phòng tắm được trang bị vòi sen.

Sân bay gần nhất là Sân bay Liên Khương, cách căn hộ 112 km.",,3.0
https://www.booking.com/hotel/vn/venue-travel-apple-hause-ninh-thuan.vi.html,Apple Hause Venuestay,"Apple HausBT1-6 Khu Dân Cư Phía Bắc, Nguyễn Văn Cừ, Phan Rang, Ninh Thuận, Phan Rang, Việt Nam","Apple Hause Venuestay tọa lạc ở Phan Rang và có hồ bơi ngoài trời. Chỗ nghỉ này có hồ bơi riêng, Wi-Fi miễn phí và chỗ đậu xe riêng miễn phí.

Biệt thự điều hòa này có 5 phòng ngủ riêng biệt, bếp đầy đủ tiện nghi, cùng 6 phòng tắm. Khăn tắm và ga trải giường có sẵn ở biệt thự.

Sân bay gần nhất là Sân bay Liên Khương, cách biệt thự 112 km.",,3.0
https://www.booking.com/hotel/vn/leethuyhomepr86.vi.html,LeeThuyhomePR86,"66 Lê Thánh Tôn, Kinh Dinh, Việt Nam","Tọa lạc ở Kinh Dinh, LeeThuyhomePR86 cung cấp chỗ nghỉ có Wi-Fi miễn phí và sân hiên.

Tất cả các căn đều có điều hòa, phòng tắm riêng, TV màn hình phẳng, bếp đầy đủ tiện nghi và ban công.

Sân bay gần nhất là Sân bay Liên Khương, cách căn hộ 112 km.",9.5,
https://www.booking.com/hotel/vn/can-ho-homestay-ninh-thuan-heri24h.vi.html,Căn Hộ Homestay Ninh Thuận-Heri24h,"Đông Hồ - Phường Thanh Sơn - TP.PRTC 09, Kinh Dinh, Việt Nam","Căn Hộ Homestay Ninh Thuận-Heri24h tọa lạc ở Kinh Dinh, cung cấp chỗ nghỉ có điều hòa, Wi-Fi miễn phí, cũng như sân chơi trẻ em.

Căn hộ có sân hiên nơi khách có thể nhìn ra thành phố, khu vực ghế ngồi, TV màn hình phẳng truyền hình cáp, bếp đầy đủ tiện nghi gồm tủ lạnh và bếp, cùng phòng tắm riêng được trang bị vòi xịt/chậu rửa vệ sinh và đồ vệ sinh cá nhân miễn phí. Tất cả các căn đều được thiết kế có ban công nhìn ra khu vườn.

Sân bay gần nhất là Sân bay Liên Khương, cách Căn Hộ Homestay Ninh Thuận-Heri24h 112 km.",9.4,3.0
https://www.booking.com/hotel/vn/annhien-homes.vi.html,Annhien home's,"Thống Nhất, Ấp Long Thạnh, Việt Nam","Nằm ở Ấp Long Thạnh, Annhien home's cung cấp chỗ nghỉ có Wi-Fi miễn phí, điều hòa và khu vườn với sân hiên.

Nơi đây còn có phòng tắm riêng với vòi xịt/chậu rửa vệ sinh ở tất cả các căn, cùng đồ vệ sinh cá nhân miễn phí, máy sấy tóc và dép đi trong phòng.

Khách tại nhà nghỉ B&B có thể thưởng thức bữa sáng thực đơn à la carte.

Sân bay gần nhất là Sân bay quốc tế Cam Ranh, cách Annhien home's 78 km.",4,
https://www.booking.com/hotel/vn/villa-park.vi.html,VILLA PARK,"Đặng Chí Thanh, phường Thanh Sơn, Kinh Dinh, Việt Nam","Với khu vườn, phòng chờ chung, cùng sân hiên, VILLA PARK cung cấp chỗ nghỉ ở Kinh Dinh có Wi-Fi miễn phí và nhìn ra thành phố. Biệt thự cung cấp chỗ đậu xe riêng miễn phí và bếp chung.

Biệt thự điều hòa này có 6 phòng ngủ, phòng khách, bếp đầy đủ tiện nghi với tủ lạnh và ấm đun nước, 6 phòng tắm với vòi xịt/chậu rửa vệ sinh và vòi sen. Khăn tắm và ga trải giường có sẵn ở biệt thự.

Biệt thự có phòng xông hơi khô.

Sân bay gần nhất là Sân bay Liên Khương, cách VILLA PARK 112 km.",10,
https://www.booking.com/hotel/vn/hanh-ngo-homestay.vi.html,Hành Ngò Homestay - Hòn Đỏ Ninh Thuận,"Thôn Mỹ Hiệp, Xã Thanh Hải, Huyện Ninh Hải, Thôn Dư Khánh, Việt Nam","Tọa lạc ở Thôn Dư Khánh, Hành Ngò Homestay - Hòn Đỏ Ninh Thuận cung cấp chỗ nghỉ có Wi-Fi miễn phí, điều hòa và khu vườn với sân hiên phơi nắng.

Nơi đây còn có phòng tắm riêng với vòi xịt/chậu rửa vệ sinh ở tất cả các căn, cùng đồ vệ sinh cá nhân miễn phí, máy sấy tóc và dép đi trong phòng.

Homestay có BBQ.

Sân bay gần nhất là Sân bay Liên Khương, cách Hành Ngò Homestay - Hòn Đỏ Ninh Thuận 128 km.",8.6,
https://www.booking.com/hotel/vn/lang-cuu-farmstay-phan-rang-thap-cham1.vi.html,Làng Cừu Farmstay,"Mũi Dinh, Thuan Nam distict, Ninh Thuan Province, Thôn Sơn Hải, Việt Nam","Nhìn ra núi, Làng Cừu Farmstay ở Thôn Sơn Hải cung cấp chỗ nghỉ có khu vườn và nhà hàng.

Nơi đây còn có phòng tắm chung với vòi xịt/chậu rửa vệ sinh ở tất cả các căn, cùng đồ vệ sinh cá nhân miễn phí, máy sấy tóc và dép đi trong phòng.

Lodge có phục vụ bữa sáng thực đơn à la carte mỗi sáng.

Sân bay gần nhất là Sân bay quốc tế Cam Ranh, cách Làng Cừu Farmstay 95 km.",,
https://www.booking.com/hotel/vn/su-home-phan-rang-thap-cham.vi.html,Su Home,"C12a _04 , Chung cư Phú Thịnh, Mỹ Hải, Mỹ Bình, Phan Rang Tháp Chàm, Ninh Thuận, Thôn Mỹ Phước, Việt Nam","Su Home nằm ở Thôn Mỹ Phước, chỉ cách Bãi biển Phan Rang 16 phút đi bộ và Bãi biển Bình Sơn 1.7 km. Khách lưu trú tại căn hộ này có thể sử dụng Wi-Fi miễn phí và bếp đầy đủ tiện nghi.

Căn hộ có 2 phòng ngủ này cung cấp cho khách TV màn hình phẳng, điều hòa và phòng khách.

Sân bay gần nhất là Sân bay quốc tế Cam Ranh, cách căn hộ 76 km.",9,
https://www.booking.com/hotel/vn/vinh-hy-glamping.vi.html,Vĩnh Hy Glamping,"Vĩnh Hy, Vĩnh Hải, Ninh Hải, Ninh Thuận Thôn Cầu Gãy, Ninh Hải, Việt Nam","Vĩnh Hy Glamping tọa lạc ở Ninh Hải và có sân hiên. Chỗ nghỉ này có khu vườn, khu vực bãi biển riêng và phòng chờ chung, đồng thời nằm giáp biển.

Khăn tắm và ga trải giường có sẵn ở lều trại sang trọng.

Đội ngũ nhân viên của lều trại sang trọng luôn túc trực tại lễ tân 24/24 để cung cấp đề xuất cho du khách.

Sân bay quốc tế Cam Ranh cách 68 km, đồng thời chỗ nghỉ có cung cấp dịch vụ đưa đón sân bay mất phí.",9.6,
https://www.booking.com/hotel/vn/apartment-2br-city-center-phan-rang.vi.html,Apartment 2BR city center Phan Rang,"66 Lê Thánh Tôn, Kinh Dinh, Việt Nam","Apartment 2BR city center Phan Rang có ban công và tọa lạc ở Kinh Dinh, Ninh Thuận. Căn hộ cung cấp sân hiên và Wi-Fi miễn phí.

Căn hộ điều hòa này có 2 phòng ngủ riêng biệt, phòng khách, bếp đầy đủ tiện nghi, cùng 1 phòng tắm. TV màn hình phẳng được cung cấp.

Sân bay quốc tế Cam Ranh cách 73 km.",,
https://www.booking.com/hotel/vn/nybipu-homestay.vi.html,Nybipu Homestay,"Đường 702, Phan Rang, Việt Nam","Cách Bãi biển Ninh Chữ 2.9 km, Nybipu Homestay có sân hiên, điều hòa, ban công và Wi-Fi miễn phí.

Nơi đây còn có phòng tắm riêng với vòi xịt/chậu rửa vệ sinh ở tất cả các căn, cùng đồ vệ sinh cá nhân miễn phí, máy sấy tóc và dép đi trong phòng.

Sân bay gần nhất là Sân bay Liên Khương, cách homestay 119 km.",7.7,
https://www.booking.com/hotel/vn/heri24h-apartment-homestay-ninh-thuan-can-ho-phan-rang.vi.html,heri24h-Apartment Homestay Ninh Thuận - Căn Hộ Phan Rang,"Đông Hồ - Phường Thanh Sơn, Kinh Dinh, Việt Nam","Heri24h-Apartment Homestay Ninh Thuận - Căn Hộ Phan Rang tọa lạc ở Kinh Dinh, cung cấp chỗ nghỉ có điều hòa, Wi-Fi miễn phí, cũng như sân hiên phơi nắng.

Mỗi căn được thiết kế gồm bếp đầy đủ tiện nghi với bàn ăn, TV màn hình phẳng có truyền hình cáp, cùng phòng tắm riêng có vòi xịt/chậu rửa vệ sinh, đồ vệ sinh cá nhân miễn phí và máy sấy tóc. Một số căn có ban công và/hoặc sân trong nhìn ra thành phố.

Khách có thể tìm thấy sân chơi trẻ em tại căn hộ, cùng phòng chờ chung.

Sân bay gần nhất là Sân bay quốc tế Cam Ranh, cách heri24h-Apartment Homestay Ninh Thuận - Căn Hộ Phan Rang 73 km, đồng thời chỗ nghỉ này cũng cung cấp dịch vụ đưa đón sân bay mất phí.",,
https://www.booking.com/hotel/vn/nha-nghi-777-phan-rang-thap-cham.vi.html,Nhà Nghỉ 777,"Vịnh Vĩnh Hy, Vĩnh Hải, Ninh Hải, Ninh Thuận, Vịnh Vĩnh Hy, Việt Nam","Nhà Nghỉ 777 cung cấp các phòng điều hòa ở Vịnh Vĩnh Hy.

Tại guest house, các phòng đều có ban công. Với phòng tắm riêng được trang bị vòi sen và đồ vệ sinh cá nhân miễn phí, các phòng tại Nhà Nghỉ 777 cũng có Wi-Fi miễn phí, trong đó một số phòng có view núi. Tại chỗ nghỉ, mỗi phòng đều được thiết kế có ga trải giường và khăn tắm.

Nhà Nghỉ 777 có sân hiên.

Sân bay quốc tế Cam Ranh cách 68 km.",10,
https://www.booking.com/hotel/vn/ruhigen-legend-villa-vesta-collections.vi.html,Ruhigen Legend Villa Vesta Collections,"H22J+8HQ, Đông Hải, Phan Rang-Tháp Chàm, Ninh Thuận, Phan Rang, Việt Nam","Ruhigen Legend Villa Vesta Collections nằm ở Phan Rang và có bồn tắm spa. Chỗ nghỉ giáp biển này có Wi-Fi miễn phí và chỗ đậu xe riêng miễn phí.

Nhà nghỉ dưỡng có 2 phòng ngủ này cung cấp cho khách TV, điều hòa và phòng khách. Bếp có tủ lạnh.

Nhà nghỉ dưỡng cách Bãi biển Phan Rang chỉ vài bước chân và Bãi biển Bình Sơn 2.5 km.",8.4,4.0
https://www.booking.com/hotel/vn/an-nhien-aparment.vi.html,An Nhiên Aparment,"Lê Thánh Tôn, Kinh Dinh, Việt Nam","An Nhiên Aparment nằm ở Kinh Dinh. Khách lưu trú tại căn hộ này có thể sử dụng Wi-Fi miễn phí, bếp đầy đủ tiện nghi, cùng ban công.

Căn hộ có 2 phòng ngủ này cung cấp cho khách TV màn hình phẳng, điều hòa và phòng khách.

Sân bay gần nhất là Sân bay quốc tế Cam Ranh, cách căn hộ 73 km.",,
https://www.booking.com/hotel/vn/nha-nghi-motel-thuy-linh-phan-rang-thap-cham.vi.html,Nhà Nghỉ MoTel Thúy Linh,"Mỹ Hòa Vĩnh Hải Ninh Hải Ninh Thuận, Ấp Mỹ Hải, Việt Nam","Nhà Nghỉ MoTel Thúy Linh tọa lạc ở Ấp Mỹ Hải. Biệt thự đồng quê có khu vườn và chỗ đậu xe riêng miễn phí.

Khăn tắm và ga trải giường có sẵn ở biệt thự đồng quê.

Sân bay gần nhất là Sân bay Liên Khương, cách biệt thự đồng quê 131 km.",4.7,
https://www.booking.com/hotel/vn/an-nhien-apartment-thanh-pho-phan-rang-thap-cham.vi.html,An Nhiên Apartment,"66 Lê Thánh Tôn, Kinh Dinh, Việt Nam","Nằm ở Kinh Dinh thuộc Ninh Thuận, An Nhiên Apartment cung cấp Wi-Fi miễn phí và chỗ đậu xe riêng miễn phí.

Tất cả các căn đều có điều hòa, phòng tắm riêng, TV màn hình phẳng, bếp đầy đủ tiện nghi và sân hiên.

Khách cũng có thể thư giãn trong khu vườn.

Sân bay gần nhất là Sân bay quốc tế Cam Ranh, cách căn hộ 73 km.",8,
https://www.booking.com/hotel/vn/apartment-2br-phu-thinh-plaza.vi.html,Apartment 2BR Phú Thịnh Plaza,"Chung cư phú Thịnh plaza, phan văn Lân, P.Mỹ Bình, TP.Phan Rang, Ninh Thuận, Thôn Mỹ Phước, Việt Nam","Nhìn ra hồ, Apartment 2BR Phú Thịnh Plaza cung cấp chỗ nghỉ có ban công, cách Bãi biển Phan Rang khoảng 16 phút đi bộ. Nhìn ra thành phố và núi, căn hộ này cũng cung cấp Wi-Fi miễn phí.

Căn hộ điều hòa này có 2 phòng ngủ, phòng khách, bếp đầy đủ tiện nghi với tủ lạnh và ấm đun nước, 2 phòng tắm với vòi xịt/chậu rửa vệ sinh và vòi sen. Khăn tắm và ga trải giường có sẵn ở căn hộ.

Đội ngũ nhân viên lễ tân giao tiếp thành thạo bằng tiếng Anh và tiếng Việt.

Căn hộ có dịch vụ cho thuê ô tô.

Apartment 2BR Phú Thịnh Plaza cách Bãi biển Bình Sơn 1.7 km. Sân bay gần nhất là Sân bay quốc tế Cam Ranh, cách chỗ nghỉ 76 km, đồng thời chỗ nghỉ có cung cấp dịch vụ đưa đón sân bay mất phí.",,
https://www.booking.com/hotel/vn/anhouses-homestay-in-phan-rang.vi.html,Anhouse’s homestay in Phan Rang,"Nguyá»n Huy TÆ°á»ng, Kinh Dinh, Việt Nam","Anhouse’s homestay in Phan Rang là chỗ nghỉ tọa lạc ở Kinh Dinh và có ban công. Chỗ nghỉ nhìn ra thành phố, có khu vườn, sân hiên và Wi-Fi miễn phí ở toàn bộ chỗ nghỉ.

Căn hộ điều hòa này có 2 phòng ngủ, phòng khách, bếp đầy đủ tiện nghi với tủ lạnh, cùng 1 phòng tắm với vòi sen và đồ vệ sinh cá nhân miễn phí. Căn hộ có chỗ đậu xe riêng miễn phí.

Sân bay gần nhất là Sân bay quốc tế Cam Ranh, cách Anhouse’s homestay in Phan Rang 73 km.",9,
https://www.booking.com/hotel/vn/apartment-homestay-phan-rang-heri24h-1-6per.vi.html,Apartment Homestay Phan Rang - heri24h (1-6per),"Dong Ho - P. Thanh Son - TP.Phan Rang Thap Cham Ninh Thuan 12, Kinh Dinh, Việt Nam","Tọa lạc ở Kinh Dinh, Apartment Homestay Phan Rang - heri24h (1-6per) cung cấp chỗ nghỉ có điều hòa với sân trong và Wi-Fi miễn phí. Căn hộ này có khu vườn.

Có ban công nhìn ra thành phố, căn hộ có 1 phòng ngủ, phòng khách, TV màn hình phẳng truyền hình cáp, bếp đầy đủ tiện nghi, 1 phòng tắm với vòi xịt/chậu rửa vệ sinh và vòi sen. Khăn tắm và ga trải giường có sẵn ở căn hộ.

Sân bay gần nhất là Sân bay Liên Khương, cách căn hộ 112 km.",9.3,3.0
https://www.booking.com/hotel/vn/ans-house-in-phan-rang.vi.html,An's House In Phan Rang,"Đường Trần Nhân Tông, Kinh Dinh, Việt Nam","An's House In Phan Rang tọa lạc ở Kinh Dinh. Chỗ nghỉ này có ban công và chỗ đậu xe riêng miễn phí.

Có sân hiên nhìn ra thành phố, căn hộ có 2 phòng ngủ, phòng khách, TV màn hình phẳng, bếp đầy đủ tiện nghi, 1 phòng tắm với vòi xịt/chậu rửa vệ sinh và vòi sen.

Căn hộ có dịch vụ cho thuê ô tô.

Sân bay gần nhất là Sân bay Liên Khương, cách An's House In Phan Rang 112 km.",8.5,
https://www.booking.com/hotel/vn/nha-nghi-777-ninh-thuan.vi.html,nhà nghỉ 777,"vịnh vĩnh hy xã vĩnh hải huyện ninh hải tỉnh ninh thuận nhà nghỉ 777, Thôn Bảo An, Việt Nam","Tọa lạc ở Thôn Bảo An, nhà nghỉ 777 cung cấp chỗ nghỉ có Wi-Fi miễn phí và sân hiên.

Nơi đây còn có phòng tắm riêng với vòi sen ở tất cả các căn, cùng đồ vệ sinh cá nhân miễn phí, máy sấy tóc và dép đi trong phòng.

Sân bay quốc tế Cam Ranh cách 68 km.",,
https://www.booking.com/hotel/vn/kin-homestay.vi.html,KIN Homestay,"54 Đàm Quang Trung, Kinh Dinh, Việt Nam","KIN Homestay có ban công và nằm ở Kinh Dinh, Ninh Thuận. Căn hộ cung cấp sân hiên và Wi-Fi miễn phí.

Căn hộ có 5 phòng ngủ này cung cấp cho khách TV màn hình phẳng, điều hòa và phòng khách. Chỗ nghỉ này được trang bị bếp.

Sân bay gần nhất là Sân bay quốc tế Cam Ranh, cách căn hộ 73 km.",,
https://www.booking.com/hotel/vn/soc-apartment.vi.html,Sóc Apartment,"Phường Mỹ Bình, Thành Phố Phan Rang - Tháp Chàm, Thôn Mỹ Phước, Việt Nam","Nằm cách Bãi biển Phan Rang 15 phút đi bộ và Bãi biển Bình Sơn 1.5 km, Sóc Apartment cung cấp Wi-Fi miễn phí và khu vườn.

Căn hộ này có 2 phòng ngủ riêng biệt, 2 phòng tắm và phòng khách.

Sân bay gần nhất là Sân bay Liên Khương, cách căn hộ 114 km.",10,
https://www.booking.com/hotel/vn/xu-bien-home-can-ho-huong-bien.vi.html,Xứ Biển Home - Căn hộ hướng biển,"66 Lê Thánh Tôn B1.914, Kinh Dinh, Việt Nam","Nằm ở Kinh Dinh, Xứ Biển Home - Căn hộ hướng biển cung cấp chỗ nghỉ có ban công và Wi-Fi miễn phí.

Căn hộ điều hòa này có 2 phòng ngủ riêng biệt, phòng khách, bếp đầy đủ tiện nghi, cùng 1 phòng tắm. TV màn hình phẳng được cung cấp.

Sân bay quốc tế Cam Ranh cách 73 km.",,3.0
https://www.booking.com/hotel/vn/nagi-cottage.vi.html,Nagi cottage,"31 Hải Thượng Lãn Ông, Kinh Dinh, Việt Nam","Nagi cottage có khu vườn và nằm ở Kinh Dinh, Ninh Thuận. Nhà nghỉ dưỡng cung cấp chỗ đậu xe riêng miễn phí, bếp chung và Wi-Fi miễn phí.

Nhà nghỉ dưỡng điều hòa này có 3 phòng ngủ, phòng khách, bếp đầy đủ tiện nghi với tủ lạnh và ấm đun nước, 3 phòng tắm với vòi xịt/chậu rửa vệ sinh và vòi sen. Khăn tắm và ga trải giường có sẵn ở nhà nghỉ dưỡng.

Nhà nghỉ dưỡng có dịch vụ cho thuê ô tô.

Sân bay gần nhất là Sân bay quốc tế Cam Ranh, cách Nagi cottage 74 km.",10,
https://www.booking.com/hotel/vn/ca-heo-camping.vi.html,Cá heo camping,"Đường 702 Thôn mỹ hòa,xã vĩnh hải,huyện ninh hải,tỉnh ninh thuận, Ấp Mỹ Hải, Việt Nam","Cá heo camping nằm ở Ấp Mỹ Hải. Khách có thể dùng Wi-Fi miễn phí ở toàn bộ chỗ nghỉ.

Khách tại lều trại sang trọng có thể thưởng thức bữa sáng thực đơn buffet.",,
https://www.booking.com/hotel/vn/the-sixsen-villa-binh-hung-venue-travel.vi.html,The Sixsen Villa Đảo Bình Hưng Venuestay,"Cam Lập, Cam Ranh, Khánh Hòa, Thôn Bình Hưng, Việt Nam","Nằm ở Thôn Bình Hưng thuộc Ninh Thuận, gần Bãi Đá Trứng và Bãi biển Lighthouse, The Sixsen Villa Đảo Bình Hưng Venuestay cung cấp Wi-Fi miễn phí và chỗ đậu xe riêng miễn phí.

Homestay cách Bãi Kinh chỉ vài bước chân. Sân bay gần nhất là Sân bay Liên Khương, cách The Sixsen Villa Đảo Bình Hưng Venuestay 153 km.",,
https://www.booking.com/hotel/vn/an-nhien-apartment-thanh-pho-phan-rang-thap-cham-tinh-ninh-thuan.vi.html,An Nhiên Apartment,"Chung cư Hacom , đường Đông Hồ , Phường Thanh Sơn, Kinh Dinh, Việt Nam","An Nhiên Apartment có ban công và nằm ở Kinh Dinh, Ninh Thuận. Căn hộ cung cấp khu vườn và Wi-Fi miễn phí.

Căn hộ điều hòa này có 1 phòng ngủ riêng biệt, phòng khách, bếp đầy đủ tiện nghi, cùng 1 phòng tắm. TV màn hình phẳng được cung cấp.

Sân bay gần nhất là Sân bay quốc tế Cam Ranh, cách căn hộ 73 km.",,
https://www.booking.com/hotel/vn/my-hoa-oceanfront-home.vi.html,My Hoa Oceanfront Home,"My Hoa, Vinh Hai, Ninh Hai, Ấp Mỹ Hải, Việt Nam","My Hoa Oceanfront Home nằm ở Ấp Mỹ Hải. Chỗ nghỉ nhìn ra biển, có khu vườn và Wi-Fi miễn phí ở toàn bộ chỗ nghỉ.

Nhà nghỉ dưỡng này có 2 phòng ngủ riêng biệt, phòng khách, bếp nhỏ đầy đủ tiện nghi với tủ lạnh, lò nướng, cùng 3 phòng tắm.

Sân bay Liên Khương cách 132 km.","9,0",4.0
https://www.booking.com/hotel/vn/chung-cu-phu-thinh-p-my-binh-tp-phan-rang-thap-cha-thanh-pho-phan-rang-thap-cham.vi.html,"Chung cư Phú Thịnh, P Mỹ Bình, tp phan rang tháp chàm, tỉnh Ninh Thuận","Chung cư Phú Thịnh, P Mỹ Bình, tp phan rang tháp chàm, tỉnh Ninh Thuận Tầng 6, Thôn Mỹ Phước, Việt Nam","Nằm ở Thôn Mỹ Phước, cách Bãi biển Phan Rang 16 phút đi bộ và Bãi biển Bình Sơn 1.7 km, Chung cư Phú Thịnh, P Mỹ Bình, tp phan rang tháp chàm, tỉnh Ninh Thuận cung cấp chỗ nghỉ có Wi-Fi miễn phí và khu vườn.

Tất cả các căn đều có điều hòa, phòng tắm riêng, TV màn hình phẳng và bếp nhỏ đầy đủ tiện nghi.

Sân bay gần nhất là Sân bay quốc tế Cam Ranh, cách căn hộ 76 km.",8,
https://www.booking.com/hotel/vn/guesthouse-room-with-kitchenette-amp-ensuite-bathroom.vi.html,Kite Studio - Mỹ Hòa Lagoon,"Hoàng Sáng Guest House, Mỹ Hòa, Ninh Hải, Ninh Thuận, Ấp Mỹ Hải, Việt Nam","Kite Studio - Mỹ Hòa Lagoon tọa lạc ở Ấp Mỹ Hải. Guest house còn cung cấp Wi-Fi miễn phí và chỗ đậu xe riêng miễn phí.

Tại guest house, tất cả các phòng đều được thiết kế có tủ quần áo. Tại Kite Studio - Mỹ Hòa Lagoon, phòng nào cũng có điều hòa và phòng tắm riêng.

Sân bay gần nhất là Sân bay quốc tế Cam Ranh, cách chỗ nghỉ 76 km.",,
https://www.booking.com/hotel/vn/hai-an-homestay.vi.html,Hải An Homestay,"Yên Ninh, Thôn My An, Việt Nam","Nằm chỉ cách Bãi biển Phan Rang 8 phút đi bộ, Hải An Homestay cung cấp chỗ nghỉ ở Thôn My An với khu vườn, tiện nghi BBQ, cũng như dịch vụ phòng. Lodge cung cấp chỗ đậu xe riêng miễn phí và bếp chung.

Lodge điều hòa này có khu vực ăn uống, bếp với tủ lạnh và TV màn hình phẳng. Khăn tắm và ga trải giường có sẵn ở lodge.

Thành thạo tiếng Anh và tiếng Việt, đội ngũ nhân viên tại lễ tân 24/24 luôn túc trực để hỗ trợ khách.

Khách có thể sử dụng sân hiên phơi nắng tại lodge.

Hải An Homestay cách Bãi biển Bình Sơn 16 phút đi bộ. Sân bay quốc tế Cam Ranh cách 78 km.",,
