url,name,location,description,point,star
https://www.booking.com/hotel/vn/queen-luxury-phan-rang-thap-cham1.vi.html,Queen Luxury Hotel,"Nguyễn Tri Phương, Kinh Dinh, Việt Nam","Queen Luxury Hotel có khu vườn, sân hiên, nhà hàng và quầy bar ở Kinh Dinh. Chỗ nghỉ này cung cấp dịch vụ phòng và quầy lễ tân 24 giờ cho khách.

Các phòng được trang bị điều hòa, TV màn hình phẳng có truyền hình cáp, tủ lạnh, ấm đun nước, vòi xịt/chậu rửa vệ sinh, đồ vệ sinh cá nhân miễn phí và bàn làm việc. Ngoài phòng tắm riêng với vòi sen và máy sấy tóc, các phòng tại khách sạn cũng có Wi-Fi miễn phí, trong đó một số phòng có view hồ. Tại Queen Luxury Hotel, mỗi phòng đều có ga trải giường và khăn tắm.

Sân bay quốc tế Cam Ranh cách 74 km.",10,
https://www.booking.com/hotel/vn/hai-dang-mui-dinh-ca-na.vi.html,Mũi Dinh Hotel,"Quốc lộ 1A, Lạc Sơn 1, Cà Ná, Thuận Nam, Ninh Thuận, Phan Rang, Việt Nam","Nằm giáp biển, Mũi Dinh Hotel cung cấp chỗ nghỉ 2 sao ở Phan Rang, đồng thời có khu vực bãi biển riêng, phòng chờ chung và sân hiên. Chỗ nghỉ cung cấp lễ tân 24/24, dịch vụ đưa đón sân bay, dịch vụ phòng và Wi-Fi miễn phí.

Tại khách sạn, tất cả các phòng đều được thiết kế có tủ quần áo. Với phòng tắm riêng được trang bị vòi sen và đồ vệ sinh cá nhân miễn phí, một số căn tại Mũi Dinh Hotel cũng có view biển. Tại chỗ nghỉ, phòng nào cũng có ga trải giường và khăn tắm.

Tại Mũi Dinh Hotel, khách sẽ tìm thấy nhà hàng phục vụ ẩm thực Việt và Á. Bên cạnh đó, họ có thể yêu cầu món chay.

Sân bay Liên Khương cách 137 km.",7.4,2.0
https://www.booking.com/hotel/vn/phi-kite-school.vi.html,Phi Kite School,"Vĩnh Hải, Ninh Hải District, Ninh Thuan Province, Phan Rang, Việt Nam","Nằm giáp biển, Phi Kite School cung cấp chỗ nghỉ 3 sao ở Phan Rang, đồng thời có khu vườn, khu vực bãi biển riêng và sân hiên. Chỗ nghỉ này có các tiện nghi như nhà hàng và quầy bar. Chỗ nghỉ cung cấp lễ tân 24/24, dịch vụ đưa đón sân bay, dịch vụ phòng và Wi-Fi miễn phí ở toàn bộ chỗ nghỉ.

Tại khách sạn, mỗi phòng đều có ban công. Với phòng tắm riêng được trang bị vòi xịt/chậu rửa vệ sinh và máy sấy tóc, một số phòng tại Phi Kite School cũng có view biển. Tại chỗ nghỉ, tất cả các phòng có ga trải giường và khăn tắm.

Phi Kite School có sân chơi trẻ em. Khách tại khách sạn sẽ có thể tận hưởng các hoạt động ở trong Phan Rang và khu vực xung quanh, như leo núi và lướt ván buồm.

Sân bay Liên Khương cách 131 km.",8.6,3.0
https://www.booking.com/hotel/vn/vietnam-surf-camping.vi.html,Vietnam Surf Camp,"Duong 702 thon My Hoa/ Xa Vinh Hai, Ấp Mỹ Hải, Việt Nam","Vietnam Surf Camp nằm ở Ấp Mỹ Hải, nhìn ra biển và có Wi-Fi miễn phí cùng chỗ đậu xe riêng miễn phí.

Khách cũng có thể thư giãn trong khu vườn.

Sân bay gần nhất là Sân bay Liên Khương, cách khu cắm trại 132 km.",8.3,
https://www.booking.com/hotel/vn/homestay-khach-san-ninh-thuan.vi.html,HOMESTAY KHÁCH SẠN NINH THUẬN,"Chung cư Phú Thịnh plaza, Phan Văn Lân, p. Mỹ Bình, Thôn Mỹ Phước, Việt Nam","Với ban công nhìn ra thành phố, khu vực bãi biển riêng và phòng chờ chung, HOMESTAY KHÁCH SẠN NINH THUẬN nằm ở Thôn Mỹ Phước, gần Bãi biển Phan Rang và cách Bãi biển Bình Sơn 1.6 km. Chỗ nghỉ nhìn ra khu vườn và có Wi-Fi miễn phí ở toàn bộ chỗ nghỉ.

Căn hộ điều hòa này có 2 phòng ngủ, phòng khách, bếp đầy đủ tiện nghi với tủ lạnh và ấm đun nước, 2 phòng tắm với vòi xịt/chậu rửa vệ sinh và vòi sen. Khăn tắm và ga trải giường có sẵn ở căn hộ.

Căn hộ có dịch vụ cho thuê ô tô.

Sân bay Liên Khương cách 114 km, đồng thời chỗ nghỉ có cung cấp dịch vụ đưa đón sân bay mất phí.",7.3,3.0
https://www.booking.com/hotel/vn/can-ho-tai-thanh-pho-bien-phan-rang-thap-cham.vi.html,"Tom's House Phan Rang - 2BR, Park view, 3km from beach","66 Lê Thánh Tôn, Phan Rang, Việt Nam","Với khu vườn, phòng chờ chung, cùng sân hiên, Tom's House Phan Rang - 2BR, Park view, 3km from beach cung cấp chỗ nghỉ ở Phan Rang có Wi-Fi miễn phí và nhìn ra thành phố. Chỗ nghỉ này cung cấp ban công và nhìn ra khu vườn.

Căn hộ điều hòa này có 2 phòng ngủ, phòng khách, bếp đầy đủ tiện nghi với tủ lạnh và ấm đun nước, 1 phòng tắm với vòi xịt/chậu rửa vệ sinh và vòi sen. Khăn tắm và ga trải giường có sẵn ở căn hộ.

Thành thạo tiếng Anh và tiếng Việt, đội ngũ nhân viên tại lễ tân 24/24 luôn sẵn lòng đưa ra đề xuất hữu ích về khu vực xung quanh.

Căn hộ có sân chơi trẻ em. Du khách có thể đi xe đạp trong khu vực, đồng thời Tom's House Phan Rang - 2BR, Park view, 3km from beach cũng có khu vực bãi biển riêng.

Sân bay gần nhất là Sân bay Liên Khương, cách chỗ nghỉ 112 km, đồng thời chỗ nghỉ này cũng cung cấp dịch vụ đưa đón sân bay mất phí.",9.2,3.0
https://www.booking.com/hotel/vn/khach-san-thai-bao-thanh-pho-phan-rang-thap-cham.vi.html,Khách sạn thái bảo,"Căn 15 lô nhà liền kề N2 đường 16 tháng 4 khu phố 4 phường Mỹ Hải, Thôn Mỹ Phước, Việt Nam","Tọa lạc ở Thôn Mỹ Phước, Khách sạn thái bảo cách Bãi biển Bình Sơn 14 phút đi bộ. Chỗ nghỉ này có các tiện nghi như dịch vụ phòng và quầy lễ tân 24 giờ, cùng với Wi-Fi miễn phí ở toàn bộ chỗ nghỉ. Đây là chỗ nghỉ không hút thuốc và nằm cách Bãi biển Phan Rang 12 phút đi bộ.

Sân bay gần nhất là Sân bay quốc tế Cam Ranh, cách khách sạn 76 km.",7.2,
https://www.booking.com/hotel/vn/khach-san-mong-an.vi.html,Khách sạn Mộng An,"Vĩnh Hy Vĩnh Hy,  Vĩnh Hải,  Ninh Hải, Vịnh Vĩnh Hy, Việt Nam","Khách sạn Mộng An nằm ở Vịnh Vĩnh Hy và có khu vườn. Tại đây có sân hiên và khách có thể sử dụng Wi-Fi miễn phí và chỗ đậu xe riêng miễn phí.

Khách tại khách sạn sẽ có thể tận hưởng các hoạt động ở trong Vịnh Vĩnh Hy và khu vực xung quanh, như leo núi.

Đội ngũ nhân viên lễ tân 24/24 giao tiếp thành thạo bằng tiếng Anh và tiếng Việt.

Sân bay gần nhất là Sân bay Liên Khương, cách Khách sạn Mộng An 148 km.",8.3,
https://www.booking.com/hotel/vn/ngoc-quy-2.vi.html,Ngọc Quý 2 Hotel,"2 Nguyễn Công Hoan, Khu K1, Mỹ Bình, Phan Rang - Tháp Chàm, Phan Rang, Việt Nam","Ngọc Quý 2 Hotel cung cấp các phòng điều hòa ở Phan Rang. Khách sạn có phòng gia đình.

Tại khách sạn, các phòng đều có tủ quần áo. Với phòng tắm riêng được trang bị vòi xịt/chậu rửa vệ sinh và đồ vệ sinh cá nhân miễn phí, các phòng tại Ngọc Quý 2 Hotel cũng có Wi-Fi miễn phí, trong đó một số phòng có ban công. Tại chỗ nghỉ, tất cả các phòng đều được thiết kế có ga trải giường và khăn tắm.

Đội ngũ nhân viên lễ tân giao tiếp thành thạo bằng tiếng Anh và tiếng Việt, ngoài ra khách có thể yêu cầu thông tin về khu vực xung quanh khi có nhu cầu.

Sân bay gần nhất là Sân bay quốc tế Cam Ranh, cách Ngọc Quý 2 Hotel 74 km.",8.4,
https://www.booking.com/hotel/vn/khach-san-anh-dong-thanh-pho-phan-rang-thap-cham.vi.html,Khách sạn Ánh Đông,"Lô02-03-04-05 Nguyễn Tri Phương, P.mỹ Bình, Phan Rang, Việt Nam","Khách sạn Ánh Đông có khu vườn, khu vực bãi biển riêng, phòng chờ chung và sân hiên ở Phan Rang. Ngoài dịch vụ tiền sảnh, chỗ nghỉ này còn có nhà hàng để phục vụ du khách. Chỗ nghỉ cung cấp lễ tân 24/24, dịch vụ đưa đón sân bay, dịch vụ phòng và Wi-Fi miễn phí ở toàn bộ chỗ nghỉ.

Các căn đi kèm điều hòa, TV màn hình phẳng có truyền hình vệ tinh, tủ lạnh, ấm đun nước, vòi xịt/chậu rửa vệ sinh, đồ vệ sinh cá nhân miễn phí và bàn làm việc. Các phòng được thiết kế có phòng tắm riêng với vòi sen, trong đó một số phòng có ban công và một số phòng khác cũng nhìn ra thành phố. Tại khách sạn, tất cả các phòng đều có ga trải giường và khăn tắm.

Sân bay Liên Khương cách 113 km.",8.1,
https://www.booking.com/hotel/vn/gamuda-villa-phan-rang-thap-cham.vi.html,Gamuda Villa,"Số 5, Đường Võ Trứ, Phường Mỹ Bình, Phan Rang - Tháp Chàm, Ninh Thuận, Việt Nam, Thôn Mỹ Phước, Việt Nam","Với khu vườn, phòng chờ chung, cùng sân hiên, Gamuda Villa cung cấp chỗ nghỉ ở Thôn Mỹ Phước có Wi-Fi miễn phí và nhìn ra biển. Căn hộ cung cấp chỗ đậu xe riêng miễn phí và bếp chung.

Có ban công nhìn ra thành phố, căn hộ có 3 phòng ngủ, phòng khách, TV màn hình phẳng truyền hình cáp, bếp đầy đủ tiện nghi, 3 phòng tắm với vòi xịt/chậu rửa vệ sinh và vòi sen. Để thuận tiện hơn cho khách, chỗ nghỉ có thể cung cấp khăn tắm và khăn trải giường với khoản phụ phí.

Căn hộ có sẵn dịch vụ cho thuê xe đạp và khu vực bãi biển riêng.

Gamuda Villa cách Bãi biển Phan Rang 1.8 km và Bãi biển Bình Sơn 2.1 km. Sân bay gần nhất là Sân bay Liên Khương, cách chỗ nghỉ 114 km, đồng thời chỗ nghỉ này cũng cung cấp dịch vụ đưa đón sân bay mất phí.",8.8,3.0
https://www.booking.com/hotel/vn/khach-san-ngoc-quy-thanh-pho-phan-rang-thap-cham1.vi.html,Khách Sạn Ngọc Quý,"Tháp Chàm, Kinh Dinh, Việt Nam","Khách Sạn Ngọc Quý tọa lạc ở Kinh Dinh. Ngoài sân hiên, khách sạn 1 sao này còn có các phòng với điều hòa được trang bị Wi-Fi miễn phí, trong đó mỗi phòng đều có phòng tắm riêng. Chỗ nghỉ có chỗ đậu xe riêng miễn phí và có cả dịch vụ đưa đón sân bay mất phí.

Các phòng được trang bị tủ lạnh, minibar, ấm đun nước, vòi xịt/chậu rửa vệ sinh, đồ vệ sinh cá nhân miễn phí và bàn làm việc. Tất cả các phòng đều có tủ quần áo và TV màn hình phẳng, ngoài ra một số căn tại khách sạn có ban công. Tại Khách Sạn Ngọc Quý, mỗi phòng đều có ga trải giường và khăn tắm.

Lễ tân tại chỗ nghỉ có thể cung cấp các thông tin hữu ích để giúp du khách tham quan khu vực xung quanh một cách thuận tiện.

Sân bay gần nhất là Sân bay quốc tế Cam Ranh, cách Khách Sạn Ngọc Quý 74 km.",,1.0
https://www.booking.com/hotel/vn/dans-house.vi.html,Dan's house,"66 Lê Thánh Tôn, Kinh Dinh, Việt Nam","Tọa lạc ở Kinh Dinh, Dan's house cung cấp chỗ nghỉ có điều hòa với sân hiên và Wi-Fi miễn phí. Chỗ nghỉ này nhìn ra thành phố và biển.

Căn hộ nằm ở tầng trệt và có 3 phòng ngủ, TV màn hình phẳng có truyền hình vệ tinh và bếp đầy đủ tiện nghi với tủ lạnh, lò vi sóng, máy giặt, minibar và bếp. Khăn tắm và ga trải giường có sẵn ở căn hộ.

Sân bay quốc tế Cam Ranh cách 73 km.",,
https://www.booking.com/hotel/vn/khach-san-thai-bao-phan-rang-tha-p-cha-m.vi.html,Khách Sạn Thái Bảo,"cÄn 15 lÃ´ N2 ÄÆ°á»ng 16 thÃ¡ng 4 phÆ°á»ng Má»¹ Háº£i, Tp. Phan Rang ThÃ¡p ChÃ m, Thôn Mỹ Phước, Việt Nam","Tọa lạc cách Bãi biển Phan Rang 12 phút đi bộ và Bãi biển Bình Sơn 1.2 km, Khách Sạn Thái Bảo cung cấp các phòng điều hòa và phòng tắm riêng ở Thôn Mỹ Phước. Wi-Fi miễn phí hoạt động ở toàn bộ chỗ nghỉ.

Tất cả các căn tại khách sạn được trang bị TV màn hình phẳng và két an toàn. Tất cả các phòng đều được thiết kế có phòng tắm riêng với vòi xịt/chậu rửa vệ sinh, đồ vệ sinh cá nhân miễn phí và máy sấy tóc. Tại Khách Sạn Thái Bảo, mỗi phòng đều được thiết kế có ga trải giường và khăn tắm.

Thành thạo tiếng Anh và tiếng Việt, đội ngũ nhân viên tại lễ tân luôn sẵn lòng hỗ trợ khách vào bất kỳ thời điểm nào trong ngày.

Sân bay gần nhất là Sân bay quốc tế Cam Ranh, cách chỗ nghỉ 76 km.",,
https://www.booking.com/hotel/vn/roxyhomestay-myhoa-lagoon.vi.html,Myhoa Lagoon - Kiting Town,"thon my hoa, Phan Rang, Việt Nam","Myhoa Lagoon - Kiting Town có hồ bơi ngoài trời, khu vườn, nhà hàng và quầy bar ở Phan Rang. Ngoài câu lạc bộ trẻ em, chỗ nghỉ này còn có sân chơi trẻ em. Chỗ nghỉ có chỗ đậu xe riêng miễn phí và có cả dịch vụ đưa đón sân bay mất phí.

Tại khách sạn, các phòng đều đi kèm với điều hòa, bàn làm việc, sân hiên với view biển, phòng tắm riêng, TV màn hình phẳng, ga trải giường và khăn tắm. Các căn đều có tủ lạnh.

Myhoa Lagoon - Kiting Town có phục vụ bữa sáng thực đơn buffet mỗi buổi sáng.

Chỗ nghỉ có bể sục.

Sân bay Liên Khương cách 131 km.",9.3,
https://www.booking.com/hotel/vn/ninh-chu.vi.html,Khách Sạn Ninh Chữ,"Ninh Chu 2 Area, Khanh Hai Town, Phan Rang, Phan Rang, Việt Nam","Với sân hiên và nhìn ra thành phố, Khách Sạn Ninh Chữ tọa lạc ở Phan Rang, cách Bãi biển Ninh Chữ chỉ vài bước chân. Chỗ nghỉ cung cấp lễ tân 24/24, dịch vụ đưa đón sân bay, dịch vụ phòng và Wi-Fi miễn phí.

Tất cả các căn được trang bị điều hòa, TV màn hình phẳng có truyền hình cáp, ấm đun nước, vòi sen, đồ vệ sinh cá nhân miễn phí và tủ quần áo. Tại khách sạn, tất cả các phòng đều được thiết kế có ga trải giường và khăn tắm.

Khách Sạn Ninh Chữ cách Bãi biển Bình Sơn 1.7 km. Sân bay quốc tế Cam Ranh cách 71 km.",8.5,
https://www.booking.com/hotel/vn/nha-phan-rang-thap-cham.vi.html,Nhã Hotel,"Yên Ninh, Phan Rang, Việt Nam","Tọa lạc ở Phan Rang, cách Bãi biển Bình Sơn 2 phút đi bộ, Nhã Hotel cung cấp chỗ nghỉ có sân hiên, chỗ đậu xe riêng miễn phí, quầy bar và khu vực bãi biển riêng. Khách sạn 2 sao này có dịch vụ phòng và dịch vụ tiền sảnh. Chỗ nghỉ cung cấp lễ tân 24/24, dịch vụ đưa đón sân bay, bếp chung và Wi-Fi miễn phí ở toàn bộ chỗ nghỉ.

Phòng nào cũng có điều hòa, ngoài ra một số căn tại khách sạn có ban công.

Nhã Hotel cách Bãi biển Phan Rang 15 phút đi bộ và Bãi biển Ninh Chữ 1.8 km. Sân bay gần nhất là Sân bay quốc tế Cam Ranh, cách chỗ nghỉ 73 km.",9.5,2.0
https://www.booking.com/hotel/vn/madlad-homestay.vi.html,MADLAD SPACE homestay,"Chung cư Hacom, Khu K1,  Phường Thanh Sơn Phòng 403, Tòa nhà B2, Kinh Dinh, Việt Nam","MADLAD SPACE homestay là chỗ nghỉ nằm ở Kinh Dinh và có ban công. Chỗ nghỉ nhìn ra thành phố, có sân hiên và Wi-Fi miễn phí ở toàn bộ chỗ nghỉ.

Căn hộ điều hòa này có 2 phòng ngủ, phòng khách, bếp đầy đủ tiện nghi với tủ lạnh và ấm đun nước, 1 phòng tắm với vòi sen và đồ vệ sinh cá nhân miễn phí. Khăn tắm và ga trải giường có sẵn ở căn hộ.

Sân bay gần nhất là Sân bay Liên Khương, cách căn hộ 112 km.",9.3,
https://www.booking.com/hotel/vn/sea-coral-phan-rang-homestay-amp-spa.vi.html,Coral Homestay Phan Rang -3BR,"Lô Lk 12.7, khu đô thị mới Đông Bắc ( Khu K1) Phường Thanh Sơn, Phan Rang, Việt Nam","Tọa lạc ở Phan Rang, Coral Homestay Phan Rang -3BR cung cấp Wi-Fi miễn phí, nơi khách có thể trải nghiệm khu vườn, sân hiên và quầy bar.

Một số căn có TV màn hình phẳng truyền hình vệ tinh, bếp đầy đủ tiện nghi với tủ lạnh, cùng phòng tắm riêng được trang bị vòi xịt/chậu rửa vệ sinh và đồ vệ sinh cá nhân miễn phí.

Khách sạn căn hộ có dịch vụ cho thuê ô tô, đồng thời du khách có thể lướt ván buồm và câu cá gần đó.

Sân bay Liên Khương cách 112 km.",7.9,3.0
https://www.booking.com/hotel/vn/kami-thanh-pho-phan-rang-thap-cham1.vi.html,KAMI HOTEL,"Nguyễn Ngọc Lân, Phan Rang, Việt Nam","KAMI HOTEL cung cấp chỗ nghỉ tại Phan Rang. Khách sạn 3 sao này cung cấp dịch vụ phòng, quầy lễ tân 24 giờ và Wi-Fi miễn phí. Khách sạn có phòng gia đình.

Sân bay gần nhất là Sân bay quốc tế Cam Ranh, cách khách sạn 74 km.",7.9,3.0
https://www.booking.com/hotel/vn/windy-homestaypr.vi.html,Windy homestayPR,"66 Lê Thánh Tôn, Kinh Dinh, Việt Nam","Windy homestayPR là chỗ nghỉ tọa lạc ở Kinh Dinh và có ban công. Chỗ nghỉ nhìn ra thành phố, có sân hiên và Wi-Fi miễn phí ở toàn bộ chỗ nghỉ.

Căn hộ điều hòa này có 2 phòng ngủ, phòng khách, bếp đầy đủ tiện nghi với tủ lạnh và ấm đun nước, 1 phòng tắm với vòi sen và đồ vệ sinh cá nhân miễn phí. Để thuận tiện hơn cho khách, chỗ nghỉ có thể cung cấp khăn tắm và khăn trải giường với khoản phụ phí.

Sân bay gần nhất là Sân bay quốc tế Cam Ranh, cách căn hộ 73 km.",9.5,4.0
https://www.booking.com/hotel/vn/chanhs-house.vi.html,Chanh's House,"Yên Ninh, Bắc Sớn, Việt Nam","Nằm ở Bắc Sớn thuộc vùng Ninh Thuận và cách Bãi biển Bình Sơn 6 phút đi bộ, Chanh's House cung cấp chỗ nghỉ có Wi-Fi miễn phí, tiện nghi BBQ, khu vườn cùng chỗ đậu xe riêng miễn phí.

Chỗ nghỉ có điều hòa, bếp đầy đủ tiện nghi với khu vực ăn uống, TV màn hình phẳng, cũng như phòng tắm riêng với vòi xịt/chậu rửa vệ sinh, đồ vệ sinh cá nhân miễn phí và máy sấy tóc. Tủ lạnh, lò nướng và bếp, cũng như ấm đun nước đều được cung cấp.

Khách có thể sử dụng sân hiên tại homestay.

Chanh's House cách Bãi biển Ninh Chữ 7 phút đi bộ. Sân bay quốc tế Cam Ranh cách 71 km, đồng thời chỗ nghỉ có cung cấp dịch vụ đưa đón sân bay mất phí.",10,
https://www.booking.com/hotel/vn/khach-san-ninh-chu-2.vi.html,Ninh Chu 2 Hotel,"272 Yên Ninh, Thị Trấn Khánh Hải, Huyện Ninh Hải, Ninh Thuận, Phan Rang, Việt Nam","Nằm ở Phan Rang, cách Bãi biển Ninh Chữ 5 phút đi bộ, Ninh Chu 2 Hotel cung cấp chỗ nghỉ có hồ bơi ngoài trời, chỗ đậu xe riêng miễn phí, khu vườn và sân hiên. Chỗ nghỉ cung cấp lễ tân 24/24, dịch vụ đưa đón sân bay, dịch vụ phòng và Wi-Fi miễn phí.

Tại khách sạn, các phòng được thiết kế có tủ quần áo. Ngoài phòng tắm riêng, vòi xịt/chậu rửa vệ sinh và máy sấy tóc, các phòng tại Ninh Chu 2 Hotel đều có view thành phố. Tại chỗ nghỉ, các phòng đều có ga trải giường và khăn tắm.

Ninh Chu 2 Hotel cách Bãi biển Bình Sơn 5 phút đi bộ. Sân bay gần nhất là Sân bay Liên Khương, cách khách sạn 116 km.",8.3,
https://www.booking.com/hotel/vn/nha-nghi-minh-duc-phan-rang1.vi.html,Minh Duc Hotel - Phan Rang,"24A An Duong Vuong, Khanh Hai, Ninh Hai, Ninh Thuan, Phan Rang, Việt Nam","Minh Duc Hotel tọa lạc tại Bãi biển Ninh Chử, cách Trung tâm thành phố Phan Rang 5 km. Khách sạn này cung cấp Wi-Fi miễn phí trong tất cả các khu vực và chỗ đỗ xe riêng miễn phí ngay tại khuôn viên.

Phòng nghỉ ở đây có TV truyền hình cáp và máy điều hòa. Tất cả các phòng đều được bố trí phòng tắm riêng với nước nóng. Dép và đồ vệ sinh cá nhân miễn phí cũng được cung cấp để tạo sự thoải mái cho du khách.

Khách sạn này có lễ tân phục vụ 24 giờ với nhân viên nói tiếng Anh.

Sân bay Cam Ranh nằm trong bán kính 50 km từ chỗ nghỉ. Du khách đi 12 km là đến Ga Tháp Chàm trong khi Bến xe Phan Rang cách đó 8 km.",8.3,
https://www.booking.com/hotel/vn/nam-duong-1.vi.html,Nam Dương 1 Hotel,"4 Nguyễn Đức Cảnh, Mỹ Hải, Phan Rang, Việt Nam","Nằm ở Phan Rang, cách Bãi biển Phan Rang 18 phút đi bộ, Nam Dương 1 Hotel cung cấp chỗ nghỉ có Wi-Fi miễn phí và chỗ đậu xe riêng miễn phí. Khách sạn có phòng gia đình.

Tại khách sạn, các phòng đều đi kèm với tủ quần áo, TV màn hình phẳng, phòng tắm riêng, ga trải giường và khăn tắm.

Đội ngũ nhân viên lễ tân 24/24 giao tiếp thành thạo bằng tiếng Anh và tiếng Việt.

Nam Dương 1 Hotel cách Bãi biển Bình Sơn 19 phút đi bộ. Sân bay gần nhất là Sân bay quốc tế Cam Ranh, cách chỗ nghỉ 76 km.",6.8,
https://www.booking.com/hotel/vn/duc-chinh-ninh-chu-phan-rang-phan-rang.vi.html,Đức Chính Hotel - Ninh Chu - Phan Rang,"354/5 Trường Chinh, Khánh Hải, Ninh Hải, Ninh Thuận, Phan Rang, Việt Nam","Tọa lạc ở Phan Rang, cách Bãi biển Ninh Chữ 3 phút đi bộ, Đức Chính Hotel - Ninh Chu - Phan Rang nhìn rabiển. Chỗ nghỉ có chỗ đậu xe riêng miễn phí và có cả dịch vụ đưa đón sân bay mất phí.

Các phòng được trang bị điều hòa, TV màn hình phẳng có truyền hình cáp, tủ lạnh, ấm đun nước, vòi sen, đồ vệ sinh cá nhân miễn phí và bàn làm việc. Với phòng tắm riêng được trang bị dép đi trong phòng, các phòng tại khách sạn cũng có Wi-Fi miễn phí, trong đó một số phòng có ban công. Tại Đức Chính Hotel - Ninh Chu - Phan Rang, mỗi phòng đều có ga trải giường và khăn tắm.

Với đội ngũ nhân viên thành thạo tiếng Anh và tiếng Việt, dịch vụ hướng dẫn luôn có sẵn tại lễ tân.

Chỗ nghỉ cách Bãi biển Bình Sơn 1.7 km. Sân bay gần nhất là Sân bay Liên Khương, cách Đức Chính Hotel - Ninh Chu - Phan Rang 117 km.",9.2,
https://www.booking.com/hotel/vn/qv-manor-homestay.vi.html,QV Luxury Apartment,"18 Nguyễn Thị Minh Khai, phường Mỹ Bình, Phan Rang, Việt Nam","Tọa lạc ở Phan Rang, QV Luxury Apartment cung cấp Wi-Fi miễn phí, nơi khách có thể trải nghiệm xe đạp miễn phí, khu vườn và phòng chờ chung.

Một số căn được trang bị điều hòa, TV màn hình phẳng, máy giặt và ấm đun nước, cũng như bếp.

Khách sạn căn hộ có sân hiên.

QV Luxury Apartment có dịch vụ cho thuê ô tô.

Chỗ nghỉ cách Bãi biển Bình Sơn 1.7 km và Bãi biển Ninh Chữ 2.9 km. Sân bay gần nhất là Sân bay Liên Khương, cách QV Luxury Apartment 113 km, đồng thời chỗ nghỉ có cung cấp dịch vụ đưa đón sân bay mất phí.",8.9,3.0
https://www.booking.com/hotel/vn/khach-san-ho-gia-villa.vi.html,KHÁCH SẠN - VILLA HỒ GIA Phan Rang,"36 Đường Trần Quang Diệu, Kinh Dinh, Việt Nam","Tọa lạc ở Kinh Dinh, cách Bãi biển Phan Rang 2.9 km, KHÁCH SẠN - VILLA HỒ GIA Phan Rang cung cấp chỗ nghỉ có hồ bơi ngoài trời, chỗ đậu xe riêng miễn phí và sân hiên. Chỗ nghỉ cung cấp lễ tân 24/24, dịch vụ đưa đón, bếp chung và Wi-Fi miễn phí ở toàn bộ chỗ nghỉ.

Tại khách sạn, mỗi phòng đều có bàn làm việc. Với phòng tắm riêng được trang bị vòi xịt/chậu rửa vệ sinh và đồ vệ sinh cá nhân miễn phí, các phòng tại KHÁCH SẠN - VILLA HỒ GIA Phan Rang có TV màn hình phẳng và điều hòa, trong đó một số phòng có ban công. Tất cả các căn có tủ quần áo.

Sân bay gần nhất là Sân bay quốc tế Cam Ranh, cách chỗ nghỉ 75 km.",7.7,
https://www.booking.com/hotel/vn/can-ho-vivi.vi.html,Căn hộ vivi,"Chung cư hacom khu k1 phường thanh sơn tp phan rang thap cham, Kinh Dinh, Việt Nam","Căn hộ vivi có ban công và tọa lạc ở Kinh Dinh, Ninh Thuận. Chỗ nghỉ có WiFi miễn phí ở toàn bộ chỗ nghỉ và chỗ đậu xe riêng có sẵn trong khuôn viên.

Căn hộ điều hòa này có 2 phòng ngủ với sân hiên nhìn ra khu vườn và bếp đầy đủ tiện nghi. TV màn hình phẳng được cung cấp.

Sân bay gần nhất là Sân bay quốc tế Cam Ranh, cách căn hộ 73 km.",,
