url,name,location,description,point,star
https://www.booking.com/hotel/vn/devesun.vi.html,Devesun Hotel,"Cao Bá Quát, Kinh Dinh, Việt Nam","Devesun Hotel ở Kinh Dinh cung cấp chỗ nghỉ 4 sao có nhà hàng. Chỗ nghỉ cung cấp lễ tân 24/24, dịch vụ đưa đón sân bay, dịch vụ phòng và Wi-Fi miễn phí ở toàn bộ chỗ nghỉ.

Các phòng ở khách sạn được trang bị ấm đun nước. Tất cả các phòng đều được thiết kế có điều hòa và TV màn hình phẳng, ngoài ra một số căn tại Devesun Hotel có view thành phố.

Khách có thể thưởng thức bữa sáng thực đơn buffet, thực đơn à la carte hoặc kiểu lục địa tại chỗ nghỉ.

Sân bay quốc tế Cam Ranh cách 73 km.",9.5,4.0
https://www.booking.com/hotel/vn/cube-homestay-phan-rang-thanh-pho-phan-rang-thap-cham.vi.html,Cube homestay Phan Rang cách biển 300m to the beach,"68 Nguyễn Thị Minh Khai, Phan Rang, Việt Nam","Tọa lạc ở Phan Rang, cách Bãi biển Bình Sơn 9 phút đi bộ và Bãi biển Ninh Chữ 1.9 km, Cube homestay Phan Rang cách biển 300m to the beach cung cấp chỗ nghỉ có Wi-Fi miễn phí, điều hòa, khu vườn và quầy bar.

Tất cả các căn có khu vực ghế ngồi, khu vực ăn uống, cùng bếp đầy đủ tiện nghi với nhiều thiết bị nấu nướng bao gồm tủ lạnh, lò nướng, lò vi sóng và bếp. Nơi đây còn có phòng tắm chung với vòi xịt/chậu rửa vệ sinh ở một số căn, cùng đồ vệ sinh cá nhân miễn phí, máy sấy tóc và dép đi trong phòng.

Homestay có dịch vụ cho thuê ô tô.

Cube homestay Phan Rang cách biển 300m to the beach cách Bãi biển Phan Rang 2.2 km. Sân bay gần nhất là Sân bay Liên Khương, cách chỗ nghỉ 114 km, đồng thời chỗ nghỉ này cũng cung cấp dịch vụ đưa đón sân bay mất phí.",9,
https://www.booking.com/hotel/vn/khach-san-miami-ninh-thuan.vi.html,Khách sạn Miami Ninh Thuận,"TM31-24, đường Đào Tấn, Khu K1 phường Thanh Sơn, Phan Rang, Việt Nam","Khách sạn Miami Ninh Thuận nằm ở Phan Rang và có khu vườn. Tại đây có sân hiên và khách có thể sử dụng Wi-Fi miễn phí và chỗ đậu xe riêng miễn phí.

Tại khách sạn, các phòng đều đi kèm với tủ quần áo và TV màn hình phẳng. Tất cả các phòng tại Khách sạn Miami Ninh Thuận có điều hòa và bàn làm việc.

Lễ tân tại chỗ nghỉ có thể cung cấp các thông tin hữu ích để giúp du khách tham quan khu vực xung quanh một cách thuận tiện.

Sân bay gần nhất là Sân bay Liên Khương, cách Khách sạn Miami Ninh Thuận 112 km.",8.8,
https://www.booking.com/hotel/vn/khach-san-anh-khoa-thanh-pho-phan-rang-thap-cham.vi.html,Khách Sạn Anh Khoa,"17 Trần Quang Diệu, Thành phố Phan Rang - Tháp Chàm, Phan Rang, Việt Nam","Khách Sạn Anh Khoa nằm ở Phan Rang và có sân hiên. Chỗ nghỉ cung cấp lễ tân 24/24, dịch vụ đưa đón sân bay, dịch vụ phòng và Wi-Fi miễn phí.

Tại khách sạn, phòng nào cũng có bàn làm việc. Với phòng tắm riêng được trang bị vòi xịt/chậu rửa vệ sinh và đồ vệ sinh cá nhân miễn phí, tất cả các phòng tại Khách Sạn Anh Khoa có TV màn hình phẳng và điều hòa, trong đó một số phòng có ban công. Tại chỗ nghỉ, các phòng đều có ga trải giường và khăn tắm.

Sân bay Liên Khương cách 112 km.",8.2,
https://www.booking.com/hotel/vn/nha-nghi-thuan-vuong.vi.html,THUẬN VƯƠNG Homestay,"thôn Vĩnh Hy , xã Vĩnh Hải , huyện Ninh Hải , tỉnh Ninh Thuận, Vịnh Vĩnh Hy, Việt Nam","THUẬN VƯƠNG Homestay cung cấp chỗ nghỉ tại Vịnh Vĩnh Hy. Ngoài dịch vụ phòng, chỗ nghỉ này còn có sân hiên phơi nắng. Chỗ nghỉ cung cấp lễ tân 24/24, dịch vụ đưa đón sân bay, bếp chung và Wi-Fi miễn phí ở toàn bộ chỗ nghỉ.

Tại guest house, tất cả các phòng có điều hòa, bàn làm việc, TV màn hình phẳng, phòng tắm riêng, ga trải giường, khăn tắm và sân trong với view thành phố. Tất cả các phòng đều có ấm đun nước, trong đó một số phòng có ban công và một số khác thì nhìn ra biển.

Guest house này có dịch vụ thuê xe đạp và dịch vụ thuê ô tô. Ngoài ra, câu cá là hoạt động được ưa chuộng trong khu vực.

Sân bay gần nhất là Sân bay quốc tế Cam Ranh, cách THUẬN VƯƠNG Homestay 68 km.",9.6,3.0
https://www.booking.com/hotel/vn/sea-urchin-homestay.vi.html,Sea Urchin Homestay,"Khu K1 Phường Mỹ Bình, Phan Rang, Việt Nam","Nằm ở Phan Rang, Sea Urchin Homestay cung cấp Wi-Fi miễn phí, nơi khách có thể trải nghiệm phòng chờ chung, sân hiên và quầy bar.

Nơi đây còn có phòng tắm chung với vòi xịt/chậu rửa vệ sinh ở một số căn, cùng đồ vệ sinh cá nhân miễn phí, máy sấy tóc và dép đi trong phòng.

Homestay có BBQ.

Sea Urchin Homestay có cả dịch vụ cho thuê xe đạp và dịch vụ cho thuê ô tô.

Sân bay Liên Khương cách 113 km.",8.6,
https://www.booking.com/hotel/vn/hoa-huong-duong-thanh-pho-phan-rang-thap-cham.vi.html,Hoa Hướng Dương Hotel,"140 Nguyễn Tri Phương, Phan Rang, Việt Nam","Nằm ở Phan Rang, Hoa Hướng Dương Hotel cung cấp sân hiên và quầy bar. Ngoài phòng chờ chung, khách sạn 3 sao này còn có các phòng với điều hòa được trang bị Wi-Fi miễn phí, trong đó mỗi phòng đều có phòng tắm riêng. Chỗ nghỉ có chỗ đậu xe riêng miễn phí và có cả dịch vụ đưa đón sân bay mất phí.

Tại khách sạn, mỗi phòng đều được thiết kế có tủ quần áo. Các phòng đều đi kèm với bàn làm việc và TV màn hình phẳng, ngoài ra một số phòng tại Hoa Hướng Dương Hotel có ban công. Tại chỗ nghỉ, tất cả các phòng đều có ga trải giường và khăn tắm.

Với đội ngũ nhân viên thành thạo tiếng Anh và tiếng Việt, dịch vụ thông tin luôn có sẵn tại lễ tân.

Sân bay Liên Khương cách 112 km.",8.1,3.0
https://www.booking.com/hotel/vn/phuc-thuan.vi.html,Phuc Thuan Hotel,"Yên Ninh, Phan Rang, Việt Nam","Nằm ở Phan Rang, cách Bãi biển Ninh Chữ chỉ vài bước chân, Phuc Thuan Hotel cung cấp chỗ nghỉ có hồ bơi ngoài trời, chỗ đậu xe riêng miễn phí, khu vực bãi biển riêng và sân hiên. Khách sạn 2 sao này có quầy lễ tân 24 giờ. Đây là chỗ nghỉ không gây dị ứng và tọa lạc cách Bãi biển Bình Sơn 1.9 km.

Các căn đi kèm điều hòa, TV màn hình phẳng có truyền hình cáp, tủ lạnh, ấm đun nước, vòi sen, đồ vệ sinh cá nhân miễn phí và bàn làm việc. Ngoài phòng tắm riêng với bồn tắm và máy sấy tóc, các phòng tại khách sạn cũng có Wi-Fi miễn phí, trong đó một số phòng có view biển. Tại Phuc Thuan Hotel, tất cả các phòng có ga trải giường và khăn tắm.

Sân bay Liên Khương cách 117 km.",8,2.0
https://www.booking.com/hotel/vn/minh-quang-phan-rang.vi.html,Khách sạn Minh Quang,"Street 16/4, Group 4, My Hai, Phan Rang, Việt Nam","Tọa lạc ở Phan Rang, cách Bãi biển Phan Rang 8 phút đi bộ, Khách sạn Minh Quang cung cấp chỗ nghỉ giáp biển, có các tiện nghi như khu vực bãi biển riêng. Chỗ nghỉ có chỗ đậu xe riêng miễn phí và có cả dịch vụ đưa đón sân bay mất phí.

Các phòng được trang bị điều hòa, TV màn hình phẳng có truyền hình cáp, tủ lạnh, ấm đun nước, vòi xịt/chậu rửa vệ sinh, đồ vệ sinh cá nhân miễn phí và tủ quần áo. Ngoài phòng tắm riêng với vòi sen và máy sấy tóc, các phòng tại khách sạn cũng có Wi-Fi miễn phí, trong đó một số phòng có view thành phố. Tại Khách sạn Minh Quang, mỗi phòng đều có ga trải giường và khăn tắm.

Nhân viên chỗ nghỉ luôn có mặt ở lễ tân để hướng dẫn du khách.

Khách sạn Minh Quang cách Bãi biển Bình Sơn chưa đến 1 km. Sân bay gần nhất là Sân bay Liên Khương, cách khách sạn 115 km.",8.1,
https://www.booking.com/hotel/vn/phan-rang.vi.html,Phan Rang Hotel,"Khu phố 5, Thanh Son, Phan Rang, Việt Nam","Phan Rang Hotel có khu vườn, phòng chờ chung, sân hiên và quầy bar ở Phan Rang. Chỗ nghỉ cung cấp lễ tân 24/24, dịch vụ đưa đón sân bay, dịch vụ phòng và Wi-Fi miễn phí.

Tại khách sạn, tất cả các phòng đều được thiết kế có bàn làm việc, TV màn hình phẳng, phòng tắm riêng, ga trải giường và khăn tắm. Các phòng tại Phan Rang Hotel có điều hòa và tủ quần áo.

Sân bay gần nhất là Sân bay Liên Khương, cách chỗ nghỉ 112 km.",8.2,
https://www.booking.com/hotel/vn/jap-karo.vi.html,JAP KARO,"KĐT biển Bình Sơn - Ninh Chữ, đường 16/04 Lô TM33.19, Tan An, Việt Nam","Tọa lạc ở Tan An, cách Bãi biển Phan Rang chưa đến 1 km, JAP KARO cung cấp chỗ nghỉ có phòng chờ chung, chỗ đậu xe riêng miễn phí, sân hiên và nhà hàng. Khách sạn 3 sao này có dịch vụ tiền sảnh và bàn bán tour. Chỗ nghỉ cung cấp lễ tân 24/24, dịch vụ đưa đón sân bay, dịch vụ phòng và Wi-Fi miễn phí.

Các phòng được trang bị điều hòa, TV màn hình phẳng có truyền hình vệ tinh, tủ lạnh, ấm đun nước, vòi xịt/chậu rửa vệ sinh, đồ vệ sinh cá nhân miễn phí và bàn làm việc. Ngoài phòng tắm riêng với vòi sen và máy sấy tóc, một số căn tại khách sạn cũng có view thành phố. Tại JAP KARO, tất cả các phòng đều được thiết kế có ga trải giường và khăn tắm.

Chỗ nghỉ cách Bãi biển Bình Sơn 13 phút đi bộ và Bãi biển Ninh Chữ 3 km.",8.7,3.0
https://www.booking.com/hotel/vn/khach-san-anh-khoa-2.vi.html,KHÁCH SẠN Biển Xanh,"Lô TM30-37, đường Hoàng Diệu, phường thanh sơn, tp Phan Rang - Tháp Chàm. Tỉnh Ninh Thuận, Kinh Dinh, Việt Nam","KHÁCH SẠN Biển Xanh tọa lạc ở Kinh Dinh. Khách sạn 2 sao này có phòng chờ chung và dịch vụ phòng. Chỗ nghỉ có chỗ đậu xe riêng miễn phí và có cả dịch vụ đưa đón sân bay mất phí.

Tại khách sạn, các phòng đều có bàn làm việc. Với phòng tắm riêng được trang bị vòi xịt/chậu rửa vệ sinh và đồ vệ sinh cá nhân miễn phí, phòng khách tại KHÁCH SẠN Biển Xanh có TV màn hình phẳng và điều hòa, trong đó một số phòng có ban công. Tại chỗ nghỉ, mỗi phòng đều được thiết kế có ga trải giường và khăn tắm.

Lễ tân tại KHÁCH SẠN Biển Xanh có thể cung cấp các thông tin hữu ích để giúp du khách tham quan khu vực xung quanh một cách thuận tiện.

Sân bay gần nhất là Sân bay Liên Khương, cách khách sạn 112 km.",9.1,2.0
https://www.booking.com/hotel/vn/leos-homestay-phan-rang.vi.html,Leo's Homestay Phan Rang,"5a Nguyễn Trãi, Phan Rang, Việt Nam","Leo's Homestay Phan Rang tọa lạc ở Phan Rang, nhìn ra thành phố và có Wi-Fi miễn phí cùng chỗ đậu xe riêng miễn phí.

Nơi đây còn có phòng tắm riêng với vòi xịt/chậu rửa vệ sinh và đồ vệ sinh cá nhân miễn phí ở từng căn, cùng dép đi trong phòng.

Homestay cung cấp sân hiên.

Sân bay gần nhất là Sân bay Liên Khương, cách Leo's Homestay Phan Rang 111 km.",9.3,
https://www.booking.com/hotel/vn/glamour-boutique-phan-rang.vi.html,Glamour Boutique,"Trần Quang Diệu Tm39-15,16,17, Phan Rang, Việt Nam","Glamour Boutique cung cấp chỗ nghỉ tại Phan Rang. Ngoài sân hiên, khách sạn 3 sao này có các phòng được trang bị điều hòa và Wi-Fi miễn phí, trong đó mỗi phòng sẽ có phòng tắm riêng. Khách sạn có phòng gia đình.

Tại khách sạn, tất cả các phòng đều được thiết kế có tủ quần áo. Mỗi phòng đều được thiết kế có bàn làm việc và TV màn hình phẳng, ngoài ra một số căn tại Glamour Boutique có ban công. Tại chỗ nghỉ, tất cả các phòng đều có ga trải giường và khăn tắm.

Thành thạo cả tiếng Anh và tiếng Việt, đội ngũ nhân viên tại lễ tân luôn sẵn lòng hỗ trợ khách lên kế hoạch cho kỳ nghỉ.

Sân bay gần nhất là Sân bay quốc tế Cam Ranh, cách Glamour Boutique 74 km.",8.9,3.0
https://www.booking.com/hotel/vn/den-gion-resort.vi.html,TTC Resort Ninh Thuan - Unlimited Access to Water Park,"Yen Ninh Street, Van Hai Ward, Phan Rang, Việt Nam","Nằm cách Thành phố Phan Rang 5 km, TTC Resort Ninh Thuan - Unlimited Access to Water Park có tầm nhìn tuyệt đẹp ra biển và bãi biển dài đầy cát trắng. Chỗ nghỉ này có hồ bơi ngoài trời, chỗ đỗ xe riêng miễn phí và nhà hàng nhìn ra Bãi biển Ninh Chữ.

Phòng nghỉ tại TTC Resort Ninh Thuan - Unlimited Access to Water Park được trang bị máy điều hòa, TV truyền hình cáp màn hình phẳng, minibar và máy pha trà/cà phê. Máy sấy tóc, áo choàng tắm và dép đi trong phòng cũng được cung cấp.

Nhà hàng Sakaya phục vụ tuyển chọn nhiều món ăn truyền thống của Việt Nam trong không gian ngoài trời.

Quán TTC Sea Bar là nơi du khách có thể thưởng thức ẩm thực, âm thanh và tận hưởng không gian vô cùng lãng mạn bên biển.

Tại Resort, du khách sẽ có cơ hội trải nghiệm một kỳ nghỉ tuyệt vời, mang lại cho du khách những kỷ niệm khó phai, đầy thú vị và thư giãn. Được đón tiếp và phục vụ du khách là niềm hạnh phúc lớn lao của chỗ nghỉ.",8.1,
https://www.booking.com/hotel/vn/royal-ninh-thuan-tp-phan-rang-thap-cham.vi.html,Royal Hotel Ninh Thuận,"21-22 Chế Lan Viên, Khu K1, P. Mỹ Bình, Tp. Phan Rang - Tháp Chàm, Ninh Thuận, Kinh Dinh, Việt Nam","Royal Hotel Ninh Thuận có khu vườn, phòng chờ chung, sân hiên và nhà hàng ở Kinh Dinh. Khách sạn 2 sao này có dịch vụ phòng và quầy lễ tân 24 giờ. Chỗ nghỉ này cung cấp dịch vụ tiền sảnh, bàn bán tour và dịch vụ thu đổi ngoại tệ cho khách.

Các phòng được thiết kế có điều hòa và TV màn hình phẳng, ngoài ra một số phòng tại khách sạn có ban công.

Leo núi là hoạt động được ưa chuộng trong khu vực. Ngoài ra, Royal Hotel Ninh Thuận có dịch vụ thuê xe đạp và dịch vụ thuê ô tô.

Sân bay Liên Khương cách 113 km.",8.6,2.0
https://www.booking.com/hotel/vn/nha-bo-homestay-ninh-thuan.vi.html,Nhà Bơ Homestay,"75/6 Trần Phú, Phủ Hà, TP. Phan Rang Tháp Chàm, Phan Rang, Việt Nam","Nhà Bơ Homestay cung cấp các phòng điều hòa ở Phan Rang.

Tại khách sạn, mỗi phòng đều có tủ quần áo. Với phòng tắm riêng được trang bị vòi xịt/chậu rửa vệ sinh và đồ vệ sinh cá nhân miễn phí, các phòng tại Nhà Bơ Homestay cũng có Wi-Fi miễn phí, trong đó một số phòng có ban công. Tại chỗ nghỉ, tất cả các phòng đều có ga trải giường và khăn tắm.

Thành thạo tiếng Anh và tiếng Việt, đội ngũ nhân viên tại lễ tân luôn túc trực để hỗ trợ khách.

Sân bay gần nhất là Sân bay quốc tế Cam Ranh, cách Nhà Bơ Homestay 72 km.",,
https://www.booking.com/hotel/vn/nha-xinh-son-hai-ninh-thuan-homestay.vi.html,Nhà xinh sơn hải ninh thuận homestay,"Nhà xinh sơn hải thôn sơn hải 2, Thôn Sơn Hải, Việt Nam","Với sân hiên, quầy bar, cùng tiện nghi thể thao dưới nước, Nhà xinh sơn hải ninh thuận homestay cung cấp chỗ nghỉ ở Thôn Sơn Hải có Wi-Fi miễn phí và nhìn ra biển. Nhà nghỉ B&B cung cấp chỗ đậu xe riêng miễn phí và bếp chung.

Khăn tắm và ga trải giường có sẵn ở nhà nghỉ B&B.

Đội ngũ nhân viên của nhà nghỉ B&B luôn túc trực tại lễ tân 24/24 để cung cấp thông tin cho du khách.

Nhà xinh sơn hải ninh thuận homestay có BBQ. Sau một ngày leo núi, lặn biển hoặc câu cá, khách có thể thư giãn trong khu vườn hoặc khu vực phòng chờ chung.

Sân bay gần nhất là Sân bay quốc tế Cam Ranh, cách chỗ nghỉ 93 km, đồng thời chỗ nghỉ có cung cấp dịch vụ đưa đón sân bay mất phí.",9.7,
https://www.booking.com/hotel/vn/c-amp-m-thanh-pho-phan-rang-thap-cham.vi.html,C&M Hotel,"Lô TM39-27, Đường Nguyễn Ngọc Lân, Phường Mỹ Bình, Thành phố Phan Rang, tỉnh Ninh Thuận, Việt Nam, Phan Rang, Việt Nam","C&M Hotel nằm ở Phan Rang. Ngoài sân hiên, khách sạn 4 sao này còn có các phòng với điều hòa được trang bị Wi-Fi miễn phí, trong đó mỗi phòng đều có phòng tắm riêng. Chỗ nghỉ này cung cấp dịch vụ phòng và phòng giữ hành lý cho khách.

Tại khách sạn, phòng nào cũng có ban công. Tất cả các phòng đều có bàn làm việc và TV màn hình phẳng, ngoài ra một số phòng tại C&M Hotel có sân trong. Tại chỗ nghỉ, tất cả các phòng có ga trải giường và khăn tắm.

Thành thạo tiếng Đan Mạch, tiếng Đức, tiếng Anh và tiếng Pháp, đội ngũ nhân viên tại lễ tân 24/24 luôn sẵn lòng hỗ trợ khách lên kế hoạch cho kỳ nghỉ.

Sân bay quốc tế Cam Ranh cách 74 km.",9.1,4.0
https://www.booking.com/hotel/vn/ngaunhien-39-s-house.vi.html,ngaunhien's house - Homestay,"Yên Ninh, Thôn Dư Khánh, Việt Nam","Tọa lạc ở Thôn Dư Khánh thuộc vùng Ninh Thuận và cách Bãi biển Ninh Chữ 5 phút đi bộ, ngaunhien's house - Homestay cung cấp chỗ nghỉ có Wi-Fi miễn phí, sân chơi trẻ em, khu vườn cùng chỗ đậu xe riêng miễn phí.

Được thiết kế với sân hiên, các căn có điều hòa, TV màn hình phẳng, cùng phòng tắm riêng gồm vòi xịt/chậu rửa vệ sinh và đồ vệ sinh cá nhân miễn phí. Một số căn có ban công và/hoặc sân trong nhìn ra núi hoặc khu vườn.

Khách có thể tìm thấy BBQ tại homestay, cùng phòng chờ chung.

Ngaunhien's house - Homestay cách Bãi biển Bình Sơn 5 phút đi bộ. Sân bay gần nhất là Sân bay Liên Khương, cách chỗ nghỉ 116 km, đồng thời chỗ nghỉ có cung cấp dịch vụ đưa đón sân bay mất phí.",9.3,
https://www.booking.com/hotel/vn/aloha-thanh-pho-phan-rang-thap-cham.vi.html,Aloha Hotel,"14 Hà Huy Giáp Phường Đài Sơn, Phan Rang, Việt Nam","Tọa lạc ở Phan Rang, Aloha Hotel cung cấp Wi-Fi miễn phí ở toàn bộ chỗ nghỉ. Chỗ nghỉ có chỗ đậu xe riêng miễn phí và có cả dịch vụ đưa đón sân bay mất phí.

Đội ngũ nhân viên lễ tân giao tiếp thành thạo bằng tiếng Anh và tiếng Việt.

Sân bay Liên Khương cách 111 km.",7.9,
https://www.booking.com/hotel/vn/hacom-galaxy.vi.html,Hacom Galaxy Hotel,"D13, KĐT Bien Binh Son - Ninh Chu, 16/4 street, My Binh ward, Phan Rang, Việt Nam","Nằm ở Phan Rang, cách Bãi biển Phan Rang 7 phút đi bộ, Hacom Galaxy Hotel cung cấp chỗ nghỉ có khu vườn, chỗ đậu xe riêng miễn phí, phòng chờ chung và sân hiên. Ngoài nhà hàng, khách sạn 3 sao này còn có các phòng với điều hòa được trang bị Wi-Fi miễn phí, trong đó mỗi phòng đều có phòng tắm riêng. Chỗ nghỉ này cung cấp dịch vụ phòng và quầy lễ tân 24 giờ cho khách.

Các căn đi kèm TV màn hình phẳng có truyền hình cáp, minibar, ấm đun nước, vòi xịt/chậu rửa vệ sinh, đồ vệ sinh cá nhân miễn phí và tủ quần áo. Tại khách sạn, các phòng đều đi kèm với ga trải giường và khăn tắm.

Hacom Galaxy Hotel cách Bãi biển Bình Sơn chưa đến 1 km. Chỗ nghỉ cách Sân bay Liên Khương 115 km và cung cấp dịch vụ đưa đón sân bay mất phí.",8.4,3.0
https://www.booking.com/hotel/vn/khach-san-an-khang-ninh-thuan.vi.html,Khách sạn Hoàng Hải,"58 Nguyễn Thị Minh Khai, phường Mỹ Bình, thành phố Phan Rang- Tháp Chàm, Phan Rang, Việt Nam","Tọa lạc ở Phan Rang, cách Bãi biển Bình Sơn chưa đến 1 km và Bãi biển Ninh Chữ 2.1 km, Khách sạn Hoàng Hải cung cấp chỗ nghỉ có Wi-Fi miễn phí. Chỗ nghỉ này cung cấp phòng chờ chung và dịch vụ phòng cho khách.

Các căn tại khách sạn được trang bị khu vực ghế ngồi. Với phòng tắm chung được trang bị vòi xịt/chậu rửa vệ sinh và đồ vệ sinh cá nhân miễn phí, phòng khách tại Khách sạn Hoàng Hải có TV màn hình phẳng và điều hòa, trong đó một số phòng có ban công. Tất cả các phòng đều có tủ quần áo và ấm đun nước để khách sử dụng.

Đội ngũ nhân viên lễ tân 24/24 giao tiếp thành thạo bằng tiếng Anh và tiếng Việt.

Chỗ nghỉ cách Bãi biển Phan Rang 2.4 km. Sân bay Liên Khương cách 114 km.",7.4,
https://www.booking.com/hotel/vn/mayhome-phan-rang.vi.html,Mayhome Phan Rang - 2BR City view - 3km to beach,"Lê Thánh Tôn, Kinh Dinh, Việt Nam","Mayhome Phan Rang - 2BR City view - 3km to beach là chỗ nghỉ tọa lạc ở Kinh Dinh và có ban công. Chỗ nghỉ nhìn ra thành phố, có sân hiên và Wi-Fi miễn phí ở toàn bộ chỗ nghỉ.

Căn hộ điều hòa này có 2 phòng ngủ, phòng khách, bếp đầy đủ tiện nghi với tủ lạnh và ấm đun nước, 1 phòng tắm với vòi xịt/chậu rửa vệ sinh và vòi sen. TV màn hình phẳng được cung cấp.

Sân bay gần nhất là Sân bay Liên Khương, cách căn hộ 112 km.",10,
https://www.booking.com/hotel/vn/hon-co-ca-na-resort.vi.html,Hòn Cò Resort - Cà Ná,"National Road 1A, Ca Na, Thuan Nam, Thôn Lạc Nghiệp, Việt Nam","Tọa lạc ở tỉnh Ninh Thuận, Hòn Cò Resort - Cà Ná cung cấp chỗ nghỉ với nhà hàng trong khuôn viên. Nơi đây có Wi-Fi miễn phí trong tất cả các khu vực và chỗ đỗ xe riêng miễn phí ngay tại khuôn viên.

Phòng nghỉ được trang bị TV truyền hình cáp màn hình phẳng. Một số phòng có khu vực ghế ngồi để khách thư giãn và một số phòng cho tầm nhìn ra quang cảnh biển hoặc khu vườn. Phòng tắm riêng đi kèm tiện nghi vòi sen, khăn tắm và đồ vệ sinh cá nhân miễn phí. Các phòng cũng được cung cấp miễn phí nước đóng chai, trà và cà phê.

Chỗ nghỉ cung cấp dịch vụ lễ tân 24 giờ và dịch vụ phòng. Nơi đây còn có phòng tập thể dục.

Thành phố Phan Rang - Tháp Chàm nằm trong bán kính 35 km từ resort. Sân bay gần nhất là Sân bay Quốc tế Cam Ranh, cách chỗ nghỉ 95 km.

Du khách có thể thưởng thức bữa sáng tự chọn tại Nhà hàng Hải Âu. Nhà hàng cũng phục vụ nhiều món đặc sản, hải sản và món ăn kiểu Việt Nam.",7.6,3.0
https://www.booking.com/hotel/vn/khach-san-ngoc-bich-phan-rang-thap-cham-tinh-ninh-thuan.vi.html,Khách sạn Ngọc Bích,"07 Đường Lương Ngọc Quyến 07 Đường Lương Ngọc Quyến, P. Phủ hà, Phan Rang, Việt Nam","Khách sạn Ngọc Bích cung cấp chỗ nghỉ ở Phan Rang. Khách sạn 3 sao này có dịch vụ phòng và quầy lễ tân 24 giờ.

Sân bay Liên Khương cách 111 km.",7.5,3.0
https://www.booking.com/hotel/vn/hoan-my-resort.vi.html,Hoan My Resort - Ninh Chu,"Đường Yên Ninh - Khu Phố 3 - Phường Mỹ Bình - TP.PRTC - Tỉnh Ninh Thuận, Phan Rang, Việt Nam","Nằm giáp biển, Hoan My Resort - Ninh Chu cung cấp chỗ nghỉ 4 sao ở Phan Rang, đồng thời có hồ bơi ngoài trời, trung tâm thể dục và khu vườn. Với sân hiên và khu vực bãi biển riêng, chỗ nghỉ này nằm gần các điểm tham quan như Bãi biển Bình Sơn, Bãi biển Ninh Chữ và Bãi biển Phan Rang. Du khách có thể thưởng thức các món Mỹ và Việt tại nhà hàng hoặc thưởng thức ly cocktail tại quầy bar.

Resort sẽ cung cấp cho khách các phòng được trang bị điều hòa có bàn làm việc, ấm đun nước, minibar, két an toàn, TV màn hình phẳng và phòng tắm riêng với vòi xịt/chậu rửa vệ sinh. Tại Hoan My Resort - Ninh Chu, các phòng đều có ga trải giường và khăn tắm.

Chỗ nghỉ có phục vụ bữa sáng thực đơn buffet và thực đơn à la carte mỗi buổi sáng.

Thành thạo tiếng Anh, tiếng Nga, tiếng Việt và tiếng Hoa, đội ngũ nhân viên tại lễ tân 24/24 luôn túc trực để hỗ trợ khách.

Chỗ nghỉ cách Sân bay Liên Khương 115 km và cung cấp dịch vụ đưa đón sân bay mất phí.",8.6,4.0
