url,name,location,description,point,star
https://www.booking.com/hotel/vn/momizi-serviced-apartment.vi.html,MOMIZI Serviced Apartment,"15 Vũ Văn Dũng, Hải Dương, Việt Nam","Nhìn ra thành phố, MOMIZI Serviced Apartment ở Hải Dương cung cấp chỗ nghỉ có xe đạp miễn phí, phòng chờ chung và sân hiên. WiFi miễn phí có sẵn ở toàn bộ chỗ nghỉ.

Chỗ nghỉ có TV màn hình phẳng, phòng tắm riêng được trang bị vòi xịt/chậu rửa vệ sinh, vòi sen và đồ vệ sinh cá nhân miễn phí, cùng bếp có tủ lạnh, lò nướng và lò vi sóng. Một số căn có khu vực ghế ngồi và/hoặc ban công.

Căn hộ có phục vụ bữa sáng thực đơn à la carte mỗi sáng.

Trong thời gian lưu trú tại MOMIZI Serviced Apartment, khách được tùy ý sử dụng tiện nghi chăm sóc sức khoẻ và spa, bao gồm phòng xông hơi khô và bể sục.

Du khách có thể đi xe đạp để khám phá khu vực xung quanh, đồng thời chỗ nghỉ có thể sắp xếp dịch vụ cho thuê ô tô.

MOMIZI Serviced Apartment cách Nhà hát lớn Hải Phòng 44 km. Sân bay Quốc tế Cát Bi cách 50 km, đồng thời chỗ nghỉ có cung cấp dịch vụ đưa đón sân bay mất phí.",,3.0
