url,name,location,description,point,star
https://www.booking.com/hotel/vn/bo.vi.html,YO Hotel,"22 Phố Đào Đạo, Hải Dương, Việt Nam","Tọa lạc ở Hải Dương, cách Nhà hát lớn Hải Phòng 44 km, YO Hotel cung cấp chỗ nghỉ có khu vườn, chỗ đậu xe riêng miễn phí, nhà hàng và quầy bar. Khách sạn nằm cách Trung tâm thương mại Vincom Ngô Quyền khoảng 45 km và Hai Phong Railway Station 45 km. Chỗ nghỉ cung cấp lễ tân 24/24, dịch vụ đưa đón sân bay, dịch vụ phòng và Wi-Fi miễn phí ở toàn bộ chỗ nghỉ.

Các phòng được trang bị điều hòa, TV màn hình phẳng có truyền hình cáp, tủ lạnh, ấm đun nước, vòi sen, đồ vệ sinh cá nhân miễn phí và bàn làm việc. Tất cả các phòng có phòng tắm riêng, máy sấy tóc và ga trải giường.

Khách sạn có phục vụ bữa sáng thực đơn à la carte hằng ngày.

Sân bay Quốc tế Cát Bi cách 50 km.",9.4,3.0
https://www.booking.com/hotel/vn/asean-hai-duong.vi.html,Asean Hotel,"168 Trần Hưng Đạo, Hải Dương, Việt Nam","Nằm ở Hải Dương, cách Nhà hát lớn Hải Phòng 43 km, Asean Hotel cung cấp chỗ nghỉ có phòng chờ chung, chỗ đậu xe riêng miễn phí và sân hiên. Ngoài Wi-Fi miễn phí, khách sạn 3 sao này còn cung cấp quầy lễ tân 24 giờ. Khách sạn có phòng gia đình.

Các căn đi kèm điều hòa, tủ lạnh, minibar, ấm đun nước, vòi xịt/chậu rửa vệ sinh, đồ vệ sinh cá nhân miễn phí và bàn làm việc. Ngoài phòng tắm riêng được trang bị vòi sen và máy sấy tóc, các phòng tại khách sạn đều có view thành phố. Tại Asean Hotel, tất cả các phòng có ga trải giường và khăn tắm.

Chỗ nghỉ cách Trung tâm thương mại Vincom Ngô Quyền 44 km và Hai Phong Railway Station 44 km. Sân bay gần nhất là Sân bay Quốc tế Cát Bi, cách Asean Hotel 50 km.",6.9,3.0
https://www.booking.com/hotel/vn/nk-cong-doan-hai-duong.vi.html,NK Công Đoàn Hải Dương,"107b Chi Lăng, Hải Dương, Việt Nam","Nằm ở Hải Dương, cách Nhà hát lớn Hải Phòng 46 km, NK Công Đoàn Hải Dương cung cấp chỗ nghỉ có khu vườn, chỗ đậu xe riêng miễn phí, sân hiên và nhà hàng. Khách sạn nằm cách Trung tâm thương mại Vincom Ngô Quyền khoảng 46 km và Hai Phong Railway Station 46 km. Chỗ nghỉ cung cấp lễ tân 24/24, dịch vụ đưa đón sân bay, dịch vụ phòng và Wi-Fi miễn phí ở toàn bộ chỗ nghỉ.

Tại khách sạn, các phòng đều có tủ quần áo. Với phòng tắm riêng được trang bị vòi xịt/chậu rửa vệ sinh và đồ vệ sinh cá nhân miễn phí, tất cả các phòng tại NK Công Đoàn Hải Dương có TV màn hình phẳng và điều hòa, trong đó một số phòng có ban công. Phòng khách đều có bàn làm việc và ấm đun nước để khách sử dụng.

Sân bay Quốc tế Cát Bi cách 52 km.",7.8,3.0
https://www.booking.com/hotel/vn/purple-lotus.vi.html,Purple Lotus Hotel,"232 Đường Trường Chinh, Phường Tân Bình, Thành Phố Hải Dương, Tỉnh Hải Dương, Hải Dương, Việt Nam","Nằm ở Hải Dương, cách Nhà hát lớn Hải Phòng 48 km, Purple Lotus Hotel cung cấp chỗ nghỉ có trung tâm thể dục, chỗ đậu xe riêng miễn phí, phòng chờ chung và nhà hàng. Ngoài Wi-Fi miễn phí, khách sạn 3 sao này còn cung cấp dịch vụ phòng và quầy lễ tân 24 giờ. Chỗ nghỉ này cung cấp máy ATM và dịch vụ tiền sảnh cho khách.

Khách sạn cung cấp cho khách các phòng có điều hòa, bàn làm việc, ấm đun nước, tủ lạnh, minibar, két an toàn, TV màn hình phẳng và phòng tắm riêng với vòi sen. Một số phòng có bếp với bếp. Tất cả các phòng có tủ quần áo.

Purple Lotus Hotel cách Trung tâm thương mại Vincom Ngô Quyền 48 km. Sân bay Quốc tế Cát Bi cách 67 km.",8.8,3.0
https://www.booking.com/hotel/vn/phuong-anh.vi.html,Phuong Anh Hotel 1 Hai Duong,"Lot 18.1-3 Nam Cuong Urban Western, Ngo Quyen, Hải Dương, Việt Nam","Phuong Anh Hotel 1 Hai Duong tọa lạc ở Hải Dương, cách Chợ Thanh Bình khoảng 10 phút lái xe. Các phòng máy lạnh hiện đại tại đây đi kèm với Wi-Fi miễn phí và TV màn hình phẳng. Khách sạn có trung tâm thể dục và trung tâm dịch vụ doanh nhân. Nhà hàng ngay trong khuôn viên nơi này phục vụ các món ăn Việt Nam và quốc tế cũng như cung cấp dịch vụ ăn uống tại phòng.

Tất cả các phòng đều có tầm nhìn ra khu vườn hoặc thành phố và đi kèm với sàn trải thảm cũng như máy lạnh. Minibar và tiện nghi pha trà/cà phê cũng được cung cấp trong phòng. Các phòng tắm riêng được trang bị vòi sen.

Phuong Anh Hotel 1 Hai Duong nằm trong bán kính 1 km từ Trung tâm Thành phố Hải Dương và 4 km từ Ga Xe lửa Hải Dương. Khách sạn cách Hồ An Dương 30 phút lái xe. Thủ đô Hà Nội cách đó 50 km.

Khách sạn cung cấp dịch vụ giặt là và vận chuyển sân bay kèm phụ phí. Du khách có thể cất giữ hành lý tại quầy lễ tân 24 giờ. Chỗ đỗ xe được cung cấp miễn phí.",7.7,
https://www.booking.com/hotel/vn/phuong-anh-2.vi.html,Phuong Anh Hotel 2 Hai Duong,"03 Truong Chinh Street, Hải Dương, Việt Nam","Tọa lạc ở Hải Dương, cách Nhà hát lớn Hải Phòng 46 km, Phuong Anh Hotel 2 Hai Duong cung cấp chỗ nghỉ có xe đạp miễn phí, chỗ đậu xe riêng miễn phí, khu vườn và phòng chờ chung. Khách sạn 3 sao này cung cấp bếp chung, dịch vụ phòng và Wi-Fi miễn phí. Các món ăn Mỹ, Quảng Đông, Hoa và Anh được phục vụ tại nhà hàng ngay trong khuôn viên.

Phòng khách tại khách sạn được trang bị điều hòa, khu vực ghế ngồi, TV màn hình phẳng có truyền hình vệ tinh, két an toàn, phòng tắm riêng, vòi xịt/chậu rửa vệ sinh, đồ vệ sinh cá nhân miễn phí và máy sấy tóc. Phuong Anh Hotel 2 Hai Duong cung cấp một số căn nhìn ra thành phố và các phòng được thiết kế có sân trong. Tại chỗ nghỉ, phòng nào cũng có ga trải giường và khăn tắm.

Chỗ nghỉ có phục vụ bữa sáng thực đơn buffet, thực đơn à la carte hoặc kiểu lục địa hằng ngày.

Phuong Anh Hotel 2 Hai Duong có sân hiên. Đi xe đạp là hoạt động được ưa chuộng trong khu vực. Ngoài ra, khách sạn có dịch vụ thuê ô tô.

Thành thạo tiếng Anh, tiếng Indonesia, tiếng Nhật và tiếng Malaysia, đội ngũ nhân viên tại lễ tân 24/24 luôn túc trực để hỗ trợ khách.

Phuong Anh Hotel 2 Hai Duong cách Trung tâm thương mại Vincom Ngô Quyền 46 km và Hai Phong Railway Station 46 km. Chỗ nghỉ cách Sân bay Quốc tế Cát Bi 52 km và cung cấp dịch vụ đưa đón sân bay mất phí.",7.7,3.0
https://www.booking.com/hotel/vn/mandala-amp-suites-hai-duong.vi.html,Mandala Hotel & Suites Hai Duong,"Ngã tư Lê Thanh Nghị - Yết Kiêu, Hải Dương, Việt Nam","Nằm ở Hải Dương, cách Nhà hát lớn Hải Phòng 47 km và Trung tâm thương mại Vincom Ngô Quyền 47 km, Mandala Hotel & Suites Hai Duong cung cấp chỗ nghỉ có nhà hàng và Wi-Fi miễn phí ở toàn bộ chỗ nghỉ cũng như chỗ đậu xe riêng miễn phí cho khách lái xe. Khách sạn 4 sao này có dịch vụ phòng và quầy lễ tân 24 giờ. Khách sạn có hồ bơi trong nhà và dịch vụ tiền sảnh.

Khách sạn sẽ cung cấp cho khách các phòng được trang bị điều hòa có bàn làm việc, ấm đun nước, tủ lạnh, két an toàn, TV màn hình phẳng, ban công và phòng tắm riêng với vòi sen. Tại Mandala Hotel & Suites Hai Duong, các phòng đều có ga trải giường và khăn tắm.

Hằng ngày, chỗ nghỉ có các lựa chọn thực đơn buffet, thực đơn à la carte hoặc kiểu lục địa cho bữa sáng.

Chỗ nghỉ cách Hai Phong Railway Station 47 km. Chỗ nghỉ cách Sân bay Quốc tế Cát Bi 69 km và cung cấp dịch vụ đưa đón sân bay mất phí.",9.7,4.0
https://www.booking.com/hotel/vn/khach-san-song-lo.vi.html,Khách Sạn Sông Lô,"281 Bùi Thị Xuân, Hải Dương, Việt Nam","Nằm cách Nhà hát lớn Hải Phòng 45 km và Trung tâm thương mại Vincom Ngô Quyền 46 km, Khách Sạn Sông Lô cung cấp các phòng ở Hải Dương. Khách sạn 2 sao này cung cấp dịch vụ phòng, quầy lễ tân 24 giờ và Wi-Fi miễn phí. Khách sạn có phòng gia đình.

Tại khách sạn, mỗi phòng đều có ban công. Tại Khách Sạn Sông Lô, tất cả các phòng đều có điều hòa và TV màn hình phẳng.

Chỗ nghỉ cách Hai Phong Railway Station 46 km. Sân bay gần nhất là Sân bay Quốc tế Cát Bi, cách Khách Sạn Sông Lô 51 km.",8.2,2.0
https://www.booking.com/hotel/vn/star-hai-duong.vi.html,Star Hotel Hai Duong,"Lot  62, 26 Do Thi Phia Dong, Block 1, Hai Tan Ward, Hải Dương, Việt Nam","Tọa lạc ở Hải Dương, cách Nhà hát lớn Hải Phòng 45 km, Star Hotel Hai Duong cung cấp chỗ nghỉ có xe đạp miễn phí, chỗ đậu xe riêng miễn phí, khu vườn và phòng chờ chung. Ngoài nhà hàng, khách sạn 1 sao này còn có các phòng với điều hòa được trang bị Wi-Fi miễn phí, trong đó mỗi phòng đều có phòng tắm riêng. Chỗ nghỉ này cung cấp bếp chung, dịch vụ phòng và dịch vụ thu đổi ngoại tệ cho khách.

Tất cả các căn được trang bị TV màn hình phẳng có truyền hình cáp, minibar, ấm đun nước, vòi xịt/chậu rửa vệ sinh, đồ vệ sinh cá nhân miễn phí và tủ quần áo. Tại khách sạn, tất cả các phòng đều có ga trải giường và khăn tắm.

Star Hotel Hai Duong có sân hiên phơi nắng. Đi xe đạp là hoạt động được ưa chuộng trong khu vực. Ngoài ra, chỗ nghỉ có dịch vụ thuê ô tô.

Với đội ngũ nhân viên thành thạo tiếng Anh, tiếng Indonesia, tiếng Malaysia và tiếng Việt, dịch vụ thông tin luôn có sẵn tại lễ tân.

Star Hotel Hai Duong cách Trung tâm thương mại Vincom Ngô Quyền 46 km và Hai Phong Railway Station 46 km. Sân bay gần nhất là Sân bay Quốc tế Cát Bi, cách khách sạn 51 km, đồng thời chỗ nghỉ này cũng cung cấp dịch vụ đưa đón sân bay mất phí.",7.8,1.0
https://www.booking.com/hotel/vn/apec-mandala-wyndham-hai-duong-hai-duong.vi.html,Apec Mandala hotel & suites Hải dương,"Cầu Hải Tân, Hải Dương, Việt Nam","Tọa lạc ở Hải Dương, cách Nhà hát lớn Hải Phòng 46 km, Trung tâm thương mại Vincom Ngô Quyền 46 km và Hai Phong Railway Station 46 km, Apec Mandala hotel & suites Hải dương cung cấp chỗ nghỉ có sân hiên và Wi-Fi miễn phí. Căn hộ có hồ bơi riêng, khu vườn và chỗ đậu xe riêng miễn phí.

Căn hộ điều hòa này có 1 phòng ngủ riêng biệt, bếp đầy đủ tiện nghi, cùng 1 phòng tắm. TV màn hình phẳng được cung cấp.

Trong thời gian lưu trú tại căn hộ, khách được tùy ý sử dụng tiện nghi chăm sóc sức khoẻ và spa, bao gồm hồ bơi trong nhà và trung tâm thể dục.

Sân bay gần nhất là Sân bay Quốc tế Cát Bi, cách Apec Mandala hotel & suites Hải dương 67 km.",7.8,3.0
https://www.booking.com/hotel/vn/spacious-serviced-studio.vi.html,Spacious studio in Hai Duong city,"Lê Thanh Nghị, Hải Dương, Việt Nam","Tọa lạc ở Hải Dương, Spacious studio in Hai Duong city cung cấp hồ bơi riêng và Wi-Fi miễn phí. Khách lưu trú tại căn hộ này có thể sử dụng bếp đầy đủ tiện nghi.

Căn hộ có 1 phòng ngủ này cung cấp cho khách TV màn hình phẳng, điều hòa và phòng khách.

Căn hộ cách Nhà hát lớn Hải Phòng 46 km và Trung tâm thương mại Vincom Ngô Quyền 46 km.",,
https://www.booking.com/hotel/vn/new-home-hai-duong.vi.html,Milano Hotel,"Số 30 ngõ 65 Trường Chinh, Phường Tứ Minh, Hải Dương, Việt Nam","Milano Hotel có khu vườn, sân hiên, nhà hàng và quầy bar ở Hải Dương. Chỗ nghỉ cung cấp lễ tân 24/24, dịch vụ đưa đón sân bay, dịch vụ phòng và Wi-Fi miễn phí ở toàn bộ chỗ nghỉ.

Tại khách sạn, tất cả các phòng có bàn làm việc, TV màn hình phẳng, phòng tắm riêng, ga trải giường và khăn tắm.

Sân bay Quốc tế Cát Bi cách 66 km.",9.2,
https://www.booking.com/hotel/vn/lotus-hai-duong.vi.html,Lotus Hotel Hai Duong,"447 Truong Chinh, Thanh Binh, Hải Dương, Việt Nam","Tọa lạc ở Hải Dương, cách Nhà hát lớn Hải Phòng 48 km, Lotus Hotel Hai Duong cung cấp chỗ nghỉ có phòng chờ chung, chỗ đậu xe riêng miễn phí và sân hiên. Khách sạn 2 sao này có phòng giữ hành lý. Khách sạn cũng cung cấp Wi-Fi miễn phí và dịch vụ đưa đón sân bay mất phí.

Tất cả các căn tại khách sạn được trang bị điều hòa, khu vực ghế ngồi, TV màn hình phẳng có truyền hình cáp, két an toàn, phòng tắm riêng, vòi sen, đồ vệ sinh cá nhân miễn phí và máy sấy tóc. Một số phòng có bếp với bếp. Tại Lotus Hotel Hai Duong, tất cả các phòng đều có ga trải giường và khăn tắm.

Chỗ nghỉ cách Trung tâm thương mại Vincom Ngô Quyền 48 km. Sân bay Quốc tế Cát Bi cách 67 km.",8.8,2.0
https://www.booking.com/hotel/vn/nc-home.vi.html,BO Hotel Home Căn hộ chung cư cao cấp,"chung cư ecorivers Hải Dương, Hải Dương, Việt Nam","Tọa lạc cách Nhà hát lớn Hải Phòng 46 km và Trung tâm thương mại Vincom Ngô Quyền 47 km, BO Hotel Home Căn hộ chung cư cao cấp cung cấp các phòng điều hòa và phòng tắm riêng ở Hải Dương. Guest house thân thiện với vật nuôi này cũng có Wi-Fi miễn phí.

Tại guest house, tất cả các phòng đều có tủ quần áo, TV màn hình phẳng, phòng tắm riêng, ga trải giường và khăn tắm. Tất cả các căn đều có tủ lạnh.

BO Hotel Home Căn hộ chung cư cao cấp cách Hai Phong Railway Station 47 km. Sân bay Quốc tế Cát Bi cách 52 km.",,
https://www.booking.com/hotel/vn/khach-san-mio.vi.html,Mio Hotel,"Lô 15.32 KĐT Phía Tây, Phường Tứ Minh, TP Hải Dương, Tỉnh Hải Dương, Hải Dương, Việt Nam","Mio Hotel nằm ở Hải Dương và có nhà hàng. Khách sạn 1 sao này có dịch vụ đưa đón miễn phí và dịch vụ phòng. Tại đây có sân hiên và khách có thể sử dụng Wi-Fi miễn phí và chỗ đậu xe riêng miễn phí.

Khách tại khách sạn sẽ có thể tận hưởng các hoạt động ở trong Hải Dương và khu vực xung quanh, như leo núi.

Nhân viên Mio Hotel luôn có mặt ở lễ tân để đề xuất du khách.

Sân bay Quốc tế Cát Bi cách 66 km.",8.6,1.0
https://www.booking.com/hotel/vn/nam-cuong-hai-duong.vi.html,Nam Cuong Hai Duong Hotel,"Số 1 Đại Lộ Võ Nguyên Giáp, Hải Dương, Việt Nam","Nam Cuong Hai Duong Hotel có hồ bơi ngoài trời, nhà hàng mở cửa 24 giờ và các phòng nghỉ máy lạnh với truy cập Internet miễn phí cả ngày. Quầy bar ở tầng 25 có tầm nhìn toàn cảnh thành phố.

Các phòng tại Nam Cuong Hai được trang bị TV và minibar. Phòng tắm riêng có vòi sen và đồ vệ sinh cá nhân.

Du khách có thể thư giãn trong bồn tạo sóng hoặc chăm sóc bản thân với dịch vụ mát-xa hoặc chăm sóc sắc đẹp. Tại đây có một số hoạt động giải trí năng động như các lớp tập thể dục, sân tennis và bida.

Quý khách có thể thưởng thức ẩm thực Việt Nam, châu Á và châu Âu cả ngày lẫn đêm tại Nhà hàng Garden View. Khách sạn có một số quầy bar cho khách thư giãn với đồ uống.

Nam Cuong Hai Duong Hotel cách thành phố Hà Nội 1,5 giờ lái xe. Sân bay Quốc tế Nội Bài cách đó 2 giờ lái xe.",7.9,4.0
https://www.booking.com/hotel/vn/po-duy-anh-hotel-h-i-d-ng.vi.html,Duy Anh Hotel,"No.19, Vu Van Dung Street, Quang Trung Ward, 170000 Hải Dương, Việt Nam","Tọa lạc cách Nhà hát lớn Hải Phòng 44 km, Duy Anh Hotel cung cấp chỗ nghỉ 3 sao ở Hải Dương và có quầy bar. Chỗ nghỉ này có các tiện nghi như nhà hàng, dịch vụ đưa đón miễn phí và dịch vụ phòng, cùng với Wi-Fi miễn phí ở toàn bộ chỗ nghỉ. Chỗ nghỉ này cung cấp quầy lễ tân 24 giờ và dịch vụ tiền sảnh cho khách.

Khách sạn cách Trung tâm thương mại Vincom Ngô Quyền 44 km và Hai Phong Railway Station 44 km.","7,5",3.0
https://www.booking.com/hotel/vn/po-kim-bao-hotel-h-i-d-ng.vi.html,Kim Bao Hotel,"16 Vuong Chieu,Phuong.Binh Han, ​03000 Hải Dương, Việt Nam","Nằm cách Nhà hát lớn Hải Phòng 44 km, Kim Bao Hotel cung cấp chỗ nghỉ 3 sao ở Hải Dương và có quầy bar. Chỗ nghỉ này có các tiện nghi như nhà hàng, dịch vụ phòng và quầy lễ tân 24 giờ, cùng với Wi-Fi miễn phí ở toàn bộ chỗ nghỉ. Chỗ nghỉ này cung cấp dịch vụ tiền sảnh, cùng dịch vụ thu đổi ngoại tệ cho khách.

Khách sạn cách Trung tâm thương mại Vincom Ngô Quyền 44 km và Hai Phong Railway Station 44 km.","8,5",4.0
https://www.booking.com/hotel/vn/nha-nghi-truc-lam.vi.html,Nhà nghỉ Trúc Lâm,"LÃ´ 25.8 TrÆ°á»ng Chinh, Hải Dương, Việt Nam","Nhà nghỉ Trúc Lâm nằm ở Hải Dương và có sân hiên. Chỗ nghỉ này có ban công, chỗ đậu xe riêng miễn phí và Wi-Fi miễn phí.

Nhà nghỉ B&B có TV màn hình phẳng. Khăn tắm và ga trải giường có sẵn ở nhà nghỉ B&B.

Sân bay Quốc tế Cát Bi cách 67 km.",1,
https://www.booking.com/hotel/vn/khach-san-phuong-dong-hai-duong.vi.html,Khách sạn Phương Đông,"Nguyễn Lương Bằng 37, Hải Dương, Việt Nam","Tọa lạc ở Hải Dương, cách Nhà hát lớn Hải Phòng 49 km, Khách sạn Phương Đông cung cấp chỗ nghỉ có khu vườn, chỗ đậu xe riêng miễn phí, sân hiên và nhà hàng. Ngoài Wi-Fi miễn phí, khách sạn 1 sao này còn cung cấp dịch vụ phòng và quầy lễ tân 24 giờ. Du khách có thể thưởng thức đồ uống tại quầy bar.

Tại khách sạn, phòng nào cũng có điều hòa, bàn làm việc, TV màn hình phẳng, phòng tắm riêng, ga trải giường, khăn tắm và ban công với view vườn. Phòng khách đều có tủ quần áo và ấm đun nước để khách sử dụng.

Khách sạn Phương Đông cách Trung tâm thương mại Vincom Ngô Quyền 49 km. Sân bay Quốc tế Cát Bi cách 67 km.",7.4,1.0
https://www.booking.com/hotel/vn/can-ho-hai-duong.vi.html,Căn hộ studio lighthouse,"Ecorivers Hải dương H12803, Hải Dương, Việt Nam","Nhìn ra hồ, Căn hộ studio lighthouse cung cấp chỗ nghỉ tọa lạc ở Hải Dương, cách Nhà hát lớn Hải Phòng 46 km và Trung tâm thương mại Vincom Ngô Quyền 47 km. Chỗ nghỉ này có hồ bơi riêng, Wi-Fi miễn phí và chỗ đậu xe riêng miễn phí.

Căn hộ điều hòa này có 1 phòng ngủ với ban công nhìn ra thành phố và bếp đầy đủ tiện nghi. Khăn tắm và ga trải giường có sẵn ở căn hộ.

Căn hộ cách Hai Phong Railway Station 47 km. Sân bay gần nhất là Sân bay Quốc tế Cát Bi, cách Căn hộ studio lighthouse 52 km.",9.3,
https://www.booking.com/hotel/vn/khach-san-phuong-dong-hai-duong1.vi.html,Khách sạn New Phương Đông,"Nguyễn Lương Bằng, Hải Dương, Việt Nam","Tọa lạc ở Hải Dương, cách Nhà hát lớn Hải Phòng 49 km, Khách sạn New Phương Đông cung cấp chỗ nghỉ có khu vườn, chỗ đậu xe riêng miễn phí, sân hiên và nhà hàng. Ngoài Wi-Fi miễn phí, khách sạn 1 sao này còn cung cấp dịch vụ phòng và quầy lễ tân 24 giờ. Du khách có thể thưởng thức đồ uống tại quầy bar.

Tại khách sạn, mỗi phòng đều có điều hòa, bàn làm việc, TV màn hình phẳng, phòng tắm riêng, ga trải giường, khăn tắm và ban công với view vườn. Các phòng đều có tủ quần áo và ấm đun nước để khách sử dụng.

Khách sạn New Phương Đông cách Trung tâm thương mại Vincom Ngô Quyền 49 km. Sân bay Quốc tế Cát Bi cách 67 km.",3,1.0
https://www.booking.com/hotel/vn/can-ho-chung-cu-cao-cap-hai-duong.vi.html,Căn hộ chung cư cao cấp lighthouse,"Cầu Hải Tân Tầng 2803, Hải Dương, Việt Nam","Căn hộ chung cư cao cấp lighthouse cung cấp chỗ nghỉ tọa lạc ở Hải Dương, cách Nhà hát lớn Hải Phòng 47 km, Trung tâm thương mại Vincom Ngô Quyền 47 km và Hai Phong Railway Station 48 km. Chỗ nghỉ này có hồ bơi riêng và chỗ đậu xe riêng miễn phí.

Căn hộ điều hòa này có 2 phòng ngủ với ban công nhìn ra thành phố và bếp đầy đủ tiện nghi. Khăn tắm và ga trải giường có sẵn ở căn hộ.

Sân bay gần nhất là Sân bay Quốc tế Cát Bi, cách căn hộ 53 km.",9.5,
https://www.booking.com/hotel/vn/truc-lam-hai-duong2.vi.html,Trúc lâm hotel,"Trường Chinh, Hải Dương, Việt Nam","Trúc lâm hotel tọa lạc ở Hải Dương và có sân hiên. Chỗ nghỉ này có ban công, chỗ đậu xe riêng miễn phí và Wi-Fi miễn phí.

Nhà nghỉ B&B có TV màn hình phẳng. Khăn tắm và ga trải giường có sẵn ở nhà nghỉ B&B.

Sân bay Quốc tế Cát Bi cách 67 km.",,
https://www.booking.com/hotel/vn/lakha-house.vi.html,LAKHA HOUSE,"Tòa H1 lighthouse ecopack phường Hải Tân, Thành phố Hải Dương, Hải Dương, Việt Nam","Tọa lạc ở Hải Dương, LAKHA HOUSE cung cấp chỗ nghỉ có hồ bơi riêng và Wi-Fi miễn phí. Căn hộ này cách Nhà hát lớn Hải Phòng 46 km và Trung tâm thương mại Vincom Ngô Quyền 47 km.

Căn hộ điều hòa này có 1 phòng ngủ riêng biệt với ban công và bếp đầy đủ tiện nghi. TV màn hình phẳng được cung cấp.

Căn hộ cách Hai Phong Railway Station 47 km. Sân bay gần nhất là Sân bay Quốc tế Cát Bi, cách LAKHA HOUSE 53 km.",,
https://www.booking.com/hotel/vn/gan-cho-dua-gia-loc-hai-duong.vi.html,"Gần chợ dưa , gia lộc , hải dương","Gần chợ dưa , tp hải dương , hải dương, Hải Dương, Việt Nam","Nằm ở Hải Dương, cách Nhà hát lớn Hải Phòng 47 km và Trung tâm thương mại Vincom Ngô Quyền 48 km, Gần chợ dưa, gia lộc, hải dương cung cấp chỗ nghỉ có các tiện nghi như Wi-Fi miễn phí và TV màn hình phẳng. Căn hộ cách Hai Phong Railway Station 48 km.

Căn hộ điều hòa này có 1 phòng ngủ với ban công nhìn ra khu vườn và bếp đầy đủ tiện nghi.

Sân bay gần nhất là Sân bay Quốc tế Cát Bi, cách căn hộ 69 km.",,
https://www.booking.com/hotel/vn/hai-duong-garden-hai-duong.vi.html,Hai Duong Garden,"54 Do Ngoc Du Tan Binh, Hải Dương, Việt Nam","Nằm ởHải Dương, cách Nhà hát lớn Hải Phòng 47 km và Trung tâm thương mại Vincom Ngô Quyền 48 km, Hai Duong Garden cung cấp chỗ nghỉ có Wi-Fi miễn phí, khu vườn với sân hiên, phòng tập thể dục và bể sục. Chỗ nghỉ có điều hòa và bể sục.

Căn hộ có ban công, khu vực ghế ngồi, TV màn hình phẳng truyền hình cáp, bếp đầy đủ tiện nghi gồm tủ lạnh và lò vi sóng, cùng phòng tắm riêng được trang bị vòi xịt/chậu rửa vệ sinh và đồ vệ sinh cá nhân miễn phí.

Khách cũng có thể thư giãn trong khu vực phòng chờ chung.

Hai Duong Garden cách Hai Phong Railway Station 48 km. Sân bay gần nhất là Sân bay Quốc tế Cát Bi, cách chỗ nghỉ 68 km, đồng thời chỗ nghỉ này cũng cung cấp dịch vụ đưa đón sân bay mất phí.",7,4.0
https://www.booking.com/hotel/vn/oasis-appartment.vi.html,Oasis Appartment,"Km4, nguyễn lương bằng, tứ minh, thành phố Hải Dương 4, Hải Dương, Việt Nam","Tọa lạc ở Hải Dương, cách Nhà hát lớn Hải Phòng 49 km và Trung tâm thương mại Vincom Ngô Quyền 49 km, Oasis Appartment cung cấp chỗ nghỉ có điều hòa và khu vườn với sân hiên.

Sân bay Quốc tế Cát Bi cách 68 km.",,
