url,name,location,description,point,star
https://www.booking.com/hotel/vn/yourhome-naphon-homestay.vi.html,Your home Mai Chau,"Poom Kính, Poom Coọng Xã Nà Phòn, huyện Mai Châu, tỉnh Hòa Bình, Mai Châu, Việt Nam","Nhìn ra núi, Your home Mai Chau ở Mai Châu cung cấp chỗ nghỉ có xe đạp miễn phí, khu vườn, phòng chờ chung, sân hiên và quầy bar. Homestay có WiFi và chỗ đậu xe riêng miễn phí.

Nơi đây còn có phòng tắm riêng với vòi xịt/chậu rửa vệ sinh ở tất cả các căn, cùng đồ vệ sinh cá nhân miễn phí, máy sấy tóc và dép đi trong phòng.

Your home Mai Chau có phục vụ bữa sáng kiểu Á mỗi buổi sáng.

Du khách có thể đi xe đạp để khám phá khu vực xung quanh.

Sân bay gần nhất là Sân bay Thọ Xuân, cách chỗ nghỉ 126 km, đồng thời chỗ nghỉ này cũng cung cấp dịch vụ đưa đón sân bay mất phí.",9.1,
https://www.booking.com/hotel/vn/quan-hang-homestay.vi.html,Homestay Quân Hằng,"La Village, Chieng Chau Ward, Mai Chau, Hoa BInh Homestay No 86, Mai Châu, Việt Nam","Nhìn ra núi, Homestay Quân Hằng nằm ở Mai Châu và có nhà hàng, bếp chung, quầy bar, khu vườn cũng như sân hiên. WiFi và chỗ đậu xe riêng đều có sẵn tại homestay miễn phí.

Nơi đây còn có phòng tắm riêng với vòi xịt/chậu rửa vệ sinh ở tất cả các căn, cùng đồ vệ sinh cá nhân miễn phí, máy sấy tóc và dép đi trong phòng.

Homestay Quân Hằng có cả dịch vụ cho thuê xe đạp và dịch vụ cho thuê ô tô, đồng thời du khách có thể đi xe đạp gần đó.

Sân bay Thọ Xuân cách 124 km.",9.2,
https://www.booking.com/hotel/vn/nha-cua-bin-bins-house-xom-bin-xa-pu-bin-huyen-mai-chau-hoa-binh.vi.html,"Nhà Của Bin - Bin's House (Xóm Bin, xã Pù Bin, huyện Mai Châu, Hòa Bình)","Xóm Bin, xã Thành Sơn, huyện Mai Châu, tỉnh Hòa Bình, Mai Châu, Việt Nam","Tọa lạc ở Mai Châu, Nhà Của Bin - Bin's House (Xóm Bin, xã Pù Bin, huyện Mai Châu, Hòa Bình) cung cấp chỗ nghỉ có Wi-Fi miễn phí, điều hòa và khu vườn với sân hiên phơi nắng. Chỗ đậu xe riêng có thể được sắp xếp với một khoản phụ phí.

Du khách có thể câu cá để khám phá khu vực xung quanh, đồng thời căn hộ có thể sắp xếp dịch vụ cho thuê xe đạp.

Sân bay Thọ Xuân cách 150 km.",9.8,
https://www.booking.com/hotel/vn/que-homestay-hoa-binh.vi.html,Quế Homestay,"Xóm Te Xã Xăm Khòe  Huyện Mai Châu, Hòa Bình, Việt Nam","Tọa lạc ở Hòa Bình, Quế Homestay cung cấp chỗ nghỉ có Wi-Fi miễn phí, điều hòa và khu vườn.

Nơi đây còn có phòng tắm riêng với vòi xịt/chậu rửa vệ sinh ở một số căn, cùng đồ vệ sinh cá nhân miễn phí, máy sấy tóc và dép đi trong phòng.

Khách có thể thưởng thức bữa sáng thực đơn buffet, kiểu Á hoặc món chay tại chỗ nghỉ.

Sân bay gần nhất là Sân bay Thọ Xuân, cách homestay 130 km.",10,
https://www.booking.com/hotel/vn/hill-house-mai-chau.vi.html,Hill House,"Xóm Nhót, xã Nà Phòn, huyện Mai Châu, tỉnh Hòa Bình, Mai Châu, Việt Nam","Nhìn ra núi, Hill House nằm ở Mai Châu và có nhà hàng, dịch vụ phòng, quầy bar, khu vườn, sân hiên cũng như sân chơi trẻ em. WiFi và chỗ đậu xe riêng đều có sẵn tại homestay miễn phí.

Nơi đây còn có phòng tắm chung với vòi xịt/chậu rửa vệ sinh ở một số căn, cùng đồ vệ sinh cá nhân miễn phí, máy sấy tóc và dép đi trong phòng.

Chỗ nghỉ có phục vụ bữa sáng mỗi buổi sáng, gồm các lựa chọn thực đơn buffet, thực đơn à la carte và kiểu Á.

Hill House có tắm suối nước nóng.

Chỗ nghỉ có cả dịch vụ cho thuê xe đạp và dịch vụ cho thuê ô tô, đồng thời du khách có thể leo núi và đi xe đạp gần đó.

Chỗ nghỉ cách Sân bay Thọ Xuân 127 km và cung cấp dịch vụ đưa đón sân bay mất phí.",9.5,
https://www.booking.com/hotel/vn/hai-duong-guesthouse.vi.html,Hai Duong Guesthouse,"150 Dien Bien Phu, Hòa Bình, Việt Nam","Hai Duong Guesthouse tọa lạc ở Hòa Bình, cách Vietnam National University 44 km. Tại đây có sân hiên và khách có thể sử dụng Wi-Fi miễn phí và chỗ đậu xe riêng miễn phí.

Tại guest house, tất cả các phòng đều có bàn làm việc. Với phòng tắm riêng được trang bị vòi sen và dép đi trong phòng, phòng khách tại Hai Duong Guesthouse có TV và điều hòa, trong đó một số phòng có ban công. Tại chỗ nghỉ, mỗi phòng đều được thiết kế có ga trải giường và khăn tắm.

Thành thạo tiếng Anh và tiếng Việt, đội ngũ nhân viên tại lễ tân luôn sẵn lòng đưa ra hướng dẫn hữu ích về khu vực xung quanh.

Sân bay Quốc tế Nội Bài cách 94 km.",7.2,
https://www.booking.com/hotel/vn/mai-chau-hillside-homestay.vi.html,Mai Chau Hillside Homestay,"Nà Phòn, Mai Châu, Việt Nam","Tọa lạc ở Mai Châu, Mai Chau Hillside Homestay cung cấp chỗ nghỉ có điều hòa với sân hiên và Wi-Fi miễn phí. Homestay có khu vườn và chỗ đậu xe riêng miễn phí.

Khăn tắm và ga trải giường có sẵn ở homestay.

Sân bay gần nhất là Sân bay Thọ Xuân, cách homestay 125 km.",9.7,
https://www.booking.com/hotel/vn/hakuna-matata-mai-chau-mai-chau.vi.html,Hakuna Matata homestay Mai Châu,"120  Chiềng Sại Village ‏‎Mai Châu, Mai Châu, Việt Nam","Hakuna Matata homestay Mai Châu có hồ bơi ngoài trời theo mùa, khu vườn, sân hiên và nhà hàng ở Mai Châu. Chỗ nghỉ có chỗ đậu xe riêng miễn phí và có cả dịch vụ đưa đón sân bay mất phí.

Tất cả các phòng đều được thiết kế có phòng tắm riêng, trong đó một số phòng có sân trong và một số khác cũng nhìn ra núi.

Sân bay Thọ Xuân cách 125 km.",9.5,
https://www.booking.com/hotel/vn/hai-duong-hoa-binh.vi.html,Hai Duong Hotel,"524 Tran Hung Dao, Hòa Bình, Việt Nam","Tọa lạc ở Hòa Bình, cách Vietnam National University 44 km, Hai Duong Hotel có phòng chờ chung. Ngoài xe đạp miễn phí, khách sạn 2 sao này còn có các phòng với điều hòa được trang bị Wi-Fi miễn phí, trong đó mỗi phòng đều có phòng tắm riêng. Chỗ đậu xe riêng có sẵn trong khuôn viên.

Tại khách sạn, tất cả các phòng đều được thiết kế có tủ quần áo. Phòng nào cũng có bàn làm việc và TV màn hình phẳng, ngoài ra một số căn tại Hai Duong Hotel có sân hiên. Tại chỗ nghỉ, mỗi phòng đều có ga trải giường và khăn tắm.

Nhân viên Hai Duong Hotel luôn có mặt ở lễ tân để hướng dẫn du khách.

Sân bay Quốc tế Nội Bài cách 93 km.",6.4,2.0
https://www.booking.com/hotel/vn/thien-binh.vi.html,Thiên Bình Hotel,"Quốc lộ 21A, Hòa Bình, Việt Nam","Nằm ở Hòa Bình, cách Bảo tàng mỹ thuật Việt Nam 35 km, Thiên Bình Hotel cung cấp chỗ nghỉ có khu vườn, chỗ đậu xe riêng miễn phí, phòng chờ chung và sân hiên. Ngoài nhà hàng, khách sạn 3 sao này còn có các phòng với điều hòa được trang bị Wi-Fi miễn phí, trong đó mỗi phòng đều có phòng tắm riêng. Chỗ nghỉ này cung cấp dịch vụ phòng, quầy lễ tân 24 giờ và phòng giữ hành lý cho khách.

Các phòng đều có tủ quần áo và TV màn hình phẳng, ngoài ra một số phòng tại khách sạn có ban công. Tại Thiên Bình Hotel, các phòng được thiết kế có ga trải giường và khăn tắm.

Chỗ nghỉ cách Văn Miếu - Quốc Tử Giám 35 km và Lăng Chủ tịch Hồ Chí Minh 36 km.",6.5,3.0
https://www.booking.com/hotel/vn/ho-da-co-thien-long-resort.vi.html,HỒ ĐÁ CỔ THIÊN LONG RESORT,"Xóm Rổng Tằm, xã Lâm Sơn, Lương Sơn, tỉnh Hòa Bình, Hòa Bình, Việt Nam","Với hồ bơi ngoài trời, khu vườn, cùng sân hiên, HỒ ĐÁ CỔ THIÊN LONG RESORT cung cấp chỗ nghỉ ở Hòa Bình có Wi-Fi miễn phí và nhìn ra núi. Nằm cách Sân vận động Quốc gia Mỹ Đình 41 km, chỗ nghỉ cung cấp quầy bar.

Nhà nghỉ dưỡng điều hòa này có 1 phòng ngủ với ban công nhìn ra hồ bơi.

Nhà nghỉ dưỡng cách Trung tâm thương mại Vincom Nguyễn Chí Thanh 43 km và Bảo tàng mỹ thuật Việt Nam 44 km.",8.2,
https://www.booking.com/hotel/vn/muong-zen-homestay-hoa-binh.vi.html,Mường Zen Homestay,"Dân hoà, Kỳ Sơn, Hoà Bình, Hòa Bình, Việt Nam","Mường Zen Homestay có hồ bơi ngoài trời, khu vườn, sân hiên và nhà hàng ở Hòa Bình. Du khách có thể tận hưởng cảnh khu vườn.

Tại khách sạn, mỗi phòng đều có sân trong với view núi. Với phòng tắm riêng được trang bị vòi xịt/chậu rửa vệ sinh và đồ vệ sinh cá nhân miễn phí, các phòng tại Mường Zen Homestay cũng có Wi-Fi miễn phí, trong đó một số phòng có view hồ bơi. Tại chỗ nghỉ, tất cả các phòng có ga trải giường và khăn tắm.

Mường Zen Homestay có phục vụ bữa sáng thực đơn à la carte mỗi sáng.

Chỗ nghỉ cách Sân bay Quốc tế Nội Bài 79 km và cung cấp dịch vụ đưa đón sân bay mất phí.",10,
https://www.booking.com/hotel/vn/4l-kim-boi.vi.html,4L HOTEL KIM BÔI,"Suối Khoáng Kim Bôi Hòa Bình, Làng Trang, Việt Nam","4L HOTEL KIM BÔI nằm ở Làng Trang và có sân hiên. Chỗ nghỉ cung cấp lễ tân 24/24, dịch vụ đưa đón sân bay, dịch vụ phòng và Wi-Fi miễn phí ở toàn bộ chỗ nghỉ.

Tất cả các phòng tại khách sạn đi kèm khu vực ghế ngồi. Phòng tắm riêng được trang bị vòi xịt/chậu rửa vệ sinh, đồ vệ sinh cá nhân miễn phí và máy sấy tóc. Tại 4L HOTEL KIM BÔI, các phòng đều đi kèm với ga trải giường và khăn tắm.

Sân bay Quốc tế Nội Bài cách 98 km.",7.3,
https://www.booking.com/hotel/vn/hien-hung-nha-nghi-view-ban-lac-mai-chau.vi.html,"Mami Home - Homestay Bản Lác, Mai Châu","Bản Lác Bản Lác Mai Châu, Hòa Bình, Mai Châu, Việt Nam","Nằm ở Mai Châu, Mami Home - Homestay Bản Lác, Mai Châu cung cấp chỗ nghỉ có điều hòa và khu vườn.

Tại đây có phòng tắm riêng đầy đủ tiện nghi với vòi sen và đồ vệ sinh cá nhân miễn phí.

Khách cũng có thể thư giãn trong khu vực phòng chờ chung.

Sân bay gần nhất là Sân bay Thọ Xuân, cách lodge 124 km, đồng thời chỗ nghỉ này cũng cung cấp dịch vụ đưa đón sân bay mất phí.",8.9,
https://www.booking.com/hotel/vn/a-little-hill-retreat.vi.html,A Little Hill Retreat,"Cư Yên, Lương Sơn, Hòa Bình, Việt Nam","Nằm ở Hòa Bình, cách Sân vận động Quốc gia Mỹ Đình 38 km, A Little Hill Retreat cung cấp chỗ nghỉ có hồ bơi ngoài trời, chỗ đậu xe riêng miễn phí, khu vườn và sân hiên. Chỗ nghỉ này có các tiện nghi như nhà hàng, câu lạc bộ trẻ em và dịch vụ phòng, cùng với Wi-Fi miễn phí ở toàn bộ chỗ nghỉ. Khách sạn cung cấp hồ bơi trong nhà và quầy lễ tân 24 giờ.

Tại khách sạn, mỗi phòng đều có tủ quần áo. Phòng tắm riêng được trang bị vòi xịt/chậu rửa vệ sinh, đồ vệ sinh cá nhân miễn phí và máy sấy tóc. Tại A Little Hill Retreat, các phòng đều đi kèm với ga trải giường và khăn tắm.

Chỗ nghỉ cách Trung tâm thương mại Vincom Nguyễn Chí Thanh 40 km và Bảo tàng mỹ thuật Việt Nam 41 km.",1,
https://www.booking.com/hotel/vn/an-huy-homestay-mai-chau-mai-chau-hoa-binh.vi.html,An Huy Homestay Mai Châu,"Tổ dân phố tuyến 5 Chiềng Sại , Mai Châu - Hoà Bình, Mai Châu, Việt Nam","Tọa lạc ở Mai Châu, An Huy Homestay Mai Châu cung cấp chỗ nghỉ có hồ bơi ngoài trời mở quanh năm, khu vườn và sân hiên.

Khách tại homestay có thể thưởng thức bữa sáng thực đơn buffet.

Sân bay Thọ Xuân cách 125 km.",8.9,
https://www.booking.com/hotel/vn/mai-chau-green-house-mai-chau.vi.html,Mai Chau Green house,"Nà Phòn, Mai Châu, Việt Nam","Tọa lạc ở Mai Châu thuộc Hòa Bình, Mai Chau Green house cung cấp Wi-Fi miễn phí và chỗ đậu xe riêng miễn phí.

Nơi đây còn có phòng tắm chung với vòi xịt/chậu rửa vệ sinh ở một số căn, cùng đồ vệ sinh cá nhân miễn phí, máy sấy tóc và dép đi trong phòng.

Khách cũng có thể thư giãn trong khu vườn.

Sân bay gần nhất là Sân bay Thọ Xuân, cách homestay 128 km.",7.1,
https://www.booking.com/hotel/vn/hung-manh-plaza.vi.html,Hùng Mạnh Plaza Hotel,"Ngã ba Mãn Đức, khu 3, thị trấn Mường Khến, huyện Tân Lạc, tỉnh Hòa Bình, Hương Tân Lạc, Việt Nam","Hùng Mạnh Plaza Hotel có khu vườn, phòng chờ chung, sân hiên và nhà hàng ở Hương Tân Lạc. Khách sạn 2 sao này cung cấp dịch vụ phòng, quầy lễ tân 24 giờ và Wi-Fi miễn phí. Chỗ đậu xe riêng miễn phí có sẵn và khách sạn còn cung cấp dịch vụ thuê xe đạp cho những khách muốn khám phá khu vực xung quanh.

Tại khách sạn, các phòng đều đi kèm với điều hòa, bàn làm việc, TV màn hình phẳng, phòng tắm riêng, ga trải giường, khăn tắm và sân trong với view thành phố. Tất cả các phòng đều có tủ quần áo và máy pha cà phê để khách sử dụng.

Sân bay Thọ Xuân cách 113 km.",7.7,2.0
https://www.booking.com/hotel/vn/duong-thim-homestay-mai-chau.vi.html,Duong Thim Homestay Mai Chau,"Nà Phòn, Mai Châu, Việt Nam","Nhìn ra núi, Duong Thim Homestay Mai Chau nằm ở Mai Châu và có nhà hàng, dịch vụ tiền sảnh, quầy bar, khu vườn cũng như sân hiên. WiFi và chỗ đậu xe riêng đều có sẵn tại homestay miễn phí.

Nơi đây còn có phòng tắm chung với vòi xịt/chậu rửa vệ sinh ở một số căn, cùng đồ vệ sinh cá nhân miễn phí, máy sấy tóc và dép đi trong phòng.

Hằng ngày, chỗ nghỉ có các lựa chọn kiểu Mỹ, kiểu Á hoặc món chay cho bữa sáng.

Duong Thim Homestay Mai Chau có dịch vụ cho thuê xe đạp, đồng thời du khách có thể đi xe đạp gần đó.

Sân bay Thọ Xuân cách 128 km.",9,
https://www.booking.com/hotel/vn/tuas-homestay.vi.html,Tua's Homestay,"Bản Lác, Mai Châu, Việt Nam","Nhìn ra núi, Tua's Homestay ở Mai Châu cung cấp chỗ nghỉ có khu vườn, phòng chờ chung và sân hiên. WiFi miễn phí có sẵn ở toàn bộ chỗ nghỉ.

Nơi đây còn có phòng tắm chung với vòi xịt/chậu rửa vệ sinh ở một số căn, cùng đồ vệ sinh cá nhân miễn phí, máy sấy tóc và dép đi trong phòng.

Du khách có thể đi xe đạp để khám phá khu vực xung quanh, đồng thời homestay có thể sắp xếp dịch vụ cho thuê xe đạp.

Sân bay gần nhất là Sân bay Thọ Xuân, cách Tua's Homestay 124 km, đồng thời chỗ nghỉ có cung cấp dịch vụ đưa đón sân bay mất phí.",8.5,
https://www.booking.com/hotel/vn/anns-villa-hill-hoa-binh-city.vi.html,Ann's Villa Hill Hoa Binh City,"68 Đường Tiểu khu 10, phường Tân Thịnh, Hòa Bình, Việt Nam, Hòa Bình, Việt Nam","Với hồ bơi ngoài trời, khu vườn, cùng phòng chờ chung, Ann's Villa Hill Hoa Binh City cung cấp chỗ nghỉ ở Hòa Bình có Wi-Fi miễn phí và nhìn ra núi. Biệt thự cung cấp chỗ đậu xe riêng miễn phí và bếp chung.

Có sân hiên nhìn ra thành phố, biệt thự có 6 phòng ngủ, phòng khách, TV màn hình phẳng truyền hình vệ tinh, bếp đầy đủ tiện nghi, 7 phòng tắm với vòi xịt/chậu rửa vệ sinh và vòi sen. Khăn tắm và ga trải giường có sẵn ở biệt thự.

Biệt thự có phục vụ bữa sáng kiểu Á hằng ngày.

Thành thạo tiếng Anh và tiếng Việt, đội ngũ nhân viên tại lễ tân 24/24 luôn túc trực để hỗ trợ khách.

Khách có thể sử dụng sân chơi trẻ em tại Ann's Villa Hill Hoa Binh City.

Chỗ nghỉ cách Vietnam National University 40 km. Sân bay gần nhất là Sân bay Quốc tế Nội Bài, cách Ann's Villa Hill Hoa Binh City 98 km.",,
https://www.booking.com/hotel/vn/mai-chau-moonlight-ecohouse.vi.html,Mai Chau Moonlight Ecohouse,"69 Bản Lác, Mai Châu, Việt Nam","Với khu vườn và quầy bar, Mai Chau Moonlight Ecohouse nằm ở Mai Châu và cung cấp Wi-Fi miễn phí.

Sân bay gần nhất là Sân bay Thọ Xuân, cách homestay 124 km.",8.8,
https://www.booking.com/hotel/vn/a-la-homestay-hoa-binh1.vi.html,A La Homestay,"xóm pà khôm, xã hang kia, huyện mai châu, tỉnh hòa bình, Hòa Bình, Việt Nam","Tọa lạc ở Hòa Bình, A La Homestay cung cấp Wi-Fi miễn phí, nơi khách có thể trải nghiệm khu vườn, sân hiên và nhà hàng.

Nơi đây còn có phòng tắm riêng với vòi xịt/chậu rửa vệ sinh ở tất cả các căn, cùng đồ vệ sinh cá nhân miễn phí, máy sấy tóc và dép đi trong phòng.

Sân bay gần nhất là Sân bay Thọ Xuân, cách lodge 160 km.",10,
https://www.booking.com/hotel/vn/cao-phong-kayaking-glam.vi.html,Caofong Glamping Village,"Xóm Môn, xã Bắc Phong, Cao Phong, Hòa Bình, Hòa Bình, Việt Nam","Nằm ở Hòa Bình, Caofong Glamping Village cung cấp Wi-Fi miễn phí, nơi khách có thể trải nghiệm hồ bơi ngoài trời, khu vườn và phòng chờ chung.

Nơi đây còn có phòng tắm riêng với vòi xịt/chậu rửa vệ sinh ở một số căn, cùng đồ vệ sinh cá nhân miễn phí, máy sấy tóc và dép đi trong phòng.

Khách tại khu cắm trại có thể thưởng thức bữa sáng thực đơn à la carte. Tại Caofong Glamping Village, khách sẽ tìm thấy nhà hàng phục vụ ẩm thực Việt, địa phương và Á.

Chỗ nghỉ có dịch vụ cho thuê ô tô.

Sân bay Quốc tế Nội Bài cách 111 km.",6.5,
https://www.booking.com/hotel/vn/mai-chau-lodge.vi.html,Mai Chau Lodge,"Mai Chau Town, Hoa Binh Province, Mai Châu, Việt Nam","Nằm ẩn mình giữa thung lũng Mai Châu đẹp đẽ, kỳ nghỉ yên tĩnh, các chuyến đi bộ ngắm cảnh và chạy xe đạp đang chờ đón khách tại nhà nghỉ bằng gỗ này. Tại đây có hồ bơi ngoài trời, phòng tắm hơi ướt và nhà hàng phục vụ bữa sáng tự chọn hàng ngày.

Các phòng máy lạnh tại đây có ban công riêng nhìn ra cảnh núi non hoặc hồ bơi và có những làn gió mát lạnh. Phòng đặc trưng với nội thất kiểu Việt Nam hiện đại, có Wi-Fi miễn phí và máy pha trà/cà phê.

Mai Chau Lodge nằm cách những ngôi làng của dân tộc Lạc, Poom Coong và Nhot 1 km. Cách chợ cuối tuần của vùng 27 km, chỗ ở này cung cấp xe vận chuyển từ Hà Nội và quanh Mai Châu.

Khách có thể sử dụng phòng xông hơi khô sau chuyến chèo thuyền kayak xuôi dòng sông. Chỗ ở này có bãi đậu xe miễn phí cũng như trung tâm dịch vụ doanh nhân, dịch vụ tour và phòng đọc.

Nhìn ra những cánh đồng lúa, Bo Luong Restaurant phục vụ các món ăn địa phương và quốc tế. Nhà hàng cũng có hầm chứa đầy ắp rượu vang. Các bữa ăn của khách cũng có thể được mang đến tận phòng hoặc phục vụ ngoài trời cạnh hồ nước.",8.1,3.0
https://www.booking.com/hotel/vn/veque-farm-4-netflix-bi-a-bbq-rap-chieu-phim-ngoai-troi-karaoke.vi.html,"Veque farm 4 - Netflix, Bi-a, BBQ, Rạp chiếu phim ngoài trời, Karaoke","edu farm, tổ 9, xuân Linh, xã Thuỷ Xuân Tiên, chương mỹ, hà nội, Ðồng Gội, Việt Nam","Veque farm 4 - Netflix, Bi-a, BBQ, Rạp chiếu phim ngoài trời, Karaoke tọa lạc ở Ðồng Gội, cách Trung tâm thương mại Vincom Nguyễn Chí Thanh 36 km, Sân vận động Quốc gia Mỹ Đình 36 km và Bảo tàng mỹ thuật Việt Nam 37 km. Chỗ nghỉ này có hồ bơi riêng, Wi-Fi miễn phí và chỗ đậu xe riêng miễn phí.

Biệt thự điều hòa này có 3 phòng ngủ với sân hiên nhìn ra khu vườn và bếp đầy đủ tiện nghi. TV màn hình phẳng được cung cấp.

Biệt thự có phục vụ bữa sáng kiểu Á hằng ngày.

Veque farm 4 - Netflix, Bi-a, BBQ, Rạp chiếu phim ngoài trời, Karaoke cách Văn Miếu - Quốc Tử Giám 37 km và Lăng Chủ tịch Hồ Chí Minh 37 km.",,
https://www.booking.com/hotel/vn/hoa-binh-i.vi.html,Hoa Binh Hotel,"367 An Duong Vuong, Hòa Bình, Việt Nam","Hoa Binh Hotel I cung cấp chỗ ở tại thành phố Hòa Bình. Khách sạn có sân chơi cho trẻ em và tầm nhìn ra quang cảnh núi non. Du khách có thể thưởng thức bữa ăn tại nhà hàng hoặc đồ uống ở quầy bar. Chỗ đỗ xe riêng miễn phí được cung cấp ngay trong khuôn viên.

Phòng nghỉ tại đây được trang bị TV truyền hình cáp màn hình phẳng và ổ cắm cho iPod. Một số phòng nghỉ có khu vực tiếp khách, nơi du khách có thể thư giãn. Một số phòng nhìn ra quang cảnh khu vườn hoặc thành phố. Các phòng đi kèm phòng tắm riêng. Ngoài ra còn được cung cấp áo choàng tắm và dép. Trong phòng cũng được trang bị TV với các kênh truyền hình vệ tinh.

Khách sạn có lễ tân 24 giờ, cửa hàng quà tặng và các cửa hiệu. Wi-Fi miễn phí có trong toàn bộ khuôn viên khách sạn.

Khách sạn cung cấp dịch vụ cho thuê xe máy và khu vực này nổi tiếng với hoạt động đi xe đạp. Sân bay gần nhất là Sân bay Quốc tế Nội Bài, cách Hoa Binh Hotel I khoảng 67 km.",5.5,3.0
https://www.booking.com/hotel/vn/veque-farm-8-netflix-bi-a-bbq-rap-chieu-phim-ngoai-troi-karaoke.vi.html,"Veque farm 8 - Netflix, Bi-a, BBQ, Rạp chiếu phim ngoài trời, Karaoke","Edu farm, tổ 9, xuân Linh, xã Thuỷ Xuân Tiên, Huyện Chương Mỹ, Hà Nội, Ðồng Gội, Việt Nam","Veque farm 8 - Netflix, Bi-a, BBQ, Rạp chiếu phim ngoài trời, Karaoke có ban công và nằm ở Ðồng Gội, Hòa Bình. Chỗ nghỉ này có hồ bơi riêng, Wi-Fi miễn phí và chỗ đậu xe riêng miễn phí.

Biệt thự điều hòa này có 3 phòng ngủ với sân hiên nhìn ra khu vườn và bếp đầy đủ tiện nghi. TV màn hình phẳng được cung cấp.

Khách tại biệt thự có thể thưởng thức bữa sáng kiểu Á.

Veque farm 8 - Netflix, Bi-a, BBQ, Rạp chiếu phim ngoài trời, Karaoke cách Trung tâm thương mại Vincom Nguyễn Chí Thanh 36 km và Sân vận động Quốc gia Mỹ Đình 36 km.",,
https://www.booking.com/hotel/vn/homestay-muong-hich-bungalow-1.vi.html,homestay mường hịch bungalow 1,"mai hịch, mai châu, hòa bình 2 phòng bungalow, 1 tầng, phòng rộng 35m2, Hòa Bình, Việt Nam","Nằm ở Hòa Bình, homestay mường hịch bungalow 1 cung cấp chỗ nghỉ có Wi-Fi miễn phí, điều hòa và khu vườn với hồ bơi ngoài trời.

Nơi đây còn có phòng tắm riêng với vòi xịt/chậu rửa vệ sinh ở tất cả các căn, cùng đồ vệ sinh cá nhân miễn phí, máy sấy tóc và dép đi trong phòng.

Nhà nghỉ B&B có sân hiên.

Khách nghỉ tại homestay mường hịch bungalow 1 có thể chơi bóng bàn trong khuôn viên, hoặc đi xe đạp ở khu vực xung quanh.

Sân bay gần nhất là Sân bay Thọ Xuân, cách chỗ nghỉ 119 km.",10,
https://www.booking.com/hotel/vn/larita-doi-co-mo-hoa-binh.vi.html,Larita Đồi Cỏ Mơ,"Huyện lương sơn, Hòa Bình, Việt Nam","Nằm ở Hòa Bình, Larita Đồi Cỏ Mơ có khu vườn, nhà hàng, quầy bar, cùng Wi-Fi miễn phí ở toàn bộ chỗ nghỉ. Chỗ nghỉ này cung cấp dịch vụ phòng và quầy lễ tân 24 giờ cho khách.

Sân bay Quốc tế Nội Bài cách 77 km.",1,
https://www.booking.com/hotel/vn/mai-chau-village-view.vi.html,Mai Chau Village View,"Xóm Nhót,Xã Nà Phòn,Huyện Mai Châu,Tỉnh Hòa Bình, Mai Châu, Việt Nam","Mai Chau Village View có hồ bơi ngoài trời, khu vườn, sân hiên và quầy bar ở Mai Châu. Chỗ nghỉ có chỗ đậu xe riêng miễn phí và có cả dịch vụ đưa đón sân bay mất phí.

Wi-Fi miễn phí có sẵn cho tất cả khách sử dụng, trong đó một số phòng có ban công. Tại guest house, phòng nào cũng có ga trải giường và khăn tắm.

Mai Chau Village View có phục vụ bữa sáng thực đơn à la carte hoặc kiểu Á.

Sân bay Thọ Xuân cách 127 km.",9.7,
