url,name,location,description,point,star
https://www.booking.com/hotel/vn/ben-39-s-home-mai-chau.vi.html,Ben's Home,"Số 6, tổ liên gia số 3, xóm Mỏ, xã Chiềng Châu, Mai Châu, Việt Nam","Ben's Home là chỗ nghỉ điều hòa nằm ở Mai Châu và có ban công. Chỗ nghỉ cung cấp Wi-Fi miễn phí, hồ bơi ngoài trời theo mùa, sân hiên và nhà hàng.

Homestay có chỗ đậu xe riêng miễn phí.

Ben's Home có phục vụ bữa sáng thực đơn à la carte và món chay mỗi buổi sáng.

Du khách có thể đi xe đạp để khám phá khu vực xung quanh.

Chỗ nghỉ cách Sân bay Thọ Xuân 123 km và cung cấp dịch vụ đưa đón sân bay mất phí.",9.7,
https://www.booking.com/hotel/vn/bakhan-floating-house.vi.html,Bakhan Floating House,"Ngòi Hoa, Hương Tân Lạc, Việt Nam","Bakhan Floating House cung cấp chỗ nghỉ điều hòa ở Hương Tân Lạc. Wi-Fi miễn phí có sẵn và chỗ đậu xe riêng có thể được sắp xếp với một khoản phụ phí.

Tại khách sạn, tất cả các phòng đều được thiết kế có tủ quần áo. Phòng tắm riêng được trang bị vòi xịt/chậu rửa vệ sinh, đồ vệ sinh cá nhân miễn phí và máy sấy tóc. Tại Bakhan Floating House, tất cả các phòng có ga trải giường và khăn tắm.

Với đội ngũ nhân viên thành thạo tiếng Anh và tiếng Việt, dịch vụ thông tin luôn có sẵn tại lễ tân.

Sân bay Quốc tế Nội Bài cách 131 km.",9.3,
https://www.booking.com/hotel/vn/hai-nam-homestay.vi.html,Hải Nam homestay,"Xã Mai Hịch, huyện Mai Châu, tỉnh Hòa Bình, Hòa Bình, Việt Nam","Với quầy bar, Hải Nam homestay cung cấp chỗ nghỉ ở Hòa Bình có Wi-Fi miễn phí và nhìn ra núi. Nhà nghỉ B&B có khu vườn và chỗ đậu xe riêng miễn phí.

Bếp có tủ lạnh, lò nướng và lò vi sóng, đồng thời có vòi xịt/chậu rửa vệ sinh với đồ vệ sinh cá nhân miễn phí và máy sấy tóc.

Sân bay gần nhất là Sân bay Thọ Xuân, cách nhà nghỉ B&B 120 km.",,
https://www.booking.com/hotel/vn/bamboo-eco-lodge-venuestay.vi.html,Bamboo Eco Lodge - Venuestay,"2 Báº£n LÃ¡c, Mai Châu, Việt Nam","Bamboo Eco Lodge - Venuestay nằm ở Mai Châu với khu vườn, hồ bơi ngoài trời mở quanh năm và nhìn ra khu vườn. Biệt thự cung cấp chỗ đậu xe riêng miễn phí, quầy lễ tân 24 giờ và Wi-Fi miễn phí.

Khăn tắm và ga trải giường có sẵn ở biệt thự.

Sân bay gần nhất là Sân bay Thọ Xuân, cách biệt thự 124 km.",,3.0
https://www.booking.com/hotel/vn/buot-valley.vi.html,Agritage Buot Valley - Embrace the Heritage,"Bản Bướt, xã Chiềng Yên, huyện Vân Hồ , Bo Ba, Việt Nam","Nhìn ra núi, Agritage Buot Valley - Embrace the Heritage ở Bo Ba cung cấp chỗ nghỉ có khu vườn, phòng chờ chung, sân hiên và tiện nghi thể thao dưới nước. WiFi và chỗ đậu xe riêng đều có sẵn tại homestay miễn phí.

Nơi đây còn có phòng tắm chung với vòi xịt/chậu rửa vệ sinh ở một số căn, cùng đồ vệ sinh cá nhân miễn phí, máy sấy tóc và dép đi trong phòng.

Agritage Buot Valley - Embrace the Heritage có phục vụ bữa sáng kiểu Á hoặc món chay.

Tại chỗ nghỉ, khách có thể sử dụng bể sục.

Du khách có thể leo núi gần đó.

Sân bay gần nhất là Sân bay Thọ Xuân, cách Agritage Buot Valley - Embrace the Heritage 142 km.",8,
https://www.booking.com/hotel/vn/villa-hoa-binh-3pn-view-nui-ivory-resort.vi.html,Villa Hoà Bình 3PN view núi -Ivory Resort,"Lâm Sơn, Lương Sơn, Hòa Bình, Việt Nam","Với khu vườn, phòng chờ chung, cùng sân hiên, Villa Hoà Bình 3PN view núi -Ivory Resort cung cấp chỗ nghỉ ở Hòa Bình có Wi-Fi miễn phí và nhìn ra núi. Nằm cách Sân vận động Quốc gia Mỹ Đình 45 km, chỗ nghỉ cung cấp nhà hàng và chỗ đậu xe riêng miễn phí.

Biệt thự điều hòa này có 3 phòng ngủ, TV màn hình phẳng, khu vực ăn uống và bếp với tủ lạnh và minibar.

Biệt thự có sân chơi trẻ em. Khuôn viên của Villa Hoà Bình 3PN view núi -Ivory Resort có công viên nước và du khách có thể leo núi ở khu vực gần đó.

Chỗ nghỉ cách Trung tâm thương mại Vincom Nguyễn Chí Thanh 47 km. Sân bay Quốc tế Nội Bài cách 74 km, đồng thời chỗ nghỉ có cung cấp dịch vụ đưa đón sân bay mất phí.",,
https://www.booking.com/hotel/vn/mai-chau-riverside-camping.vi.html,Mai Chau riverside camping,"Mai Chau riverside camping Chieng Chau, village, Mai Châu, Việt Nam","Tọa lạc ở Mai Châu, Mai Chau riverside camping cung cấp chỗ nghỉ có điều hòa với sân hiên và Wi-Fi miễn phí. Homestay có khu vườn và chỗ đậu xe riêng miễn phí.

Khăn tắm và ga trải giường có sẵn ở homestay.

Sân bay gần nhất là Sân bay Thọ Xuân, cách homestay 123 km.",5,
https://www.booking.com/hotel/vn/dong-chanh-villa-venue-travel.vi.html,Đồng Chanh Villa Venuestay,"Thôn Đồng Chanh A, Nhuận Trạch, Lương Sơn, Hòa Bình 000000, Việt Nam 2, Hòa Bình, Việt Nam","Tọa lạc ở Hòa Bình, cách Sân vận động Quốc gia Mỹ Đình 35 km và Trung tâm thương mại Vincom Nguyễn Chí Thanh 37 km, Đồng Chanh Villa Venuestay cung cấp chỗ nghỉ có Wi-Fi miễn phí, điều hòa, hồ bơi ngoài trời và khu vườn.

Nơi đây còn có phòng tắm riêng với vòi sen ở tất cả các căn, cùng đồ vệ sinh cá nhân miễn phí, máy sấy tóc và dép đi trong phòng.

Homestay cách Bảo tàng mỹ thuật Việt Nam 38 km và Văn Miếu - Quốc Tử Giám 38 km.",,
https://www.booking.com/hotel/vn/medifarm-mai-chau.vi.html,Medifarm Mai Châu,"Xóm Pheo 2, xã Cun Pheo, Huyện Mai Châu, Mai Châu, Việt Nam","Tọa lạc ở Mai Châu, Medifarm Mai Châu cung cấp Wi-Fi miễn phí, nơi khách có thể trải nghiệm khu vườn, nhà hàng và quầy bar.

Nơi đây còn có phòng tắm riêng với vòi xịt/chậu rửa vệ sinh ở một số căn, cùng đồ vệ sinh cá nhân miễn phí, máy sấy tóc và dép đi trong phòng.

Khách tại lodge có thể thưởng thức bữa sáng kiểu Á.

Sân bay gần nhất là Sân bay Thọ Xuân, cách Medifarm Mai Châu 136 km.",,
https://www.booking.com/hotel/vn/bin-house-villa-hoa-binh.vi.html,Bin House Villa Hòa Bình,"https://maps.app.goo.gl/uEjGNgrnh54FsSu79, Hòa Bình, Việt Nam","Với khu vườn, sân hiên, cùng nhà hàng, Bin House Villa Hòa Bình cung cấp chỗ nghỉ ở Hòa Bình có Wi-Fi miễn phí và nhìn ra hồ bơi. Chỗ nghỉ này có bàn bi-a.

Biệt thự điều hòa này có 4 phòng ngủ, TV màn hình phẳng truyền hình vệ tinh, khu vực ăn uống, bếp với tủ lạnh và phòng khách.

Tại biệt thự, khách có thể sử dụng bể sục. Khách có thể sử dụng BBQ tại Bin House Villa Hòa Bình.

Chỗ nghỉ cách Trung tâm thương mại Vincom Nguyễn Chí Thanh 40 km và Sân vận động Quốc gia Mỹ Đình 40 km.",7,
https://www.booking.com/hotel/vn/cong-homestay-mai-chau.vi.html,Cong Homestay,"Bản Lác, Mai Châu, Việt Nam","Tọa lạc ở Mai Châu, Cong Homestay cung cấp chỗ nghỉ có điều hòa với ban công và Wi-Fi miễn phí. Homestay có khu vườn và chỗ đậu xe riêng miễn phí.

Hằng ngày, chỗ nghỉ có các lựa chọn thực đơn à la carte, món chay hoặc không chứa gluten cho bữa sáng.

Sân bay gần nhất là Sân bay Thọ Xuân, cách homestay 124 km.",6.2,
https://www.booking.com/hotel/vn/villa-315.vi.html,Ivory Mountain Villa,"Đường Thung khe, khu nghỉ dưỡng IVORY Villas and Resort, Quốc lộ 6 - xóm Kẽm - Lâm Sơn - Lương Sơn - Hoà Bình., Hòa Bình, Việt Nam","Tọa lạc ở Hòa Bình, cách Trung tâm thương mại Vincom Nguyễn Chí Thanh 47 km và Sân vận động Quốc gia Mỹ Đình 47 km, Ivory Mountain Villa cung cấp chỗ nghỉ có Wi-Fi miễn phí, điều hòa, khu vườn và sân hiên. Căn hộ này còn có hồ bơi riêng.

Căn hộ này có 3 phòng ngủ với ban công nhìn ra khu vườn. Khăn tắm và ga trải giường có sẵn ở căn hộ.

Căn hộ cách Bảo tàng mỹ thuật Việt Nam 48 km và Văn Miếu - Quốc Tử Giám 48 km.",,
https://www.booking.com/hotel/vn/hoa-dao-hoa-binh.vi.html,Hoa Dao Hotel,"Tan Thinh Ward - Comercial Area, Hòa Bình, Việt Nam","Tọa lạc ở Hòa Bình, cách Vietnam National University 43 km, Hoa Dao Hotel cung cấp chỗ nghỉ có khu vườn, chỗ đậu xe riêng miễn phí, phòng chờ chung và sân hiên. Khách sạn 3 sao này cung cấp quầy bar. Chỗ nghỉ cung cấp lễ tân 24/24, dịch vụ đưa đón sân bay, dịch vụ phòng và Wi-Fi miễn phí.

Tất cả các căn được trang bị điều hòa, TV màn hình phẳng có truyền hình vệ tinh, tủ lạnh, ấm đun nước, vòi xịt/chậu rửa vệ sinh, đồ vệ sinh cá nhân miễn phí và bàn làm việc. Các phòng đều có phòng tắm riêng được trang bị vòi sen và máy sấy tóc, trong đó một số căn tại khách sạn cũng có ban công. Tại Hoa Dao Hotel, tất cả các phòng đều có ga trải giường và khăn tắm.

Tại chỗ nghỉ, khách sẽ tìm thấy nhà hàng phục vụ ẩm thực hải sản, Việt và địa phương. Bên cạnh đó, họ có thể yêu cầu món chay, không chứa sữa và món thuần chay.

Sân bay Quốc tế Nội Bài cách 93 km.",6.9,3.0
https://www.booking.com/hotel/vn/ban-muong-xanh-nong-trai-vui-ve-venue-travel.vi.html,Bản Mường Xanh - Nông Trại Vui Vẻ Venuestay,"Bản Mường Xanh - Nông trại vui vẻ  Xóm Bằng Gà, xã Cao Sơn, Hòa Bình, Vietnam, Hòa Bình, Việt Nam","Nằm ở Hòa Bình, cách Sân vận động Quốc gia Mỹ Đình 47 km và Trung tâm thương mại Vincom Nguyễn Chí Thanh 48 km, Bản Mường Xanh - Nông Trại Vui Vẻ Venuestay cung cấp chỗ nghỉ có Wi-Fi miễn phí, điều hòa và khu vườn với hồ bơi ngoài trời.

Nơi đây còn có phòng tắm riêng với vòi sen và đồ vệ sinh cá nhân miễn phí ở từng căn, cùng máy sấy tóc.

Homestay cách Bảo tàng mỹ thuật Việt Nam 50 km và Văn Miếu - Quốc Tử Giám 50 km.",,
https://www.booking.com/hotel/vn/homestay-in-da-bia-community-based-tourism.vi.html,Homestay in Da Bia - Community Based Tourism,"Đá Bia, Tiền Phong, Đà Bắc Hòa Bình 2, Hòa Bình, Việt Nam","Homestay in Da Bia - Community Based Tourism tọa lạc ở Hòa Bình và có khu vườn. Tại đây có sân hiên phơi nắng và khách có thể sử dụng Wi-Fi miễn phí và chỗ đậu xe riêng miễn phí.

Tại hostel, tất cả các phòng có ban công với view vườn. Mỗi phòng đều có phòng tắm chung với vòi sen, đồ vệ sinh cá nhân miễn phí và máy sấy tóc. Các phòng có bàn làm việc.

Sân bay gần nhất là Sân bay Quốc tế Nội Bài, cách Homestay in Da Bia - Community Based Tourism 137 km.",,
https://www.booking.com/hotel/vn/ivory-villa-amp-resort.vi.html,Ivory Villa & Resort,"Xóm Kẽm, xã Lâm Sơn, huyện Lương Sơn, Hoà Bình, Hòa Bình, Việt Nam","Tọa lạc ở Hòa Bình, chỉ cách Trung tâm thương mại Vincom Nguyễn Chí Thanh 47 km, Ivory Villa & Resort cung cấp chỗ nghỉ có khu vườn, sân hiên, quầy bar và Wi-Fi miễn phí. Biệt thự này cung cấp chỗ nghỉ có ban công.

Biệt thự điều hòa này có 3 phòng ngủ riêng biệt, phòng khách, bếp đầy đủ tiện nghi, cùng 3 phòng tắm. TV màn hình phẳng được cung cấp.

Biệt thự có phục vụ bữa sáng thực đơn buffet hằng ngày.

Ivory Villa & Resort cách Sân vận động Quốc gia Mỹ Đình 47 km và Bảo tàng mỹ thuật Việt Nam 48 km.",,
https://www.booking.com/hotel/vn/villa-101-view-ho.vi.html,Ivory Villas & Resort - Villa view hồ Lake View,"Lâm Sơn, Hòa Bình, Rống Vong, Việt Nam","Với hồ bơi ngoài trời, khu vườn, cùng sân hiên, Ivory Villas & Resort - Villa view hồ Lake View cung cấp chỗ nghỉ ở Rống Vong có Wi-Fi miễn phí và nhìn ra hồ. Tọa lạc cách Trung tâm thương mại Vincom Nguyễn Chí Thanh 47 km, chỗ nghỉ cung cấp nhà hàng và chỗ đậu xe riêng miễn phí.

Biệt thự điều hòa này có 3 phòng ngủ riêng biệt, phòng khách, bếp nhỏ đầy đủ tiện nghi với tủ lạnh, bếp, cùng 3 phòng tắm. TV màn hình phẳng được cung cấp.

Biệt thự có dịch vụ cho thuê xe đạp.

Ivory Villas & Resort - Villa view hồ Lake View cách Sân vận động Quốc gia Mỹ Đình 47 km và Bảo tàng mỹ thuật Việt Nam 48 km.",,
https://www.booking.com/hotel/vn/tamara-villa-venuestay.vi.html,Tamara Villa - Venuestay,"Tamara Villa, Xóm Suối Yên, Lương Sơn, Hòa Bình 36263, Hòa Bình, Việt Nam","Với hồ bơi ngoài trời, khu vườn, cùng sân hiên, Tamara Villa - Venuestay cung cấp chỗ nghỉ ở Hòa Bình có Wi-Fi miễn phí và nhìn ra hồ bơi. Biệt thự cung cấp chỗ đậu xe riêng miễn phí và quầy lễ tân 24 giờ.

Có 5 phòng ngủ, biệt thự điều hòa này có 4 phòng tắm với vòi sen và máy sấy tóc. Chỗ nghỉ này được trang bị bếp.

Biệt thự cách Trung tâm thương mại Vincom Nguyễn Chí Thanh 42 km và Sân vận động Quốc gia Mỹ Đình 42 km.",,4.0
https://www.booking.com/hotel/vn/the-candy-villa-venue-travel.vi.html,The Candy Villa - Venuestay,"Xóm, Nước Lạnh, Lương Sơn, Hòa Bình, Hòa Bình, Việt Nam","Với hồ bơi ngoài trời, khu vườn, cùng sân hiên, The Candy Villa - Venuestay cung cấp chỗ nghỉ ở Hòa Bình có Wi-Fi miễn phí và nhìn ra núi. Chỗ nghỉ này có hồ bơi riêng và chỗ đậu xe riêng miễn phí.

Biệt thự điều hòa này có 6 phòng ngủ, phòng khách, bếp đầy đủ tiện nghi với tủ lạnh và ấm đun nước, 7 phòng tắm với vòi sen và đồ vệ sinh cá nhân miễn phí. Khăn tắm và ga trải giường có sẵn ở biệt thự.

Biệt thự cách Sân vận động Quốc gia Mỹ Đình 38 km và Trung tâm thương mại Vincom Nguyễn Chí Thanh 39 km.",,4.0
https://www.booking.com/hotel/vn/sapphire-villa-venue-travel.vi.html,Sapphire Villa - Venuestay,"Vườn Cỏ Thơm, Luong Son, Việt Nam","Với sân hiên, Sapphire Villa - Venuestay cung cấp chỗ nghỉ ở Luong Son có Wi-Fi miễn phí và nhìn ra hồ bơi. Tọa lạc cách Sân vận động Quốc gia Mỹ Đình 38 km, chỗ nghỉ cung cấp hồ bơi ngoài trời và chỗ đậu xe riêng miễn phí.

Biệt thự điều hòa này có 5 phòng ngủ, TV màn hình phẳng và bếp với tủ lạnh và bếp. Khăn tắm và ga trải giường có sẵn ở biệt thự.

Biệt thự cách Trung tâm thương mại Vincom Nguyễn Chí Thanh 40 km và Bảo tàng mỹ thuật Việt Nam 41 km.",,4.0
https://www.booking.com/hotel/vn/nha-nghi-viet-hung-mai-chau2.vi.html,Nhà Nghỉ Việt Hùng,"Hang Chiều, Mai Châu, Việt Nam","Nhà Nghỉ Việt Hùng tọa lạc ở Mai Châu, nhìn ra núi và có Wi-Fi miễn phí cùng chỗ đậu xe riêng miễn phí.

Được thiết kế với sân hiên, các căn có điều hòa, TV màn hình phẳng, cùng phòng tắm riêng gồm vòi sen và đồ vệ sinh cá nhân miễn phí. Tất cả các căn đều được thiết kế có ban công nhìn ra khu vườn.

Khách có thể thư giãn trong khu vườn tại chỗ nghỉ.

Sân bay gần nhất là Sân bay Thọ Xuân, cách nhà nghỉ B&B 125 km.",7,
https://www.booking.com/hotel/vn/undertree-life-villa.vi.html,Undertree life villa,"Xóm rậm cư yên lương sơn hòa bình, Hòa Bình, Việt Nam","Tọa lạc cách Trung tâm thương mại Vincom Nguyễn Chí Thanh 39 km và Sân vận động Quốc gia Mỹ Đình 40 km ở Hòa Bình, Undertree life villa cung cấp chỗ nghỉ cóbếp. Chỗ nghỉ này có ban công, chỗ đậu xe riêng miễn phí và Wi-Fi miễn phí.

Với 1 phòng ngủ, chalet điều hòa này có 2 phòng tắm với vòi xịt/chậu rửa vệ sinh, vòi sen và đồ vệ sinh cá nhân miễn phí.

Khách tại chalet có thể thưởng thức bữa sáng thực đơn à la carte hoặc kiểu Á.

Undertree life villa cách Bảo tàng mỹ thuật Việt Nam 40 km và Văn Miếu - Quốc Tử Giám 40 km.",,
https://www.booking.com/hotel/vn/6senses-garden-homestay-hoa-binh1.vi.html,6Senses Garden Homestay,"Suối Cốc, Cư Yên, Lương Sơn, Hoà Bình, Hòa Bình, Việt Nam","Nằm ở Hòa Bình, cách Trung tâm thương mại Vincom Nguyễn Chí Thanh 42 km và Sân vận động Quốc gia Mỹ Đình 42 km, 6Senses Garden Homestay cung cấp chỗ nghỉ có Wi-Fi miễn phí, điều hòa và khu vườn.

Tại đây có phòng tắm riêng đầy đủ tiện nghi với vòi sen và máy sấy tóc.

Homestay cách Bảo tàng mỹ thuật Việt Nam 43 km và Văn Miếu - Quốc Tử Giám 43 km.",,
https://www.booking.com/hotel/vn/homestay-nha-cua-chi-food-amp-coffee-mai-chau.vi.html,Homestay nhà của chi food&coffee,"Bản Lác, Mai Châu, Việt Nam","Với khu vườn, sân hiên, cùng quầy bar, Homestay nhà của chi food&coffee cung cấp chỗ nghỉ ở Mai Châu có Wi-Fi miễn phí và nhìn ra núi.

Homestay có chỗ đậu xe riêng miễn phí.

Sân bay gần nhất là Sân bay Thọ Xuân, cách Homestay nhà của chi food&coffee 123 km.",10,
https://www.booking.com/hotel/vn/toms-house-hoa-binh.vi.html,Tom's House,"Tổ 6, xóm Mỏ, xã Chiềng Châu, Mai Châu, Hòa Bình, Hòa Bình, Việt Nam","Tom's House nằm ở Hòa Bình, nhìn ra khu vườn và có Wi-Fi miễn phí cùng chỗ đậu xe riêng miễn phí.

Một số chỗ nghỉ có bao gồm sân hiên nhìn ra núi, bếp đầy đủ tiện nghi, cùng phòng tắm riêng được trang bị vòi xịt/chậu rửa vệ sinh.

Khách cũng có thể thư giãn trong khu vườn.

Sân bay Thọ Xuân cách 123 km.",,
https://www.booking.com/hotel/vn/a-la-homestay-hoa-binh.vi.html,A La Homestay,"xóm pà khôm, xã hang kia, huyện mai châu, tỉnh hòa bình, Hòa Bình, Việt Nam","Với khu vườn, sân hiên, cùng nhà hàng, A La Homestay cung cấp chỗ nghỉ ở Hòa Bình có Wi-Fi miễn phí và nhìn ra khu vườn. Lodge cung cấp chỗ đậu xe riêng miễn phí và dịch vụ phòng.

Thành thạo tiếng Anh và tiếng Việt, đội ngũ nhân viên tại lễ tân 24/24 luôn sẵn lòng hỗ trợ khách lên kế hoạch cho kỳ nghỉ.

Sân bay gần nhất là Sân bay Thọ Xuân, cách lodge 167 km.",9,
https://www.booking.com/hotel/vn/venue-travel-moc-tien-retreat.vi.html,Mộc Tiên Retreat Venuestay,"Đường 6, Luong Son, Việt Nam","Nằm ở Luong Son, cách Sân vận động Quốc gia Mỹ Đình 44 km và Trung tâm thương mại Vincom Nguyễn Chí Thanh 45 km, Mộc Tiên Retreat Venuestay cung cấp chỗ nghỉ có Wi-Fi miễn phí, điều hòa và khu vườn với hồ bơi ngoài trời.

Homestay có TV màn hình phẳng và phòng tắm riêng với đồ vệ sinh cá nhân miễn phí, máy sấy tóc và vòi sen.

Mộc Tiên Retreat Venuestay cách Bảo tàng mỹ thuật Việt Nam 47 km và Văn Miếu - Quốc Tử Giám 47 km.",9,
https://www.booking.com/hotel/vn/villa-ho-dong-quyt-venue-travel.vi.html,Villa Hồ Đồngng Quýt - Venuestay,"KCN Lương Sơn, Luong Son, Việt Nam","Tọa lạc chỉ cách Sân vận động Quốc gia Mỹ Đình 35 km, Villa Hồ Đồngng Quýt - Venuestay cung cấp chỗ nghỉ ở Luong Son với hồ bơi ngoài trời, phòng chờ chung, cũng như quầy lễ tân 24 giờ. Biệt thự có hồ bơi riêng, khu vườn, tiện nghi BBQ, Wi-Fi miễn phí và chỗ đậu xe riêng miễn phí.

Biệt thự có 10 phòng ngủ, 11 phòng tắm, ga trải giường, khăn tắm, TV màn hình phẳng, khu vực ăn uống, bếp đầy đủ tiện nghi, cùng sân hiên nhìn ra hồ bơi.

Biệt thự cách Trung tâm thương mại Vincom Nguyễn Chí Thanh 37 km và Bảo tàng mỹ thuật Việt Nam 38 km.",,4.0
https://www.booking.com/hotel/vn/villa-6-phong-ngu-day-du-tien-ich-be-boi-ban-bi-a-hoa-binh.vi.html,Villa 6 Phòng ngủ - Đầy đủ tiện ích - bể bơi - bàn bi a - Hoà Bình,"Đường Mây Lang Thang, Luong Son, Việt Nam","Nhìn ra khu vườn, Villa 6 Phòng ngủ - Đầy đủ tiện ích - bể bơi - bàn bi a - Hoà Bình cung cấp chỗ nghỉ có hồ bơi ngoài trời, phòng chờ chung và sân hiên, cách Trung tâm thương mại Vincom Nguyễn Chí Thanh khoảng 40 km. Căn hộ có hồ bơi riêng, khu vườn, tiện nghi BBQ, Wi-Fi miễn phí và chỗ đậu xe riêng miễn phí.

Căn hộ có 6 phòng ngủ, bếp với tủ lạnh và bếp, TV màn hình phẳng, khu vực ghế ngồi, 5 phòng tắm được trang bị vòi xịt/chậu rửa vệ sinh.

Căn hộ cách Sân vận động Quốc gia Mỹ Đình 41 km và Bảo tàng mỹ thuật Việt Nam 41 km.",,4.0
https://www.booking.com/hotel/vn/mai-chau-eco-home-hoa-binh.vi.html,Mai chau Eco Home,"Xóm Bước, xã Xăm Khoè, huyện Mai Châu, tỉnh Hoà Bình, Hòa Bình, Việt Nam","Nằm ở Hòa Bình, Mai chau Eco Home cung cấp chỗ nghỉ có điều hòa với sân hiên và Wi-Fi miễn phí. Homestay có khu vườn và chỗ đậu xe riêng miễn phí.

Homestay có TV. Khăn tắm và ga trải giường có sẵn ở homestay.

Khách có thể thưởng thức bữa sáng thực đơn buffet, kiểu Á hoặc món chay tại chỗ nghỉ.

Sân bay gần nhất là Sân bay Thọ Xuân, cách homestay 128 km.",,
https://www.booking.com/hotel/vn/gia-bao-anh-villa-luong-son.vi.html,GIA BAO ANH VILLA,"Vườn Cỏ Thơm, Luong Son, Việt Nam","GIA BAO ANH VILLA là chỗ nghỉ nằm ở Luong Son, có ban công, hồ bơi riêng và nhìn ra khu vườn. Tọa lạc cách Sân vận động Quốc gia Mỹ Đình 38 km, chỗ nghỉ cung cấp sân hiên và chỗ đậu xe riêng miễn phí.

Căn hộ điều hòa 3 phòng ngủ này có khu vực ghế ngồi, TV màn hình phẳng và bếp với minibar.

Căn hộ cách Trung tâm thương mại Vincom Nguyễn Chí Thanh 39 km và Bảo tàng mỹ thuật Việt Nam 41 km.",8,
https://www.booking.com/hotel/vn/nha-cua-chi-homestay-food-amp-coffee.vi.html,NHÀ CỦA CHI - HOMESTAY FOOD & COFFEE,"Sân Cỏ Chiềng Châu, Chiềng Châu, Mai Châu, Hòa Bình, Hòa Bình, Việt Nam","Nhìn ra núi, NHÀ CỦA CHI - HOMESTAY FOOD & COFFEE nằm ở Hòa Bình và có nhà hàng, dịch vụ phòng, quầy bar, khu vườn cũng như sân hiên. Homestay có WiFi và chỗ đậu xe riêng miễn phí.

Nơi đây còn có phòng tắm riêng với vòi xịt/chậu rửa vệ sinh ở một số căn, cùng đồ vệ sinh cá nhân miễn phí, máy sấy tóc và dép đi trong phòng.

NHÀ CỦA CHI - HOMESTAY FOOD & COFFEE có cả dịch vụ cho thuê xe đạp và dịch vụ cho thuê ô tô, đồng thời du khách có thể đi xe đạp gần đó.

Sân bay Thọ Xuân cách 123 km, đồng thời chỗ nghỉ có cung cấp dịch vụ đưa đón sân bay mất phí.",9.5,
https://www.booking.com/hotel/vn/sun-blush-village-luong-son.vi.html,Sun Blush Villa & Resort Lương Sơn - 4 - 111,"Hồ Gò Cáp, Xã Tân Vinh, Huyện Lương Sơn, TP Hòa Bình, Tỉnh Hòa Bình, Hòa Bình, Việt Nam","Nhìn ra hồ bơi, Sun Blush Villa & Resort Lương Sơn - 4 - 111 cung cấp chỗ nghỉ có hồ bơi ngoài trời, khu vườn và nhà hàng, cách Sân vận động Quốc gia Mỹ Đình khoảng 38 km. Với chỗ đậu xe riêng miễn phí, căn hộ nằm ở khu vực mà khách có thể tham gia vào các hoạt động như câu cá, đi xe đạp và bi-a.

Với sân hiên nhìn ra núi, căn hộ có 4 phòng ngủ, phòng khách, TV màn hình phẳng truyền hình cáp, bếp đầy đủ tiện nghi, 4 phòng tắm với vòi xịt/chậu rửa vệ sinh và vòi sen. Khăn tắm và ga trải giường có sẵn ở căn hộ.

Dịch vụ đề xuất 24/7 luôn có sẵn tại lễ tân với đội ngũ nhân viên thành thạo tiếng Anh và tiếng Việt.

Căn hộ cung cấp sân chơi trẻ em và BBQ.

Sun Blush Villa & Resort Lương Sơn - 4 - 111 cách Trung tâm thương mại Vincom Nguyễn Chí Thanh 40 km và Bảo tàng mỹ thuật Việt Nam 41 km. Chỗ nghỉ cách Sân bay Quốc tế Nội Bài 67 km và cung cấp dịch vụ đưa đón sân bay mất phí.",3,
https://www.booking.com/hotel/vn/sweet-mai-chau-homestay.vi.html,Sweet Mai Châu Homestay,"xóm Cha Long , xã Tòng Đậu, huyện Mai Châu, Hòa Bình, Việt Nam","Sweet Mai Châu Homestay nằm ở Hòa Bình. Chỗ nghỉ này có ban công, chỗ đậu xe riêng miễn phí và Wi-Fi miễn phí.

Nhà nghỉ dưỡng có 1 phòng ngủ, bếp với lò nướng và minibar, 5 phòng tắm với vòi sen, máy sấy tóc và máy giặt.

Sân bay gần nhất là Sân bay Thọ Xuân, cách nhà nghỉ dưỡng 129 km.",10,
