url,name,location,description,point,star
https://www.booking.com/hotel/vn/la-maison-de-buoc.vi.html,La Maison De Buoc,"Buoc Village, Xam Khoe Ward, Mai Chau District, Hoa Binh Province, Mai Châu, Việt Nam","La Maison De Buoc có khu vườn, sân hiên, nhà hàng và quầy bar ở Mai Châu. Khách sạn cung cấp hồ bơi ngoài trời, dịch vụ phòng và Wi-Fi miễn phí.

Tại khách sạn, tất cả các phòng đều được thiết kế có ban công. Phòng tắm riêng được trang bị vòi xịt/chậu rửa vệ sinh, đồ vệ sinh cá nhân miễn phí và máy sấy tóc. Tất cả các căn tại La Maison De Buoc có điều hòa và bàn làm việc.

Khách tại chỗ nghỉ sẽ có thể tận hưởng các hoạt động ở trong Mai Châu và khu vực xung quanh, như đi xe đạp.

Thành thạo tiếng Anh và tiếng Việt, đội ngũ nhân viên tại lễ tân luôn sẵn lòng đưa ra thông tin hữu ích về khu vực xung quanh.

Sân bay Thọ Xuân cách 128 km.",8.9,
https://www.booking.com/hotel/vn/mai-chau-ecolodge.vi.html,Mai Chau Ecolodge,"Na Thia Village, Na Phon Commune, Mai Châu, Việt Nam","Được bao quanh bởi những ngọn núi và cánh đồng lúa, Mai Chau Ecolodge cung cấp các phòng và suite hiện đại với tầm nhìn và Wi-Fi miễn phí. Nơi nghỉ này có nhà hàng, quán bar, hồ bơi ngoài trời và spa trong nhà để khách thư giãn.

Mai Chau Ecolodge cách Làng Pom Coọng 500 m và cách Làng Lạc 1 km. Trung tâm thị trấn Mai Châu và Làng Vạn cách đó lần lượt 1,5 km và 3 km.

Mỗi phòng và suite đều có ban công, khu vực tiếp khách và minibar. Phòng tắm riêng đi kèm vòi sen, máy sấy tóc và đồ vệ sinh cá nhân miễn phí.

Xe đạp miễn phí có sẵn cho khách nghỉ tại Mai Chau Ecolodge sử dụng. Nằm trong số các tiện nghi tại đây còn có sảnh khách chung, dịch vụ đặt vé và bàn đặt tour.

Thực đơn tự chọn được phục vụ cho bữa sáng.",8.9,4.0
https://www.booking.com/hotel/vn/mandala-retreats-kim-boi.vi.html,Mandala Retreats Kim Bôi,"Thôn Mớ Đá, thị trấn Bo, huyện Kim Bôi, tỉnh Hòa Bình, Hòa Bình, Việt Nam","Mandala Retreats Kim Bôi có xe đạp miễn phí, hồ bơi ngoài trời, khu vườn và nhà hàng ở Hòa Bình. Khách sạn 5 sao này cung cấp dịch vụ phòng, quầy lễ tân 24 giờ và Wi-Fi miễn phí. Chỗ nghỉ này cung cấp bể sục, nhân viên phục vụ hoạt động giải trí và phòng gia đình.

Khách sạn sẽ cung cấp cho khách các phòng được trang bị điều hòa có bàn làm việc, ấm đun nước, minibar, két an toàn, TV màn hình phẳng, ban công và phòng tắm riêng với vòi xịt/chậu rửa vệ sinh. Tại Mandala Retreats Kim Bôi, tất cả các phòng đều có ga trải giường và khăn tắm.

Chỗ nghỉ có phục vụ bữa sáng thực đơn buffet mỗi sáng.

Mandala Retreats Kim Bôi có tắm suối nước nóng.

Sân bay Quốc tế Nội Bài cách 111 km.",8.1,5.0
https://www.booking.com/hotel/vn/mai-chau-moment-spa-amp-resort.vi.html,Mai Chau Moment Spa & Resort,"Nà Phòn, Mai Châu, Việt Nam","Mai Chau Moment Spa & Resort có khu vườn, sân hiên, nhà hàng và quầy bar ở Mai Châu. Chỗ nghỉ cung cấp lễ tân 24/24, dịch vụ đưa đón sân bay, dịch vụ phòng và Wi-Fi miễn phí ở toàn bộ chỗ nghỉ.

Tại resort, mỗi phòng đều được thiết kế có ban công. Các phòng đều có phòng tắm riêng với vòi xịt/chậu rửa vệ sinh, đồ vệ sinh cá nhân miễn phí và máy sấy tóc. Tại Mai Chau Moment Spa & Resort, các phòng được thiết kế có điều hòa và két an toàn.

Chỗ nghỉ có phục vụ bữa sáng thực đơn buffet hoặc kiểu Á.

Sân bay Thọ Xuân cách 124 km.",8.2,
https://www.booking.com/hotel/vn/mai-chau-onsen-retreat.vi.html,Mai Chau Onsen Retreat,"Xăm Khòe, Mai Châu, Hòa Bình, Mai Châu, Việt Nam","Mai Chau Onsen Retreat cung cấp chỗ nghỉ tại Mai Châu. Mỗi phòng tại khách sạn 4 sao này đều nhìn ra núi, đồng thời khách có thể sử dụng khu vườn và quầy bar. Khách sạn có hồ bơi trong nhà, hồ bơi ngoài trời mở quanh năm, sân hiên và khách có thể dùng bữa ở nhà hàng.

Khách sạn sẽ cung cấp cho khách các phòng được trang bị điều hòa có bàn làm việc, ấm đun nước, minibar, két an toàn, TV màn hình phẳng và phòng tắm riêng với vòi xịt/chậu rửa vệ sinh. Wi-Fi miễn phí có sẵn cho tất cả khách sử dụng, trong đó một số phòng có ban công. Các căn có tủ quần áo.

Chỗ nghỉ có phục vụ bữa sáng mỗi sáng, gồm các lựa chọn thực đơn buffet, thực đơn à la carte và kiểu lục địa.

Thành thạo tiếng Anh và tiếng Việt, đội ngũ nhân viên luôn túc trực 24/7 tại lễ tân.

Chỗ nghỉ cách Sân bay Thọ Xuân 125 km và cung cấp dịch vụ đưa đón sân bay mất phí.",9,4.0
https://www.booking.com/hotel/vn/mai-chau-xanh-bungalow.vi.html,Mai Chau Xanh Bungalow,"2 Bản Lác, Mai Châu, Việt Nam","Mai Chau Xanh Bungalow tọa lạc ở Mai Châu và có khu vườn. Ngoài dịch vụ phòng, chỗ nghỉ này còn có sân hiên phơi nắng. Chỗ nghỉ cung cấp lễ tân 24/24, dịch vụ đưa đón sân bay, bếp chung và Wi-Fi miễn phí ở toàn bộ chỗ nghỉ.

Tại khách sạn, tất cả các phòng đều được thiết kế có ban công với view núi. Phòng nào cũng có phòng tắm riêng với vòi xịt/chậu rửa vệ sinh, đồ vệ sinh cá nhân miễn phí và máy sấy tóc.

Tại Mai Chau Xanh Bungalow, khách sẽ tìm thấy nhà hàng phục vụ ẩm thực Á. Bên cạnh đó, họ có thể yêu cầu không chứa sữa và không chứa gluten.

Đi xe đạp là hoạt động được ưa chuộng trong khu vực. Ngoài ra, chỗ nghỉ có dịch vụ thuê xe đạp.

Sân bay Thọ Xuân cách 124 km.",9.3,
https://www.booking.com/hotel/vn/mai-chau-countryside-homestay.vi.html,Mai Chau Countryside Homestay,"No.30 Pom Coong, Mai Châu, Việt Nam","Với quầy bar, Mai Chau Countryside Homestay cung cấp chỗ nghỉ ở Mai Châu. Chỗ nghỉ có WiFi miễn phí ở toàn bộ chỗ nghỉ và chỗ đậu xe riêng có sẵn trong khuôn viên.

Tại đây có phòng tắm riêng đầy đủ tiện nghi với vòi xịt/chậu rửa vệ sinh và đồ vệ sinh cá nhân miễn phí.

Tại homestay, khách sẽ tìm thấy nhà hàng phục vụ ẩm thực Á.

Mai Chau Countryside Homestay có dịch vụ cho thuê ô tô.

Chỗ nghỉ cách Sân bay Thọ Xuân 125 km và cung cấp dịch vụ đưa đón sân bay mất phí.",9.5,
https://www.booking.com/hotel/vn/halo-retreat.vi.html,Halo Retreat,"Xóm Tráng, xã bình thanh, huyện cao phong, hoà bình, Hòa Bình, Việt Nam","Halo Retreat ở Hòa Bình cung cấp chỗ nghỉ 3 sao có khu vườn. Tại đây có sân hiên và khách có thể sử dụng Wi-Fi miễn phí và chỗ đậu xe riêng miễn phí.

Một số phòng có bếp với tủ lạnh và lò vi sóng.

Dịch vụ thông tin 24/7 luôn có sẵn tại lễ tân với đội ngũ nhân viên thành thạo tiếng Anh và tiếng Việt.

Sân bay gần nhất là Sân bay Quốc tế Nội Bài, cách khách sạn 107 km.",9.3,3.0
https://www.booking.com/hotel/vn/maison-valley.vi.html,Mai Chau Valley Retreat,"Hai Son Village, Mai Hich Ward, Mai Chau District, Hoa Binh Province, Mai Châu, Việt Nam","Nhìn ra hồ, Mai Chau Valley Retreat ở Mai Châu cung cấp chỗ nghỉ có hồ bơi ngoài trời, khu vườn, sân hiên và quầy bar. Homestay có WiFi và chỗ đậu xe riêng miễn phí.

Nơi đây còn có phòng tắm chung với vòi sen ở một số căn, cùng đồ vệ sinh cá nhân miễn phí, máy sấy tóc và dép đi trong phòng.

Du khách có thể câu cá và đi xe đạp gần đó.

Sân bay gần nhất là Sân bay Thọ Xuân, cách Mai Chau Valley Retreat 120 km, đồng thời chỗ nghỉ có cung cấp dịch vụ đưa đón sân bay mất phí.",9.4,
https://www.booking.com/hotel/vn/the-skyview-hoa-binh-ky-son.vi.html,The Skyview Hòa Bình,"xóm Gò Bùi, xã Dân Hòa, Kỳ Sơn, Hòa Bình, Kệ Sơn, Việt Nam","Tọa lạc ở Kệ Sơn, cách Sân vận động Quốc gia Mỹ Đình 49 km, The Skyview Hòa Bình cung cấp chỗ nghỉ có hồ bơi ngoài trời theo mùa, chỗ đậu xe riêng miễn phí, khu vườn và phòng chờ chung. Ngoài sân hiên, khách sạn 2 sao này còn có các phòng với điều hòa và phòng tắm riêng. Chỗ nghỉ này cung cấp bếp chung, dịch vụ phòng và dịch vụ thu đổi ngoại tệ cho khách.

Phòng khách được trang bị tủ lạnh, minibar, ấm đun nước, vòi xịt/chậu rửa vệ sinh, áo choàng tắm và bàn làm việc. Tất cả các căn có tủ quần áo.

Khách sạn có phục vụ bữa sáng thực đơn buffet hoặc kiểu Á. Tại The Skyview Hòa Bình, khách sẽ tìm thấy nhà hàng phục vụ ẩm thực Việt. Bên cạnh đó, họ có thể yêu cầu món chay và món thuần chay.

Khách có thể chơi bi-a tại chỗ nghỉ. Ngoài ra, chỗ nghỉ có dịch vụ thuê ô tô.

Thành thạo tiếng Anh và tiếng Việt, đội ngũ nhân viên tại lễ tân luôn sẵn lòng hỗ trợ khách vào bất kỳ thời điểm nào trong ngày.

Sân bay Quốc tế Nội Bài cách 78 km.",8.4,2.0
https://www.booking.com/hotel/vn/mai-chau-sky-resort-ha2a-ba-nh1.vi.html,Mai Chau Sky Resort,"Bản Nà Thia, xã Nà Phòn, huyện Mai Châu, Mai Châu, Việt Nam","Mai Chau Sky Resort có hồ bơi ngoài trời, khu vườn, nhà hàng và quầy bar ở Mai Châu. Chỗ nghỉ cung cấp lễ tân 24/24, dịch vụ đưa đón sân bay, dịch vụ phòng và Wi-Fi miễn phí.

Tại resort, tất cả các phòng có sân hiên với view núi. Với phòng tắm riêng được trang bị vòi sen và đồ vệ sinh cá nhân miễn phí, tất cả các căn tại Mai Chau Sky Resort có TV màn hình phẳng và điều hòa, trong đó một số phòng có ban công. Các phòng đều có bàn làm việc và ấm đun nước để khách sử dụng.

Leo núi và câu cá là hoạt động được ưa chuộng trong khu vực. Ngoài ra, resort 3 sao này có dịch vụ thuê xe đạp.

Sân bay Thọ Xuân cách 126 km.",8.4,3.0
https://www.booking.com/hotel/vn/melody-retreat-venue-travel.vi.html,Melody Retreat - Venuestay,"Cư Yên, Lương Sơn, Hòa Bình, Hòa Bình, Việt Nam","Nằm ở Hòa Bình, cách Sân vận động Quốc gia Mỹ Đình 38 km, Melody Retreat - Venuestay cung cấp chỗ nghỉ có hồ bơi ngoài trời, chỗ đậu xe riêng miễn phí, khu vườn và phòng chờ chung. Với quầy bar, chỗ nghỉ nằm cách Trung tâm thương mại Vincom Nguyễn Chí Thanh 40 km. Khách sạn này nhìn ra hồ bơi và cung cấp sân hiên, lễ tân 24/24, cùng Wi-Fi miễn phí ở toàn bộ chỗ nghỉ.

Tại khách sạn, tất cả các phòng đều có sân trong với view vườn. Với phòng tắm riêng được trang bị vòi xịt/chậu rửa vệ sinh và đồ vệ sinh cá nhân miễn phí, tất cả các căn tại Melody Retreat - Venuestay có TV màn hình phẳng và điều hòa, trong đó một số phòng có ban công. Tất cả các phòng đều có tủ lạnh.

Chỗ nghỉ cách Bảo tàng mỹ thuật Việt Nam 41 km và Văn Miếu - Quốc Tử Giám 41 km.",9.7,
https://www.booking.com/hotel/vn/lepont-mu-waterfall-bungalow.vi.html,LePont Mu Waterfall Bungalow,"Thác Mu, xã Tự Do, huyện Lạc Sơn, tỉnh Hòa Bình, Hòa Bình, Việt Nam","Nhìn ra khu vườn, LePont Mu Waterfall Bungalow nằm ở Hòa Bình và có nhà hàng, dịch vụ phòng, quầy bar, khu vườn, hồ bơi ngoài trời mở theo mùa cũng như sân hiên. WiFi và chỗ đậu xe riêng đều có sẵn tại lodge miễn phí.

Nơi đây còn có phòng tắm chung với vòi xịt/chậu rửa vệ sinh ở một số căn, cùng đồ vệ sinh cá nhân miễn phí, máy sấy tóc và dép đi trong phòng.

Sân bay Thọ Xuân cách 96 km.",9,
https://www.booking.com/hotel/vn/avana-retreat.vi.html,Avana Retreat,"Xóm Pạnh, Xã Bao La, Mai Châu, Việt Nam","Avana Retreat có khu vườn, sân hiên, nhà hàng và quầy bar ở Mai Châu. Chỗ nghỉ này có các tiện nghi như dịch vụ phòng và quầy lễ tân 24 giờ, cùng với Wi-Fi miễn phí ở toàn bộ chỗ nghỉ. Resort cung cấp hồ bơi ngoài trời, trung tâm thể dục, hoạt động giải trí vào buổi tối và câu lạc bộ trẻ em.

Tại resort, phòng nào cũng có ban công. Phòng tắm riêng được trang bị vòi sen, đồ vệ sinh cá nhân miễn phí và máy sấy tóc. Tại Avana Retreat, mỗi phòng đều được thiết kế có khu vực ghế ngồi.

Chỗ nghỉ có sân chơi trẻ em.

Sân bay Thọ Xuân cách 135 km.",9.5,
https://www.booking.com/hotel/vn/thao-ly-homestay-mai-chau.vi.html,Thao Ly Homestay Mai Chau,"Bản Nhót, huyện Mai Châu, Hoà Bình, Hòa Bình, Việt Nam","Nằm ở Hòa Bình, Thao Ly Homestay Mai Chau cung cấp chỗ nghỉ nhìn ra núi, có Wi-Fi miễn phí và khu vườn với sân hiên.

Nơi đây còn có phòng tắm chung với vòi xịt/chậu rửa vệ sinh ở một số căn, cùng đồ vệ sinh cá nhân miễn phí, máy sấy tóc và dép đi trong phòng.

Sân bay Thọ Xuân cách 127 km.",9.1,
https://www.booking.com/hotel/vn/maichau-hideaway.vi.html,Mai Chau Hideaway Lake Resort,"Xóm Suối Lốn, Tân Mai, Mai châu Hòa Binh Suoi Lon Village, Tan Mai, Maichau District, Mai Châu, Việt Nam","Maichau Hideaway Resort là resort thân thiện với môi trường ở huyện Mai Châu. Nơi đây có hồ bơi, nhà hàng cùng quầy bar và khu vườn để khách thư giãn.

Các phòng đều có mái tranh và nội thất gỗ, mang lại cảm giác mộc mạc cho phòng nghỉ. Tất cả các phòng đều có máy điều hòa, sân hiên và ban công riêng. Tủ lạnh mini và ấm đun nước cũng được bố trí trong phòng. Phòng tắm riêng được trang bị bồn tắm và vòi sen.

Maichau Hideaway Resort phục vụ ăn uống với thực đơn lập sẵn.

Thành phố Hà Nội cách chỗ nghỉ này 130 km.",8.3,4.0
https://www.booking.com/hotel/vn/muong-bi-homestay.vi.html,Muong Bi Homestay,"Ai Village, Phong Phu Ward, Tan Lac District, Hoa Binh, Hòa Bình, Việt Nam","Nhìn ra khu vườn, Muong Bi Homestay ở Hòa Bình cung cấp chỗ nghỉ có hồ bơi ngoài trời, khu vườn, phòng chờ chung và sân hiên. WiFi miễn phí có sẵn ở toàn bộ chỗ nghỉ.

Một số căn có TV màn hình phẳng truyền hình vệ tinh, bếp đầy đủ tiện nghi với tủ lạnh, cùng phòng tắm chung được trang bị vòi xịt/chậu rửa vệ sinh và đồ vệ sinh cá nhân miễn phí.

Khách có thể thưởng thức bữa sáng thực đơn buffet, kiểu Á hoặc món chay tại chỗ nghỉ.

Homestay có sân chơi trẻ em.

Du khách có thể lặn biển, câu cá và đi xe đạp để khám phá khu vực xung quanh.

Sân bay Thọ Xuân cách 119 km, đồng thời chỗ nghỉ có cung cấp dịch vụ đưa đón sân bay mất phí.",8.7,
https://www.booking.com/hotel/vn/tho-phuc-homestay.vi.html,Cò's House,"27 Bản Lác, Mai Châu, Việt Nam","Tọa lạc ở Mai Châu, Cò's House cung cấp Wi-Fi miễn phí, nơi khách có thể trải nghiệm xe đạp miễn phí, khu vườn và phòng chờ chung. Chỗ đậu xe riêng có sẵn trong khuôn viên.

Một số chỗ nghỉ có bao gồm sân hiên nhìn ra thành phố, bếp đầy đủ tiện nghi, cùng phòng tắm chung được trang bị vòi xịt/chậu rửa vệ sinh.

Chỗ nghỉ có phục vụ bữa sáng thực đơn buffet, kiểu Mỹ hoặc kiểu Á hằng ngày. Tại homestay, khách sẽ tìm thấy nhà hàng phục vụ ẩm thực Á.

Sân bay Thọ Xuân cách 124 km, đồng thời chỗ nghỉ có cung cấp dịch vụ đưa đón sân bay mất phí.",9.4,
https://www.booking.com/hotel/vn/little-mai-chau-home-stay.vi.html,Little Mai Chau Home Stay,"Xóm Nà Phòn, xã Nà Phòn, Mai Châu, Việt Nam","Với khu vườn và phòng chờ chung, Little Mai Chau Home Stay nằm ở Mai Châu và cung cấp Wi-Fi miễn phí.

Một số căn có sân hiên và/hoặc ban công nhìn ra núi hoặc khu vườn.

Tại homestay, khách sẽ tìm thấy nhà hàng phục vụ ẩm thực Việt và Á. Bên cạnh đó, họ có thể yêu cầu món chay, không chứa sữa và món thuần chay.

Little Mai Chau Home Stay có sân chơi trẻ em.

Chỗ nghỉ có cả dịch vụ cho thuê xe đạp và dịch vụ cho thuê ô tô, đồng thời du khách có thể đi xe đạp gần đó.

Sân bay Thọ Xuân cách 125 km, đồng thời chỗ nghỉ có cung cấp dịch vụ đưa đón sân bay mất phí.",9.4,
https://www.booking.com/hotel/vn/little-bee.vi.html,Little Bee,"Cot Bai, Cao Ram, Luong Son, Hoa Binh, Viet Nam Cot Bai, Cao Ram, Luong Son, Hoa Binh, Luong Son, Việt Nam","Cách Sân vận động Quốc gia Mỹ Đình 46 km, Little Bee có khu vườn, sân hiên, điều hòa, ban công và Wi-Fi miễn phí.

Nơi đây còn có phòng tắm riêng với vòi xịt/chậu rửa vệ sinh ở tất cả các căn, cùng đồ vệ sinh cá nhân miễn phí, máy sấy tóc và dép đi trong phòng.

Khu cắm trại cách Trung tâm thương mại Vincom Nguyễn Chí Thanh 48 km và Bảo tàng mỹ thuật Việt Nam 49 km.",9.4,
https://www.booking.com/hotel/vn/fairy-house-mai-chau.vi.html,Fairy House Mai Châu,"79 Bản Lác, Mai Châu, Việt Nam","Nằm ở Mai Châu, Fairy House Mai Châu cung cấp chỗ nghỉ nhìn ra hồ, có Wi-Fi miễn phí và khu vườn với sân hiên.

Nơi đây còn có phòng tắm chung với vòi xịt/chậu rửa vệ sinh ở một số căn, cùng đồ vệ sinh cá nhân miễn phí, máy sấy tóc và dép đi trong phòng.

Nhà nghỉ B&B có phục vụ bữa sáng thực đơn buffet hoặc kiểu Á.

Fairy House Mai Châu có dịch vụ cho thuê xe đạp.

Sân bay Thọ Xuân cách 124 km.",8.8,
https://www.booking.com/hotel/vn/mai-chau-sunset-boutique.vi.html,Mai Chau Sunset Boutique Hotel,"Poom Coong Village , Mai Chau, hoa Binh, Mai Châu, Việt Nam","Mai Chau Sunset Boutique Hotel cung cấp chỗ nghỉ tại huyện Mai Châu và có truy cập Wi-Fi miễn phí. Nơi nghỉ có nhà hàng trong khuôn vien. Chỗ đỗ xe riêng miễn phí được bố trí ngay trong khuôn viên nơi này.

Các phòng tại đây bao gồm phòng tắm riêng với vòi sen. Dép đi trong phòng, đồ vệ sinh cá nhân miễn phí và máy sấy tóc cũng được cung cấp để mang lại sự thoải mái cho khách.

Xe đạp miễn phí và các tour đi bộ với hướng dẫn viên nói tiếng Anh được bố trí cho du khách. Nơi nghỉ có lễ tân làm việc 24 giờ.

Khách sạn cũng cung cấp dịch vụ cho thuê xe hơi và có xe đạp cho khách sử dụng miễn phí.",8.3,3.0
https://www.booking.com/hotel/vn/pubin-paradise.vi.html,PuBin Paradise,"Xóm Hợp Thành, Xã Thành Sơn, Huyện Mai Châu, tỉnh Hoà Bình, Hòa Bình, Việt Nam","PuBin Paradise cung cấp chỗ nghỉ tại Hòa Bình. Chỗ nghỉ này có các tiện nghi như nhà hàng, dịch vụ phòng và quầy lễ tân 24 giờ, cùng với Wi-Fi miễn phí ở toàn bộ chỗ nghỉ. Khách sạn có khu vườn và cung cấp sân chơi trẻ em.

Phòng tắm riêng được trang bị vòi xịt/chậu rửa vệ sinh, đồ vệ sinh cá nhân miễn phí và máy sấy tóc. Tất cả các phòng đều có bàn làm việc và ấm đun nước để khách sử dụng.

Khách sạn có phục vụ bữa sáng kiểu Á mỗi buổi sáng.

Sân bay Thọ Xuân cách 151 km.",8.2,
https://www.booking.com/hotel/vn/mai-chau-la-vida-homestay.vi.html,Mai Chau La Vida Homestay,"Bản Cha, Tòng Đậu, Mai Châu, Mai Châu, Việt Nam","Mai Chau La Vida Homestay nằm ở Mai Châu, nhìn ra núi và có Wi-Fi miễn phí cùng chỗ đậu xe riêng miễn phí.

Các căn có bếp đầy đủ tiện nghi với khu vực ăn uống, tủ lạnh, ấm đun nước và lò vi sóng. Nơi đây còn có phòng tắm chung với vòi xịt/chậu rửa vệ sinh ở một số căn, cùng đồ vệ sinh cá nhân miễn phí, máy sấy tóc và dép đi trong phòng.

Chỗ nghỉ có phục vụ bữa sáng mỗi buổi sáng, gồm các lựa chọn kiểu Anh/ Ai-len, kiểu Ý và kiểu Mỹ.

Khách cũng có thể thư giãn trong khu vườn.

Sân bay gần nhất là Sân bay Thọ Xuân, cách homestay 128 km.",9.1,
https://www.booking.com/hotel/vn/truong-huy-homestay.vi.html,Truong Huy Homestay,"Nhot Village, Na Phon Commune, Mai Chau District, Hoa Binh Provine, Mai Châu, Việt Nam","Nằm ở Mai Châu, Truong Huy Homestay cung cấp Wi-Fi miễn phí, nơi khách có thể trải nghiệm khu vườn, phòng chờ chung và sân hiên.

Một số căn có khu vực ghế ngồi và/hoặc ban công.

Tại homestay, khách sẽ tìm thấy nhà hàng phục vụ ẩm thực Việt. Bên cạnh đó, họ có thể yêu cầu món chay và không chứa gluten.

Truong Huy Homestay có BBQ.

Chỗ nghỉ có cả dịch vụ cho thuê xe đạp và dịch vụ cho thuê ô tô, đồng thời du khách có thể đi xe đạp gần đó.

Chỗ nghỉ cách Sân bay Thọ Xuân 127 km và cung cấp dịch vụ đưa đón sân bay mất phí.",9.4,
https://www.booking.com/hotel/vn/mai-chau-home-holiday.vi.html,Mai Chau Home Holiday,"64 Pom Coọng, Mai Châu, Việt Nam","Nhìn ra thành phố, Mai Chau Home Holiday tọa lạc ở Mai Châu và có nhà hàng, bếp chung, quầy bar, khu vườn, sân hiên cũng như sân chơi trẻ em. Wi-Fi miễn phí được cung cấp ở toàn bộ chỗ nghỉ.

Mỗi căn đều được thiết kế có ban công nhìn ra núi.

Chỗ nghỉ này có phòng chờ chung, ngoài ra khách có thể đi xe đạp gần đó.

Chỗ nghỉ cách Sân bay Thọ Xuân 126 km và cung cấp dịch vụ đưa đón sân bay mất phí.",9.5,
https://www.booking.com/hotel/vn/green-mai-chau.vi.html,Green Homestay Mai Chau,"nà phòn mai châu hòa bình xóm nà phòn huyện mai châu hòa bình, Mai Châu, Việt Nam","Green Homestay Mai Chau có xe đạp miễn phí, khu vườn, phòng chờ chung và quầy bar ở Mai Châu. Chỗ đậu xe riêng miễn phí có sẵn và guest house còn cung cấp dịch vụ đưa đón cho những khách muốn khám phá khu vực xung quanh.

Tại guest house, các phòng được thiết kế có sân hiên với view núi. Các căn tại Green Homestay Mai Chau có điều hòa và bàn làm việc.

Khách tại chỗ nghỉ có thể thưởng thức bữa sáng kiểu Mỹ hoặc kiểu Á.

Đội ngũ nhân viên lễ tân 24/24 giao tiếp thành thạo bằng tiếng Anh và tiếng Việt.

Sân bay gần nhất là Sân bay Thọ Xuân, cách Green Homestay Mai Chau 124 km.",9,
https://www.booking.com/hotel/vn/meadow-mai-chau-homesay.vi.html,Meadow Mai Chau Homestay,"Nhót, Nà Phòn, Mai Châu, Hòa Bình, Việt Nam, Mai Châu, Việt Nam","Nhìn ra núi, Meadow Mai Chau Homestay nằm ở Mai Châu và có nhà hàng, bếp chung, quầy bar, khu vườn cũng như sân hiên. Homestay có WiFi và chỗ đậu xe riêng miễn phí.

Nơi đây còn có phòng tắm chung với vòi xịt/chậu rửa vệ sinh ở một số căn, cùng đồ vệ sinh cá nhân miễn phí, máy sấy tóc và dép đi trong phòng.

Hằng ngày, chỗ nghỉ có các lựa chọn thực đơn buffet, kiểu Á hoặc món chay cho bữa sáng.

Du khách có thể đi xe đạp để khám phá khu vực xung quanh, đồng thời Meadow Mai Chau Homestay có thể sắp xếp dịch vụ cho thuê xe đạp.

Chỗ nghỉ cách Sân bay Thọ Xuân 127 km và cung cấp dịch vụ đưa đón sân bay mất phí.",9.3,
https://www.booking.com/hotel/vn/homestay-185.vi.html,Mai Chau Green Ecohouse,"185 Bản Lác, Mai Châu District, Hoa Binh, Vietnam, Hòa Bình, Việt Nam","Nằm ở Hòa Bình, Mai Chau Green Ecohouse cung cấp Wi-Fi miễn phí, nơi khách có thể trải nghiệm xe đạp miễn phí, khu vườn và sân hiên.

Du khách có thể đi xe đạp gần đó.

Sân bay gần nhất là Sân bay Thọ Xuân, cách homestay 124 km.",9.5,
https://www.booking.com/hotel/vn/lim-39-s-house.vi.html,Lim's house,"Alley 1, group 3, Mo Village,, Mai Châu, Việt Nam","Lim's house ở thị trấn Mai Châu này có tiện nghi BBQ và nhà hàng trong khuôn viên.

Các phòng tại đây có ấm đun nước và phòng tắm riêng với bồn tắm/vòi sen, dép cùng đồ vệ sinh cá nhân miễn phí.

Du khách có thể tham gia nhiều hoạt động khác nhau như đạp xe và đi bộ đường dài. Chỗ nghỉ nhà dân này cũng cho thuê xe máy.",9.6,
