url,name,location,description,point,star
https://www.booking.com/hotel/vn/a-pao-homestay.vi.html,A Pao Homestay Mai Chau,"Pà Cò, Mai Châu, Hòa Bình, Việt Nam","Tọa lạc ở Hòa Bình, A Pao Homestay Mai Chau cung cấp Wi-Fi miễn phí và chỗ đậu xe riêng miễn phí.

Một số căn có sân hiên và/hoặc ban công nhìn ra núi.

Khách tại căn hộ có thể thưởng thức bữa sáng thực đơn buffet hoặc kiểu lục địa. Tại A Pao Homestay Mai Chau, khách sẽ tìm thấy nhà hàng phục vụ ẩm thực Việt. Bên cạnh đó, họ có thể yêu cầu món chay, không chứa sữa và món thuần chay.

Chỗ nghỉ có sân chơi trẻ em.

Khách nghỉ tại A Pao Homestay Mai Chau có thể leo núi gần đó, hoặc thỏa thích sử dụng khu vườn.

Sân bay Thọ Xuân cách 154 km.",8.8,3.0
https://www.booking.com/hotel/vn/sojo-hoa-binh.vi.html,SOJO Hotel Hoa Binh,"112 Le Thanh Tong, Tan Thinh, Hòa Bình, Việt Nam","Nằm ở Hòa Bình, cách Vietnam National University 43 km, SOJO Hotel Hoa Binh cung cấp chỗ nghỉ có trung tâm thể dục, chỗ đậu xe riêng miễn phí, phòng chờ chung và nhà hàng. Ngoài quầy bar, khách sạn 4 sao này có các phòng được trang bị điều hòa và phòng tắm riêng. Chỗ nghỉ này cung cấp bếp chung, quầy lễ tân 24 giờ và dịch vụ thu đổi ngoại tệ cho khách.

Các căn tại khách sạn đi kèm khu vực ghế ngồi, TV màn hình phẳng và két an toàn. Phòng khách đều có minibar.

Chỗ nghỉ có phục vụ bữa sáng thực đơn buffet, thực đơn à la carte hoặc kiểu lục địa mỗi sáng.

Sân bay Quốc tế Nội Bài cách 92 km.",8.8,4.0
https://www.booking.com/hotel/vn/hoa-vien-hoa-binh.vi.html,Hoa Viên Hotel - Suối khoáng Kim Bôi,"Khu du lịch Suối khoáng Kim Bôi, xóm Mớ Đá, thị trấn Bo, huyện Kim Bôi, tỉnh Hòa Bình, Hòa Bình, Việt Nam","Hoa Viên Hotel - Suối khoáng Kim Bôi có khu vườn, phòng chờ chung, nhà hàng và quầy bar ở Hòa Bình. Ngoài Wi-Fi miễn phí, khách sạn 4 sao này còn cung cấp quầy lễ tân 24 giờ và dịch vụ tiền sảnh. Chỗ đậu xe riêng miễn phí có sẵn và khách sạn còn cung cấp dịch vụ thuê xe đạp cho những khách muốn khám phá khu vực xung quanh.

Phòng khách được trang bị điều hòa, TV màn hình phẳng có truyền hình cáp, minibar, ấm đun nước, vòi sen, đồ vệ sinh cá nhân miễn phí và bàn làm việc. Tại khách sạn, mỗi phòng đều được thiết kế có phòng tắm riêng với máy sấy tóc và dép đi trong phòng.

Hoa Viên Hotel - Suối khoáng Kim Bôi có sân chơi trẻ em.

Sân bay Quốc tế Nội Bài cách 99 km.",6.4,4.0
https://www.booking.com/hotel/vn/tan-39-s-home-stay.vi.html,Nha Tan - Mai Chau Homestay and Tours,"Na Chiềng ( Nà Thia Cũ )- Nà Phòn- Mai Châu Na Chiềng ( Nà Thia Cũ )- Nà Phòn- Mai Châu, Mai Châu, Việt Nam","Tọa lạc ở Mai Châu, Nha Tan - Mai Chau Homestay and Tours cung cấp chỗ nghỉ nhìn ra núi, có Wi-Fi miễn phí và khu vườn với sân hiên.

Một số căn có khu vực ghế ngồi và/hoặc ban công.

Tại homestay, khách sẽ tìm thấy nhà hàng phục vụ ẩm thực Á. Bên cạnh đó, họ có thể yêu cầu món chay, không chứa sữa và món thuần chay.

Chỗ nghỉ này có sân chơi trẻ em và BBQ, ngoài ra khách có thể đi xe đạp gần đó.

Chỗ nghỉ cách Sân bay Thọ Xuân 126 km và cung cấp dịch vụ đưa đón sân bay mất phí.",9.8,
https://www.booking.com/hotel/vn/bao-an-resort-amp-bungalow.vi.html,BAO AN RESORT & BUNGALOW,"Tổ 9 Kỳ Sơn, Khu du lịch sinh thái Bảo Thọ Quốc Tế Hòa Bình, Hòa Bình, Việt Nam","Nằm ở Hòa Bình, cách Vietnam National University 33 km, BAO AN RESORT & BUNGALOW cung cấp chỗ nghỉ có khu vườn, chỗ đậu xe riêng miễn phí, sân hiên và nhà hàng. Chỗ nghỉ này có các tiện nghi như dịch vụ phòng và quầy lễ tân 24 giờ, cùng với Wi-Fi miễn phí ở toàn bộ chỗ nghỉ. Khách có thể sử dụng quầy bar.

Tại khách sạn, các phòng đều đi kèm với bàn làm việc, TV màn hình phẳng, phòng tắm riêng, ga trải giường và khăn tắm. BAO AN RESORT & BUNGALOW cung cấp một số phòng nhìn ra núi và phòng nào cũng có ban công. Tất cả các phòng tại chỗ nghỉ có điều hòa và tủ quần áo.

Sân bay gần nhất là Sân bay Quốc tế Nội Bài, cách BAO AN RESORT & BUNGALOW 83 km.",9.6,
https://www.booking.com/hotel/vn/viet-anh-mai-chau-homestay.vi.html,Viet Anh Mai Chau Homestay,"Xóm Lác, Xã Chiềng Châu, Huyện Mai Châu, Mai Châu, Việt Nam","Nhìn ra khu vườn, Viet Anh Mai Chau Homestay ở Mai Châu cung cấp chỗ nghỉ có xe đạp miễn phí, khu vườn, phòng chờ chung, sân hiên và nhà hàng. WiFi và chỗ đậu xe riêng đều có sẵn tại homestay miễn phí.

Nơi đây còn có phòng tắm chung với vòi xịt/chậu rửa vệ sinh ở một số căn, cùng đồ vệ sinh cá nhân miễn phí, máy sấy tóc và dép đi trong phòng.

Hằng ngày, chỗ nghỉ có các lựa chọn thực đơn à la carte, kiểu Á hoặc món chay cho bữa sáng.

Du khách có thể đi xe đạp gần đó.

Sân bay Thọ Xuân cách 124 km, đồng thời chỗ nghỉ có cung cấp dịch vụ đưa đón sân bay mất phí.",10,
https://www.booking.com/hotel/vn/maichau-dreams-homestay.vi.html,Mai Chau Dreams Homestay,"Bản Lác - Pom Coong, Mai Châu, Việt Nam","Mai Chau Dreams Homestay có xe đạp miễn phí, khu vườn, sân hiên và nhà hàng ở Mai Châu. Chỗ đậu xe riêng có thể được sắp xếp với một khoản phụ phí. Chỗ nghỉ cung cấp lễ tân 24/24, dịch vụ đưa đón sân bay, bếp chung và Wi-Fi miễn phí.

Tại khách sạn, các phòng đều có ban công với view thành phố. Tại Mai Chau Dreams Homestay, mỗi phòng đều được thiết kế có ga trải giường và khăn tắm.

Sân bay Thọ Xuân cách 124 km.",7.8,
https://www.booking.com/hotel/vn/ora-hill-farmstay-amp-glamping.vi.html,Ora Hill Farmstay & Glamping Hoa Binh,"Xóm Mỗ 2, Xã Bình Thanh, Huyện Cao Phong, Tỉnh Hòa Bình, Cao Phong, Việt Nam","Nhìn ra núi, Ora Hill Farmstay & Glamping Hoa Binh ở Cao Phong cung cấp chỗ nghỉ có hồ bơi ngoài trời, khu vườn, phòng chờ chung, sân hiên và quầy bar. WiFi và chỗ đậu xe riêng đều có sẵn tại lều trại sang trọng miễn phí.

Với sân trong, một số căn có điều hòa, khu vực ăn uống và khu vực ghế ngồi với TV màn hình phẳng. Nơi đây còn có phòng tắm chung với vòi sen ở một số căn, cùng đồ vệ sinh cá nhân miễn phí, máy sấy tóc và dép đi trong phòng.

Ora Hill Farmstay & Glamping Hoa Binh có phục vụ bữa sáng thực đơn à la carte hoặc kiểu Á.

Sân bay Quốc tế Nội Bài cách 105 km.",9.3,
https://www.booking.com/hotel/vn/mai-chau-valley-view.vi.html,Mai Chau Valley View Hotel,"Mai Chau Town, Mai Châu, Việt Nam","Mai Chau Valley View Hotel có quầy lễ tân 24 giờ và cung cấp các phòng nghỉ thoải mái với Wi-Fi miễn phí trong toàn bộ khuôn viên. Trong khuôn viên có chỗ đỗ xe miễn phí và khách sạn cung cấp xe đạp cho khách sử dụng miễn phí.

Cách khách sạn chỉ 600 m đi bộ là một làng dân tộc nơi quý khách có thể tìm hiểu về người dân địa phương. Chợ Mai Châu và Bến xe Mai Châu đều nằm trong bán kính 1 km từ khách sạn, trong khi thành phố Hà Nội cách đó chừng 140 km.

Các phòng máy lạnh tại đây có sàn lát gỗ, tủ quần áo, khu vực tiếp khách và truyền hình cáp màn hình phẳng. Ngoài ra còn có ban công và phòng tắm riêng đi kèm vòi sen, máy sấy tóc và đồ vệ sinh cá nhân miễn phí.

Tại Mai Chau Valley View Hotel, nhân viên thân thiện có thể hỗ trợ khách với các dịch vụ đặt vé, giữ hành lý và sắp xếp tour du lịch. Khách sạn có thể cung cấp dịch vụ giặt là, mát xa và dịch vụ đưa đón theo yêu cầu với một khoản phụ phí.

Nhà hàng trong khách sạn phục vụ các món ăn ngon của Việt Nam và Phương Tây từ 06:30 đến 22:00 hàng ngày.",9.3,
https://www.booking.com/hotel/vn/giang-house-hoa-binh.vi.html,Giang House,"Thôn 3/2a Thành Lập Lương Sơn Hoà Bình Thôn 3/2a Thành Lập, Lương Sơn, Hòa Bình, Hòa Bình, Việt Nam","Cách Trung tâm thương mại Vincom Nguyễn Chí Thanh 39 km, Giang House có hồ bơi ngoài trời, khu vườn, điều hòa, ban công và Wi-Fi miễn phí.

Nơi đây còn có phòng tắm riêng với vòi xịt/chậu rửa vệ sinh ở tất cả các căn, cùng đồ vệ sinh cá nhân miễn phí, máy sấy tóc và dép đi trong phòng.

Khách có thể sử dụng sân hiên tại homestay.

Giang House cách Sân vận động Quốc gia Mỹ Đình 39 km và Bảo tàng mỹ thuật Việt Nam 40 km.",9,
https://www.booking.com/hotel/vn/chien-tam-homestay.vi.html,Mai Chau with Love homestay,"bản Nhót , xã Nà Phòn , Huyện Mai Châu , tỉnh  Hòa Bình Chien Tam homestay bản Nhót xã Nà Phòn , huyện Mai Châu , tỉnh Hòa Bình, Bản Bang, Việt Nam","Nhìn ra núi, Mai Chau with Love homestay ở Bản Bang cung cấp chỗ nghỉ có khu vườn, phòng chờ chung, sân hiên và nhà hàng. WiFi và chỗ đậu xe riêng đều có sẵn tại homestay miễn phí.

Nơi đây còn có phòng tắm chung với vòi xịt/chậu rửa vệ sinh ở một số căn, cùng đồ vệ sinh cá nhân miễn phí, máy sấy tóc và dép đi trong phòng.

Mai Chau with Love homestay có sân chơi trẻ em.

Chỗ nghỉ có cả dịch vụ cho thuê xe đạp và dịch vụ cho thuê ô tô, đồng thời du khách có thể câu cá và đi xe đạp gần đó.

Sân bay Thọ Xuân cách 127 km, đồng thời chỗ nghỉ có cung cấp dịch vụ đưa đón sân bay mất phí.",8.5,
https://www.booking.com/hotel/vn/peaceful-maichau-homestay-hoa-binh.vi.html,Peaceful MaiChau Homestay,"Xóm Nhót, xã Nà Phòn, huyện Mai Châu, thị trấn Mai Châu, tỉnh Hòa Bình, Mai Châu, Việt Nam","Nhìn ra khu vườn, Peaceful MaiChau Homestay ở Mai Châu cung cấp chỗ nghỉ có hồ bơi ngoài trời, khu vườn, sân hiên và quầy bar. WiFi và chỗ đậu xe riêng đều có sẵn tại nhà nghỉ B&B miễn phí.

Nơi đây còn có phòng tắm riêng với vòi xịt/chậu rửa vệ sinh ở tất cả các căn, cùng đồ vệ sinh cá nhân miễn phí, máy sấy tóc và dép đi trong phòng.

Peaceful MaiChau Homestay có phục vụ bữa sáng thực đơn buffet hằng ngày.

Sân bay gần nhất là Sân bay Thọ Xuân, cách chỗ nghỉ 127 km.",9.4,3.0
https://www.booking.com/hotel/vn/serena-resort-hoa-binh.vi.html,Serena Kim Boi Resort - Hoa Binh,"Khai Doi Village, Sao Bay Town, Kim Boi Dist, Hòa Bình, Việt Nam","""Serena Kim Boi Resort - Hoa Binh"" là chỗ nghỉ nhìn ra sông Bôi. Khách có thể thưởng thức cảnh quan tuyệt đẹp của những cánh đồng lúa hoặc ngâm mình trong bồn tắm nước khoáng nóng Kim Bôi. Khu nghỉ dưỡng này cũng có suối tắm nước nóng Onsen, phòng xông hơi ướt và bể bơi.

Quý khách có thể thưởng thức một tách trà trong lúc ngắm nhìn quang cảnh núi non/khu vườn.

Chỗ nghỉ có lễ tân phục vụ 24 giờ/ngày.

Khu nghỉ dưỡng cũng cung cấp xe đạp cho khách sử dụng miễn phí. Sân bay gần nhất là sân bay quốc tế Nội Bài, cách chỗ nghỉ 73 km.

Quý khách có thể dùng bữa tại nhà hàng trong khuôn viên và thưởng thức đồ uống tại quầy bar.",8,4.0
https://www.booking.com/hotel/vn/furano-garden-home-hoa-binh-venue-travel.vi.html,Furano Garden Home Hoa Binh - Venuestay,"Bản, Suối Cốc, Lương Sơn, Hòa Bình, Việt Nam, Hòa Bình, Việt Nam","Cách Sân vận động Quốc gia Mỹ Đình 40 km, Furano Garden Home Hoa Binh - Venuestay có hồ bơi ngoài trời, khu vườn, điều hòa, sân trong và Wi-Fi miễn phí.

Biệt thự có TV màn hình phẳng và phòng tắm riêng với đồ vệ sinh cá nhân miễn phí, dép đi trong phòng và vòi sen. Một số căn có sân hiên và/hoặc ban công nhìn ra thành phố hoặc núi.

Furano Garden Home Hoa Binh - Venuestay có sân chơi trẻ em.

Khách nghỉ tại chỗ nghỉ có thể chơi bi-a trong khuôn viên, hoặc leo núi hay câu cá ở khu vực xung quanh.

Furano Garden Home Hoa Binh - Venuestay cách Trung tâm thương mại Vincom Nguyễn Chí Thanh 42 km và Bảo tàng mỹ thuật Việt Nam 43 km.",9.3,4.0
https://www.booking.com/hotel/vn/ivory-villas-and-resort.vi.html,Ivory Villas and Resort,"Kem Hamlet, Lam Son Commune, Luong Son Ward, Hoa Binh City Kem Hamlet, Lam Son Commune, Luong Son Ward, Hoa Binh City, Hòa Bình, Việt Nam","Với khu vườn, sân hiên và nhìn ranúi, Ivory Villas and Resort nằm ở Hòa Bình, cách Sân vận động Quốc gia Mỹ Đình 45 km. Ngoài xe đạp miễn phí, resort 4 sao này có các phòng được trang bị điều hòa và Wi-Fi miễn phí, trong đó mỗi phòng sẽ có phòng tắm riêng. Chỗ nghỉ này cung cấp dịch vụ phòng, quầy lễ tân 24 giờ và dịch vụ thu đổi ngoại tệ cho khách.

Các phòng đều đi kèm với bàn làm việc và TV màn hình phẳng, ngoài ra một số phòng tại resort có ban công. Tất cả các phòng đều có tủ quần áo và ấm đun nước để khách sử dụng.

Hằng ngày, chỗ nghỉ có các lựa chọn thực đơn buffet, kiểu Mỹ hoặc kiểu Á cho bữa sáng. Tại Ivory Villas and Resort, khách sẽ tìm thấy nhà hàng phục vụ ẩm thực Mỹ, Việt và Á. Bên cạnh đó, họ có thể yêu cầu món chay, đồ ăn Halal và kosher (cho người đạo Do Thái).

Chỗ nghỉ có sân chơi trẻ em.

Ivory Villas and Resort cách Trung tâm thương mại Vincom Nguyễn Chí Thanh 47 km và Bảo tàng mỹ thuật Việt Nam 48 km.",7.3,4.0
https://www.booking.com/hotel/vn/vresort.vi.html,VResort Kim Boi - Hoa Binh,"Thôn Kim Đức, xã Vĩnh Tiến, huyện Kim Bôi, Tỉnh Hòa Bình, Việt Nam, Hòa Bình, Việt Nam","VResort Kim Boi - Hoa Binh ở Hòa Bình cung cấp chỗ nghỉ có nhà hàng và quầy bar. Ngoài sân hiên, khách sạn 3 sao này có các phòng được trang bị điều hòa và Wi-Fi miễn phí, trong đó mỗi phòng sẽ có phòng tắm riêng. Chỗ nghỉ này có hồ bơi ngoài trời mở theo mùa, hồ bơi trong nhà, phòng xông hơi khô và khu vườn.

Tại khách sạn, mỗi phòng đều được thiết kế có tủ quần áo. VResort Kim Boi - Hoa Binh cung cấp một số căn nhìn ra núi và tất cả các phòng đều được thiết kế có ấm đun nước. Các phòng ở chỗ nghỉ được trang bị TV màn hình phẳng và máy sấy tóc.

Khách có thể thưởng thức bữa sáng thực đơn buffet, thực đơn à la carte hoặc kiểu Mỹ tại chỗ nghỉ.

Khách tại VResort Kim Boi - Hoa Binh sẽ có thể tận hưởng các hoạt động ở trong Hòa Bình và khu vực xung quanh, như đi xe đạp.

Sân bay Quốc tế Nội Bài cách 89 km.",7.8,3.0
https://www.booking.com/hotel/vn/homestay-highland-hmong.vi.html,Homestay Highland Hmong,"Bản Lác, Hòa Bình, Việt Nam","Nằm ở Hòa Bình, Homestay Highland Hmong cung cấp chỗ nghỉ có khu vườn, Wi-Fi miễn phí, bếp chung, cùng dịch vụ phòng. Khách có thể sử dụng sân trong và sân hiên.

Khăn tắm và ga trải giường có sẵn ở homestay.

Đội ngũ nhân viên lễ tân 24/24 giao tiếp thành thạo bằng tiếng Anh và tiếng Việt.

Sân bay gần nhất là Sân bay Thọ Xuân, cách homestay 160 km, đồng thời chỗ nghỉ có cung cấp dịch vụ đưa đón sân bay mất phí.",9.2,
https://www.booking.com/hotel/vn/mai-chau-home.vi.html,Mai Chau Home,"Stilt House 32, Ban Lac, Mai Chau, Hoa Binh, Mai Châu, Việt Nam","Nhìn ra hồ, Mai Chau Home tọa lạc ở Mai Châu và có nhà hàng, bếp chung, bar thức ăn nhẹ cũng như khu vườn. WiFi và chỗ đậu xe riêng đều có sẵn tại homestay miễn phí.

Tại đây có phòng tắm chung đầy đủ tiện nghi với vòi xịt/chậu rửa vệ sinh và dép đi trong phòng.

Du khách có thể đi xe đạp gần đó.

Sân bay Thọ Xuân cách 124 km, đồng thời chỗ nghỉ có cung cấp dịch vụ đưa đón sân bay mất phí.",9.3,
https://www.booking.com/hotel/vn/mai-chau-mountain-view-resort.vi.html,Mai Chau Mountain View Resort,"2 Bản Lác Mai Châu Mountain View, Mai Châu, Việt Nam","Mai Chau Mountain View Resort có xe đạp miễn phí, hồ bơi ngoài trời theo mùa, khu vườn và nhà hàng ở Mai Châu. Khách sạn 4 sao này cung cấp quầy bar. Chỗ nghỉ cung cấp lễ tân 24/24, dịch vụ đưa đón sân bay, dịch vụ phòng và Wi-Fi miễn phí.

Tại khách sạn, tất cả các phòng đều có điều hòa, bàn làm việc, sân hiên với view núi, phòng tắm riêng, TV màn hình phẳng, ga trải giường và khăn tắm. Tất cả các căn đều có tủ quần áo và ấm đun nước để khách sử dụng.

Mai Chau Mountain View Resort có sân chơi trẻ em.

Sân bay Thọ Xuân cách 124 km.",8.8,4.0
https://www.booking.com/hotel/vn/khach-san-gia-re-mai-chau-tien-loan.vi.html,Khách Sạn Gía Rẽ Mai Châu Tiến Loan,"số 100 tiểu khu 4 , thị trấn mai châu, Mai Châu, Việt Nam","Khách Sạn Gía Rẽ Mai Châu Tiến Loan tọa lạc ở Mai Châu. Tại đây có sân hiên và khách có thể sử dụng Wi-Fi miễn phí và chỗ đậu xe riêng miễn phí.

Khách sạn có phục vụ bữa sáng kiểu Á hằng ngày.

Thành thạo tiếng Anh và tiếng Việt, đội ngũ nhân viên tại lễ tân 24/24 luôn túc trực để hỗ trợ khách.

Sân bay Thọ Xuân cách 125 km.",9.2,
https://www.booking.com/hotel/vn/phu-gia-hoa-binh.vi.html,Grand Hotel,"Phu Thanh Phat Trade Center Area - #129 Le Thanh Ton, Hòa Bình, Việt Nam","Tọa lạc ở Hòa Bình, cách Vietnam National University 43 km, Grand Hotel cung cấp chỗ nghỉ có phòng chờ chung, chỗ đậu xe riêng miễn phí, nhà hàng và quầy bar. Khách sạn 3 sao này có dịch vụ văn phòng và dịch vụ tiền sảnh. Chỗ nghỉ cung cấp lễ tân 24/24, dịch vụ đưa đón sân bay, dịch vụ phòng và Wi-Fi miễn phí.

Các phòng được trang bị điều hòa, TV màn hình phẳng có truyền hình cáp, minibar, ấm đun nước, vòi xịt/chậu rửa vệ sinh, đồ vệ sinh cá nhân miễn phí và bàn làm việc. Tất cả các phòng đều được thiết kế có két an toàn và một số phòng nhìn ra thành phố. Tất cả các căn có tủ quần áo.

Sân bay Quốc tế Nội Bài cách 92 km.",7.2,3.0
https://www.booking.com/hotel/vn/mai-chau-tropical-homestay.vi.html,Mai Chau Tropical Homestay,"Nà Phòn, Hòa Bình, Việt Nam","Nhìn ra khu vườn, Mai Chau Tropical Homestay ở Hòa Bình cung cấp chỗ nghỉ có hồ bơi ngoài trời, khu vườn, sân hiên và nhà hàng. WiFi và chỗ đậu xe riêng đều có sẵn tại homestay miễn phí.

Nơi đây còn có phòng tắm chung với vòi xịt/chậu rửa vệ sinh ở một số căn, cùng đồ vệ sinh cá nhân miễn phí, máy sấy tóc và dép đi trong phòng.

Hằng ngày, chỗ nghỉ có các lựa chọn thực đơn à la carte, kiểu lục địa hoặc kiểu Á cho bữa sáng.

Du khách có thể đi xe đạp gần đó.

Chỗ nghỉ cách Sân bay Thọ Xuân 127 km và cung cấp dịch vụ đưa đón sân bay mất phí.",9.7,
https://www.booking.com/hotel/vn/khach-san-tien-loan-hoa-binh.vi.html,Khách Sạn Tiến Loan,"số 100 tiểu khu 4 ,thị trấn mai châu, huyện mai châu, Hòa Bình, Việt Nam","Khách Sạn Tiến Loan tọa lạc ở Hòa Bình. Tại đây có sân hiên và khách có thể sử dụng Wi-Fi miễn phí và chỗ đậu xe riêng miễn phí.

Khách sạn có phục vụ bữa sáng thực đơn buffet hoặc kiểu Á.

Thành thạo tiếng Anh và tiếng Việt, đội ngũ nhân viên luôn túc trực 24/7 tại lễ tân.

Sân bay Thọ Xuân cách 125 km.",10,
https://www.booking.com/hotel/vn/mai-chau-horizon-homestay.vi.html,Mai chau Horizon Homestay,"Pom Coọng, Mai Châu, Việt Nam","Mai chau Horizon Homestay tọa lạc ở Mai Châu. Tại đây có sân hiên và khách có thể sử dụng Wi-Fi miễn phí và chỗ đậu xe riêng miễn phí.

Khách tại guest house có thể thưởng thức bữa sáng thực đơn buffet.

Đi xe đạp là hoạt động được ưa chuộng trong khu vực. Ngoài ra, Mai chau Horizon Homestay có dịch vụ thuê xe đạp và dịch vụ thuê ô tô.

Với đội ngũ nhân viên thành thạo tiếng Anh và tiếng Việt, dịch vụ hướng dẫn 24/7 luôn có sẵn tại lễ tân.

Sân bay gần nhất là Sân bay Thọ Xuân, cách chỗ nghỉ 125 km.",9,
https://www.booking.com/hotel/vn/mai-hich-farmstay-2.vi.html,MAI HICH FARMSTAY 2,"Hịch 2, MAI HỊCH, MAI CHÂU, HOÀ BÌNH, Mai Hạ, Việt Nam","MAI HICH FARMSTAY 2 cung cấp chỗ nghỉ có khu vườn, Wi-Fi miễn phí và nằm ở Mai Hạ.

Nơi đây còn có phòng tắm chung với vòi xịt/chậu rửa vệ sinh ở một số căn, cùng đồ vệ sinh cá nhân miễn phí, máy sấy tóc và dép đi trong phòng.

Homestay có phục vụ bữa sáng thực đơn buffet hoặc kiểu Á.

Sân bay Thọ Xuân cách 119 km.",9.9,
https://www.booking.com/hotel/vn/maida-lodge.vi.html,Maida Lodge,"xóm Đoàn Kết, xã Tiền Phong, huyện Đà Bắc ,tỉnh Hoà Bình, Hòa Bình, Việt Nam","Maida Lodge có hồ bơi ngoài trời, khu vườn, phòng chờ chung và nhà hàng ở Hòa Bình. Chỗ nghỉ này có các tiện nghi như quầy bar và tiện nghi thể thao dưới nước. Chỗ nghỉ này cung cấp dịch vụ phòng, quầy lễ tân 24 giờ và dịch vụ thu đổi ngoại tệ cho khách.

Tại resort, tất cả các phòng có tủ quần áo. Phòng tắm riêng được trang bị vòi xịt/chậu rửa vệ sinh, đồ vệ sinh cá nhân miễn phí và máy sấy tóc. Tất cả các căn tại Maida Lodge có điều hòa và bàn làm việc.

Chỗ nghỉ có sân hiên phơi nắng. Đi xe đạp là hoạt động được ưa chuộng trong khu vực. Ngoài ra, Maida Lodge có dịch vụ thuê xe đạp.

Sân bay Quốc tế Nội Bài cách 140 km.",8.6,
https://www.booking.com/hotel/vn/mai-chau-rustic-home.vi.html,Mai Chau Rustic Home,"Mo Village, Mai Chau District, Hoa Binh, Mai Châu, Việt Nam","Nhìn ra núi, Mai Chau Rustic Home ở Mai Châu cung cấp chỗ nghỉ có phòng chờ chung, nhà hàng và quầy bar. WiFi miễn phí có sẵn ở toàn bộ chỗ nghỉ.

Để thuận tiện hơn cho khách, chỗ nghỉ có thể cung cấp khăn tắm và khăn trải giường với khoản phụ phí.

Homestay có phục vụ bữa sáng thực đơn à la carte hoặc kiểu Á.

Khách có thể sử dụng sân hiên phơi nắng tại Mai Chau Rustic Home.

Sân bay Thọ Xuân cách 123 km.",8.8,
https://www.booking.com/hotel/vn/mai-chau-friendly-homestay-mai-chau.vi.html,Mai Châu Friendly homestay,"Nà Chiềng, Nà Phòn, Mai Châu, Hoà Bình, Bản Bang, Việt Nam","Nằm ở Bản Bang, Mai Châu Friendly homestay cung cấp chỗ nghỉ có hồ bơi ngoài trời mở quanh năm, Wi-Fi miễn phí, khu vườn và sân hiên.

Nơi đây còn có phòng tắm chung với vòi xịt/chậu rửa vệ sinh ở một số căn, cùng đồ vệ sinh cá nhân miễn phí, máy sấy tóc và dép đi trong phòng.

Khách tại nhà nghỉ B&B có thể thưởng thức bữa sáng kiểu Á.

Sân bay Thọ Xuân cách 124 km.",,
https://www.booking.com/hotel/vn/linh-san.vi.html,Linh San Hotel,"Số 16 đường QH15, khu đô thị Mỹ Phong, Thinh Làng, Việt Nam","Linh San Hotel cung cấp chỗ nghỉ ở Thinh Làng. Khách sạn 2 sao này cung cấp dịch vụ phòng, quầy lễ tân 24 giờ và Wi-Fi miễn phí. Đây là chỗ nghỉ không hút thuốc và nằm cách Vietnam National University 37 km.

Sân bay Quốc tế Nội Bài cách 95 km.",8.5,2.0
