url,name,location,description,point,star
https://www.booking.com/hotel/vn/santorini-home-resort.vi.html,SANTORINI HOME RESORT,"Đường Ninh Tân, Vạn Ninh, Việt Nam","SANTORINI HOME RESORT nằm ở Vạn Ninh. Chỗ nghỉ này có khu vườn, sân hiên và khu vực bãi biển riêng, đồng thời tọa lạc giáp biển.

Chỗ nghỉ điều hòa này được trang bị bếp.

Khuôn viên của biệt thự có BBQ và du khách có thể lặn biển ở khu vực gần đó.",,
https://www.booking.com/hotel/vn/po-paragon-villa-hotel-nha-trang.vi.html,Paragon Villa Hotel Nha Trang,"Lot 203, Box DL, B01, An Vien Eco Tourism Area, Vinh Nguyen Ward, Nha Trang, Việt Nam","Tọa lạc cách Bãi biển South Beach 1 phút đi bộ, Paragon Villa Hotel Nha Trang cung cấp chỗ nghỉ 3 sao ở Nha Trang, đồng thời có khu vườn, nhà hàng và quầy bar. Chỗ nghỉ này nằm cách Bãi biển Nha Trang 3 km, Bảo tàng Alexandre Yersin 18 phút đi bộ và Viện Hải dương học 1.7 km. Chỗ nghỉ cung cấp lễ tân 24/24, dịch vụ đưa đón sân bay, dịch vụ phòng và Wi-Fi miễn phí ở toàn bộ chỗ nghỉ.

Khách sạn cách Tháp Trầm Hương 6 km và Trung tâm thương mại Nha Trang Center 7.1 km.","7,4",3.0
https://www.booking.com/hotel/vn/the-arena-cam-ranh-thanh-pho-cam-ranh7.vi.html,"THE ARENA Cam Ranh, căn hộ","THE ARENA Cam Ranh, Miếu Ông, Việt Nam","Với hồ bơi ngoài trời, khu vườn, cùng khu vực bãi biển riêng, THE ARENA Cam Ranh, căn hộ cung cấp chỗ nghỉ ở Miếu Ông có Wi-Fi miễn phí và nhìn ra thành phố. Tọa lạc cách 100 Egg Mud Bath 27 km, chỗ nghỉ cung cấp sân hiên và chỗ đậu xe riêng miễn phí.

Căn hộ điều hòa này có 1 phòng ngủ và 1 phòng tắm với vòi xịt/chậu rửa vệ sinh, vòi sen và đồ vệ sinh cá nhân miễn phí. Khăn tắm và ga trải giường có sẵn ở căn hộ.

Du khách có thể leo núi để khám phá khu vực xung quanh.

Căn hộ cách Bảo tàng Alexandre Yersin 34 km và Tháp Trầm Hương 34 km.",9,
https://www.booking.com/hotel/vn/kien-thinh-gia.vi.html,Kiến Thịnh Gia Hotel,"22 Hàn Thuyên, Nha Trang, Việt Nam","Tọa lạc ở Nha Trang, cách Bãi biển Nha Trang 1.7 km, Kiến Thịnh Gia Hotel cung cấp chỗ nghỉ có phòng chờ chung, chỗ đậu xe riêng miễn phí, sân hiên và khu vực bãi biển riêng. Khách sạn 2 sao này có dịch vụ phòng và dịch vụ tiền sảnh. Chỗ nghỉ này cung cấp dịch vụ đưa đón sân bay và dịch vụ cho thuê xe đạp.

Phòng khách được trang bị điều hòa, TV màn hình phẳng có truyền hình cáp, tủ lạnh, ấm đun nước, vòi xịt/chậu rửa vệ sinh, đồ vệ sinh cá nhân miễn phí và tủ quần áo. Ngoài phòng tắm riêng với vòi sen và máy sấy tóc, các phòng tại khách sạn cũng có Wi-Fi miễn phí, trong đó một số phòng có view núi. Tại Kiến Thịnh Gia Hotel, phòng nào cũng có ga trải giường và khăn tắm.

Đi xe đạp là hoạt động được ưa chuộng trong khu vực. Ngoài ra, chỗ nghỉ có dịch vụ thuê ô tô.

Đội ngũ nhân viên lễ tân giao tiếp thành thạo bằng tiếng Ả Rập, tiếng Bulgaria, tiếng Catalan và tiếng Séc, ngoài ra khách có thể yêu cầu hướng dẫn về khu vực xung quanh khi có nhu cầu.

Các điểm tham quan nổi tiếng gần Kiến Thịnh Gia Hotel bao gồm Chợ Đầm, Bảo tàng Khánh Hòa và Trung tâm thương mại Nha Trang Center. Sân bay gần nhất là Sân bay quốc tế Cam Ranh, cách khách sạn 37 km.",7,2.0
https://www.booking.com/hotel/vn/the-arena-cam-ranh-kh-resort.vi.html,Cam Ranh Sea View apeartment Nha Trang,"Lô D14D Bãi Dài, Thành phố Cam Ranh, tỉnh Khánh Hòa, Cam Ranh, Việt Nam","Tọa lạc ở Cam Ranh, cách 100 Egg Mud Bath 27 km, Cam Ranh Sea View apeartment Nha Trang cung cấp chỗ nghỉ có trung tâm thể dục, chỗ đậu xe riêng miễn phí, khu vườn và sân hiên. Chỗ nghỉ này có các tiện nghi như nhà hàng, dịch vụ phòng và quầy lễ tân 24 giờ, cùng với Wi-Fi miễn phí. Du khách có thể tận hưởng cảnh biển.

Tại khách sạn, mỗi phòng đều có ban công với view thành phố. Các phòng đều có điều hòa, két an toàn và TV màn hình phẳng để du khách có thể sử dụng.

Cam Ranh Sea View apeartment Nha Trang cách Bảo tàng Alexandre Yersin 34 km và Tháp Trầm Hương 34 km. Sân bay gần nhất là Sân bay quốc tế Cam Ranh, cách chỗ nghỉ 9 km.",8.2,
https://www.booking.com/hotel/vn/san-vuon-khanh-hoa.vi.html,Sân Vườn Hotel Khánh Hòa,"448 Trần Quý Cáp, TT. Ninh Hòa, Ninh Hòa, Khánh Hòa, Ninh Hòa, Việt Nam","Nằm ở Ninh Hòa, cách Tháp Bà Ponagar 30 km, Sân Vườn Hotel Khánh Hòa cung cấp chỗ nghỉ có Wi-Fi miễn phí và chỗ đậu xe riêng miễn phí. Khách sạn 2 sao này có các phòng được trang bị điều hòa. Khách sạn có phòng gia đình.

Tại khách sạn, các phòng đều đi kèm với bàn làm việc, TV màn hình phẳng, phòng tắm riêng, ga trải giường và khăn tắm. Tất cả các phòng đều có tủ quần áo và ấm đun nước để khách sử dụng.

Dịch vụ đề xuất 24/7 luôn có sẵn tại lễ tân với đội ngũ nhân viên thành thạo tiếng Anh và tiếng Việt.

Sân Vườn Hotel Khánh Hòa cách Hòn Chồng 31 km và Trung tâm du lịch Suối khoáng nóng Tháp Bà 32 km. Sân bay gần nhất là Sân bay quốc tế Cam Ranh, cách chỗ nghỉ 68 km.",7.2,2.0
https://www.booking.com/hotel/vn/marina-sea-view-nha-trang.vi.html,Marina Sea view,"25 Đường Phan Chu Trinh, P.Vạn Thạnh, TP Nha Trang, Tỉnh Khánh Hoà, Việt Nam, Nha Trang, Việt Nam","Marina Sea view là chỗ nghỉ giáp biển nằm ở Nha Trang, cách Chợ Đầm 6 phút đi bộ và Trung tâm thương mại Nha Trang Center chưa đến 1 km. Chỗ nghỉ điều hòa này cách Bãi biển Nha Trang 15 phút đi bộ, khách có thể sử dụng WiFi miễn phí và chỗ đậu xe riêng có sẵn trong khuôn viên.

Căn hộ có 2 phòng ngủ, phòng khách với TV màn hình phẳng, bếp đầy đủ tiện nghi, cùng 2 phòng tắm với vòi xịt/chậu rửa vệ sinh và vòi sen.

Các điểm tham quan nổi tiếng gần căn hộ bao gồm Nhà thờ Chánh tòa Kitô Vua (Nhà thờ Núi), Bảo tàng Khánh Hòa và Ga Nha Trang. Sân bay quốc tế Cam Ranh cách 36 km.",,
https://www.booking.com/hotel/vn/luxury-apt-sea-view-marina-suites-full-option.vi.html,2608 - Luxury Apt Sea View Marina Suites Full Option,"25 Phan Chu Trinh, Nha Trang, Việt Nam","Với khu vườn, phòng chờ chung, cùng quầy bar, 2608 - Luxury Apt Sea View Marina Suites Full Option cung cấp chỗ nghỉ ở Nha Trang có Wi-Fi miễn phí và nhìn ra biển. Chỗ đậu xe riêng có sẵn trong khuôn viên.

Căn hộ có 1 phòng ngủ, 1 phòng tắm, ga trải giường, khăn tắm, TV màn hình phẳng có truyền hình cáp, khu vực ăn uống, bếp đầy đủ tiện nghi, cùng sân hiên nhìn ra thành phố.

Khách có thể bơi ở hồ bơi trong nhà hoặc đi xe đạp.

Các điểm tham quan nổi tiếng gần căn hộ bao gồm Bãi biển Nha Trang, Chợ Đầm và Trung tâm thương mại Nha Trang Center. Chỗ nghỉ cách Sân bay quốc tế Cam Ranh 37 km và cung cấp dịch vụ đưa đón sân bay mất phí.",,4.0
https://www.booking.com/hotel/vn/phong-khach-san-3-sao.vi.html,Hòn Chồng Hotel,"6 Phạm Văn Đồng, Nha Trang, Việt Nam","Tọa lạc ở Nha Trang, cách Bãi biển Ba Làng chưa đến 1 km, Hòn Chồng Hotel cung cấp chỗ nghỉ có khu vườn, chỗ đậu xe riêng miễn phí, sân hiên và nhà hàng. Ngoài Wi-Fi miễn phí, khách sạn 3 sao này còn cung cấp dịch vụ phòng và quầy lễ tân 24 giờ. Một số căn tại chỗ nghỉ có ban công với view biển.

Khách tại khách sạn có thể thưởng thức bữa sáng thực đơn buffet.

Hòn Chồng Hotel cách Bãi biển Nha Trang 2.9 km và Hòn Chồng 8 phút đi bộ.",10,3.0
https://www.booking.com/hotel/vn/green-home-nha-trang.vi.html,Green Home Nha Trang,"92/20 Hùng Vương, Phường Lộc Thọ, Nha Trang, Khánh Hòa, Nha Trang, Việt Nam","Tọa lạc ở Nha Trang, cách Bãi biển Nha Trang 8 phút đi bộ, Green Home Nha Trang có quầy bar và nhìn rathành phố. Chỗ nghỉ này có các tiện nghi như nhà hàng, dịch vụ phòng và quầy lễ tân 24 giờ, cùng với Wi-Fi miễn phí. Du khách có thể thưởng thức đồ uống tại bar thức ăn nhẹ.

Khách sạn sẽ cung cấp cho khách các phòng được trang bị điều hòa có tủ quần áo, ấm đun nước, tủ lạnh, minibar, két an toàn, TV màn hình phẳng và phòng tắm riêng với vòi sen.

Các điểm tham quan nổi tiếng gần Green Home Nha Trang bao gồm Trung tâm thương mại Nha Trang Center, Nhà thờ Chánh tòa Kitô Vua (Nhà thờ Núi) và Tháp Trầm Hương. Sân bay quốc tế Cam Ranh cách 35 km.",9.2,
https://www.booking.com/hotel/vn/lobster.vi.html,Tôm Hùm Palace,"số 1 Bãi Nồm , Bình Ba , Cam Bình , Cam Ranh , Khánh Hòa, Cam Ranh, Việt Nam","Nằm giáp biển, Tôm Hùm Palace cung cấp chỗ nghỉ 3 sao ở Cam Ranh, đồng thời có hồ bơi ngoài trời, khu vườn và phòng chờ chung. Ngoài dịch vụ phòng, chỗ nghỉ này còn có nhà hàng và sân hiên để phục vụ du khách. Chỗ nghỉ cung cấp lễ tân 24/24, dịch vụ đưa đón sân bay, bếp chung và Wi-Fi miễn phí ở toàn bộ chỗ nghỉ.

Tại khách sạn, các phòng đều có bàn làm việc. Với phòng tắm riêng được trang bị vòi xịt/chậu rửa vệ sinh và đồ vệ sinh cá nhân miễn phí, phòng khách tại Tôm Hùm Palace có TV màn hình phẳng và điều hòa, trong đó một số phòng có ban công. Tại chỗ nghỉ, mỗi phòng đều được thiết kế có ga trải giường và khăn tắm.

Khách tại Tôm Hùm Palace sẽ có thể tận hưởng các hoạt động ở trong Cam Ranh và khu vực xung quanh, như câu cá.",8.2,3.0
https://www.booking.com/hotel/vn/happy-home-the-costa-by-ms-phuong.vi.html,HAPPY HOME - The Costa -by Ms Phuong,"32 Trần Phú Tầng 12, Nha Trang, Việt Nam","Với hồ bơi ngoài trời, khu vườn, cùng phòng chờ chung, HAPPY HOME - The Costa -by Ms Phuong cung cấp chỗ nghỉ ở Nha Trang có Wi-Fi miễn phí và nhìn ra biển. Căn hộ cung cấp chỗ đậu xe riêng miễn phí và bếp chung.

Với sân hiên nhìn ra thành phố, căn hộ có 1 phòng ngủ, phòng khách, TV màn hình phẳng truyền hình cáp, bếp đầy đủ tiện nghi, 1 phòng tắm với vòi xịt/chậu rửa vệ sinh và vòi sen. Khăn tắm và ga trải giường có sẵn ở căn hộ.

Các điểm tham quan nổi tiếng gần căn hộ bao gồm Bãi biển Nha Trang, Tháp Trầm Hương và Trung tâm thương mại Nha Trang Center. Chỗ nghỉ cách Sân bay quốc tế Cam Ranh 36 km và cung cấp dịch vụ đưa đón sân bay mất phí.",9.3,
https://www.booking.com/hotel/vn/khach-san-phu-quy-2.vi.html,Phu Quy Hotel,"01 Tuệ Tĩnh, Phường Lộc Thọ, Nha Trang, Nha Trang, Việt Nam","Nằm giáp biển, Phu Quy Hotel cung cấp chỗ nghỉ 3 sao ở Nha Trang, đồng thời có hồ bơi ngoài trời, phòng chờ chung và sân hiên. Chỗ đậu xe riêng có thể được sắp xếp với một khoản phụ phí. Chỗ nghỉ cung cấp lễ tân 24/24, dịch vụ đưa đón sân bay, dịch vụ phòng và Wi-Fi miễn phí ở toàn bộ chỗ nghỉ.

Khách sạn cung cấp cho khách các phòng có điều hòa, bàn làm việc, ấm đun nước, tủ lạnh, minibar, két an toàn, TV màn hình phẳng và phòng tắm riêng với vòi xịt/chậu rửa vệ sinh. Tại Phu Quy Hotel, phòng nào cũng có ga trải giường và khăn tắm.

Tại chỗ nghỉ, khách sẽ tìm thấy nhà hàng phục vụ ẩm thực Việt, địa phương và Á.

Các điểm tham quan nổi tiếng gần Phu Quy Hotel bao gồm Bãi biển Nha Trang, Tháp Trầm Hương và Trung tâm thương mại Nha Trang Center. Sân bay quốc tế Cam Ranh cách 34 km.",8.1,3.0
https://www.booking.com/hotel/vn/blue-cam-ranh-nha-trang-resort.vi.html,Cam Ranh Nha Trang resort,"Lô D14D Bãi Dài, Thành phố Cam Ranh, tỉnh Khánh Hòa. ·, Nha Trang, Việt Nam","Nằm ở Nha Trang, Cam Ranh Nha Trang resort cung cấp chỗ nghỉ có ban công hoặc sân trong, Wi-Fi miễn phí và TV, cũng như khu vườn và nhà hàng.

Nơi đây còn có phòng tắm riêng với vòi xịt/chậu rửa vệ sinh ở tất cả các căn, cùng đồ vệ sinh cá nhân miễn phí, máy sấy tóc và dép đi trong phòng.

Căn hộ cách 100 Egg Mud Bath 27 km và Bảo tàng Alexandre Yersin 34 km. Sân bay gần nhất là Sân bay quốc tế Cam Ranh, cách Cam Ranh Nha Trang resort 4 km.",8,
https://www.booking.com/hotel/vn/happy-river.vi.html,Happy River,"3 Phạm Văn Đồng 608, Nha Trang, Việt Nam","Tọa lạc ở Nha Trang, cách Bãi biển Hòn Chồng chỉ vài bước chân và Bãi biển Ba Làng chưa đến 1 km, Happy River cung cấp chỗ nghỉ có các tiện nghi như Wi-Fi miễn phí và TV màn hình phẳng. Căn hộ này cách Tháp Bà Ponagar 19 phút đi bộ và Bảo tàng Khánh Hòa 3.4 km.

Căn hộ điều hòa này có 2 phòng ngủ với ban công và bếp đầy đủ tiện nghi.

Căn hộ cách Bãi biển Nha Trang 2.8 km và Hòn Chồng 8 phút đi bộ.",,
https://www.booking.com/hotel/vn/sika-ng-112-hoang-hoa-tham-nt-by-bay-luxury.vi.html,Sika Hotel - ng 112 Hoàng Hoa Thám NT - by BAY LUXURY,"Đường Hoàng Hoa Thám, Nha Trang, Việt Nam","Nằm ở Nha Trang thuộc Khánh Hòa, gần Bãi biển Nha Trang và Trung tâm thương mại Nha Trang Center, Sika Hotel - ng 112 Hoàng Hoa Thám NT - by BAY LUXURY cung cấp Wi-Fi miễn phí và chỗ đậu xe riêng miễn phí.

Các điểm tham quan nổi tiếng gần căn hộ bao gồm Nhà thờ Chánh tòa Kitô Vua (Nhà thờ Núi), Chợ Đầm và Bảo tàng Khánh Hòa. Sân bay gần nhất là Sân bay quốc tế Cam Ranh, cách Sika Hotel - ng 112 Hoàng Hoa Thám NT - by BAY LUXURY 36 km.",,2.0
https://www.booking.com/hotel/vn/khach-san-uss.vi.html,Khách Sạn USS,"10 Nguyễn Khánh Toàn, Nha Trang, Việt Nam","Khách Sạn USS là chỗ nghỉ 2 sao tọa lạc ở Nha Trang, cách Bãi biển Ba Làng chưa đến 1 km và Bãi biển Đường Đệ 3 km. Chỗ nghỉ này có các tiện nghi như nhà hàng, dịch vụ phòng và quầy lễ tân 24 giờ, cùng với Wi-Fi miễn phí ở toàn bộ chỗ nghỉ. Đây là chỗ nghỉ không hút thuốc và nằm cách Bãi biển Hòn Chồng chưa đến 1 km.

Khách sạn cách Hòn Chồng 2.3 km và Tháp Bà Ponagar 2.6 km. Sân bay gần nhất là Sân bay quốc tế Cam Ranh, cách Khách Sạn USS 41 km.",5.2,2.0
https://www.booking.com/hotel/vn/the-arena-cam-ranh-khu-nghi-duong-dang-cap-khanh-hoa.vi.html,The Arena Cam Ranh- Khu Nghỉ Dưỡng Đẳng Cấp,"Lô D14D Đại Lộ Nguyễn Tất Thành, Bãi Dài, KDL Bắc Bán Đảo Cam Ranh, TP.Cam Ranh, Tỉnh Khánh Hòa 650000 Cam Lâm, Khánh Hòa Province 650000, Diên Khánh, Việt Nam","Với hồ bơi ngoài trời mở quanh năm, The Arena Cam Ranh- Khu Nghỉ Dưỡng Đẳng Cấp ở Diên Khánh cung cấp chỗ nghỉ có Wi-Fi miễn phí và chỗ đậu xe riêng miễn phí cho khách lái xe.

Tất cả các căn đều có điều hòa, phòng tắm riêng, TV màn hình phẳng, bếp đầy đủ tiện nghi và sân hiên.

Khách sạn căn hộ cách 100 Egg Mud Bath 27 km và Bảo tàng Alexandre Yersin 34 km. Sân bay gần nhất là Sân bay quốc tế Cam Ranh, cách The Arena Cam Ranh- Khu Nghỉ Dưỡng Đẳng Cấp 9 km.",,3.0
https://www.booking.com/hotel/vn/central-nha-trang-nha-trang2.vi.html,Central Nha Trang Hotel,"28 HÃ¹ng VÆ°Æ¡ng, Nha Trang, Việt Nam","Nằm ở Nha Trang, cách Bãi biển Nha Trang 14 phút đi bộ, Central Nha Trang Hotel cung cấp chỗ nghỉ có khu vườn, chỗ đậu xe riêng miễn phí, nhà hàng và quầy bar. Chỗ nghỉ cách Ga Nha Trang khoảng 1.8 km, Chợ Đầm 1.9 km và Bảo tàng Khánh Hòa 15 phút đi bộ. Chỗ nghỉ cung cấp lễ tân 24/24, dịch vụ đưa đón sân bay, dịch vụ phòng và Wi-Fi miễn phí ở toàn bộ chỗ nghỉ.

Các điểm tham quan nổi tiếng gần khách sạn bao gồm Tháp Trầm Hương, Trung tâm thương mại Nha Trang Center và Nhà thờ Chánh tòa Kitô Vua (Nhà thờ Núi). Sân bay quốc tế Cam Ranh cách 35 km.",,
https://www.booking.com/hotel/vn/homestay-kiwi.vi.html,HOMESTAY Kiwi,"71/17 Nguyá»n Thá» Minh Khai, Nha Trang, Việt Nam","Với sân hiên và bếp chung, HOMESTAY Kiwi nằm tại vị trí thuận tiện ở Nha Trang, cách Tháp Trầm Hương 1.7 km và Nhà thờ Chánh tòa Kitô Vua (Nhà thờ Núi) 19 phút đi bộ. Chỗ nghỉ điều hòa này cách Bãi biển Nha Trang 16 phút đi bộ, khách có thể sử dụng WiFi miễn phí và chỗ đậu xe riêng có sẵn trong khuôn viên.

Homestay có TV màn hình phẳng truyền hình cáp. Khăn tắm và ga trải giường có sẵn ở homestay.

Đội ngũ nhân viên lễ tân 24/24 giao tiếp thành thạo bằng tiếng Anh và tiếng Việt.

Homestay có dịch vụ cho thuê xe đạp.

Các điểm tham quan nổi tiếng gần HOMESTAY Kiwi bao gồm Trung tâm thương mại Nha Trang Center, Ga Nha Trang và Bảo tàng Khánh Hòa. Sân bay gần nhất là Sân bay quốc tế Cam Ranh, cách chỗ nghỉ 35 km.",9.4,
https://www.booking.com/hotel/vn/the-arena-nha-trang.vi.html,The Arena,"12 Hùng Vương, Nha Trang, Việt Nam","Nằm ở Nha Trang, cách Bãi biển Nha Trang 16 phút đi bộ, The Arena cung cấp chỗ nghỉ có hồ bơi ngoài trời, chỗ đậu xe riêng miễn phí, khu vườn và sân hiên. Chỗ nghỉ này có các tiện nghi như dịch vụ phòng và quầy lễ tân 24 giờ, cùng với Wi-Fi miễn phí ở toàn bộ chỗ nghỉ. Khách có thể sử dụng quầy bar.

Tại resort, các phòng được thiết kế có điều hòa, bàn làm việc, ban công với view vườn, phòng tắm riêng, TV màn hình phẳng, ga trải giường và khăn tắm. Các căn đều có tủ quần áo và ấm đun nước để khách sử dụng.

The Arena có phục vụ bữa sáng thực đơn buffet mỗi buổi sáng.

Các điểm tham quan nổi tiếng gần chỗ nghỉ bao gồm Tháp Trầm Hương, Nhà thờ Chánh tòa Kitô Vua (Nhà thờ Núi) và Trung tâm thương mại Nha Trang Center. Sân bay quốc tế Cam Ranh cách 35 km.",,
https://www.booking.com/hotel/vn/ris-panorama-nha-trang-apartment.vi.html,RIS Panorama Condotel,"02 Nguyễn Thị Minh Khai, Nha Trang, Khánh Hòa B2508, Nha Trang, Việt Nam","Nằm ở Nha Trang, RIS Panorama Condotel cung cấp Wi-Fi miễn phí, nơi khách có thể trải nghiệm hồ bơi ngoài trời, trung tâm thể dục và nhà hàng.

Chỗ nghỉ có điều hòa, bếp đầy đủ tiện nghi, TV màn hình phẳng, cũng như phòng tắm riêng với vòi xịt/chậu rửa vệ sinh, đồ vệ sinh cá nhân miễn phí và máy sấy tóc. Tủ lạnh, lò vi sóng và bếp, cũng như ấm đun nước đều được cung cấp.

Khách tại căn hộ có thể thưởng thức bữa sáng thực đơn buffet.

RIS Panorama Condotel có dịch vụ cho thuê ô tô.

Các điểm tham quan nổi tiếng gần chỗ nghỉ bao gồm Bãi biển Nha Trang, Trung tâm thương mại Nha Trang Center và Nhà thờ Chánh tòa Kitô Vua (Nhà thờ Núi). Sân bay quốc tế Cam Ranh cách 35 km.",8.9,3.0
https://www.booking.com/hotel/vn/welcome-the-arena-cam-ranh.vi.html,Welcome The Arena Beach,"Nguyễn Tất Thành, Miếu Ông, Việt Nam","Tọa lạc ở Miếu Ông, cách 100 Egg Mud Bath 26 km, Welcome The Arena Beach cung cấp chỗ nghỉ có hồ bơi ngoài trời, chỗ đậu xe riêng miễn phí, trung tâm thể dục và khu vườn. Mỗi phòng tại khách sạn 5 sao này đều nhìn ra hồ bơi, đồng thời khách có thể sử dụng khu vực bãi biển riêng và phòng chờ chung. Chỗ nghỉ này cung cấp bếp chung, dịch vụ phòng và dịch vụ thu đổi ngoại tệ cho khách.

Tại khách sạn, phòng nào cũng có điều hòa, bàn làm việc, TV màn hình phẳng, phòng tắm riêng, ga trải giường, khăn tắm và ban công với view biển. Phòng khách đều có tủ lạnh.

Chỗ nghỉ có phục vụ bữa sáng hằng ngày, gồm các lựa chọn thực đơn buffet, thực đơn à la carte và kiểu Á. Tại Welcome The Arena Beach, khách sẽ tìm thấy nhà hàng phục vụ ẩm thực Hoa, Ý và Hàn. Bên cạnh đó, họ có thể yêu cầu món chay và món thuần chay.

Chỗ nghỉ có sân hiên. Khách có thể chơi trò phi tiêu tại Welcome The Arena Beach. Ngoài ra, chỗ nghỉ có dịch vụ thuê xe đạp và dịch vụ thuê ô tô.

Thành thạo tiếng Anh, tiếng Việt và tiếng Hoa, đội ngũ nhân viên tại lễ tân luôn sẵn lòng hỗ trợ khách lên kế hoạch cho kỳ nghỉ.

Khách sạn cách Bảo tàng Alexandre Yersin 33 km và Viện Hải dương học 33 km.",,5.0
https://www.booking.com/hotel/vn/po-nhatrang-cozy-hotel-the-best-rated-area-in-nha-trang.vi.html,Nhatrang Cozy Hotel,"99 Nguyen Thien Thuat Street, 650000 Nha Trang, Việt Nam","Với quầy bar, Nhatrang Cozy Hotel tọa lạc ở Nha Trang, Khánh Hòa, cách Bãi biển Nha Trang 12 phút đi bộ và Tháp Trầm Hương 1.3 km. Khách sạn 2 sao này có dịch vụ phòng và máy ATM. Chỗ nghỉ cung cấp lễ tân 24/24, dịch vụ đưa đón sân bay, bếp chung và Wi-Fi miễn phí ở toàn bộ chỗ nghỉ.

Các điểm tham quan nổi tiếng gần khách sạn bao gồm Trung tâm thương mại Nha Trang Center, Nhà thờ Chánh tòa Kitô Vua (Nhà thờ Núi) và Ga Nha Trang. Sân bay quốc tế Cam Ranh cách 35 km.","8,9",2.0
https://www.booking.com/hotel/vn/hometravel-nha-trang.vi.html,Hometravel Nha Trang,"34/2/11 Nguyễn Thiện Thuật, Nha Trang, Việt Nam","Tọa lạc ở Nha Trang, cách Bãi biển Nha Trang chưa đến 1 km, Hometravel Nha Trang nhìn rathành phố. Ngoài sân hiên, khách sạn 1 sao này còn có các phòng với điều hòa được trang bị Wi-Fi miễn phí, trong đó mỗi phòng đều có phòng tắm riêng. Chỗ nghỉ này cung cấp dịch vụ phòng và quầy lễ tân 24 giờ cho khách.

Các phòng được thiết kế có tủ quần áo và TV màn hình phẳng, ngoài ra một số căn tại khách sạn có ban công. Tại Hometravel Nha Trang, tất cả các phòng đều được thiết kế có ga trải giường và khăn tắm.

Các điểm tham quan nổi tiếng gần chỗ nghỉ bao gồm Tháp Trầm Hương, Trung tâm thương mại Nha Trang Center và Nhà thờ Chánh tòa Kitô Vua (Nhà thờ Núi). Sân bay gần nhất là Sân bay quốc tế Cam Ranh, cách Hometravel Nha Trang 35 km.",10,1.0
https://www.booking.com/hotel/vn/panorama-thanh-pho-nha-trang12.vi.html,Panorama View,"2 Nguyễn Thị Minh Khai, Nha Trang, Việt Nam","Với hồ bơi ngoài trời, trung tâm thể dục, cùng sân hiên, Panorama View cung cấp chỗ nghỉ ở Nha Trang có Wi-Fi miễn phí và nhìn ra thành phố. Nằm cách Bãi biển Nha Trang chưa đến 1 km, chỗ nghỉ cung cấp nhà hàng và chỗ đậu xe riêng miễn phí.

Căn hộ có 1 phòng ngủ, bếp với tủ lạnh và lò vi sóng, TV màn hình phẳng, khu vực ghế ngồi, 1 phòng tắm được trang bị vòi sen. Khăn tắm và ga trải giường có sẵn ở căn hộ.

Căn hộ có phục vụ bữa sáng thực đơn à la carte và kiểu Á mỗi sáng.

Đội ngũ nhân viên lễ tân 24/24 giao tiếp thành thạo bằng tiếng Anh và tiếng Nga.

Panorama View có cả dịch vụ cho thuê xe đạp và dịch vụ cho thuê ô tô.

Các điểm tham quan nổi tiếng gần chỗ nghỉ bao gồm Trung tâm thương mại Nha Trang Center, Nhà thờ Chánh tòa Kitô Vua (Nhà thờ Núi) và Tháp Trầm Hương. Chỗ nghỉ cách Sân bay quốc tế Cam Ranh 35 km và cung cấp dịch vụ đưa đón sân bay mất phí.",8.6,3.0
