url,name,location,description,point,star
https://www.booking.com/hotel/vn/seahorse-paradise-residences.vi.html,SEAHORSE PARADISE RESIDENCES,"2 Nguyễn Thị Minh Khai, Nha Trang, Việt Nam","Nhìn ra núi, SEAHORSE PARADISE RESIDENCES ở Nha Trang cung cấp chỗ nghỉ có hồ bơi ngoài trời, trung tâm thể dục, sân hiên, nhà hàng và quầy bar. Wi-Fi miễn phí được cung cấp ở toàn bộ chỗ nghỉ.

Chỗ nghỉ có điều hòa, bếp đầy đủ tiện nghi, TV màn hình phẳng, cũng như phòng tắm riêng với vòi xịt/chậu rửa vệ sinh, đồ vệ sinh cá nhân miễn phí và máy sấy tóc.

Căn hộ có phục vụ bữa sáng thực đơn buffet mỗi sáng.

Các điểm tham quan nổi tiếng gần SEAHORSE PARADISE RESIDENCES bao gồm Bãi biển Nha Trang, Tháp Trầm Hương và Trung tâm thương mại Nha Trang Center. Sân bay quốc tế Cam Ranh cách 35 km, đồng thời chỗ nghỉ có cung cấp dịch vụ đưa đón sân bay mất phí.",9.4,3.0
https://www.booking.com/hotel/vn/artnest-amp-apartment.vi.html,Art Nest Hotel Nha Trang,"Hùng Vương 33, Nha Trang, Việt Nam","Tọa lạc ở Nha Trang, cách Bãi biển Nha Trang 8 phút đi bộ, Art Nest Hotel Nha Trang cung cấp chỗ nghỉ có hồ bơi ngoài trời, chỗ đậu xe riêng, trung tâm thể dục và sân hiên. Chỗ nghỉ này có quầy bar, cũng như nhà hàng phục vụ ẩm thực địa phương. Chỗ nghỉ cung cấp lễ tân 24/24, dịch vụ đưa đón sân bay, dịch vụ phòng và Wi-Fi miễn phí.

Tại khách sạn, mỗi phòng đều được thiết kế có điều hòa, bàn làm việc, ban công với view thành phố, phòng tắm riêng, TV màn hình phẳng, ga trải giường và khăn tắm. Các phòng đều có két an toàn và một số phòng nhìn ra biển. Phòng khách đều có tủ quần áo và ấm đun nước để khách sử dụng.

Khách tại Art Nest Hotel Nha Trang có thể thưởng thức bữa sáng thực đơn buffet hoặc kiểu lục địa.

Các điểm tham quan nổi tiếng gần chỗ nghỉ bao gồm Trung tâm thương mại Nha Trang Center, Nhà thờ Chánh tòa Kitô Vua (Nhà thờ Núi) và Tháp Trầm Hương. Sân bay quốc tế Cam Ranh cách 35 km.",8.6,
https://www.booking.com/hotel/vn/fusion-resort-nha-trang.vi.html,Fusion Resort Cam Ranh - All Spa Inclusive,"Lot D10B Northern of Cam Ranh Peninsula, Nguyen Tat Thanh Boulevard, Cam Lam District, Cam Ranh, Việt Nam","Fusion Resort Cam Ranh có khu vực bãi biển riêng và chỗ nghỉ yên tĩnh, tiện nghi với WiFi miễn phí trong toàn bộ khuôn viên. Khách lưu trú tại Fusion Resort Cam Ranh có thể tận hưởng miễn phí các liệu pháp spa, bữa sáng cả ngày và dịch vụ xe đưa đón khách từ/đến Thành phố Nha Trang. Chỗ nghỉ tổ chức các lớp học Yoga và thiền miễn phí.

Với tầm nhìn ra hồ bơi và biển, các biệt thự rộng rãi tại đây được bài trí đầy phong cách với tủ để quần áo, TV màn hình phẳng, két an toàn cá nhân cũng như khu vực ghế ngồi đi kèm ghế sofa. Các căn còn được trang bị ấm đun nước điện và minibar. Phòng tắm riêng đi kèm bồn tắm treo, máy sấy tóc và đồ vệ sinh cá nhân miễn phí. Dịch vụ chỉnh trang giường buổi tối cũng được cung cấp cho khách.

Tại Fusion Resort Cam Ranh, du khách có thể ngâm mình ở hồ bơi ngoài trời, rèn luyện sức khỏe tại trung tâm thể dục hoặc thư giãn trong khu vườn cây xanh tươi tốt. Nhân viên lễ tân 24 giờ có thể hỗ trợ du khách với dịch vụ thu đổi ngoại tệ, giữ hành lý, đặt vé và giặt là.

Chỗ nghỉ nằm cách Viện Hải dương học 13,4 km. Sân bay Cam Ranh nằm trong bán kính 5 km từ chỗ nghỉ này. Dịch vụ đưa đón sân bay có thể được thu xếp theo yêu cầu với một khoản phụ phí. Chỗ đỗ xe miễn phí có thể được bố trí theo yêu cầu.

Nhà hàng Fresh bên hồ bơi phục vụ các món ăn chính thống của Việt Nam, các món ăn quốc tế được yêu thích và hải sản tươi sống.",9.3,5.0
https://www.booking.com/hotel/vn/the-view-cam-lam-district.vi.html,The View Hotel,"D16-17-16 KĐT Hưng Thịnh, Cam Hải Đông D16-17-16, Cam Lâm, Việt Nam","Tọa lạc ở Cam Lâm, cách Bãi Dài 18 phút đi bộ, The View Hotel cung cấp chỗ nghỉ có xe đạp miễn phí, chỗ đậu xe riêng miễn phí, khu vườn và sân hiên. Khách sạn 2 sao này có dịch vụ phòng và dịch vụ tiền sảnh. Chỗ nghỉ cung cấp lễ tân 24/24, dịch vụ đưa đón sân bay, bếp chung và Wi-Fi miễn phí.

Tại khách sạn, tất cả các phòng đều được thiết kế có điều hòa, bàn làm việc, ban công với view núi, phòng tắm riêng, TV màn hình phẳng, ga trải giường và khăn tắm. Các phòng được thiết kế có ấm đun nước, trong đó một số phòng có bếp nhỏ với lò nướng, lò vi sóng và minibar. Các phòng đều có tủ lạnh.

Đi xe đạp là hoạt động được ưa chuộng trong khu vực. Ngoài ra, The View Hotel có dịch vụ thuê ô tô.

Chỗ nghỉ cách 100 Egg Mud Bath 16 km và Bảo tàng Alexandre Yersin 23 km. Sân bay gần nhất là Sân bay quốc tế Cam Ranh, cách The View Hotel 13 km.",9,2.0
https://www.booking.com/hotel/vn/star-beach-panorama.vi.html,Star Beach Panorama Condotel,"02 Nguyễn Thị Minh Khai, phường Lộc Thọ, Nha Trang, Việt Nam","Tọa lạc ở Nha Trang, cách Bãi biển Nha Trang chưa đến 1 km và Tháp Trầm Hương 13 phút đi bộ, Star Beach Panorama Condotel cung cấp chỗ nghỉ có Wi-Fi miễn phí, điều hòa, hồ bơi ngoài trời và trung tâm thể dục. Chỗ đậu xe riêng có sẵn trong khuôn viên.

Tất cả các căn có thiết kế gồm khu vực ghế ngồi, TV màn hình phẳng có truyền hình cáp, cùng phòng tắm riêng có trang bị đồ vệ sinh cá nhân miễn phí, vòi xịt/chậu rửa vệ sinh và vòi sen. Một số căn có ban công và/hoặc sân trong nhìn ra thành phố hoặc biển.

Khách cũng có thể thư giãn trong khu vực phòng chờ chung.

Các điểm tham quan nổi tiếng gần căn hộ bao gồm Trung tâm thương mại Nha Trang Center, Nhà thờ Chánh tòa Kitô Vua (Nhà thờ Núi) và Ga Nha Trang. Sân bay quốc tế Cam Ranh cách 35 km, đồng thời chỗ nghỉ có cung cấp dịch vụ đưa đón sân bay mất phí.",8.7,4.0
https://www.booking.com/hotel/vn/the-costa-nha-trang-apartment.vi.html,The Sea Luxury Nha Trang Apartment,"32 Trần Phú, Nha Trang, Việt Nam","Nhìn ra thành phố, The Sea Luxury Nha Trang Apartment ở Nha Trang cung cấp chỗ nghỉ có hồ bơi ngoài trời, trung tâm thể dục, khu vườn, khu vực bãi biển riêng và sân hiên. Căn hộ có WiFi và chỗ đậu xe riêng miễn phí.

The Sea Luxury Nha Trang Apartment có ban công nơi khách có thể nhìn ra biển, khu vực ghế ngồi, TV màn hình phẳng, bếp đầy đủ tiện nghi gồm tủ lạnh và lò nướng, cùng phòng tắm riêng được trang bị vòi xịt/chậu rửa vệ sinh và đồ vệ sinh cá nhân miễn phí. Để thuận tiện hơn cho khách, chỗ nghỉ có thể cung cấp khăn tắm và khăn trải giường với khoản phụ phí.

Các điểm tham quan nổi tiếng gần chỗ nghỉ bao gồm Bãi biển Nha Trang, Trung tâm thương mại Nha Trang Center và Nhà thờ Chánh tòa Kitô Vua (Nhà thờ Núi). Chỗ nghỉ cách Sân bay quốc tế Cam Ranh 36 km và cung cấp dịch vụ đưa đón sân bay mất phí.",8.9,4.0
https://www.booking.com/hotel/vn/duyen-ha-resort-cam-ranh.vi.html,Duyen Ha Resort Cam Ranh,"Lot D9B, Group 3, Cam Hai Dong Commune, Cam Lam District, Khanh Hoa Province, Cam Ranh, Việt Nam","Tọa lạc tại thành phố Cam Ranh, cách thành phố Nha Trang 21 km, Duyen Ha Resort Cam Ranh có hồ bơi ngoài trời và trung tâm spa. Resort này cung cấp miễn phí đồ uống chào mừng và có trung tâm thể dục, hồ bơi chính cũng như bãi biển riêng. Khách có thể thưởng thức một loạt ẩm thực tại 6 nhà hàng khác nhau ngay trong khuôn viên hoặc thư giãn với đồ uống ở quầy bar.

Mỗi căn tại đây đều được bố trí máy điều hòa, khu vực chỗ ngồi với ghế sofa, tủ quần áo, két an toàn cá nhân, TV truyền hình vệ tinh màn hình phẳng và minibar. Một số căn có sân hiên/ban công. Phòng tắm riêng trong từng căn đi kèm bồn tắm/vòi sen, máy sấy tóc, áo choàng tắm, dép lê và đồ vệ sinh miễn phí. Dịch vụ phòng có thể được cung cấp theo yêu cầu.

Nhân viên giao tiếp thông thạo tiếng Anh tại quầy lễ tân có thể hỗ trợ du khách với dịch vụ tiền sảnh và dịch vụ trung chuyển theo yêu cầu. Trong khuôn viên có cửa hàng và trung tâm thể dục. Chỗ nghỉ cũng cung cấp tiện nghi thể thao dưới nước và dịch vụ trông giữ trẻ.

Du khách có thể chơi tennis và golf mini tại resort. Sân bay gần nhất là sân bay quốc tế Cam Ranh, nằm trong bán kính 5 km từ chỗ nghỉ.",8.4,5.0
https://www.booking.com/hotel/vn/the-costa-residence.vi.html,The Costa Nha Trang Residences,"32-34 Tran Phu, Nha Trang, Việt Nam","Nằm trên Đường Bờ biển Trần Phú, The Costa Residence chào đón du khách với 2 hồ bơi ngoài trời, trong đó có 1 hồ bơi vô cực, trung tâm thể dục và các phòng nghỉ được bài trí sang trọng với cửa sổ lớn. Wi-Fi miễn phí được cung cấp ở tất cả các khu vực.

Với thiết kế hiện đại, chỗ nghỉ trên bãi biển trang nhã này chỉ cách ga tàu Nha Trang 1,6 km và khu nghỉ dưỡng Vinpearland nổi tiếng 2,5 km. Sân bay Cam Ranh cách đó 35 km.

Mỗi phòng nghỉ tại đây đều được bài trí theo phong cách khác nhau và có lối trang trí hiện đại. Các phòng có TV màn hình phẳng, khu vực phòng ăn và bếp đầy đủ tiện nghi. Các phòng tắm riêng đi kèm máy sấy tóc.

Trong số các tiện nghi tại đây có bàn đặt tour và dịch vụ giặt hấp. Du khách còn có thể thư giãn trên ghế tắm nắng và dịch vụ đưa đón sân bay được cung cấp với một khoản phụ phí.",8.6,5.0
https://www.booking.com/hotel/vn/royal-nha-trang.vi.html,Royal Hotel Nha Trang,"172/8 Bạch Đằng P. Tân Lập, Nha Trang, Việt Nam","Nằm cách Tháp Trầm Hương 18 phút đi bộ và Ga Nha Trang 1.5 km, Royal Hotel Nha Trang cung cấp các phòng ở Nha Trang. Ngoài hồ bơi ngoài trời, khách sạn 3 sao này còn có các phòng với điều hòa được trang bị Wi-Fi miễn phí, trong đó mỗi phòng đều có phòng tắm riêng. Khách sạn này nhìn ra thành phố và cung cấp sân hiên cùng lễ tân 24/24.

Tất cả các căn đi kèm TV màn hình phẳng có truyền hình cáp, ấm đun nước, vòi sen, đồ vệ sinh cá nhân miễn phí và tủ quần áo. Mỗi phòng đều có két an toàn, trong đó một số phòng có ban công. Tại khách sạn, tất cả các phòng có ga trải giường và khăn tắm.

Khách tại Royal Hotel Nha Trang có thể thưởng thức bữa sáng kiểu Á. Tại chỗ nghỉ, khách sẽ tìm thấy nhà hàng phục vụ ẩm thực Mỹ, Tứ Xuyên và Việt. Bên cạnh đó, họ có thể yêu cầu không chứa sữa.

Các điểm tham quan nổi tiếng gần Royal Hotel Nha Trang bao gồm Bãi biển Nha Trang, Nhà thờ Chánh tòa Kitô Vua (Nhà thờ Núi) và Trung tâm thương mại Nha Trang Center. Sân bay quốc tế Cam Ranh cách 35 km.",7.8,3.0
https://www.booking.com/hotel/vn/iridescent-clouds.vi.html,Iridescent Clouds Hotel Nha Trang -Mây Ngũ Sắc,"66 Pham Van Dong, Nha Trang, Việt Nam","Nằm tại thành phố Nha Trang, Iridescent Clouds có các phòng nghỉ tiện nghi đi kèm máy lạnh, nhà hàng trong khuôn viên, truy cập WiFi miễn phí trong tất cả các khu vực và chỗ đỗ xe riêng miễn phí trong khuôn viên.

Tất cả các phòng nghỉ sáng sủa, có lối bài trí trang nhã tại đây đều được trang bị cửa sổ nhìn ra biển/thành phố, truyền hình vệ tinh màn hình phẳng, minibar, ấm đun nước điện và phòng tắm riêng với tiện nghi vòi sen, máy sấy tóc, dép đi trong phòng cùng đồ vệ sinh cá nhân miễn phí. Một số phòng có khu vực tiếp khách và bàn.

Iridescent Clouds có lễ tân 24 giờ, bàn đặt tour, dịch vụ đưa/đón và đưa/đón sân bay (có tính phí).

Chỗ nghỉ cách Chùa Hòn Đỏ 3,6 km, cách Tháp Chàm Po Nagar 4,5 km và cách sân bay quốc tế Cam Ranh 32 km.",6.9,3.0
https://www.booking.com/hotel/vn/villa-le-corail-a-gran-melia-hotel.vi.html,"Villa Le Corail, A Gran Melia Hotel","Bai Tien, Duong De, Vinh Hoa Ward, Nha Trang, Việt Nam","Nằm ở Nha Trang, cách Hòn Chồng 7.4 km, Villa Le Corail, A Gran Melia Hotel cung cấp chỗ nghỉ có xe đạp miễn phí, chỗ đậu xe riêng miễn phí, hồ bơi ngoài trời và trung tâm thể dục. Chỗ nghỉ này cung cấp khu vực bãi biển riêng, sân hiên và quầy bar. Đây là chỗ nghỉ không hút thuốc và tọa lạc cách Tháp Bà Ponagar 7.9 km.

Resort sẽ cung cấp cho khách các phòng có điều hòa, tủ quần áo, máy pha cà phê, minibar, két an toàn, TV màn hình phẳng và phòng tắm riêng với vòi sen. Mỗi phòng đều được thiết kế có ấm đun nước, trong đó một số phòng có ban công và một số khác thì nhìn ra biển. Tại Villa Le Corail, A Gran Melia Hotel, các phòng đều đi kèm với ga trải giường và khăn tắm.

Khách tại chỗ nghỉ có thể thưởng thức bữa sáng thực đơn buffet hoặc kiểu lục địa. Tại Villa Le Corail, A Gran Melia Hotel, khách sẽ tìm thấy nhà hàng phục vụ ẩm thực Nhật, Địa Trung Hải và Tây Ban Nha. Bên cạnh đó, họ có thể yêu cầu món chay, không chứa sữa và món thuần chay.

Đi xe đạp là hoạt động được ưa chuộng trong khu vực. Ngoài ra, resort 5 sao này có dịch vụ thuê ô tô.

Thành thạo tiếng Anh, tiếng Tây Ban Nha, tiếng Pháp và tiếng Nga, đội ngũ nhân viên tại lễ tân 24/24 luôn túc trực để hỗ trợ khách.

Resort cách Bảo tàng Khánh Hòa 10 km và Trung tâm du lịch Suối khoáng nóng Tháp Bà 10 km.",9.4,5.0
https://www.booking.com/hotel/vn/lustay-panorama-nha-trang.vi.html,Panorama Nha Trang by C-Real,"Nguyễn Thị Minh Khai, Lộc Thọ 02, Nha Trang, Việt Nam","Nhìn ra thành phố, Panorama Nha Trang by C-Real ở Nha Trang cung cấp chỗ nghỉ có hồ bơi ngoài trời, khu vực bãi biển riêng, phòng chờ chung, sân hiên và nhà hàng. WiFi miễn phí có sẵn.

Khách sạn căn hộ có ban công, khu vực ghế ngồi, TV màn hình phẳng truyền hình vệ tinh, bếp đầy đủ tiện nghi gồm tủ lạnh và lò nướng, cùng phòng tắm riêng được trang bị vòi xịt/chậu rửa vệ sinh và đồ vệ sinh cá nhân miễn phí. Để thuận tiện hơn cho khách, chỗ nghỉ có thể cung cấp khăn tắm và khăn trải giường với khoản phụ phí.

Panorama Nha Trang by C-Real có phục vụ bữa sáng thực đơn buffet hoặc kiểu Á.

Chỗ nghỉ có dịch vụ cho thuê ô tô.

Các điểm tham quan nổi tiếng gần Panorama Nha Trang by C-Real bao gồm Bãi biển Nha Trang, Tháp Trầm Hương và Trung tâm thương mại Nha Trang Center. Sân bay quốc tế Cam Ranh cách 35 km, đồng thời chỗ nghỉ có cung cấp dịch vụ đưa đón sân bay mất phí.",7.1,3.0
https://www.booking.com/hotel/vn/queen-ann-nha-trang.vi.html,Queen Ann Nha Trang Hotel,"100 Tran Phu, Nha Trang, Việt Nam","Queen Ann Nha Trang Hotel cung cấp chỗ nghỉ tại thành phố Nha Trang, cách Trung tâm thuyền buồm Việt Nam 800 m. Khách sạn này có Wi-Fi miễn phí trong toàn khuôn viên và hồ bơi ngoài trời. Du khách có thể dùng bữa tại nhà hàng trong khuôn viên hoặc nhâm nhi đồ uống ở quầy bar. 

Từ khách sạn, du khách đi 900 m là đến Chợ đêm Nha Trang và 1 km là tới Bãi biển Nha Trang. Chùa Long Sơn và Bến tàu tham quan vịnh Nha Trang đều nằm trong bán kính 4 km từ Queen Ann Nha Trang Hotel trong khi Tháp Chàm Ponagar cách đó 4,9 km. Khách sạn cách sân bay gần nhất là sân bay quốc tế Cam Ranh 24 km và cung cấp dịch vụ đưa đón sân bay kèm phụ phí.

Các phòng nghỉ tại đây được trang bị TV truyền hình cáp màn hình phẳng, ổ cắm cho iPod, ấm đun nước và phòng tắm riêng. Áo choàng tắm, dép và đồ vệ sinh cá nhân miễn phí cũng có sẵn để tạo sự thoải mái cho khách.

Quầy lễ tân 24 giờ cung cấp dịch vụ giữ hành lý. Du khách có thể rèn luyện sức khỏe tại trung tâm thể dục, thư giãn với liệu pháp mát-xa ở trung tâm spa hoặc sử dụng miễn phí hồ bơi.

Nhà hàng Royal Restaurant cung cấp tuyển chọn các món ăn địa phương và quốc tế trong khi Lobby Lounge phục vụ các món ăn nhẹ. Khách được mời đồ uống và trái cây chào đón miễn phí vào ngày nhận phòng.",8.6,5.0
https://www.booking.com/hotel/vn/the-arena-cam-ranh-resort-39-s-full-service-apartment-near-the-airport.vi.html,"The Arena Resort's full Service Apartment - near the airport Cam Ranh, Nha Trang, Khanh Hoa","Nguyễn Tất Thành The Arena Cam Ranh Resort, Miếu Ông, Việt Nam","Nằm ở Miếu Ông, cách 100 Egg Mud Bath 27 km, The Arena Resort's full Service Apartment - near the airport Cam Ranh, Nha Trang, Khanh Hoa cung cấp chỗ nghỉ có trung tâm thể dục, chỗ đậu xe riêng miễn phí, khu vườn và nhà hàng. Khách sạn 5 sao này cung cấp dịch vụ phòng, quầy lễ tân 24 giờ và Wi-Fi miễn phí. Khách có thể sử dụng quầy bar.

Khách sạn sẽ cung cấp cho khách các phòng có điều hòa, bàn làm việc, ấm đun nước, tủ lạnh, minibar, két an toàn, TV màn hình phẳng, sân hiên, phòng tắm riêng và vòi xịt/chậu rửa vệ sinh. The Arena Resort's full Service Apartment - near the airport Cam Ranh, Nha Trang, Khanh Hoa cung cấp một số phòng nhìn ra thành phố và tất cả các phòng đều có ban công. Tất cả các căn có ga trải giường.

Chỗ nghỉ cách Bảo tàng Alexandre Yersin 34 km và Tháp Trầm Hương 34 km. Sân bay gần nhất là Sân bay quốc tế Cam Ranh, cách The Arena Resort's full Service Apartment - near the airport Cam Ranh, Nha Trang, Khanh Hoa 4 km.",7.3,5.0
https://www.booking.com/hotel/vn/le-more.vi.html,LeMore Hotel Nha Trang,"33A To Hien Thanh Street, Tan Lap Ward, Nha Trang, Việt Nam","Nằm ở Nha Trang, cách Bãi biển Nha Trang 19 phút đi bộ, LeMore Hotel Nha Trang cung cấp chỗ nghỉ có hồ bơi ngoài trời, chỗ đậu xe riêng miễn phí, trung tâm thể dục và phòng chờ chung. Chỗ nghỉ này có quầy bar, cũng như nhà hàng phục vụ ẩm thực Mỹ. Chỗ nghỉ cung cấp lễ tân 24/24, dịch vụ đưa đón sân bay, câu lạc bộ trẻ em và Wi-Fi miễn phí ở toàn bộ chỗ nghỉ.

Khách có thể thưởng thức bữa sáng thực đơn buffet, thực đơn à la carte hoặc kiểu lục địa tại chỗ nghỉ.

Khách sạn có sân chơi trẻ em.

Các điểm tham quan nổi tiếng gần LeMore Hotel Nha Trang bao gồm Nhà thờ Chánh tòa Kitô Vua (Nhà thờ Núi), Trung tâm thương mại Nha Trang Center và Tháp Trầm Hương. Sân bay quốc tế Cam Ranh cách 35 km.",8.7,4.0
https://www.booking.com/hotel/vn/muong-thanh-vien-trieu-apartment-nha-trang-nha-trang1.vi.html,MT Viễn Triều Thai Ha Oceanus Apartment Nha Trang,"03 Phạm Văn Đồng, Nha Trang, Việt Nam","Tọa lạc ở Nha Trang và cách Bãi biển Hòn Chồng chỉ vài bước chân, MT Viễn Triều Thai Ha Oceanus Apartment Nha Trang cung cấp dịch vụ tiền sảnh, các phòng không gây dị ứng, sân hiên, Wi-Fi miễn phí ở toàn bộ chỗ nghỉ và nhà hàng. Khách sạn 4 sao này có quầy lễ tân 24 giờ và máy ATM. Đây là chỗ nghỉ không hút thuốc và nằm cách Bãi biển Ba Làng chưa đến 1 km.

Tại khách sạn, tất cả các phòng đều có tủ quần áo. Với phòng tắm riêng được trang bị vòi xịt/chậu rửa vệ sinh và đồ vệ sinh cá nhân miễn phí, phòng khách tại MT Viễn Triều Thai Ha Oceanus Apartment Nha Trang có TV màn hình phẳng và điều hòa, trong đó một số phòng có ban công. Tại chỗ nghỉ, mỗi phòng đều được thiết kế có ga trải giường và khăn tắm.

MT Viễn Triều Thai Ha Oceanus Apartment Nha Trang cách Bãi biển Nha Trang 2.8 km và Hòn Chồng chưa đến 1 km.",7.2,4.0
https://www.booking.com/hotel/vn/eastin-grand-nha-trang.vi.html,The Empyrean Nha Trang,"2 Nguyễn Thị Minh Khai, Nha Trang, Việt Nam","Tọa lạc ở Nha Trang, cách Bãi biển Nha Trang chưa đến 1 km, The Empyrean Nha Trang cung cấp chỗ nghỉ có hồ bơi ngoài trời, chỗ đậu xe riêng miễn phí, trung tâm thể dục và khu vực bãi biển riêng. Ngoài nhà hàng, khách sạn 5 sao này có các phòng được trang bị điều hòa và Wi-Fi miễn phí, trong đó mỗi phòng sẽ có phòng tắm riêng. Chỗ nghỉ này cung cấp dịch vụ phòng, quầy lễ tân 24 giờ và phòng giữ hành lý cho khách.

Tại khách sạn, phòng nào cũng có bàn làm việc. Tất cả các phòng đều được thiết kế có ấm đun nước, TV màn hình phẳng và két an toàn, trong đó một số phòng có ban công và một số khác nhìn ra thành phố. Các phòng có tủ quần áo.

Các điểm tham quan nổi tiếng gần The Empyrean Nha Trang bao gồm Trung tâm thương mại Nha Trang Center, Nhà thờ Chánh tòa Kitô Vua (Nhà thờ Núi) và Tháp Trầm Hương. Chỗ nghỉ cách Sân bay quốc tế Cam Ranh 35 km và cung cấp dịch vụ đưa đón sân bay mất phí.",7.9,5.0
https://www.booking.com/hotel/vn/a-sea-view-beautiful-studio-apartment.vi.html,A sea view beautiful studio apartment,"25-26 Phạm Văn Đồng, Nha Trang, Việt Nam","Nằm cách Bãi biển Ba Làng 2 phút đi bộ, A sea view beautiful studio apartment cung cấp chỗ nghỉ ở Nha Trang có hồ bơi trong nhà. Nhìn ra biển, căn hộ còn có khu vườn, hồ bơi riêng và Wi-Fi miễn phí.

Căn hộ điều hòa này có 1 phòng ngủ riêng biệt, phòng khách, bếp đầy đủ tiện nghi với tủ lạnh, lò vi sóng, cùng 1 phòng tắm. Khăn tắm và ga trải giường có sẵn ở căn hộ.

Căn hộ cách Bãi biển Hòn Chồng 3 phút đi bộ và Bãi biển Đường Đệ 2.4 km. Sân bay gần nhất là Sân bay quốc tế Cam Ranh, cách A sea view beautiful studio apartment 40 km.",9.7,
https://www.booking.com/hotel/vn/annova-nha-trang.vi.html,Annova Nha Trang Hotel,"Lý Tự Trọng 05, Nha Trang, Việt Nam","Nằm ở Nha Trang, cách Bãi biển Nha Trang 9 phút đi bộ, Annova Nha Trang Hotel cung cấp chỗ nghỉ có trung tâm thể dục, chỗ đậu xe riêng miễn phí, phòng chờ chung và nhà hàng. Khách sạn 5 sao này cung cấp câu lạc bộ trẻ em, dịch vụ phòng và Wi-Fi miễn phí. Chỗ nghỉ này cung cấp quầy lễ tân 24 giờ, dịch vụ tiền sảnh và dịch vụ thu đổi ngoại tệ cho khách.

Tại khách sạn, các phòng được thiết kế có điều hòa, bàn làm việc, TV màn hình phẳng, phòng tắm riêng, ga trải giường, khăn tắm và sân trong với view thành phố. Mỗi phòng đều được thiết kế có két an toàn, trong đó một số phòng có ban công và một số khác cũng nhìn ra biển. Các căn đều có tủ quần áo và ấm đun nước để khách sử dụng.

Chỗ nghỉ có phục vụ bữa sáng thực đơn buffet, kiểu lục địa hoặc kiểu Mỹ mỗi buổi sáng.

Tại Annova Nha Trang Hotel, khách có thể sử dụng hồ bơi trong nhà.

Các điểm tham quan nổi tiếng gần chỗ nghỉ bao gồm Nhà thờ Chánh tòa Kitô Vua (Nhà thờ Núi), Trung tâm thương mại Nha Trang Center và Chợ Đầm. Sân bay quốc tế Cam Ranh cách 36 km.",8.8,5.0
