url,name,location,description,point,star
https://www.booking.com/hotel/vn/the-costa-nha-trang-managed-by-luna.vi.html,Rozy's Cozy Beachfront Apartment,"Tòa nhà The Costa: 32-34 Trần Phú, Lộc Thọ, Nha Trang, Khánh Hòa, Nha Trang, Việt Nam","Tọa lạc ở Nha Trang, cách Bãi biển Nha Trang 3 phút đi bộ và Trung tâm thương mại Nha Trang Center 400 m, Rozy's Cozy Beachfront Apartment cung cấp chỗ nghỉ có Wi-Fi miễn phí, điều hòa, hồ bơi ngoài trời và khu vực bãi biển riêng.

Căn hộ có ban công nơi khách có thể nhìn ra biển, khu vực ghế ngồi, TV màn hình phẳng, bếp đầy đủ tiện nghi gồm tủ lạnh và lò vi sóng, cùng phòng tắm riêng được trang bị vòi sen và đồ vệ sinh cá nhân miễn phí. Để thuận tiện hơn cho khách, chỗ nghỉ có thể cung cấp khăn tắm và khăn trải giường với khoản phụ phí.

Các điểm tham quan nổi tiếng gần Rozy's Cozy Beachfront Apartment bao gồm Nhà thờ Chánh tòa Kitô Vua (Nhà thờ Núi), Tháp Trầm Hương và Ga Nha Trang. Chỗ nghỉ cách Sân bay quốc tế Cam Ranh 36 km và cung cấp dịch vụ đưa đón sân bay mất phí.",9.3,4.0
https://www.booking.com/hotel/vn/aquamarine-resort-cam-ranh-all-inclusive.vi.html,Aquamarine Resort Hotel Cam Ranh,"Km 20 Nguyen Tat Thanh St, Bai Dai Beach, Cam Hai Dong Ward, Cam Lam Town, Khanh Hoa Province, Nha Trang, Việt Nam","Tọa lạc ở Nha Trang, cách 100 Egg Mud Bath 17 km, Aquamarine Resort Hotel Cam Ranh cung cấp chỗ nghỉ có hồ bơi ngoài trời theo mùa, chỗ đậu xe riêng miễn phí, khu vườn và khu vực bãi biển riêng. Ngoài sân hiên, khách sạn 5 sao này có các phòng được trang bị điều hòa và Wi-Fi miễn phí, trong đó mỗi phòng sẽ có phòng tắm riêng. Khách sạn có sân chơi trẻ em và nhìn ra biển, ngoài ra du khách có thể thưởng thức bữa ăn tại nhà hàng hoặc đồ uống tại quầy bar.

Tại khách sạn, tất cả các phòng đều được thiết kế có bàn làm việc. Các phòng ở Aquamarine Resort Hotel Cam Ranh được trang bị TV màn hình phẳng và đồ vệ sinh cá nhân miễn phí.

Chỗ nghỉ có phục vụ bữa sáng mỗi sáng, gồm các lựa chọn thực đơn buffet, kiểu lục địa và kiểu Anh/ Ai-len.

Thành thạo tiếng Anh, tiếng Pháp, tiếng Nga và tiếng Việt đội ngũ nhân viên luôn túc trực 24/7 tại lễ tân.

Chỗ nghỉ cách Bảo tàng Alexandre Yersin 24 km và Viện Hải dương học 24 km. Chỗ nghỉ cách Sân bay quốc tế Cam Ranh 13 km và cung cấp dịch vụ đưa đón sân bay mất phí.",9,5.0
https://www.booking.com/hotel/vn/b475house.vi.html,B475house,"10/11A Pasteur 10/11A pasteur xương huân district, Nha Trang, Việt Nam","Với sân hiên, B475house tọa lạc ở Nha Trang, Khánh Hòa, cách Bãi biển Nha Trang 16 phút đi bộ và Trung tâm thương mại Nha Trang Center 500 m. Ngoài Wi-Fi miễn phí, khách sạn 2 sao này còn cung cấp dịch vụ phòng và quầy lễ tân 24 giờ. Chỗ nghỉ này cung cấp dịch vụ tiền sảnh, bàn bán tour và dịch vụ thu đổi ngoại tệ cho khách.

Tất cả các căn được trang bị điều hòa, TV màn hình phẳng có truyền hình cáp, tủ lạnh, ấm đun nước, vòi sen, đồ vệ sinh cá nhân miễn phí và tủ quần áo. Tất cả các phòng đều có phòng tắm riêng với máy sấy tóc, trong đó một số phòng có ban công và một số phòng khác cũng nhìn ra thành phố. Tại khách sạn, mỗi phòng đều có ga trải giường và khăn tắm.

Các điểm tham quan nổi tiếng gần B475house bao gồm Chợ Đầm, Bảo tàng Khánh Hòa và Nhà thờ Chánh tòa Kitô Vua (Nhà thờ Núi). Sân bay gần nhất là Sân bay quốc tế Cam Ranh, cách chỗ nghỉ 36 km.",9,2.0
https://www.booking.com/hotel/vn/vitamin-sea-hostel-nha-trang.vi.html,Vitamin Sea Homestay Nha Trang,"39 Yet Kieu, Van Thang, Nha Trang, Việt Nam","Vitamin Sea Homestay Nha Trang nằm ở Nha Trang, cách Bãi biển Nha Trang 2.1 km và Tháp Trầm Hương 1.9 km. Chỗ nghỉ nằm gần một số điểm tham quan nổi tiếng, cách Chùa Long Sơn khoảng 13 phút đi bộ, Ga Nha Trang khoảng 1.2 km, Bảo tàng Khánh Hòa khoảng chưa đến 1 km. Chỗ nghỉ này cung cấp bếp chung và Wi-Fi miễn phí.

Tại hostel, tất cả các phòng có phòng tắm riêng với vòi sen.

Các điểm tham quan nổi tiếng gần Vitamin Sea Homestay Nha Trang bao gồm Nhà thờ Chánh tòa Kitô Vua (Nhà thờ Núi), Chợ Đầm và Trung tâm thương mại Nha Trang Center. Sân bay gần nhất là Sân bay quốc tế Cam Ranh, cách chỗ nghỉ 36 km.",8.6,
https://www.booking.com/hotel/vn/sea-soul.vi.html,Sea Soul Hotel,"78 Tuệ Tĩnh, Nha Trang, Việt Nam","Nằm ở Nha Trang, cách Bãi biển Nha Trang 7 phút đi bộ, Sea Soul Hotel cung cấp chỗ nghỉ có sân hiên, chỗ đậu xe riêng miễn phí, nhà hàng và quầy bar. Khách sạn 5 sao này có dịch vụ phòng và dịch vụ tiền sảnh. Chỗ nghỉ cung cấp lễ tân 24/24, dịch vụ đưa đón sân bay, câu lạc bộ trẻ em và Wi-Fi miễn phí ở toàn bộ chỗ nghỉ.

Khách sạn sẽ cung cấp cho khách các phòng có điều hòa, bàn làm việc, ấm đun nước, minibar, két an toàn, TV và phòng tắm riêng với vòi xịt/chậu rửa vệ sinh. Tất cả các phòng có tủ quần áo.

Sea Soul Hotel có phục vụ bữa sáng thực đơn buffet hoặc kiểu Á.

Chỗ nghỉ có hồ bơi trong nhà.

Sea Soul Hotel cách Tháp Trầm Hương 16 phút đi bộ và Trung tâm thương mại Nha Trang Center 2.4 km.",9,5.0
https://www.booking.com/hotel/vn/panorama-luxury-beach-front.vi.html,Panorama Luxury Beach Front,"2 Nguyễn Thị Minh Khai, Nha Trang, Việt Nam","Với Bãi biển Nha Trang nằm cách đó chưa đến 1 km, Panorama Luxury Beach Front cung cấp chỗ nghỉ, nhà hàng, khu vườn, khu vực bãi biển riêng và phòng chờ chung. Chỗ nghỉ có Wi-Fi miễn phí ở toàn bộ chỗ nghỉ và chỗ đậu xe riêng có sẵn trong khuôn viên.

Với sân hiên hoặc ban công nhìn ra thành phố và biển, các căn chỗ nghỉ có điều hòa, khu vực ghế ngồi, TV màn hình phẳng truyền hình cáp và bếp. Nơi đây còn có phòng tắm riêng với vòi xịt/chậu rửa vệ sinh ở tất cả các căn, cùng đồ vệ sinh cá nhân miễn phí, máy sấy tóc và dép đi trong phòng.

Khách tại căn hộ có thể thưởng thức bữa sáng thực đơn buffet.

Khách có thể bơi ở hồ bơi trong nhà hoặc đi xe đạp.

Các điểm tham quan nổi tiếng gần Panorama Luxury Beach Front bao gồm Trung tâm thương mại Nha Trang Center, Nhà thờ Chánh tòa Kitô Vua (Nhà thờ Núi) và Tháp Trầm Hương. Chỗ nghỉ cách Sân bay quốc tế Cam Ranh 35 km và cung cấp dịch vụ đưa đón sân bay mất phí.",8.8,3.0
https://www.booking.com/hotel/vn/uy-duong-nha-trang.vi.html,Uy Dương Hotel & Apartment - Nha Trang,"5 Bửu Đóa, Nha Trang, Việt Nam","Nằm cách Bãi biển Nha Trang 2.2 km, Uy Dương Hotel & Apartment - Nha Trang cung cấp chỗ nghỉ có phòng chờ chung, sân hiên và bếp chung. Khách sạn căn hộ có WiFi và chỗ đậu xe riêng miễn phí.

Tất cả các căn có phòng tắm riêng, vòi xịt/chậu rửa vệ sinh, điều hòa, TV màn hình phẳng và tủ lạnh. Để thuận tiện hơn cho khách, chỗ nghỉ có thể cung cấp khăn tắm và khăn trải giường với khoản phụ phí.

Du khách có thể đi xe đạp gần đó.

Uy Dương Hotel & Apartment - Nha Trang cách Chùa Long Sơn 4.3 km và Tháp Trầm Hương 4.4 km. Sân bay gần nhất là Sân bay quốc tế Cam Ranh, cách chỗ nghỉ 31 km.",8.5,
https://www.booking.com/hotel/vn/havana-nha-trang-hotel.vi.html,Havana Nha Trang Hotel,"38 Tran Phu, Nha Trang, Việt Nam","Havana Nha Trang Hotel cung cấp chỗ nghỉ hiện đại chỉ cách Quảng trường 2/4 khoảng 5 phút đi bộ. Bãi biển đầy cát nằm ngay phía bên kia đường. Nơi đây có hồ bơi ngoài trời, trung tâm thể dục và các liệu pháp spa.

Tất cả các phòng nghỉ không hút thuốc tại đây đều được trang bị Wi-Fi miễn phí cũng như TV màn hình phẳng. Két an toàn cá nhân và ấm đun nước điện cũng được cung cấp trong phòng. Phòng tắm riêng đi kèm bồn tắm và đồ vệ sinh cá nhân miễn phí.

Havana Nha Trang Hotel cách Sân bay Nha Trang 40 km. Nơi đây có chỗ đỗ xe miễn phí trong khi dịch vụ đưa đón sân bay được cung cấp với một khoản phụ phí.

Cả các món ăn Châu Á và quốc tế đều được phục vụ tại nhà hàng Spicy Restaurant. Bữa sáng tự chọn được cung cấp tại đây hoặc khách cũng có thể chọn ăn uống ngay trong phòng.

Bàn đặt tour có thể thu xếp các chuyến đi trong ngày và dịch vụ cho thuê xe hơi. Khách sạn cũng có trung tâm dịch vụ doanh nhân, dịch vụ trông trẻ và lễ tân 24 giờ.",8.7,5.0
https://www.booking.com/hotel/vn/the-costa-central-nha-trang.vi.html,Central Nha Trang Apartment,"32 Trần Phú, Nha Trang, Việt Nam","Tọa lạc ở Nha Trang, Central Nha Trang Apartment cung cấp chỗ nghỉ có hồ bơi ngoài trời mở quanh năm, Wi-Fi miễn phí, khu vực bãi biển riêng và nhà hàng.

Căn hộ có dịch vụ cho thuê ô tô.

Các điểm tham quan nổi tiếng gần Central Nha Trang Apartment bao gồm Bãi biển Nha Trang, Trung tâm thương mại Nha Trang Center và Nhà thờ Chánh tòa Kitô Vua (Nhà thờ Núi). Chỗ nghỉ cách Sân bay quốc tế Cam Ranh 36 km và cung cấp dịch vụ đưa đón sân bay mất phí.",8.6,
https://www.booking.com/hotel/vn/viet-ha.vi.html,Oliver Hotel,"96A3 Trần Phú, P. Lộc Thọ, Nha Trang, Việt Nam","Oliver Hotel tọa lạc dọc đường Trần Phú và cách bãi biển Nha Trang 1 phút đi bộ. Tại đây có nhà hàng, Wi-Fi miễn phí và phòng nghỉ máy lạnh với TV màn hình phẳng.

Từ Oliver Hotel, quý khách lái xe 2 phút là đến Chợ Đêm đầy sôi động và 10 phút là đến Dinh Bảo Đại. Sân bay quốc tế Cam Ranh cách đó 45 phút lái xe.

Các phòng nghỉ tại đây được thiết kế hiện đại với hệ thống ánh sáng ấm áp. Tất cả các phòng tiện nghi được trang bị tủ lạnh và phòng tắm riêng với tiện nghi vòi sen nước nóng.

Với quầy lễ tân 24 giờ, khách sạn cung cấp dịch vụ cho thuê xe hơi và phòng giữ hành lý cho khách. Khách có thể thu xếp việc đi lại và tham quan ở bàn bán tour.

Nhà hàng tại đây phục vụ đủ loại các món ăn hảo hạng của địa phương và quốc tế cho bữa sáng.",7.3,3.0
https://www.booking.com/hotel/vn/khach-san-pho-ngoc.vi.html,Khách sạn Phố Ngọc,"252 Dã Tượng, Nha Trang, Việt Nam","Tọa lạc ở Nha Trang, cách Bãi biển Nha Trang chưa đến 1 km, Khách sạn Phố Ngọc cung cấp chỗ nghỉ có xe đạp miễn phí, chỗ đậu xe riêng miễn phí, khu vực bãi biển riêng và phòng chờ chung. Khách sạn 3 sao này có dịch vụ phòng và máy ATM. Chỗ nghỉ cung cấp lễ tân 24/24, dịch vụ đưa đón sân bay, bếp chung và Wi-Fi miễn phí.

Tại khách sạn, phòng nào cũng có điều hòa, bàn làm việc, sân trong với view thành phố, phòng tắm riêng, TV màn hình phẳng, ga trải giường và khăn tắm. Tất cả các phòng đều có ấm đun nước, trong đó một số phòng có bếp nhỏ với lò nướng. Phòng khách đều có tủ lạnh.

Khách sạn Phố Ngọc có sân hiên. Leo núi là hoạt động được ưa chuộng trong khu vực. Ngoài ra, chỗ nghỉ có dịch vụ thuê ô tô.

Khách sạn Phố Ngọc cách Viện Hải dương học 2.5 km và Bảo tàng Alexandre Yersin 2.5 km.",8.6,3.0
https://www.booking.com/hotel/vn/dbhotel.vi.html,DB Hotel Nha Trang,"96A/6/13-14 TRẦN PHÚ, P LỘC THỌ, TP NHA TRANG, TỈNH KHÁNH HÒA, Nha Trang, Việt Nam","Nằm giáp biển, DB Hotel Nha Trang cung cấp chỗ nghỉ 4 sao ở Nha Trang, đồng thời có hồ bơi ngoài trời, phòng chờ chung và sân hiên. Chỗ nghỉ này có các tiện nghi như nhà hàng, dịch vụ phòng và quầy lễ tân 24 giờ, cùng với Wi-Fi miễn phí. Đây là chỗ nghỉ không hút thuốc và nằm cách Bãi biển Nha Trang 9 phút đi bộ.

Tại khách sạn, phòng nào cũng có bàn làm việc. Với phòng tắm riêng được trang bị đồ vệ sinh cá nhân miễn phí, tất cả các căn tại DB Hotel Nha Trang có TV màn hình phẳng và điều hòa, trong đó một số phòng có ban công. Tại chỗ nghỉ, tất cả các phòng có ga trải giường và khăn tắm.

DB Hotel Nha Trang có phục vụ bữa sáng thực đơn à la carte hoặc kiểu Á.

Khách sạn cách Tháp Trầm Hương 19 phút đi bộ và Viện Hải dương học 3.2 km.",8.2,4.0
https://www.booking.com/hotel/vn/blue-sea-2-nhatrang.vi.html,Blue Sea Hotel 2,"129 Cu Chi, Nha Trang, Việt Nam","Nằm ở Nha Trang, cách Bãi biển Ba Làng chưa đến 1 km, Blue Sea Hotel 2 nhìn ranúi. Ngoài Wi-Fi miễn phí, khách sạn 2 sao này còn cung cấp phòng chờ chung và dịch vụ phòng. Chỗ nghỉ này cung cấp quầy lễ tân 24 giờ, bàn bán tour và dịch vụ thu đổi ngoại tệ cho khách.

Tại khách sạn, các phòng đều đi kèm với bàn làm việc, sân trong với view thành phố, phòng tắm riêng, TV màn hình phẳng, ga trải giường và khăn tắm. Tất cả các phòng đều có tủ lạnh.

Các điểm tham quan nổi tiếng gần Blue Sea Hotel 2 bao gồm Bãi biển Hòn Chồng, Tháp Bà Ponagar và Hòn Chồng. Sân bay gần nhất là Sân bay quốc tế Cam Ranh, cách chỗ nghỉ 40 km.",7.8,2.0
https://www.booking.com/hotel/vn/potique.vi.html,Potique Hotel,"22 Hung Vuong Street, Loc Tho Ward, Nha Trang City, Nha Trang, Việt Nam","Tọa lạc ở Nha Trang, cách Bãi biển Nha Trang 14 phút đi bộ, Potique Hotel cung cấp chỗ nghỉ có hồ bơi ngoài trời, chỗ đậu xe riêng miễn phí, trung tâm thể dục và sân hiên. Chỗ nghỉ này có các tiện nghi như nhà hàng, câu lạc bộ trẻ em và dịch vụ phòng, cùng với Wi-Fi miễn phí ở toàn bộ chỗ nghỉ. Chỗ nghỉ này cung cấp quầy lễ tân 24 giờ, dịch vụ văn phòng và dịch vụ thu đổi ngoại tệ cho khách.

Khách sạn sẽ cung cấp cho khách các phòng được trang bị điều hòa có bàn làm việc, ấm đun nước, minibar, két an toàn, TV màn hình phẳng và phòng tắm riêng với vòi sen. Tại Potique Hotel, tất cả các phòng đều có ga trải giường và khăn tắm.

Chỗ nghỉ có phục vụ bữa sáng mỗi sáng, gồm các lựa chọn thực đơn buffet, kiểu lục địa và kiểu Á.

Các điểm tham quan nổi tiếng gần chỗ nghỉ bao gồm Trung tâm thương mại Nha Trang Center, Nhà thờ Chánh tòa Kitô Vua (Nhà thờ Núi) và Tháp Trầm Hương. Sân bay quốc tế Cam Ranh cách 36 km.",9.1,5.0
https://www.booking.com/hotel/vn/bondibackpackersnhatrang.vi.html,Bondi Backpackers Nhatrang,"35/91 Nguyen Thien Thuat, Nha Trang, Việt Nam","Bondi Backpackers Nhatrang có hồ bơi ngoài trời, phòng chờ chung, sân hiên và nhà hàng ở Nha Trang. Chỗ nghỉ gần Tháp Trầm Hương, Ga Nha Trang và Chợ Đầm. Chỗ nghỉ cung cấp lễ tân 24/24, dịch vụ đưa đón sân bay, máy ATM và Wi-Fi miễn phí ở toàn bộ chỗ nghỉ.

Các căn tại hostel được trang bị khu vực ghế ngồi. Phòng khách có ga trải giường.

Bondi Backpackers Nhatrang có phục vụ bữa sáng thực đơn buffet hoặc kiểu lục địa.

Hostel này có dịch vụ thuê xe đạp và dịch vụ thuê ô tô. Ngoài ra, đi xe đạp là hoạt động được ưa chuộng trong khu vực.

Bên cạnh quầy bar ngay trong khuôn viên, khách còn có thể sử dụng khu vực văn phòng/hội họp.

Các điểm tham quan nổi tiếng gần chỗ nghỉ bao gồm Bãi biển Nha Trang, Nhà thờ Chánh tòa Kitô Vua (Nhà thờ Núi) và Trung tâm thương mại Nha Trang Center. Sân bay quốc tế Cam Ranh cách 35 km.",8.3,
https://www.booking.com/hotel/vn/seascape-villas-in-long-beach-cam-ranh.vi.html,Seascape Villas In Long Beach Cam Ranh,"Lot D14B Nguyen Tat Thanh street, Cam Hai Dong commune, Cam Lam district, Khanh Hoa Province, Vietnam, Cam Ranh, Việt Nam","Nằm giáp biển, Seascape Villas In Long Beach Cam Ranh cung cấp chỗ nghỉ 5 sao ở Cam Ranh, đồng thời có hồ bơi ngoài trời, trung tâm thể dục và khu vườn. Chỗ nghỉ này có các tiện nghi như khu vực bãi biển riêng, sân hiên, cũng như quầy bar. Chỗ nghỉ cung cấp lễ tân 24/24, dịch vụ đưa đón sân bay, câu lạc bộ trẻ em và Wi-Fi miễn phí ở toàn bộ chỗ nghỉ.

Tất cả các căn được trang bị điều hòa, tủ lạnh, lò nướng, ấm đun nước, vòi sen, đồ vệ sinh cá nhân miễn phí và bàn làm việc. Ngoài phòng tắm riêng, bể sục và máy sấy tóc, các phòng tại resort đều có view hồ bơi. Phòng khách ở Seascape Villas In Long Beach Cam Ranh được trang bị TV màn hình phẳng và dép đi trong phòng.

Chỗ nghỉ có phục vụ bữa sáng thực đơn buffet, thực đơn à la carte hoặc kiểu lục địa mỗi sáng. Tại chỗ nghỉ, khách sẽ tìm thấy nhà hàng phục vụ ẩm thực châu Phi, Mỹ và Pháp. Bên cạnh đó, họ có thể yêu cầu món chay và đồ ăn Halal.

Seascape Villas In Long Beach Cam Ranh có sân chơi trẻ em. Khách có thể chơi bi-a tại resort. Ngoài ra, chỗ nghỉ có dịch vụ thuê xe đạp và dịch vụ thuê ô tô.

Seascape Villas In Long Beach Cam Ranh cách 100 Egg Mud Bath 26 km và Bảo tàng Alexandre Yersin 33 km.",9.9,5.0
https://www.booking.com/hotel/vn/can-ho-scenia-view-truc-dien-bien-co-cho-thue-thang.vi.html,Scenia Bay seaview apartment Nha Trang - Căn hộ View biển GB,"25-26 Phạm Văn Đồng, Nha Trang, Việt Nam","Nhìn ra biển, Scenia Bay seaview apartment Nha Trang - Căn hộ View biển GB ở Nha Trang cung cấp chỗ nghỉ có hồ bơi ngoài trời, khu vườn, khu vực bãi biển riêng, sân hiên và quầy bar. Chỗ nghỉ có WiFi miễn phí ở toàn bộ chỗ nghỉ và chỗ đậu xe riêng có sẵn trong khuôn viên.

Căn hộ có ban công, khu vực ghế ngồi, TV màn hình phẳng, bếp đầy đủ tiện nghi gồm tủ lạnh và lò vi sóng, cùng phòng tắm riêng được trang bị vòi xịt/chậu rửa vệ sinh và máy sấy tóc.

Các điểm tham quan nổi tiếng gần Scenia Bay seaview apartment Nha Trang - Căn hộ View biển GB bao gồm Bãi biển Ba Làng, Bãi biển Hòn Chồng và Hòn Chồng. Sân bay quốc tế Cam Ranh cách 40 km.",9,
https://www.booking.com/hotel/vn/rosaka-nha-trang-hotel.vi.html,Rosaka Nha Trang Hotel,"107A Nguyen Thien Thuat, Nha Trang, Việt Nam","Rosaka Nha Trang Hotel cung cấp chỗ nghỉ với hồ bơi vô cực tại trung tâm nhộn nhịp của thành phố Nha Trang. Chỗ nghỉ này cũng có nhà hàng, quán bar và phòng tập thể dục. Du khách có thể truy cập WiFi miễn phí trong toàn bộ khuôn viên nơi này.

Trung tâm Thuyền buồm Việt Nam và quán Sailing Club đều nằm trong bán kính 300 m từ Rosaka Hotel trong khi Quảng trường 2/4 cách đó 700 m. Sân bay gần nhất là sân bay quốc tế Cam Ranh, cách chỗ nghỉ 40 km. Dịch vụ đưa đón sân bay có thể được thu xếp với một khoản phụ phí.

Phòng nghỉ gắn máy điều hòa tại đây có ban công riêng nhìn ra quang cảnh và được trang bị truyền hình vệ tinh màn hình phẳng. Mỗi phòng đều được bố trí phòng tắm riêng với chậu rửa vệ sinh (bidet), dép và đồ vệ sinh cá nhân miễn phí.

Du khách có thể tới quầy lễ tân 24 giờ để được hỗ trợ với dịch vụ giữ hành lý, sắp xếp tour du lịch và các dịch vụ concierge khác.",5,4.0
https://www.booking.com/hotel/vn/po-la-mer-hotel-nha-trang.vi.html,La Mer Hotel Nha Trang,"03 Pham Van Dong, Nha Trang, Việt Nam","La Mer Hotel Nha Trang là chỗ nghỉ 3 sao nằm ở Nha Trang, cách Bãi biển Ba Làng 14 phút đi bộ và Bãi biển Nha Trang 2.7 km. Chỗ nghỉ này có các tiện nghi như nhà hàng, phòng chờ chung và quầy lễ tân 24 giờ, cùng với Wi-Fi miễn phí ở toàn bộ chỗ nghỉ. Chỗ nghỉ này cung cấp dịch vụ tiền sảnh, cùng dịch vụ thu đổi ngoại tệ cho khách.

Khách sạn cách Bãi biển Hòn Chồng 2.9 km và Hòn Chồng 5 phút đi bộ.","7,4",3.0
https://www.booking.com/hotel/vn/happy-banana-apartment.vi.html,Happy Banana Apartment,"Căn hộ 2412, 3 -5 Phạm Văn Đồng, Phường Vĩnh Phước, Nha Trang, Việt Nam","Nhìn ra thành phố, Happy Banana Apartment ở Nha Trang cung cấp chỗ nghỉ có xe đạp miễn phí, khu vực bãi biển riêng, phòng chờ chung, sân hiên và nhà hàng. WiFi miễn phí có sẵn.

Căn hộ có ban công nơi khách có thể nhìn ra biển, khu vực ghế ngồi, TV màn hình phẳng truyền hình vệ tinh, bếp đầy đủ tiện nghi gồm tủ lạnh và lò vi sóng, cùng phòng tắm riêng được trang bị vòi xịt/chậu rửa vệ sinh và đồ vệ sinh cá nhân miễn phí. Để thuận tiện hơn cho khách, chỗ nghỉ có thể cung cấp khăn tắm và khăn trải giường với khoản phụ phí.

Happy Banana Apartment có sân chơi trẻ em.

Du khách có thể leo núi, câu cá và đi xe đạp để khám phá khu vực xung quanh.

Các điểm tham quan nổi tiếng gần chỗ nghỉ bao gồm Bãi biển Hòn Chồng, Bãi biển Ba Làng và Hòn Chồng. Chỗ nghỉ cách Sân bay quốc tế Cam Ranh 39 km và cung cấp dịch vụ đưa đón sân bay mất phí.",8.7,3.0
https://www.booking.com/hotel/vn/the-costa-central-stylish-beachfront-and-luxury.vi.html,The Costa Central and Luxury 2 bedrooms,"32 Trần Phú, Nha Trang, Việt Nam","Nhìn ra biển, The Costa Central and Luxury 2 bedrooms cung cấp chỗ nghỉ có khu vực bãi biển riêng và ban công, cách Bãi biển Nha Trang khoảng 5 phút đi bộ. Căn hộ cung cấp chỗ đậu xe riêng miễn phí, quầy lễ tân 24 giờ và Wi-Fi miễn phí.

Căn hộ điều hòa này có 2 phòng ngủ, phòng khách, bếp đầy đủ tiện nghi với tủ lạnh và ấm đun nước, 2 phòng tắm với vòi xịt/chậu rửa vệ sinh và vòi sen. Khăn tắm và ga trải giường có sẵn ở căn hộ.

Các điểm tham quan nổi tiếng gần căn hộ bao gồm Trung tâm thương mại Nha Trang Center, Nhà thờ Chánh tòa Kitô Vua (Nhà thờ Núi) và Tháp Trầm Hương. Sân bay quốc tế Cam Ranh cách 36 km.",9.3,
https://www.booking.com/hotel/vn/the-westin-resort-spa-cam-ranh.vi.html,The Westin Resort & Spa Cam Ranh,"Lot D14a Northern Peninsula Cam Ranh, Cam Hai Dong Ward, Cam Lam District, 650000 Cam Ranh, Việt Nam","Tọa lạc ở Cam Ranh, cách Bãi Dài 3 phút đi bộ, The Westin Resort & Spa Cam Ranh cung cấp chỗ nghỉ có xe đạp miễn phí, chỗ đậu xe riêng miễn phí, hồ bơi ngoài trời và trung tâm thể dục. Khách sạn 5 sao này cung cấp khu vực bãi biển riêng, câu lạc bộ trẻ em và Wi-Fi miễn phí. Khách sạn có sân hiên và nhìn ra hồ bơi, ngoài ra du khách có thể thưởng thức bữa ăn tại nhà hàng hoặc đồ uống tại quầy bar.

Các phòng được trang bị điều hòa, TV màn hình phẳng có truyền hình cáp, minibar, ấm đun nước, vòi sen, đồ vệ sinh cá nhân miễn phí và bàn làm việc. Tất cả các phòng đều được thiết kế có két an toàn, trong đó một số phòng có sân trong và một số khác cũng nhìn ra biển. Tại khách sạn, mỗi phòng đều có ga trải giường và khăn tắm.

Khách có thể thưởng thức bữa sáng thực đơn buffet, kiểu lục địa hoặc kiểu Mỹ tại chỗ nghỉ.

The Westin Resort & Spa Cam Ranh có sân chơi trẻ em. Đi xe đạp là hoạt động được ưa chuộng trong khu vực. Ngoài ra, chỗ nghỉ có dịch vụ thuê ô tô.

Thành thạo tiếng Anh, tiếng Hàn và tiếng Việt, đội ngũ nhân viên tại lễ tân 24/24 luôn túc trực để hỗ trợ khách.

The Westin Resort & Spa Cam Ranh cách 100 Egg Mud Bath 26 km và Bảo tàng Alexandre Yersin 32 km. Chỗ nghỉ cách Sân bay quốc tế Cam Ranh 3 km và cung cấp dịch vụ đưa đón sân bay mất phí.",9,5.0
