url,name,location,description,point,star
https://www.booking.com/hotel/vn/kim-thanh-718-tran-thai-tong-tp-lao-cai-by-bay-luxury.vi.html,"Kim Thành Hotel - 718 Trần Thái Tông, TP Lào Cai - by Bay Luxury","Duyen Hai, Lào Cai, Việt Nam","Cung cấp chỗ nghỉ có Wi-Fi miễn phí, điều hòa và TV màn hình phẳng, Kim Thành Hotel - 718 Trần Thái Tông, TP Lào Cai - by Bay Luxury nằm cách Trạm cáp treo Fansipan 39 km và Hồ Sa Pa 34 km.

Căn hộ cách Sa Pa Bus Station 34 km và Ham Rong Garden - Ham Rong Mountain 35 km. Sân bay gần nhất là Sân bay Wenshan Puzhehei, cách Kim Thành Hotel - 718 Trần Thái Tông, TP Lào Cai - by Bay Luxury 187 km.",,1.0
https://www.booking.com/hotel/vn/van-ha-lao-cai-by-bay-luxury.vi.html,Vân Hà Hotel Lào Cai - by Bay Luxury,"022 Thủy Hoa, Lào Cai, Việt Nam","Tọa lạc cách Trạm cáp treo Fansipan 39 km, Vân Hà Hotel Lào Cai - by Bay Luxury cung cấp chỗ nghỉ có Wi-Fi miễn phí và chỗ đậu xe riêng miễn phí.

Tất cả các căn đều có điều hòa và TV màn hình phẳng.

Căn hộ cách Hồ Sa Pa 34 km và Sa Pa Bus Station 35 km. Sân bay gần nhất là Sân bay Wenshan Puzhehei, cách Vân Hà Hotel Lào Cai - by Bay Luxury 186 km.",,1.0
https://www.booking.com/hotel/vn/khach-san-linh-vu-lao-cai123456.vi.html,Khách sạn Hoàng Yến,"001 PHỐ SOI TIỀN, Lào Cai, Việt Nam","Located in Lao Cai, 2.5 km from Duc Huy Plaza, KHACH SAN HOANG YEN features views of the garden. Featuring a bar, the 2-star hotel has air-conditioned rooms with a shared bathroom. The accommodation provides a 24-hour front desk and room service for guests.

The hotel is located right in the Walking Street area, in the busiest location in Lao Cai city, with many convenient restaurants, cafes, and supermarkets. From the hotel, it is 900m to Coc Leu tourist market, 1.9km to Lao Cai International Border Gate, and 2.3km to Thuong Temple. We have Trung Nguyen coffee, pure juice, and office rice. The rooms are clean and comfortable. 24/7 security

The units in the hotel are fitted with a kettle. Guest rooms in KHACH SAN HOANG YEN are equipped with a flat-screen TV and slippers.",8.4,2.0
https://www.booking.com/hotel/vn/kim-ngan-lao-cai-thanh-pho-lao-cai.vi.html,Kim Ngân Hotel Lào Cai,"58 Hợp Thành, Phố Mới, Lào Cai, Việt Nam","Tọa lạc ở Lào Cai, cách Trạm cáp treo Fansipan 38 km, Kim Ngân Hotel Lào Cai cung cấp chỗ nghỉ có Wi-Fi miễn phí và chỗ đậu xe riêng miễn phí. Chỗ nghỉ cách Hồ Sa Pa khoảng 33 km, Sa Pa Bus Station 33 km và Ham Rong Garden - Ham Rong Mountain 34 km. Khách sạn có phòng gia đình.

Tại khách sạn, phòng nào cũng có tủ quần áo, TV màn hình phẳng, phòng tắm riêng, ga trải giường và khăn tắm. Phòng khách đều có tủ lạnh.

Thành thạo tiếng Anh và tiếng Việt, đội ngũ nhân viên tại lễ tân 24/24 luôn sẵn lòng đưa ra hướng dẫn hữu ích về khu vực xung quanh.

Kim Ngân Hotel Lào Cai cách Sa Pa Stone Church 34 km và Thung lũng Mường Hoa 45 km. Sân bay gần nhất là Sân bay Wenshan Puzhehei, cách chỗ nghỉ 187 km.",7,
https://www.booking.com/hotel/vn/ali-naderi.vi.html,Khách Sạn Hoàng Gia 2 Lào Cai,"032, Bac Cuong Ward, Tran Hung Dao Highway, Lào Cai, Việt Nam","Nằm ở Lào Cai, cách Trạm cáp treo Fansipan 38 km, Khách Sạn Hoàng Gia 2 Lào Cai cung cấp chỗ nghỉ có khu vườn, chỗ đậu xe riêng miễn phí và phòng chờ chung. Chỗ nghỉ có Wi-Fi miễn phí này nằm cách Hồ Sa Pa khoảng 33 km và Sa Pa Bus Station 33 km. Chỗ nghỉ này cung cấp dịch vụ phòng, quầy lễ tân 24 giờ và dịch vụ thu đổi ngoại tệ cho khách.

Tại khách sạn, các phòng được thiết kế có điều hòa, bàn làm việc, TV màn hình phẳng, phòng tắm riêng, ga trải giường, khăn tắm và sân hiên với view thành phố. Các căn ở Khách Sạn Hoàng Gia 2 Lào Cai được trang bị đồ vệ sinh cá nhân miễn phí và máy tính để bàn.

Chỗ nghỉ cách Ham Rong Garden - Ham Rong Mountain 34 km và Sa Pa Stone Church 34 km. Sân bay gần nhất là Sân bay Wenshan Puzhehei, cách Khách Sạn Hoàng Gia 2 Lào Cai 189 km.",7.9,2.0
https://www.booking.com/hotel/vn/red-river-view.vi.html,Red River View Hotel,"178 Le Dai Hanh, Lao Cai City, Lào Cai, Việt Nam","Nằm ở Lào Cai, cách Trạm cáp treo Fansipan 38 km, Red River View Hotel cung cấp chỗ nghỉ có phòng chờ chung, chỗ đậu xe riêng miễn phí, nhà hàng và quầy bar. Khách sạn 3 sao này có máy ATM và dịch vụ tiền sảnh. Chỗ nghỉ cung cấp lễ tân 24/24, dịch vụ đưa đón sân bay, dịch vụ phòng và Wi-Fi miễn phí ở toàn bộ chỗ nghỉ.

Tất cả các căn đi kèm điều hòa, TV màn hình phẳng có truyền hình cáp, tủ lạnh, ấm đun nước, vòi xịt/chậu rửa vệ sinh, đồ vệ sinh cá nhân miễn phí và bàn làm việc. Ngoài phòng tắm riêng được trang bị vòi sen và máy sấy tóc, các phòng tại khách sạn đều có view thành phố. Tại Red River View Hotel, tất cả các phòng có ga trải giường và khăn tắm.

Khách tại chỗ nghỉ có thể thưởng thức bữa sáng thực đơn à la carte.

Red River View Hotel cách Hồ Sa Pa 33 km và Sa Pa Bus Station 33 km.",7.7,3.0
https://www.booking.com/hotel/vn/lao-cai-star.vi.html,Lao Cai Star Hotel,"3 Hoang Lien Street, Coc Leu Ward, Lào Cai, Việt Nam","Lao Cai là khách sạn sang trọng kết hợp phong cách của phương Tây và những nét đặc trưng Việt Nam truyền thống. Nơi nghỉ này nằm cách Chợ Cốc Lếu 5 phút đi bộ và cách Ga Lào Cai 2 km.

Tất cả phòng nghỉ tại Lao Cai Star Hotel đều có tầm nhìn toàn cảnh ra cảnh quan xung quanh, truy cập Wi-Fi miễn phí và truyền hình cáp màn hình phẳng. Các phòng suite có đồ trang trí bằng gỗ trang trọng và khu tiếp khách riêng biệt.

Quý khách có thể chọn trong số 2 nhà hàng trong khuôn viên: Lotus phục vụ các món đặc sản Việt Nam và các món ăn châu Á, trong khi nhà hàng Carmelia Restaurant lại tập trung vào đồ ăn quốc tế cổ điển. Khách sạn cung cấp dịch vụ phòng 24/7.

Nhân viên lễ tân 24 giờ có thể giúp quý khách lên kế hoạch cho các chuyến thăm quan và du ngoạn. Ngôi làng Sa Pa đẹp như tranh vẽ nằm cách khách sạn Lao Cai Star 30 phút lái xe Trong khuôn viên khách sạn có chỗ đỗ xe riêng miễn phí.",8.3,4.0
https://www.booking.com/hotel/vn/khach-san-hoang-gia-lao-cai.vi.html,Khách Sạn Hoàng Gia Lào Cai - Hoang Gia Hotel,"233, Tran Hung Dao Highway, Bac Cuong Ward, Lào Cai, Việt Nam","Tọa lạc ở Lào Cai, cách Trạm cáp treo Fansipan 38 km, Khách Sạn Hoàng Gia Lào Cai - Hoang Gia Hotel cung cấp chỗ nghỉ có khu vườn, chỗ đậu xe riêng miễn phí, phòng chờ chung và nhà hàng. Chỗ nghỉ có Wi-Fi miễn phí này nằm cách Hồ Sa Pa khoảng 33 km và Sa Pa Bus Station 33 km. Chỗ nghỉ này cung cấp bếp chung, dịch vụ phòng và dịch vụ thu đổi ngoại tệ cho khách.

Tại khách sạn, tất cả các phòng đều được thiết kế có điều hòa, bàn làm việc, TV màn hình phẳng, phòng tắm riêng, ga trải giường, khăn tắm và sân hiên với view thành phố. Tất cả các phòng có két an toàn và một số phòng nhìn ra hồ. Tất cả các căn ở Khách Sạn Hoàng Gia Lào Cai - Hoang Gia Hotel được trang bị đồ vệ sinh cá nhân miễn phí và ổ cắm iPod.

Thành thạo tiếng Anh, tiếng Việt và tiếng Hoa, đội ngũ nhân viên luôn túc trực 24/7 tại lễ tân.

Chỗ nghỉ cách Ham Rong Garden - Ham Rong Mountain 34 km và Sa Pa Stone Church 34 km.",9.2,2.0
https://www.booking.com/hotel/vn/sapa-garden-hostel.vi.html,Sapa Garden Hostel,"100a Đường Điện Biên Phủ, Lào Cai, Việt Nam","Nằm ở Lào Cai, cách Trạm cáp treo Fansipan 7.3 km, Sapa Garden Hostel cung cấp chỗ nghỉ có khu vườn, chỗ đậu xe riêng miễn phí, phòng chờ chung và sân hiên. Chỗ nghỉ này có các tiện nghi như quầy bar và tiện nghi BBQ. Chỗ nghỉ cung cấp lễ tân 24/24, dịch vụ đưa đón sân bay, dịch vụ tiền sảnh và Wi-Fi miễn phí ở toàn bộ chỗ nghỉ.

Tại hostel, các phòng đều có ga trải giường và khăn tắm.

Sapa Garden Hostel cách Hồ Sa Pa 2.3 km và Sa Pa Bus Station 2.6 km.",10,
https://www.booking.com/hotel/vn/mong-eco-house.vi.html,H'mong Eco House,"Thôn lồ - xã hoàng liên- thị xã sapa- tỉnh lào cai, Lào Cai, Việt Nam","Nằm ở Lào Cai, H'mong Eco House cung cấp Wi-Fi miễn phí, nơi khách có thể trải nghiệm khu vườn, sân hiên và nhà hàng.

Nơi đây còn có phòng tắm chung với vòi xịt/chậu rửa vệ sinh ở tất cả các căn, cùng đồ vệ sinh cá nhân miễn phí, máy sấy tóc và dép đi trong phòng.

Homestay cách Trạm cáp treo Fansipan 12 km và Hồ Sa Pa 7.8 km.",9.9,
https://www.booking.com/hotel/vn/hmong-hillside-house.vi.html,Hmong Hillside House,"Dinh Sapa Trekking Adventures, Lào Cai, Việt Nam","Tọa lạc ở Lào Cai, Hmong Hillside House cung cấp Wi-Fi miễn phí, nơi khách có thể trải nghiệm khu vườn, sân hiên và quầy bar.

Một số căn có ban công và/hoặc sân trong nhìn ra núi hoặc sông.

Homestay có phục vụ bữa sáng thực đơn buffet mỗi sáng.

Hmong Hillside House cách Trạm cáp treo Fansipan 16 km và Hồ Sa Pa 12 km.",,
https://www.booking.com/hotel/vn/khach-san-sen-vang-lao-cai1.vi.html,KHÁCH SẠN SEN VÀNG,"số 052 đường 30/4 - phường bắc lệnh số 052 đường 30/4 - phường bắc lệnh, Lào Cai, Việt Nam","Tọa lạc ở Lào Cai, cách Trạm cáp treo Fansipan 43 km, KHÁCH SẠN SEN VÀNG cung cấp chỗ nghỉ có khu vườn, chỗ đậu xe riêng miễn phí, phòng chờ chung và sân hiên. Ngoài nhà hàng, khách sạn 3 sao này còn có các phòng với điều hòa được trang bị Wi-Fi miễn phí, trong đó mỗi phòng đều có phòng tắm riêng. Chỗ nghỉ này cung cấp dịch vụ phòng, quầy lễ tân 24 giờ và dịch vụ thu đổi ngoại tệ cho khách.

Các phòng ở khách sạn được trang bị TV màn hình phẳng.

Đi xe đạp là hoạt động được ưa chuộng trong khu vực. Ngoài ra, KHÁCH SẠN SEN VÀNG có dịch vụ thuê xe đạp.

Chỗ nghỉ cách Hồ Sa Pa 37 km và Sa Pa Bus Station 38 km. Sân bay gần nhất là Sân bay Wenshan Puzhehei, cách KHÁCH SẠN SEN VÀNG 194 km.",7,3.0
https://www.booking.com/hotel/vn/mama-si-si-sapa-homestay-and-trekking.vi.html,Mama Si Si Sapa Homestay and Trekking,"8W72+VRC Near, Hầu Thào, Sa Pa, Lào Cai, Vietnam 333214, Lào Cai, Việt Nam","Nhìn ra núi, Mama Si Si Sapa Homestay and Trekking cung cấp chỗ nghỉ có khu vườn và ban công, cách Hồ Sa Pa khoảng 10 km. Chỗ nghỉ điều hòa này cách Trạm cáp treo Fansipan 14 km, khách có thể sử dụng chỗ đậu xe riêng có sẵn trong khuôn viên và Wi-Fi miễn phí.

Homestay có TV màn hình phẳng.

Chỗ nghỉ có phục vụ bữa sáng mỗi buổi sáng, gồm các lựa chọn kiểu Á, món chay và món thuần chay.

Homestay cách Sa Pa Stone Church 9.3 km và Sa Pa Bus Station 10 km. Sân bay gần nhất là Sân bay Wenshan Puzhehei, cách Mama Si Si Sapa Homestay and Trekking 226 km.",,
https://www.booking.com/hotel/vn/the-cosy-nest-of-happiness.vi.html,The cosy nest of happiness!,"Thôn Tả Chải Dao, Xã Tả Van, thị xã Sa Pa, Lào Cai, Việt Nam","The cosy nest of happiness! là chỗ nghỉ tọa lạc ở Lào Cai và có ban công. Chỗ nghỉ nhìn ra thành phố, có khu vườn, sân hiên và Wi-Fi miễn phí ở toàn bộ chỗ nghỉ.

Khăn tắm và ga trải giường có sẵn ở homestay.

Khách tại homestay có thể thưởng thức bữa sáng thực đơn buffet.

The cosy nest of happiness! cách Trạm cáp treo Fansipan 19 km và Hồ Sa Pa 15 km.",,
https://www.booking.com/hotel/vn/khach-san-hong-hao.vi.html,Khách Sạn Hồng Hảo,"Trần Nhật Duật, Lào Cai, Việt Nam","Nằm ở Lào Cai, cách Trạm cáp treo Fansipan 37 km, Khách Sạn Hồng Hảo cung cấp chỗ nghỉ có khu vườn, chỗ đậu xe riêng miễn phí, sân hiên và nhà hàng. Ngoài Wi-Fi miễn phí, khách sạn 2 sao này còn cung cấp dịch vụ phòng. Đây là chỗ nghỉ không hút thuốc và tọa lạc cách Hồ Sa Pa 32 km.

Tại khách sạn, tất cả các phòng đều có bàn làm việc, TV màn hình phẳng, phòng tắm riêng, ga trải giường và khăn tắm.

Khách Sạn Hồng Hảo cách Sa Pa Bus Station 33 km và Ham Rong Garden - Ham Rong Mountain 33 km. Sân bay gần nhất là Sân bay Wenshan Puzhehei, cách chỗ nghỉ 189 km.",6.5,2.0
https://www.booking.com/hotel/vn/homestay-y-ty-dai-ngan-lao-cai-lao-cai.vi.html,homestay y tý đại ngàn - lào cai,"y tý bất xát tỉnh lào cai, Lào Cai, Việt Nam","Tọa lạc cách Trạm cáp treo Fansipan 37 km, homestay y tý đại ngàn - lào cai cung cấp chỗ nghỉ có khu vườn, nhà hàng và dịch vụ phòng. Wi-Fi miễn phí được cung cấp ở toàn bộ chỗ nghỉ.

Nơi đây còn có phòng tắm riêng với vòi sen ở tất cả các căn, cùng máy sấy tóc và dép đi trong phòng.

Lodge cách Hồ Sa Pa 32 km và Sa Pa Bus Station 32 km. Sân bay gần nhất là Sân bay Wenshan Puzhehei, cách homestay y tý đại ngàn - lào cai 188 km.",,
https://www.booking.com/hotel/vn/anss-space-sapa.vi.html,An's Space Sapa,"Số 31 Ngõ Hùng Hồ, Đường Xuân Viên Sa Pa, Lào Cai, Lào Cai, Việt Nam","Nằm ở Lào Cai, cách Trạm cáp treo Fansipan 5.1 km, An's Space Sapa cung cấp chỗ nghỉ có khu vườn, chỗ đậu xe riêng miễn phí, sân hiên và nhà hàng. Với quầy bar, khách sạn nằm gần một số điểm tham quan nổi tiếng, cách Hồ Sa Pa 4 phút đi bộ, Sa Pa Bus Station 400 m và Ham Rong Garden - Ham Rong Mountain 18 phút đi bộ. Chỗ nghỉ cung cấp lễ tân 24/24, dịch vụ đưa đón, dịch vụ phòng và Wi-Fi miễn phí ở toàn bộ chỗ nghỉ.

Tất cả các phòng ở khách sạn được trang bị ấm đun nước và ổ cắm iPod. Tại An's Space Sapa, các phòng đều đi kèm với ga trải giường và khăn tắm.

Chỗ nghỉ cách Sa Pa Stone Church 7 phút đi bộ và Thung lũng Mường Hoa 12 km.",9.2,
https://www.booking.com/hotel/vn/the-zen-house-sapa.vi.html,The Zen House Sapa,"The Zen House Sapa, Bãi đá cổ, Hầu Thào, Thị xã Sa Pa, Lào Cai, Việt Nam","Nhìn ra thành phố, The Zen House Sapa ở Lào Cai cung cấp chỗ nghỉ có khu vườn, sân hiên và nhà hàng. Homestay có WiFi và chỗ đậu xe riêng miễn phí.

Nơi đây còn có phòng tắm chung với vòi xịt/chậu rửa vệ sinh ở tất cả các căn, cùng máy sấy tóc và dép đi trong phòng.

Chỗ nghỉ có phục vụ bữa sáng thực đơn à la carte, kiểu Mỹ hoặc kiểu Á mỗi sáng.

The Zen House Sapa cách Trạm cáp treo Fansipan 14 km và Hồ Sa Pa 10 km.",,
https://www.booking.com/hotel/vn/ta-van-countryside-homestay-lao-cai.vi.html,Ta Van Countryside Homestay,"Thon Day 1, Ta Van, Sa Pa, Lào Cai, Việt Nam","Nhìn ra núi, Ta Van Countryside Homestay nằm ở Lào Cai và có nhà hàng, bếp chung, quầy bar, khu vườn cũng như sân hiên. Homestay có WiFi và chỗ đậu xe riêng miễn phí.

Nơi đây còn có phòng tắm chung với vòi sen ở một số căn, cùng đồ vệ sinh cá nhân miễn phí, dép đi trong phòng và áo choàng tắm.

Khách cũng có thể thư giãn trong khu vực phòng chờ chung.

Ta Van Countryside Homestay cách Trạm cáp treo Fansipan 15 km và Hồ Sa Pa 11 km.",10,
https://www.booking.com/hotel/vn/local-guide-homestay-amp-trekking.vi.html,Sapa Guide Homestay & Trekking,"Ta Van, Sapa, Lào Cai, Việt Nam","Tọa lạc ở Lào Cai, cách Trạm cáp treo Fansipan 15 km, Sapa Guide Homestay & Trekking cung cấp chỗ nghỉ có khu vườn, chỗ đậu xe riêng miễn phí và sân hiên. Chỗ nghỉ có Wi-Fi miễn phí này nằm cách Sa Pa Stone Church khoảng 10 km và Sa Pa Bus Station 11 km. Đây là chỗ nghỉ không hút thuốc và nằm cách Hồ Sa Pa 11 km.

Tất cả các căn tại guest house được trang bị khu vực ghế ngồi. Ngoài phòng tắm riêng được trang bị vòi sen và đồ vệ sinh cá nhân miễn phí, các phòng tại Sapa Guide Homestay & Trekking đều có view núi. Tại chỗ nghỉ, tất cả các phòng đều có ga trải giường và khăn tắm.

Sapa Guide Homestay & Trekking cách Ham Rong Garden - Ham Rong Mountain 11 km và Thung lũng Mường Hoa 22 km. Sân bay gần nhất là Sân bay Wenshan Puzhehei, cách guest house 231 km.",9.7,
https://www.booking.com/hotel/vn/nha-nghi-samu.vi.html,Hotel Samu,"số nhà 033 đường Na Hối - thị trấn Bắc Hà - huyện Bắc Hà - tỉnh Lào Cai, Lào Cai, Việt Nam","Hotel Samu có trung tâm thể dục, khu vườn, sân hiên và nhà hàng ở Lào Cai. Ngoài quầy bar, khách sạn 3 sao này có các phòng được trang bị điều hòa và Wi-Fi miễn phí, trong đó mỗi phòng sẽ có phòng tắm riêng. Chỗ nghỉ có chỗ đậu xe riêng miễn phí và có cả dịch vụ đưa đón sân bay mất phí.

Tại khách sạn, tất cả các phòng đều được thiết kế có tủ quần áo. Các phòng đều đi kèm với ấm đun nước, trong đó một số phòng có ban công và một số khác thì nhìn ra thành phố. Tại Hotel Samu, tất cả các phòng có ga trải giường và khăn tắm.

Khách tại chỗ nghỉ có thể thưởng thức bữa sáng thực đơn buffet.

Lễ tân tại Hotel Samu có thể tư vấn cho khách về khu vực xung quanh.",7,3.0
https://www.booking.com/hotel/vn/salem-house-sapa-lao-cai.vi.html,Salem House Sapa,"Thôn Tả Van Giáy 2,xã Tả Van,thị xã Sa Pa ,tỉnh Lào Cai, Lào Cai, Việt Nam","Với phòng chờ chung, sân hiên, cùng nhà hàng, Salem House Sapa cung cấp chỗ nghỉ ở Lào Cai có Wi-Fi miễn phí và nhìn ra núi. Căn hộ cung cấp chỗ đậu xe riêng miễn phí và bếp chung.

Căn hộ này có ban công, bếp đầy đủ tiện nghi và TV màn hình phẳng. Khăn tắm và ga trải giường có sẵn ở căn hộ.

Khách tại căn hộ có thể thưởng thức bữa sáng thực đơn buffet.

Thành thạo tiếng Anh và tiếng Việt, đội ngũ nhân viên tại lễ tân luôn sẵn lòng đưa ra hướng dẫn hữu ích về khu vực xung quanh.

Du khách có thể câu cá gần đó.

Salem House Sapa cách Trạm cáp treo Fansipan 15 km và Hồ Sa Pa 10 km.",10,
https://www.booking.com/hotel/vn/ms-si-hmong-flower-house.vi.html,Mama Sisi Sapa Homestay & Trekking,"Thôn Thào Hồng Dến xã Mường Hoa thị xã Sa Pa tỉnh Lào Cai., Lào Cai, Việt Nam","Nằm ở Lào Cai, cách Trạm cáp treo Fansipan 16 km và Hồ Sa Pa 11 km, Mama Sisi Sapa Homestay & Trekking cung cấp chỗ nghỉ có khu vườn với sân hiên.

Căn hộ cách Sa Pa Stone Church 11 km và Sa Pa Bus Station 11 km.",10,
https://www.booking.com/hotel/vn/sapa-adam.vi.html,Sapa Adam Hotel,"Đường N1 (Đối Diện Bến Xe Mới SaPa TX, Sa Pa, Lào Cai, Lào Cai, Việt Nam","Sapa Adam Hotel có khu vườn, sân hiên, nhà hàng và quầy bar ở Lào Cai. Ngoài Wi-Fi miễn phí, khách sạn 4 sao này còn cung cấp dịch vụ phòng và quầy lễ tân 24 giờ. Đây là chỗ nghỉ không hút thuốc và tọa lạc cách Trạm cáp treo Fansipan 6.2 km.

Các điểm tham quan nổi tiếng gần khách sạn bao gồm Hồ Sa Pa, Sa Pa Bus Station và Ham Rong Garden - Ham Rong Mountain.",8.6,4.0
https://www.booking.com/hotel/vn/the-happy-happy-bungalow-of-happiness.vi.html,The Happy Happy Bungalow of Happiness!,"Thôn Tả Chải Dao, xã Tả Van, thị xã Sa Pa, Lào Cai, Việt Nam","Nhìn ra khu vườn, The Happy Happy Bungalow of Happiness! cung cấp chỗ nghỉ tọa lạc ở Lào Cai, cách Trạm cáp treo Fansipan 19 km và Hồ Sa Pa 15 km. Chỗ nghỉ nhìn ra núi, có khu vườn, sân hiên và Wi-Fi miễn phí ở toàn bộ chỗ nghỉ.

Chalet có 1 phòng ngủ, bếp với tủ lạnh, bếp, cũng như ấm đun nước. Khăn tắm và ga trải giường có sẵn ở chalet.

Chalet cách Sa Pa Stone Church 14 km và Sa Pa Bus Station 15 km.","10,0",3.0
https://www.booking.com/hotel/vn/muong-hoa-peaceful-homestay-amp-sapa-lao-cai.vi.html,MUONG HOA Peaceful HOMESTAY & Sapa,"Mường Hoa, Lào Cai, Việt Nam","Nhìn ra núi, MUONG HOA Peaceful HOMESTAY & Sapa cung cấp chỗ nghỉ có sân hiên và ban công, cách Hồ Sa Pa khoảng 13 km. Tọa lạc cách Trạm cáp treo Fansipan 18 km, chỗ nghỉ cung cấp khu vườn và chỗ đậu xe riêng miễn phí.

Khăn tắm và ga trải giường có sẵn ở nhà nghỉ B&B.

Nhà nghỉ B&B cách Sa Pa Stone Church 13 km và Sa Pa Bus Station 13 km. Sân bay gần nhất là Sân bay Wenshan Puzhehei, cách MUONG HOA Peaceful HOMESTAY & Sapa 230 km.",,
https://www.booking.com/hotel/vn/vi-homestay.vi.html,Vĩ Homestay,"Thôn Na kim xã Tà chải, Huyện Bắc Hà, Tỉnh Lào cai, Lào Cai, Việt Nam","Nhìn ra núi, Vĩ Homestay ở Lào Cai cung cấp chỗ nghỉ có khu vườn và sân hiên.

Tất cả các căn đều được thiết kế có ban công nhìn ra khu vườn.

Homestay có dịch vụ cho thuê ô tô, đồng thời du khách có thể leo núi gần đó.

Sân bay gần nhất là Sân bay Wenshan Puzhehei, cách Vĩ Homestay 175 km.",7.8,
https://www.booking.com/hotel/vn/lysa-house.vi.html,Lysa House,"Tổ 2 phường cầu mây thị xã sapa tỉnh Lào cai, Lào Cai, Việt Nam","Tọa lạc ở Lào Cai, cách Trạm cáp treo Fansipan 12 km và Hồ Sa Pa 7.2 km, Lysa House cung cấp chỗ nghỉ nhìn ra núi, có Wi-Fi miễn phí và khu vườn với sân hiên.

Tất cả các căn đều được thiết kế có ban công nhìn ra sông.

Chỗ nghỉ có phục vụ bữa sáng hằng ngày, gồm các lựa chọn thực đơn buffet, thực đơn à la carte và kiểu Mỹ.

Biệt thự đồng quê cách Sa Pa Stone Church 6.7 km và Sa Pa Bus Station 7 km. Sân bay gần nhất là Sân bay Wenshan Puzhehei, cách Lysa House 227 km.",10,
https://www.booking.com/hotel/vn/heaven-house-sapa.vi.html,Heaven house sapa,"Bt 09, tổ 3 phường cầu mây, thị xã sapa, Lào Cai, Việt Nam","Nhìn ra khu vườn, Heaven house sapa cung cấp chỗ nghỉ nằm ở Lào Cai, cách Trạm cáp treo Fansipan 33 km và Hồ Sa Pa 28 km. Khách lưu trú tại biệt thự này có thể sử dụng Wi-Fi miễn phí, bếp nhỏ đầy đủ tiện nghi, cùng ban công.

Biệt thự có 2 phòng ngủ này cung cấp cho khách TV màn hình phẳng, điều hòa và phòng khách.

Biệt thự cách Sa Pa Stone Church 28 km và Sa Pa Bus Station 28 km. Sân bay gần nhất là Sân bay Điện Biên Phủ, cách Heaven house sapa 295 km.",,
https://www.booking.com/hotel/vn/stone-garden-resort-amp-spa.vi.html,Stone Garden Resort & Spa,"Đội 4, Thôn Sả Xéng, Xã Tả Phìn, Sapa, Lào Cai, Lào Cai, Việt Nam","Nhìn ra núi, Stone Garden Resort & Spa ở Lào Cai cung cấp chỗ nghỉ có hồ bơi ngoài trời, khu vườn, sân hiên và quầy bar. Nhà nghỉ B&B có WiFi và chỗ đậu xe riêng miễn phí.

Nơi đây còn có phòng tắm riêng với vòi xịt/chậu rửa vệ sinh ở tất cả các căn, cùng đồ vệ sinh cá nhân miễn phí, máy sấy tóc và dép đi trong phòng.

Stone Garden Resort & Spa có phục vụ bữa sáng thực đơn à la carte mỗi buổi sáng.

Chỗ nghỉ cách Trạm cáp treo Fansipan 11 km và Hồ Sa Pa 10 km.",9.7,
https://www.booking.com/hotel/vn/chau-chau-homestay-lao-cai.vi.html,Chau Chau homestay,"8W36+3HQ, Sử Pán, Sa Pa, Lào Cai, Lào Cai, Việt Nam","Chau Chau homestay cung cấp chỗ nghỉ tọa lạc ở Lào Cai, cách Trạm cáp treo Fansipan 16 km, Hồ Sa Pa 11 km và Sa Pa Stone Church 11 km. Chỗ nghỉ nhìn ra núi, có khu vườn, sân hiên và Wi-Fi miễn phí ở toàn bộ chỗ nghỉ.

Homestay cách Sa Pa Bus Station 11 km và Ham Rong Garden - Ham Rong Mountain 11 km. Sân bay gần nhất là Sân bay Wenshan Puzhehei, cách Chau Chau homestay 231 km.",,
https://www.booking.com/hotel/vn/a-day-house.vi.html,A Đẩy house,"na kim, Lào Cai, Việt Nam","A Đẩy house tọa lạc ở Lào Cai, nhìn ra khu vườn và có Wi-Fi miễn phí cùng chỗ đậu xe riêng miễn phí.

Nơi đây còn có phòng tắm riêng với vòi xịt/chậu rửa vệ sinh ở tất cả các căn, cùng đồ vệ sinh cá nhân miễn phí, máy sấy tóc và dép đi trong phòng.

Khách cũng có thể thư giãn trong khu vườn.",,
