url,name,location,description,point,star
https://www.booking.com/hotel/vn/khach-san-sen-trang.vi.html,Sen Trang Hotel,"086 An Dương Vương, Phường Cốc Lếu, Tp. Lào Cai, Tỉnh Lào Cai., Lào Cai, Việt Nam","Nằm ở Lào Cai, cách Trạm cáp treo Fansipan 39 km, Sen Trang Hotel cung cấp chỗ nghỉ có phòng chờ chung, chỗ đậu xe riêng miễn phí, sân hiên và nhà hàng. Ngoài quầy bar, khách sạn 2 sao này còn có các phòng với điều hòa được trang bị Wi-Fi miễn phí, trong đó mỗi phòng đều có phòng tắm riêng. Chỗ nghỉ này cung cấp bếp chung, dịch vụ phòng và dịch vụ thu đổi ngoại tệ cho khách.

Các căn tại khách sạn đi kèm khu vực ghế ngồi. Tại Sen Trang Hotel, các phòng được thiết kế có ga trải giường và khăn tắm.

Leo núi là hoạt động được ưa chuộng trong khu vực. Ngoài ra, chỗ nghỉ có dịch vụ thuê ô tô.

Thành thạo tiếng Anh, tiếng Việt và tiếng Hoa, đội ngũ nhân viên tại lễ tân 24/24 luôn sẵn lòng hỗ trợ khách.

Sen Trang Hotel cách Hồ Sa Pa 34 km và Sa Pa Bus Station 34 km.",8.3,2.0
https://www.booking.com/hotel/vn/khach-san-ngoc-ha-thanh-pho-lao-cai.vi.html,Khách sạn Ngọc Hà,"001 Trần Quốc Toản, Lào Cai, Việt Nam","Nằm ở Lào Cai, cách Trạm cáp treo Fansipan 39 km, Khách sạn Ngọc Hà cung cấp chỗ nghỉ có phòng chờ chung, chỗ đậu xe riêng miễn phí và sân hiên. Khách sạn 3 sao này cung cấp bếp chung, dịch vụ phòng và Wi-Fi miễn phí. Khách sạn có bể sục và quầy lễ tân 24 giờ.

Các căn đi kèm điều hòa, TV màn hình phẳng có truyền hình vệ tinh, tủ lạnh, ấm đun nước, vòi xịt/chậu rửa vệ sinh, đồ vệ sinh cá nhân miễn phí và bàn làm việc. Tại khách sạn, các phòng đều đi kèm với ga trải giường và khăn tắm.

Khách sạn Ngọc Hà cách Hồ Sa Pa 34 km và Sa Pa Bus Station 35 km. Sân bay gần nhất là Sân bay Wenshan Puzhehei, cách chỗ nghỉ 186 km.",8.9,3.0
https://www.booking.com/hotel/vn/cao-minh-thanh-pho-lao-cai.vi.html,Cao Minh Hotel,"108 An Dương Vương, Phường Cốc Lếu, Lào Cai, Việt Nam","Nằm ở Lào Cai, cách Trạm cáp treo Fansipan 39 km, Cao Minh Hotel nhìn rathành phố. Ngoài Wi-Fi miễn phí, khách sạn 3 sao này còn cung cấp dịch vụ phòng và quầy lễ tân 24 giờ. Chỗ đậu xe riêng miễn phí có sẵn và khách sạn còn cung cấp dịch vụ thuê xe đạp cho những khách muốn khám phá khu vực xung quanh.

Khách sạn sẽ cung cấp cho khách các phòng được trang bị điều hòa có bàn làm việc, ấm đun nước, tủ lạnh, két an toàn, TV màn hình phẳng và phòng tắm riêng với vòi sen. Tại Cao Minh Hotel, tất cả các phòng đều có ga trải giường và khăn tắm.

Chỗ nghỉ cách Hồ Sa Pa 34 km và Sa Pa Bus Station 34 km.",8.5,3.0
https://www.booking.com/hotel/vn/tp-lao-cai-hoang-gia.vi.html,Cô Chung Hotel,"Nguyễn Đức Cảnh, Cốc Lếu, Lào Cai Số 107, Lào Cai, Việt Nam","Tọa lạc ở Lào Cai, cách Trạm cáp treo Fansipan 39 km, Cô Chung Hotel cung cấp chỗ nghỉ có Wi-Fi miễn phí và chỗ đậu xe riêng miễn phí. Chỗ nghỉ cách Hồ Sa Pa khoảng 34 km, Sa Pa Bus Station 35 km và Ham Rong Garden - Ham Rong Mountain 35 km. Khách sạn có phòng gia đình.

Tất cả các căn được trang bị điều hòa, TV màn hình phẳng có truyền hình cáp, ấm đun nước, vòi xịt/chậu rửa vệ sinh, đồ vệ sinh cá nhân miễn phí và bàn làm việc. Phòng tắm riêng được trang bị vòi sen, máy sấy tóc và dép đi trong phòng. Tại khách sạn, tất cả các phòng đều có ga trải giường và khăn tắm.

Thành thạo tiếng Anh và tiếng Việt, đội ngũ nhân viên tại lễ tân luôn sẵn lòng đưa ra thông tin hữu ích về khu vực xung quanh.

Cô Chung Hotel cách Sa Pa Stone Church 35 km và Thung lũng Mường Hoa 46 km. Sân bay gần nhất là Sân bay Wenshan Puzhehei, cách chỗ nghỉ 187 km.",8.7,
https://www.booking.com/hotel/vn/duc-huy-grand.vi.html,Duc Huy Grand Hotel,"72 -74 Tran Hung Dao avenue Bac Cuong ward, Lào Cai, Việt Nam","Nằm tại thành phố Lào Cai, cách trung tâm thương mại Đức Huy Plaza 100 m, Duc Huy Grand Hotel là khách sạn 4 sao có trung tâm thể dục, vườn, phòng nghỉ gắn máy điều hòa đi kèm phòng tắm riêng cùng nhà hàng phục vụ ẩm thực Mỹ, Trung Quốc và Á trong khuôn viên.

Tất cả phòng nghỉ tại đây đều được bố trí truyền hình vệ tinh màn hình phẳng, tủ lạnh, ấm đun nước, bồn tắm, máy sấy tóc, bàn, ban công và tủ quần áo. Một số còn có tầm nhìn ra cảnh núi non.

Khách sạn cung cấp bữa sáng tự chọn hàng ngày.

Duc Huy Grand Hotel cũng có sân hiên.

Nhân viên lễ tân 24 giờ có thể tư vấn cho khách về khu vực.",8.7,4.0
https://www.booking.com/hotel/vn/to-hop-van-phong-va-can-ho.vi.html,Big Hotel Lào Cai,"503 Đường Hoàng Liên 503-505, Lào Cai, Việt Nam","Nhìn ra thành phố, Big Hotel Lào Cai ở Lào Cai cung cấp chỗ nghỉ có phòng chờ chung, sân hiên, nhà hàng và quầy bar. Khách sạn căn hộ có WiFi và chỗ đậu xe riêng miễn phí.

Được thiết kế với ban công, các căn có điều hòa, TV màn hình phẳng, cùng phòng tắm riêng gồm vòi xịt/chậu rửa vệ sinh và đồ vệ sinh cá nhân miễn phí. Tủ lạnh và minibar, cũng như ấm đun nước đều được cung cấp.

Big Hotel Lào Cai cách Trạm cáp treo Fansipan 37 km và Hồ Sa Pa 32 km.",8.4,3.0
https://www.booking.com/hotel/vn/kim-cuong-lao-cai.vi.html,Diamond Hotel,"358 Nguyen Hue, Lào Cai, Việt Nam","Tọa lạc ở Lào Cai, cách Trạm cáp treo Fansipan 39 km, Diamond Hotel cung cấp chỗ nghỉ có sân hiên, chỗ đậu xe riêng miễn phí và nhà hàng. Ngoài Wi-Fi miễn phí, khách sạn 3 sao này còn cung cấp dịch vụ phòng và quầy lễ tân 24 giờ. Chỗ nghỉ này cung cấp phòng giữ hành lý, cùng dịch vụ thu đổi ngoại tệ cho khách.

Khách sạn cách Hồ Sa Pa 34 km và Sa Pa Bus Station 34 km.",7.7,3.0
https://www.booking.com/hotel/vn/khach-san-tokyo.vi.html,Khách San Tokyo,"002,phan đình phùng, lào cai, thành phố lào cai, lao cai 002 phan đình phùng phường lào cai tp lào cai, Lào Cai, Việt Nam","Nằm ở Lào Cai, cách Trạm cáp treo Fansipan 39 km, Khách San Tokyo nhìn rasông. Khách sạn 1 sao này có dịch vụ phòng và quầy lễ tân 24 giờ. Hồ Sa Pa cách khách sạn 34 km và Sa Pa Bus Station 34 km.

Các căn đi kèm điều hòa, TV màn hình phẳng có truyền hình cáp, tủ lạnh, ấm đun nước, vòi xịt/chậu rửa vệ sinh, đồ vệ sinh cá nhân miễn phí và bàn làm việc. Ngoài phòng tắm riêng, vòi sen và máy sấy tóc, các phòng tại khách sạn đều có view thành phố. Tại Khách San Tokyo, các phòng đều đi kèm với ga trải giường và khăn tắm.

Chỗ nghỉ cách Ham Rong Garden - Ham Rong Mountain 35 km và Sa Pa Stone Church 35 km. Sân bay gần nhất là Sân bay Wenshan Puzhehei, cách Khách San Tokyo 187 km.",8.5,1.0
https://www.booking.com/hotel/vn/khach-san-tokyo-lao-cai.vi.html,Khách Sạn Tokyo,"Phan Đình Phùng, Lào Cai, Việt Nam","Nhìn ra thành phố, Khách Sạn Tokyo cung cấp chỗ nghỉ có sân hiên, cách Trạm cáp treo Fansipan khoảng 39 km. Căn hộ cung cấp chỗ đậu xe riêng miễn phí, quầy lễ tân 24 giờ và Wi-Fi miễn phí.

Căn hộ điều hòa này có 1 phòng ngủ và 1 phòng tắm với vòi xịt/chậu rửa vệ sinh, vòi sen và đồ vệ sinh cá nhân miễn phí. TV màn hình phẳng được cung cấp.

Căn hộ có dịch vụ cho thuê ô tô.

Khách Sạn Tokyo cách Hồ Sa Pa 34 km và Sa Pa Bus Station 34 km.",8.6,3.0
https://www.booking.com/hotel/vn/valley-sapa.vi.html,Valley Sapa Hotel,"039 Mường Hoa, Lào Cai, Việt Nam","Nằm ở Lào Cai, cách Trạm cáp treo Fansipan 37 km, Valley Sapa Hotel cung cấp chỗ nghỉ có khu vườn, chỗ đậu xe riêng miễn phí, sân hiên và nhà hàng. Khách sạn 2 sao này cung cấp quầy bar. Chỗ nghỉ cung cấp lễ tân 24/24, dịch vụ đưa đón sân bay, dịch vụ phòng và Wi-Fi miễn phí ở toàn bộ chỗ nghỉ.

Tất cả các phòng đi kèm điều hòa, tủ lạnh, máy rửa bát, máy pha cà phê, vòi xịt/chậu rửa vệ sinh, đồ vệ sinh cá nhân miễn phí và tủ quần áo. Ngoài phòng tắm riêng, vòi sen và máy sấy tóc, các phòng tại khách sạn đều có view thành phố. Các phòng ở Valley Sapa Hotel được trang bị TV màn hình phẳng và dép đi trong phòng.

Chỗ nghỉ có phục vụ bữa sáng kiểu Mỹ hoặc kiểu Á.

Valley Sapa Hotel cách Hồ Sa Pa 31 km và Sa Pa Bus Station 32 km.",,2.0
https://www.booking.com/hotel/vn/sojo-lao-cai.vi.html,SOJO Hotel Lao Cai,"Đường An Dương Vương, phường Cốc Lếu, thành phố Lào Cai, tỉnh Lào Cai, Lào Cai, Việt Nam","Nằm ở Lào Cai, cách Trạm cáp treo Fansipan 39 km, SOJO Hotel Lao Cai cung cấp chỗ nghỉ có trung tâm thể dục, chỗ đậu xe riêng miễn phí, phòng chờ chung và nhà hàng. Ngoài quầy bar, khách sạn 4 sao này có các phòng được trang bị điều hòa và Wi-Fi miễn phí, trong đó mỗi phòng sẽ có phòng tắm riêng. Chỗ nghỉ này cung cấp bếp chung, quầy lễ tân 24 giờ và phòng giữ hành lý cho khách.

Tại khách sạn, các phòng đều đi kèm với bàn làm việc. Tất cả các phòng ở SOJO Hotel Lao Cai được trang bị TV màn hình phẳng và đồ vệ sinh cá nhân miễn phí.

Khách có thể thưởng thức bữa sáng thực đơn buffet, thực đơn à la carte hoặc kiểu Á tại chỗ nghỉ.

Chỗ nghỉ cách Hồ Sa Pa 34 km và Sa Pa Bus Station 34 km.",8.6,4.0
https://www.booking.com/hotel/vn/mai-anh-lao-cai.vi.html,Mai Anh Hotel,"38 Phan Dinh Phung Street, Lào Cai, Việt Nam","Tọa lạc ở Lào Cai, cách Trạm cáp treo Fansipan 39 km, Mai Anh Hotel nhìn rathành phố. Khách sạn 2 sao này cung cấp dịch vụ phòng, quầy lễ tân 24 giờ và Wi-Fi miễn phí. Khách sạn có phòng gia đình.

Các phòng được trang bị điều hòa, TV màn hình phẳng có truyền hình cáp, tủ lạnh, ấm đun nước, vòi sen, máy sấy tóc và bàn làm việc. Tất cả các căn có phòng tắm riêng, dép đi trong phòng và ga trải giường.

Khách sạn cách Hồ Sa Pa 34 km và Sa Pa Bus Station 34 km. Sân bay gần nhất là Sân bay Wenshan Puzhehei, cách Mai Anh Hotel 187 km.",7.3,2.0
https://www.booking.com/hotel/vn/homestay-ta-may.vi.html,Tả Mẩy Homestay,"Nậm Cang, Liên Minh, Sa Pa, Lào Cai, Lào Cai, Việt Nam","Tả Mẩy Homestay nhìn ra núi, có Wi-Fi miễn phí và chỗ đậu xe riêng miễn phí, nằm ở Lào Cai, cách Trạm cáp treo Fansipan 41 km.

Nơi đây còn có phòng tắm riêng với vòi xịt/chậu rửa vệ sinh ở tất cả các căn, cùng đồ vệ sinh cá nhân miễn phí, máy sấy tóc và dép đi trong phòng.

Khách cũng có thể thư giãn trong khu vườn.

Homestay cách Hồ Sa Pa 37 km và Sa Pa Stone Church 36 km. Sân bay gần nhất là Sân bay Điện Biên Phủ, cách Tả Mẩy Homestay 303 km, đồng thời chỗ nghỉ này cũng cung cấp dịch vụ đưa đón sân bay mất phí.",9,
https://www.booking.com/hotel/vn/muong-thanh-grand-laocai.vi.html,Muong Thanh Grand Lao Cai Hotel,"86 Thanh Nien Street, Lào Cai, Việt Nam","Tọa lạc ở Lào Cai, cách Trạm cáp treo Fansipan 40 km, Muong Thanh Grand Lao Cai Hotel cung cấp chỗ nghỉ có hồ bơi ngoài trời, chỗ đậu xe riêng miễn phí, trung tâm thể dục và nhà hàng. Có quầy bar, chỗ nghỉ nằm cách Hồ Sa Pa 35 km. Chỗ nghỉ này cung cấp dịch vụ phòng, quầy lễ tân 24 giờ và dịch vụ thu đổi ngoại tệ cho khách.

Khách sạn sẽ cung cấp cho khách các phòng được trang bị điều hòa có bàn làm việc, ấm đun nước, tủ lạnh, minibar, két an toàn, TV màn hình phẳng và phòng tắm riêng với vòi sen. Phòng khách có tủ quần áo.

Chỗ nghỉ có phục vụ bữa sáng thực đơn buffet, kiểu Á hoặc món chay hằng ngày.

Muong Thanh Grand Lao Cai Hotel có sân hiên phơi nắng. Khách có thể chơi bi-a và bóng bàn tại chỗ nghỉ. Ngoài ra, chỗ nghỉ có dịch vụ thuê ô tô.

Muong Thanh Grand Lao Cai Hotel cách Sa Pa Bus Station 35 km và Ham Rong Garden - Ham Rong Mountain 36 km.",8.1,4.0
https://www.booking.com/hotel/vn/minh-dung-lao-cai.vi.html,Minh Dung Hotel,"012 Yết Kiêu, Lào Cai, Việt Nam","Tọa lạc ở Lào Cai, cách Trạm cáp treo Fansipan 38 km, Minh Dung Hotel cung cấp chỗ nghỉ có khu vườn, chỗ đậu xe riêng miễn phí, phòng chờ chung và sân hiên. Chỗ nghỉ này có các tiện nghi như nhà hàng, dịch vụ phòng và quầy lễ tân 24 giờ, cùng với Wi-Fi miễn phí ở toàn bộ chỗ nghỉ. Chỗ nghỉ này cung cấp dịch vụ tiền sảnh, bàn bán tour và dịch vụ thu đổi ngoại tệ cho khách.

Tại khách sạn, mỗi phòng đều được thiết kế có điều hòa, bàn làm việc, ban công với view thành phố, phòng tắm riêng, TV màn hình phẳng, ga trải giường và khăn tắm. Phòng khách đều có tủ quần áo và ấm đun nước để khách sử dụng.

Minh Dung Hotel cách Hồ Sa Pa 33 km và Sa Pa Bus Station 33 km.",6.6,3.0
https://www.booking.com/hotel/vn/aristo-international.vi.html,Aristo International Hotel,"28 Yet Kieu, Kim Tan, Lào Cai, Việt Nam","Với Wi-Fi miễn phí và trung tâm spa, Aristo International Hotel cung cấp những chỗ ở tại phường Kim Tân, cách thị trấn Sa Pa 21 km. Khách sạn có sân hiên và hồ bơi ngoài trời mở cửa quanh năm, và du khách nghỉ tại đây có thể thưởng thức bữa ăn ở nhà hàng hoặc đồ uống trong quán bar. Tại đây cung cấp chỗ đỗ xe riêng miễn phí ngay trong khuôn viên.

Mỗi phòng tại khách sạn này đều được trang bị máy lạnh và truyền hình vệ tinh màn hình phẳng. Một số phòng nhất định có khu vực tiếp khách để tạo thuận tiện cho khách. Các phòng cũng bao gồm phòng tắm riêng đi kèm vòi sen. Để tạo thuận tiện cho khách, áo choàng tắm, dép và đồ vệ sinh cá nhân miễn phí sẽ được cung cấp.

Du khách sẽ tìm thấy dịch vụ đưa đón miễn phí, lễ tân 24 giờ, tiệm làm tóc và cửa hàng quà tặng tại nơi nghỉ.

Du khách có thể chơi tennis tại khách sạn.",7.6,5.0
https://www.booking.com/hotel/vn/nam-cang-homestay.vi.html,Nậm Cang Homestay,"Nậm Cang, Sa Pa, Lào Cai, Lào Cai, Việt Nam","Nhìn ra khu vườn và có khu vườn lẫn Wi-Fi miễn phí, Nậm Cang Homestay nằm ở Lào Cai, cách Trạm cáp treo Fansipan 42 km và Hồ Sa Pa 38 km.

Nơi đây còn có phòng tắm riêng với vòi xịt/chậu rửa vệ sinh và máy sấy tóc ở từng căn, cùng dép đi trong phòng.

Homestay cách Sa Pa Stone Church 37 km và Sa Pa Bus Station 37 km.",,
https://www.booking.com/hotel/vn/truc-lam-lao-cai1.vi.html,TRUC LAM HOTEL,"468 Điện Biên Phủ 468 điện biên phủ, tx sapa, lào cai, Lào Cai, Việt Nam","Tọa lạc ở Lào Cai và cách Trạm cáp treo Fansipan 5.4 km, TRUC LAM HOTEL cung cấp dịch vụ tiền sảnh, các phòng không hút thuốc, khu vườn, Wi-Fi miễn phí ở toàn bộ chỗ nghỉ và phòng chờ chung. Ngoài dịch vụ phòng, chỗ nghỉ này còn có sân hiên. Nhân viên tại chỗ có thể sắp xếp dịch vụ đưa đón sân bay.

Tại khách sạn, mỗi phòng đều có ban công với view núi. Ngoài phòng tắm riêng, vòi xịt/chậu rửa vệ sinh và máy sấy tóc, các phòng tại TRUC LAM HOTEL đều có view thành phố. Tại chỗ nghỉ, các phòng đều có tủ quần áo và TV màn hình phẳng.

Khách tại TRUC LAM HOTEL có thể thưởng thức bữa sáng thực đơn buffet.

Đi xe đạp là hoạt động được ưa chuộng trong khu vực. Ngoài ra, khách sạn có dịch vụ thuê xe đạp và dịch vụ thuê ô tô.

Đội ngũ nhân viên lễ tân giao tiếp thành thạo bằng tiếng Anh và tiếng Việt, ngoài ra khách có thể yêu cầu hướng dẫn về khu vực xung quanh khi có nhu cầu.

Các điểm tham quan nổi tiếng gần TRUC LAM HOTEL bao gồm Hồ Sa Pa, Sa Pa Bus Station và Ham Rong Garden - Ham Rong Mountain.",9,
https://www.booking.com/hotel/vn/sapahilcraf.vi.html,Sapa Hillcrest homestay,"Ý lình hồ, xã hoàng liên, TX Sapa, Lào Cai, Việt Nam","Nằm ở Lào Cai, Sapa Hillcrest homestay cung cấp Wi-Fi miễn phí, nơi khách có thể trải nghiệm khu vườn, sân hiên và nhà hàng.

Nơi đây còn có phòng tắm chung với vòi xịt/chậu rửa vệ sinh ở một số căn, cùng đồ vệ sinh cá nhân miễn phí, máy sấy tóc và dép đi trong phòng.

Hằng ngày, chỗ nghỉ có các lựa chọn kiểu lục địa, kiểu Á hoặc món chay cho bữa sáng.

Homestay cách Trạm cáp treo Fansipan 8.5 km và Hồ Sa Pa 4.2 km.",9.8,
https://www.booking.com/hotel/vn/song-hong-view-lao-cai1.vi.html,SONG HONG VIEW HOTEL,"188 Duyên Hải, Lào Cai, Việt Nam","Tọa lạc ở Lào Cai, SONG HONG VIEW HOTEL cung cấp chỗ nghỉ 3 sao có ban công riêng. Chỗ nghỉ này nằm cách Trạm cáp treo Fansipan 40 km, Hồ Sa Pa 35 km và Sa Pa Bus Station 36 km. Chỗ nghỉ cung cấp lễ tân 24/24, dịch vụ đưa đón sân bay, máy ATM và Wi-Fi miễn phí.

Các phòng được trang bị điều hòa, TV màn hình phẳng có truyền hình cáp, tủ lạnh, ấm đun nước, vòi xịt/chậu rửa vệ sinh, đồ vệ sinh cá nhân miễn phí và bàn làm việc. Ngoài phòng tắm riêng được trang bị vòi sen và máy sấy tóc, các phòng tại khách sạn đều có view sông. Tất cả các căn có tủ quần áo.

SONG HONG VIEW HOTEL cách Ham Rong Garden - Ham Rong Mountain 36 km và Sa Pa Stone Church 36 km.",7.8,3.0
https://www.booking.com/hotel/vn/khach-san-bao-son-1.vi.html,Khách sạn Bảo Sơn 1,"058 Sơn Đạo kéo dài phường Cốc Lếu thành phố Lào Cai Tỉnh Lào Cai, Lào Cai, Việt Nam","Tọa lạc cách Trạm cáp treo Fansipan 39 km, Khách sạn Bảo Sơn 1 cung cấp chỗ nghỉ có Wi-Fi miễn phí và chỗ đậu xe riêng miễn phí.

Nhà nghỉ B&B cách Hồ Sa Pa 34 km và Sa Pa Bus Station 34 km. Sân bay gần nhất là Sân bay Wenshan Puzhehei, cách Khách sạn Bảo Sơn 1 187 km.",8.4,1.0
https://www.booking.com/hotel/vn/the-1996-house.vi.html,The 1996 House,"05 Phố Thác Bạc, TT. Sa Pa, Sa Pa, Lào Cai, Việt Nam","Nằm ở Lào Cai, cách Trạm cáp treo Fansipan 4.5 km, The 1996 House cung cấp chỗ nghỉ có khu vườn, chỗ đậu xe riêng miễn phí và sân hiên. Chỗ nghỉ có Wi-Fi miễn phí này nằm cách Hồ Sa Pa khoảng 13 phút đi bộ và Sa Pa Stone Church 600 m. Một số phòng tại chỗ nghỉ có ban công với view núi.

Tại guest house, các phòng đều có sân trong. Ngoài phòng tắm riêng, vòi xịt/chậu rửa vệ sinh và đồ vệ sinh cá nhân miễn phí, các phòng tại The 1996 House đều có view thành phố. Tại chỗ nghỉ, các phòng được thiết kế có ga trải giường và khăn tắm.

The 1996 House cách Sa Pa Bus Station chưa đến 1 km và Ham Rong Garden - Ham Rong Mountain 18 phút đi bộ. Sân bay gần nhất là Sân bay Wenshan Puzhehei, cách guest house 221 km.",9.3,3.0
https://www.booking.com/hotel/vn/swiss-belhotel-lao-cai.vi.html,Sapaly Lao Cai City Hotel,"048 Nguyen Hue, Lào Cai, Việt Nam","Sapaly Lao Cai City Hotel đem tới cho du khách sự sang trọng hiện đại trong các phòng và suite máy lạnh với Wi-Fi miễn phí. Nằm trong bán kính chỉ 3 km từ trung tâm thành phố, khách sạn có 3 nhà hàng ngay trong khuôn viên và quán bar.

Ga Lào Cai cách Sapaly Lao Cai City Hotel 1,5 km trong khi thành phố Sa Pa cách đó 40 km. Khách sạn nằm trong bán kính hơn 300 km về phía Tây Bắc Hà Nội.

Tất cả các phòng và suite có cửa sổ nhìn ra quang cảnh thành phố và được trang bị truyền hình vệ tinh màn hình phẳng cũng như minibar. Phòng tắm riêng đi kèm vòi sen và đồ vệ sinh cá nhân miễn phí.

Khách sạn cung cấp lễ tân 24 giờ với tiện nghi giữ hành lý, két an toàn cùng nhiều phòng họp. Chỗ đỗ xe riêng miễn phí cũng có sẵn.

Trong số các lựa chọn ăn uống tại khách sạn có các nhà hàng phục vụ ẩm thực Việt Nam và phương Tây cũng như nhà hàng Red River. Các loại mocktail cũng như cocktail giải khát có tại lobby lounge và bar.",8.2,4.0
https://www.booking.com/hotel/vn/ta-van-paradise-homestay.vi.html,Tavan Dragon House,"Thôn Tả Van Mông, xã Tả Van, huyện Sapa, Lào Cai, Việt Nam","Nhìn ra núi, Tavan Dragon House ở Lào Cai cung cấp chỗ nghỉ có khu vườn, phòng chờ chung, sân hiên, quầy bar và tiện nghi BBQ. WiFi và chỗ đậu xe riêng đều có sẵn tại lodge miễn phí.

Các căn đều nhìn ra khu vườn và được trang bị khu vực ghế ngồi, máy giặt, bếp đầy đủ tiện nghi với tủ lạnh và phòng tắm chung với đồ vệ sinh cá nhân miễn phí và máy sấy tóc. Để thuận tiện hơn cho khách, chỗ nghỉ có thể cung cấp khăn tắm và khăn trải giường với khoản phụ phí.

Tavan Dragon House có phục vụ bữa sáng kiểu Á và món chay mỗi buổi sáng.

Khách nghỉ tại chỗ nghỉ có thể chơi bi-a trong khuôn viên, hoặc leo núi ở khu vực xung quanh.

Tavan Dragon House cách Trạm cáp treo Fansipan 15 km và Hồ Sa Pa 11 km.",9.7,
https://www.booking.com/hotel/vn/lagom-bac-ha-farmstay.vi.html,Lagom Bắc Hà Farmstay,"Thôn Lùng Phìn, xã Lùng Phìn, huyện Bắc Hà, tỉnh Lào Cai, Lào Cai, Việt Nam","Nằm ở Lào Cai, Lagom Bắc Hà Farmstay cung cấp Wi-Fi miễn phí, nơi khách có thể trải nghiệm khu vườn, sân hiên và nhà hàng.",8.8,
https://www.booking.com/hotel/vn/o-chau-homestay.vi.html,O Châu Homestay Lào Cai,"Thôn Thào Hồng Dến, T.T Sa Pa, Lào Cai, Việt Nam, Lào Cai, Việt Nam","O Châu Homestay Lào Cai nhìn ra núi, có Wi-Fi miễn phí và chỗ đậu xe riêng miễn phí, nằm ở Lào Cai, cách Trạm cáp treo Fansipan 15 km.

Nơi đây còn có phòng tắm chung với vòi xịt/chậu rửa vệ sinh ở một số căn, cùng đồ vệ sinh cá nhân miễn phí, máy sấy tóc và dép đi trong phòng.

Khách có thể sử dụng sân chơi trẻ em tại homestay.

O Châu Homestay Lào Cai cách Hồ Sa Pa 11 km và Sa Pa Stone Church 10 km. Sân bay gần nhất là Sân bay Wenshan Puzhehei, cách chỗ nghỉ 231 km.",9.9,
https://www.booking.com/hotel/vn/ha-lu-homestay.vi.html,Hà Lù Homestay,"Ô Quý Hồ, thị trấn Sa Pa, thành phố Sa Pa, Lào Cai, Việt Nam","Tọa lạc ở Lào Cai, cách Trạm cáp treo Fansipan 7.1 km, Hà Lù Homestay nhìn ranúi. Ngoài nhà hàng, khách sạn 1 sao này còn có các phòng với điều hòa được trang bị Wi-Fi miễn phí, trong đó mỗi phòng đều có phòng tắm riêng. Chỗ đậu xe riêng miễn phí có sẵn và khách sạn còn cung cấp dịch vụ thuê xe đạp cho những khách muốn khám phá khu vực xung quanh.

Tại khách sạn, các phòng đều có bàn làm việc và TV màn hình phẳng. Tại Hà Lù Homestay, tất cả các phòng đều được thiết kế có ga trải giường và khăn tắm.

Đội ngũ nhân viên lễ tân giao tiếp thành thạo bằng tiếng Anh và tiếng Việt, ngoài ra khách có thể yêu cầu thông tin về khu vực xung quanh khi có nhu cầu.

Chỗ nghỉ cách Hồ Sa Pa 9.3 km và Thung lũng Mường Hoa 2.2 km.",7.6,1.0
https://www.booking.com/hotel/vn/michis-laocai.vi.html,Michi's hotel laocai,"318 An Dương Vương, Lào Cai, Việt Nam","Tọa lạc ở Lào Cai, cách Trạm cáp treo Fansipan 37 km, Michi's hotel laocai cung cấp chỗ nghỉ có nhà hàng, chỗ đậu xe riêng miễn phí và quầy bar. Khách sạn 3 sao này có dịch vụ tiền sảnh và bàn bán tour. Chỗ nghỉ cung cấp lễ tân 24/24, dịch vụ đưa đón sân bay, dịch vụ văn phòng và Wi-Fi miễn phí.

Khách sạn sẽ cung cấp cho khách các phòng có điều hòa, bàn làm việc, ấm đun nước, két an toàn, TV màn hình phẳng và phòng tắm riêng với vòi sen. Tại Michi's hotel laocai, mỗi phòng đều có ga trải giường và khăn tắm.

Chỗ nghỉ cách Hồ Sa Pa 32 km và Sa Pa Bus Station 32 km.",8.8,3.0
