url,name,location,description,point,star
https://www.booking.com/hotel/vn/son-thoi-homestay.vi.html,Son Thoi Homestay,"Thon Day 1, Ta Van, Sapa, Lào Cai, Việt Nam","Son Thoi Homestay nhìn ra núi, có Wi-Fi miễn phí và chỗ đậu xe riêng miễn phí, nằm ở Lào Cai, cách Trạm cáp treo Fansipan 15 km.

Khách tại homestay có thể thưởng thức bữa sáng kiểu Á.

Khách cũng có thể thư giãn trong khu vườn.

Son Thoi Homestay cách Hồ Sa Pa 11 km và Sa Pa Stone Church 10 km.",10,
https://www.booking.com/hotel/vn/eco-farmer-house-sapa.vi.html,Eco Farmer House Sapa,"Tổ 2, Phường Cầu Mây, Thị xã Sapa, Tỉnh Lào Cai, Lào Cai, Việt Nam","Nhìn ra núi, Eco Farmer House Sapa ở Lào Cai cung cấp chỗ nghỉ có khu vườn, sân hiên và nhà hàng. WiFi và chỗ đậu xe riêng đều có sẵn tại lodge miễn phí.

Nơi đây còn có phòng tắm chung với vòi xịt/chậu rửa vệ sinh ở một số căn, cùng đồ vệ sinh cá nhân miễn phí, máy sấy tóc và dép đi trong phòng.

Eco Farmer House Sapa có phục vụ bữa sáng thực đơn à la carte hoặc kiểu Á.

Chỗ nghỉ cách Trạm cáp treo Fansipan 11 km và Hồ Sa Pa 6.8 km.",,
https://www.booking.com/hotel/vn/sapa-winds-house.vi.html,Sapa Wind’s House,"Tổ 1 phường cầu mây, Lào Cai, Việt Nam","Tọa lạc ở Lào Cai, Sapa Wind’s House cung cấp Wi-Fi miễn phí, nơi khách có thể trải nghiệm khu vườn, sân hiên và quầy bar.

Nơi đây còn có phòng tắm chung với vòi xịt/chậu rửa vệ sinh ở một số căn, cùng đồ vệ sinh cá nhân miễn phí, máy sấy tóc và dép đi trong phòng.

Nhà nghỉ B&B cách Trạm cáp treo Fansipan 7.8 km và Hồ Sa Pa 3.5 km.",6.5,
https://www.booking.com/hotel/vn/family-homestay-mrhieu-lao-cai.vi.html,Family homestay mrhieu,"Thôn bản dền xã bản hồ sa pa Lào Cai, Lào Cai, Việt Nam","Family homestay mrhieu nằm ở Lào Cai và có phòng xông hơi khô. Chỗ nghỉ này có ban công, chỗ đậu xe riêng miễn phí và Wi-Fi miễn phí.

Căn hộ điều hòa này có 1 phòng ngủ với sân hiên nhìn ra khu vườn và bếp đầy đủ tiện nghi. TV màn hình phẳng được cung cấp.

Căn hộ cách Trạm cáp treo Fansipan 27 km và Hồ Sa Pa 23 km. Sân bay gần nhất là Sân bay Wenshan Puzhehei, cách Family homestay mrhieu 237 km.",,
https://www.booking.com/hotel/vn/o-quy-ho-sapa.vi.html,Heaven Gate Hotel O Quy Ho,"Cong Troi Area, Lào Cai, Việt Nam","Heaven Gate Hotel O Quy Ho có khu vườn, sân hiên, nhà hàng và quầy bar ở Lào Cai. Khách sạn 4 sao này có phòng giữ hành lý. Chỗ nghỉ cung cấp lễ tân 24/24, dịch vụ đưa đón sân bay, dịch vụ phòng và Wi-Fi miễn phí ở toàn bộ chỗ nghỉ.

Ngoài phòng tắm riêng, các căn tại khách sạn đi kèm TV màn hình phẳng và điều hòa, đồng thời một số phòng có khu vực ghế ngồi. Các phòng đều có tủ quần áo và ấm đun nước để khách sử dụng.

Heaven Gate Hotel O Quy Ho cách Trạm cáp treo Fansipan 13 km và Hồ Sa Pa 15 km.",6.2,4.0
https://www.booking.com/hotel/vn/ba-lien-sapa-by-bay-luxury.vi.html,Ba Liên Hotel Sapa - by Bay Luxury,"Đường N2, Tổ 3B, Chợ Mới, Sapa, Lào Cai, Vietnam, Lào Cai, Việt Nam","Tọa lạc ở Lào Cai, cách Trạm cáp treo Fansipan 5.6 km và Hồ Sa Pa 7 phút đi bộ, Ba Liên Hotel Sapa - by Bay Luxury có Wi-Fi miễn phí và điều hòa. Căn hộ này cách Thung lũng Mường Hoa 12 km và Silver Waterfall 12 km.

Gồm 1 phòng ngủ và 1 bathroom, căn hộ có TV màn hình phẳng.

Các điểm tham quan nổi tiếng gần căn hộ bao gồm Sa Pa Bus Station, Ham Rong Garden - Ham Rong Mountain và Sa Pa Stone Church. Sân bay gần nhất là Sân bay Wenshan Puzhehei, cách Ba Liên Hotel Sapa - by Bay Luxury 216 km.",1,3.0
https://www.booking.com/hotel/vn/giangs-family-homestay.vi.html,Giang's Family Homestay,"Cau La Chuoi village, Xa Lao Chai, Thon Ly, Sa Pa, Lào Cai, Lào Cai, Việt Nam","Với khu vườn và sân hiên, Giang's Family Homestay tọa lạc ở Lào Cai, cách Trạm cáp treo Fansipan 9 km và Hồ Sa Pa 4.7 km.

Nơi đây còn có phòng tắm chung với vòi sen ở một số căn, cùng đồ vệ sinh cá nhân miễn phí, máy sấy tóc và dép đi trong phòng.

Homestay cách Sa Pa Stone Church 4.2 km và Sa Pa Bus Station 4.4 km.",,
https://www.booking.com/hotel/vn/fieu-house-lao-cai.vi.html,Fieu House,"Tổ 7, phường Sapa, thị xã Sapa, tỉnh Lào Cai, Lào Cai, Việt Nam","Nhìn ra khu vườn, Fieu House cung cấp chỗ nghỉ có khu vườn, phòng chờ chung và quầy bar, cách Trạm cáp treo Fansipan khoảng 10 km. Chỗ nghỉ tọa lạc cách Hồ Sa Pa 5.2 km và cung cấp bếp chung.

Chalet có 3 phòng ngủ, 1 phòng tắm, ga trải giường, khăn tắm, TV màn hình phẳng, khu vực ăn uống, bếp đầy đủ tiện nghi, cùng sân hiên nhìn ra núi.

Đội ngũ nhân viên lễ tân 24/24 giao tiếp thành thạo bằng tiếng Anh và tiếng Việt.

Chalet có dịch vụ cho thuê ô tô.

Fieu House cách Sa Pa Stone Church 4.7 km và Sa Pa Bus Station 4.9 km. Sân bay gần nhất là Sân bay Wenshan Puzhehei, cách chỗ nghỉ 225 km, đồng thời chỗ nghỉ có cung cấp dịch vụ đưa đón sân bay mất phí.",1,
