url,name,location,description,point,star
https://www.booking.com/hotel/vn/vu-linh-homestay.vi.html,Vu Linh Homestay,"Ngoi Tu, Vu Linh, Yen Binh, Yen Bai, Vũ Linh, Việt Nam","Vu Linh Homestay cung cấp các phòng nghỉ ở xã Vũ Linh với nhà hàng ngay trong khuôn viên và chỗ đỗ xe riêng miễn phí.

Mỗi phòng đều được trang bị TV và ấm đun nước. Vu Linh Homestay cung cấp Wi-Fi miễn phí.

Tại đây có quầy lễ tân hoạt động 24 giờ/ngày. Quý khách có thể yêu cầu bố trí các chuyến tham quan trong ngày.

Quý khách có thể tham gia nhiều hoạt động trong khu vực xung quanh, bao gồm câu cá và đi bộ đường dài.",9.6,
https://www.booking.com/hotel/vn/giang-homestay.vi.html,GiangTien Homestay-VuLinh Farmstay - Bungalow,"Ngoi Tu, Vu Linh, Yen Binh, Yen Bai Ngoi Tu Village, Yên Bình, Việt Nam","Có WiFi miễn phí, nhà hàng và sân hiên tắm nắng, Vũ Linh Farmstay cung cấp chỗ nghỉ tại làng Dzao nhỏ tại xã Vũ Linh, huyện Yên Bình. Trong khuôn viên có quầy bar và chỗ đỗ xe riêng miễn phí.

Chỗ nghỉ này cung cấp đệm ngủ và màn chống muỗi. Phòng ngủ mở ra khung cảnh khu vườn và những ngọn núi xung quanh, cánh đồng lúa và hồ nước.

Câu cá và đi bộ đường dài là các hoạt động được ưa thích trong khu vực. Du khách có thể đi dạo và đi bộ đường dài ngắm cảnh qua các thung lũng sông. Các tour đi xe máy và đi bộ có hướng dẫn viên đến các làng dân tộc địa phương và khu vực tham quan ở Tỉnh Yên Bái với người chủ chỗ nghỉ nói được tiếng Anh và tiếng Pháp cũng được tổ chức.

Du khách có thể thưởng thức các món ăn Việt Nam do gia đình tại chỗ nghỉ nhà dân này chế biến. Bữa trưa và bữa tối được cung cấp với giá rẻ.

Du khách có thể đến GiangTien Homestay-VuLinh Farmstay - Bungalow bằng xe buýt địa phương từ Thành phố Hà Giang, thị trấn Sa Pa và thành phố Hà Nội.",9.7,
https://www.booking.com/hotel/vn/dao-homestay-vu-linh.vi.html,Dao homestay Vũ Linh,"thôn ngòi tu, Yên Bình, Việt Nam","Nhìn ra núi, Dao homestay Vũ Linh tọa lạc ở Yên Bình và có nhà hàng, bếp chung, quầy bar, khu vườn, hồ bơi ngoài trời mở theo mùa cũng như sân hiên. Homestay có WiFi và chỗ đậu xe riêng miễn phí.

Được thiết kế có ban công nhìn ra hồ hoặc khu vườn, tất cả các căn tại Dao homestay Vũ Linh đều có bếp với tủ lạnh và bếp. Nơi đây còn có phòng tắm chung với vòi xịt/chậu rửa vệ sinh ở một số căn, cùng đồ vệ sinh cá nhân miễn phí, máy sấy tóc và dép đi trong phòng.

Khách có thể thưởng thức bữa sáng thực đơn buffet, kiểu Á hoặc món chay tại chỗ nghỉ.

Chỗ nghỉ cách Sân bay Quốc tế Nội Bài 135 km và cung cấp dịch vụ đưa đón sân bay mất phí.",9,
https://www.booking.com/hotel/vn/xuan-nghi-homestay-yen-bai1.vi.html,Xuân nghi homestay,"Xã Phúc an huyện yên bình tỉnh yên bái, Yen Bai, Việt Nam","Nhìn ra núi, Xuân nghi homestay ở Yen Bai cung cấp chỗ nghỉ có hồ bơi ngoài trời, khu vườn, sân hiên và quầy bar. WiFi miễn phí có sẵn.

Tất cả các căn có thiết kế gồm sân trong nhìn ra hồ bơi, bếp với tủ lạnh, cùng phòng tắm chung có trang bị vòi sen.

Sân bay gần nhất là Sân bay Quốc tế Nội Bài, cách homestay 136 km.",8.6,
